PublishedAt,Comment
2020-10-16T04:45:26Z,┏━━┓┏━━┓┏━━┓┏━━┓ ┗━┓┃┃┏┓┃┗━┓┃┃┏┓┃ ┏━┛┃┃┃┃┃┏━┛┃┃┃┃┃<br>❤️🤍💙 🇺🇲 B I D E N 🇺🇲 ❤️🤍💙<br>┃┗━┓┃┗┛┃┃┗━┓┃┗┛┃<br>┗━━┛┗━━┛┗━━┛┗━━┛
2020-10-16T04:45:07Z,Watching repeats of the office is less cringe worthy than having to watch the ABC.
2020-10-16T04:44:38Z,Rambles on and on
2020-10-16T04:43:52Z,Soft George.
2020-10-16T04:42:33Z,"George: “Biden, what’s your favorite color?”"
2020-10-16T04:42:27Z,How are you undecided ya fat pig
2020-10-16T04:41:13Z,We don’t have testing equipment?  Joe are you sleeping?  There  is a testing site everywhere!  He has very little medical knowledge and he wants to be the President?
2020-10-16T04:40:58Z,"This guy is a corrupt lyer, definitely part of the swamp"
2020-10-16T04:39:28Z,Everyone doesn’t believe in a mask and it’s against our constitution! Democrats will erode our constitution!
2020-10-16T07:06:41Z,You are absolutely right mam. God bless you. ...
2020-10-16T04:39:01Z,Mandate vaccines! This guy is out of his mind! He doesn’t know when the STFU!
2020-10-16T04:38:54Z,Talk about plagiarism everything he is saying Trump already did
2020-10-16T04:38:12Z,Where’s Hunter????
2020-10-16T04:37:19Z,"Will you take covid vaccine? Biden: heres the deal, trump this that and ...... bs..........&quot;............”.......... manufacture.... doses, bs.......bs........bs.........bs..........bs........... how clear.... positive impact.................. depends how its distributed..................bs................bs......................bs.........................bs..........wear the mask.......................................wear the mask.....................president doesn’t wear mask...................children vaccine..................lock downs...............<br><br>Hey Mr.Joe, im not sure if u remember my question, will you take a vaccine?"
2020-10-16T04:35:53Z,I refuse to toss my education down the drain with a Trump vote. It’s just idiotic.
2020-10-16T04:35:37Z,"Hey Joe, the warning label on your mask says explicitly &quot;this product (non-Respirator mask) will not provide any protection against C-19 or other viruses or contaminants.&quot; Read the labels. Trust the science. Stand in your circle and wear your mask."
2020-10-16T04:46:35Z,"I know where you&#39;re coming from, but the box label that says &quot;this product is not a respirator and will not provide protection against covid-19 or other viruses or contaminants&quot; is often misinterpreted. N95s are incredibly effective at filtering out small particles, so much so that they can protect the wearer from small particles (virusus and other small stuff) in the air. These are obviously great for doctors caring for sick patients, since airborne particles can&#39;t enter the mask. Ear loop masks fail in this regard, but what they are effective at is stopping respiratory droplets being spread from the source (i.e. the sick persons nose or mouth). They help stop the spread of covid-19 by making it when a person coughs or sneezes, most of the respiratoray droplets are slowed down and effectively blocked by the mask. I hope this helps, please wear a mask, they are a one of the few tools we have right now against slowing the spread of covid"
2020-10-16T04:34:14Z,He&#39;s never said inject BLEACH in your arm! This guy sucks!
2020-10-16T04:33:18Z,trump 2020!!!!!!!!!!!
2020-10-16T04:32:20Z,I  want to know more about Hunters laptop that exposes the Biden corruption.   Why is the media carrying water for this scumbag?
2020-10-16T04:31:23Z,Sounds like a president
2020-10-16T04:30:31Z,What an absolute moron. Couldn&#39;t coherently speak or answer a single question. My friends and I played a game where after someone asked Joe Biden a question we put our phones up to the TV speaker and tapped the talk to text button to see if it could translate Biden when it worked it was hilariously incoherent and talk to text would stumble on itself when he would repeatedly stutter and attempt to correct himself but at one point his non-answer was about a thousand words long. 😂
2020-10-16T04:49:39Z,"Biden has a speech impediment (has had it since he was a kid), not dimentia or alzheimers or whatever else. That&#39;s kinda awful that you ran his speech through google translate just to laugh at his mistakes, not gonna lie"
2020-10-16T05:05:00Z,"@@jacksonmorton4915 #1 There&#39;s 47yrs of footage of Biden publicly speaking the difference between now and 10yrs ago is staggering. Thirty years ago he&#39;s a different person altogether. Never heard him stutter or speech impediments until 2020. #2 We did not &quot;run it through Google translate&quot; ya boomer.  We sent each other text messages using talk to text. It&#39;s a feature in every smart phone to &quot;type out&quot; what you speak into the microphone. So when you actually read joe&#39;s own words, from his own mouth, it is completely incoherent. It is aimless wandering while coming nowhere near an answer to the question. He was a gaff machine.  He said extremely racist things to the young african american man who asked him about his &quot;if you don&#39;t vote for me you ain&#39;t black&quot; telling him stories about redlining which has nothing to do with the question.  He also was very transphobic calling an 8yr old trans girl a &quot;man&quot; right to her mother&#39;s face. It was a disgrace. How any body can support this man just shows how blinded with hatred for Trump. Also, yet again! Joe Biden declared he was running for senate again."
2020-10-16T05:15:03Z,"@@joobaaastard Sorry I thought you said google translate, my bad. I&#39;ve used text-to-speech before lol. Anyway, we got some diffrent opinions but I see where you are coming from. On the speech impediment thing, if you go back from 10, 20, or even 30 years ago you can still tell he struggles with deciding on words and pronunciation. I don&#39;t doubt it&#39;s gotten worse with age, but he still did have clear trouble when he was younger. Here&#39;s a video from his senator days in 1992 where he was talking about a supreme court judge nominee (how fitting lmao):<br><a href=""https://www.youtube.com/watch?v=cZlzhULrJC0"">https://www.youtube.com/watch?v=cZlzhULrJC0</a>"
2020-10-16T04:29:05Z,"Vote and Pray 🙏 <a href=""http://www.youtube.com/results?search_query=%23trump2020"">#Trump2020</a> and keep this Country safe from the left who want a NEW GREEN DEAL which could Destroy this Country&#39;s economy. <a href=""http://www.youtube.com/results?search_query=%23maga2020"">#MAGA2020</a>"
2020-10-16T04:28:40Z,Following china great  leadership we will be rich!!vote biden  M.C.G.A &quot;  MAKE CHINA GREAT AGAIN&quot; NO MORE TRUMP!!
2020-10-16T04:27:50Z,The day they say me or my kids HAVE to take a vaccine is the day it will get very ugly!!!!
2020-10-16T13:31:50Z,"You and me both brother. But it won&#39;t be forced. You just won&#39;t be able to take part in &#39;society&#39; without your <a href=""http://certificate.of.vaccine.id/"">certificate.of.vaccine.id</a>. no vaccine, no money, no food, no nothing. <br>‘Power is not a means; it is an end. One does not establish a dictatorship in order to safeguard a revolution; one makes the revolution in order to establish the dictatorship."
2020-10-16T19:36:29Z,Yeah nobody is going to force me to get a vaccine. I will leave the country before that happened.
2020-10-16T19:37:04Z,@@mikesmith6267 No country will accept you lol. Good luck with that
2020-10-17T05:30:37Z,@@Nathan-qk2lz Good luck with what? Noone but North Korea would force their citizens to get a vaccine. I know that goes against your communist beliefs that we should be owned by our government. Not happening!
2020-10-20T12:25:03Z,There is a whole series of vaccines you have to take before you can start school (Kindergarten)  you&#39;re not bitching about taking those. Let science do the work and leave politics out of your health.
2020-10-16T04:26:12Z,I will take the vaccine after ivanka takes it.
2020-10-16T04:23:00Z,They let biden lie and don&#39;t call him on it oh yeah where&#39;s hunter
2020-10-16T04:22:53Z,I would take the vaccine after 10 years it was tested to people who got them to make sure it was safe and it was studied deeply.
2020-10-16T04:21:39Z,Trump never said inject bleach in your arm and yet no one corrects biden
2020-10-16T04:21:31Z,I backed to work on the last week of April till today tested negative Oct 1St but im a dealer gambling mask save my life serve my customer and step back distancing stand at corner of my counters and now a days I double my masks if I feel uncomfortable with customer no mask no service and leave or u cough you&#39;ll ask to leave and sanitizing the counter and seats when customer leave is a must cloves all times cause passing money the most dirtiest from people to people masks save lives and most importantly is shower after work
2020-10-30T14:16:41Z,Imagine living in that much fear 🤣 couldn’t be me. 🐑🐑🐑🐑🐑
2020-10-16T04:21:29Z,"He don&#39;t wanna mandate a mask but he tell the Governors in all 50 states too. If they don&#39;t do it he will go to the mayors, council men ect and tell them mandate the mask. Snake! I hope this voter understood what he was saying."
2020-10-16T04:20:20Z,Of course Sleepy Joe would pick George to interview him! 2 liberals trying to beat up Trump! God help us of Joe gets in.  He will mandate shut downs and we will be right back to where we were!!  Wake up people!!! Vote Trump!!!
2020-10-16T04:20:19Z,"Mandatory Vaccination , hell no. Mandatory masks hell no. Lockdowns hell no . LIVE FREE OR DIE"
2020-10-16T04:18:56Z,Joe Biden 2020
2020-10-16T04:18:33Z,"Rudy Giuliani Trump&#39;s lawyer own daughter, Trump&#39;s niece, and his sister are all supporting Joe Biden. If this doesn&#39;t make it any clearer and transparent for you Simon simpletons well nothing short of a miracle will. <a href=""http://www.youtube.com/results?search_query=%23aspecialkindofstupid"">#aspecialkindofstupid</a>"
2020-10-16T04:18:00Z,Get use to following regulations if this Socialist party wins. This is the biggest bunch of bull I’ve seen in my lifetime! Can’t believe people are falling for this.
2020-10-16T04:11:45Z,"Yes, there will be long lines to vote in person, but it is worth voting in person because a democrat supporter can&#39;t dump my vote in a ditch."
2020-10-16T04:10:16Z,85% of those infected wore masks. That leaves 15% that fared much better without wearing one. Today at the doctor&#39;s office doctor took his mask down so my dad could read his lips. His face was broke out under the mask. I don&#39;t know if he was sensitive to the material or if there was something growing under there.
2020-10-16T04:09:43Z,The republican women is passive.  Is she really conservative? Conservatives I know would argue with Biden about his lies.
2020-10-16T04:29:02Z,what lies in particular here would conservatives you know argue about?
2020-10-16T04:08:57Z,"<a href=""http://antifa.com/"">antifa.com</a> goes to Biden&#39;s fundraising site, no wonder he won&#39;t condemn them."
2020-10-16T04:44:07Z,1. Do you even know what ‘Antifa’ really stands for?<br>2. He’s condemned violence on either side even its ‘Antifa’ <br>3. Act blue is how most of Biden’s fundraising comes thru to his campaign along with other democratic candidates
2020-10-16T04:44:30Z,Good I don’t want a fascist running the country either.
2020-10-16T04:08:15Z,Hope we don&#39;t have to depend on the democrat house to distribute vaccines.  We&#39;d never get a vaccine.
2020-10-16T04:07:54Z,"National Security?  Iraq, Ukraine, Russia, China, Hunter?  Biden, appears buzzed. He&#39;s rambling, wonder what they gave him tonight?"
2020-10-16T04:07:48Z,I can’t stand this guy.
2020-10-16T04:07:31Z,Trump never said to inject bleach. Stop lying.
2020-10-16T07:14:47Z,"Yes, he did."
2020-10-16T04:07:13Z,T<br>I&#39;m heading out to buy some bleach and a syringe...   What a fraud.
2020-10-16T04:06:37Z,So sick of the lie that Trump recommended shooting Bleach into your arm!  Lies!
2020-10-16T04:05:40Z,President trump&#39;s  town Hall was a hour and a 1/2 long. Badgered by the interviewer would not let people come forward with questions Biden&#39;s was about 5 minutes long who do you really want for president. Joe Biden and his families are crooks
2020-10-16T04:05:22Z,Biden never answered the question!!
2020-10-16T04:05:05Z,"🐃💩<br>The media and politicians are terrorists and they&#39;re paving the road to hell on earth with good intentions and most of you are oblivious to what&#39;s really going on.<br><br>We are being played by big pharma, the media (GE, News-Corp, Disney, Viacom/CBS, Time Warner Media), politicians (left AND right), NGOs/non-governmental organizations (The Council on Foreign Relations, UN, Trilateral Commission, Bilderberg Group, Club of Rome, Royal Institute of International Affairs) &amp; elitist tax exempt foundations (The Bill &amp; Malinda Gates Foundation, The Rockefeller Foundation, etc.) <br><br>Whether this virus is real or not does not matter! They are clearly using it to turn us against each other (Divide &amp; Conquer) and push elitist agendas (global fascist dictatorship, technocracy, mandatory vaccinations, vaccination certifications, immunity passports, total police state surveillance &amp; control system, etc.) <br><br>The job of the establishment media is to deceive, divide, and distract! There are no legitimate journalists on TV! <br>If you think you&#39;re too smart to be fooled. If you get off on virtue signaling, cult of personality worshipping, appealing to authority and the establishment media AND you&#39;re too dumb and/or brainwashed by academia and the media to see giant contradictions and obvious agendas, may your chains and your family&#39;s chains rest lightly upon you. <br><br>It&#39;s time to stop believing everyone that questions the establishment is a &quot;conspiracy theorists&quot; and wake up!!! We are losing our freedom right now! They are ushering in tyranny under the guise of public safety all over the world! This is not a conspiracy theory! It is happening right now! If America falls it&#39;s over for the rest of the world. Which side of history are you gonna be on? I choose dangerous freedom over tyrannical &quot;safety&quot;! <br><br>COVID SURVIVAL RATE ACCORDING TO THE CDC<br>(includes people with core morbidities)<br><br>• 0-19 YEARS: 99.997%<br>• 20-49 YEARS: 99.98%<br>• 50-69 YEARS: 99.5%<br>• 70+ YEARS: 94.6% <br><br>There is no EMERGENCY and there is no PANDEMIC! There is ZERO justification for continuing these extreme measures! If you believe there is, it&#39;s because you&#39;ve been brainwashed by the media! <br><br>https://youtu.be/nZke-lxhJqU<br><a href=""https://www.youtube.com/watch?v=kr04gHbP5MQ"">https://youtu.be/kr04gHbP5MQ</a><br>https://youtu.be/AW8zjzPhS-s<br><a href=""https://www.youtube.com/watch?v=5sZKwmz1CBc"">https://youtu.be/5sZKwmz1CBc</a><br><a href=""https://www.youtube.com/watch?v=Se9rkxUK8zU"">https://youtu.be/Se9rkxUK8zU</a><br><a href=""https://www.stopworldcontrol.com/planned"">https://www.stopworldcontrol.com/planned</a><br><br>The left and right dog and pony show can&#39;t agree on anything that truly benefits we the people! However, what do you know, both sides want you wearing a face diaper! Both sides want you to socially distance! BOTH SIDES WANT TO FORCE YOU TO TAKE A COVID19 TEST OVER AND OVER AND OVER AND INJECT YOU WITH BIG PHARMA&#39;S EXPERIMENTAL VACCINE AND ALL ITS BOOSTERS OVER AND OVER!!!"
2020-10-16T04:04:43Z,What a butthead liar. Trump never said anything about bleach.
2020-10-16T04:04:38Z,"Koch&#39;s postulates are four criteria designed to establish a causative relationship between a microbe and a disease.<br><br>COVID19 has not met these criteria! So we&#39;re supposed to believe they came up with tests and are creating a legitimate vaccine when they haven&#39;t even established a causative relationship between this virus and a disease?!<br><br><a href=""https://en.m.wikipedia.org/wiki/Koch%27s_postulates#/media/File%3AKoch&#39;s_Postulates.svg"">https://en.m.wikipedia.org/wiki/Koch%27s_postulates#/media/File%3AKoch&#39;s_Postulates.svg</a>"
2020-10-16T04:04:25Z,"if this old ass thinks he&#39;s gonna try to mandate that my child take some flu vaccine in order to go to school, he&#39;s out of his mind.  I can&#39;t imagine anyone in the city I live in being okay with and/or complying with that."
2020-10-16T04:03:38Z,You need to go back to the 30mg Adderall instead of the 60. Good laaard.🤦‍♂️
2020-10-16T04:03:33Z,What a joke spoon  It only lasted 5 minutes interview. One person in the crowd with a question. Do you think we&#39;re really that stupid sniff Joe  Is done
2020-10-16T04:03:14Z,I found it very interesting that everybody that asked a question had the same blue card from wich they read questions that were brilliantly worded. One could almost say it was  professional questions. I don&#39;t believe it was written by those voters. Not after all the  info that came out about &quot;planted&quot; republican voters  at previous town halls and now with the journalist from cspan. It is all msm disinformation!!!
2020-10-16T04:02:28Z,"Lol, you call this pressed?"
2020-10-16T04:02:27Z,"<a href=""https://www.youtube.com/watch?v=0BSy4xWwf6Y&amp;t=2m28s"">2:28</a>?😂🤔"
2020-10-16T04:00:13Z,"We can&#39;t madate you to take the vaccine but we can take things away from you if you don&#39;t is,basically what he&#39;s saying using the measles shot and not going to school analogy"
2020-10-16T03:59:33Z,What I want to know  Sniff  Joe That played To pay money you and Hunter your crackhead sonGot from China and Ukraine does it spin as good as American money  .  What part of America did you sell out to get that  Blood money.
2020-10-16T03:59:19Z,"HAHAHAHA! Gotta love how the title for each clip says &quot;Joe Biden pressed.....&quot; when he&#39;s being asked very easy, basic questions."
2020-11-23T19:46:01Z,they&#39;re all a bunch of liars
2021-07-23T20:40:26Z,Teeball Joe
2021-08-14T16:11:50Z,👍🏿yup...gotta be gentle with the elderly🙄
2020-10-16T03:59:11Z,OMG!!! Is Biden boring!!!
2020-10-16T03:57:52Z,You&#39;ll have to arrest me to force the vaccine on me.
2020-10-16T03:56:39Z,IDK why ppl are clutching their pearls over Biden not trusting the lying sociopath that told everyone to inject bleach. Donny  just tried to infect him with covid. It&#39;s terrifying that ppl still treat the current occupant of the WH like he&#39;s an actual president that can be trusted.
2020-10-16T05:22:31Z,"He did not tell people to inject bleach.  He made a comment that you might be able to use injections to fight virus.  Granted not best wording but you know that lots of cancers treatment are Chemo.  Which is a poison.  If you were sure he said we should inject poison, why didn&#39;t you?  It might have improved your reasoning skills.  But I doubt it."
2020-10-16T03:55:53Z,"If I was running for president and they asked me if I would mandate the vaccine, I would say, “Absolutely”. Because it takes one unvaccinated person to keep the spread going. And I would go so far as to be the first person to take the vaccine on live TV to show everyone that it’s safe and effective."
2020-10-16T03:55:34Z,"Did I hear that correctly, that Biden, under the right circumstances, would mandate a COVID-19 vaccine?"
2020-10-16T05:18:28Z,And what is wrong with that if it will make the country safer. All u critics do is look to hold on to straws to put the guy in a bad light. What would ur answer be if u were on his seat. The important thing is his motives are right and just. That is what matters.
2020-10-16T05:25:06Z,@@yescoenrico8375 🤣
2020-10-16T06:28:45Z,"Yesco bodily autonomy is important. The vaccine is rushed and previous attempts to create vaccines for coronaviruses have been abandoned because of serious side effects. Attempting to force people to be injected with a product that has been hurried, isn’t time tested and has no liability is a dangerous prospect. That alone is enough for me to pass on the Biden/Harris ticket."
2020-10-16T06:57:25Z,Wow the antivaxxers got here quick lmao
2020-10-16T07:08:53Z,Being antiv is bad for who? For u or for  the antiv?
2020-10-16T03:55:17Z,"Trump would be like: Great people and companies have made a vaccine, in fact the best people in all of the world. You know who helped them? I did.  The vaccines very great. It&#39;s coming tomorrow. I&#39;m taking it. We&#39;re all gonna take it. I got the china virus. Walter-Reed medical center has great doctors. Phenomenal Doctors.  Great job to them. I cured myself actually because I gave them the money. I feel great."
2020-10-16T05:23:11Z,Ashab Siddiqui trump can’t praise anyone but himself.
2020-10-16T03:54:39Z,the fact the he even mentioned an alternative if he don&#39;t when shows he don&#39;t deserve to be president
2020-10-16T03:54:34Z,America hates joe biden
2020-10-16T03:54:00Z,ill take it aslong as its from the same vile that he takes.....
2020-10-16T03:53:53Z,I&#39;m falling asleep watching is Someone  Asked sniffing Joe  Why  Hey forced Ukraine to  Fire. that prosecutor
2020-10-16T03:53:34Z,holds up obviously unworn mask
2020-10-16T03:53:30Z,How can George let Joe lie with a smile on his face? We all know Trump never said people should inject bleach. He said that there was discussions around bleach and he was questioning how it would work.
2020-10-16T03:52:54Z,And Biden doesn&#39;t say crazy stuff. Yea SURE! One who says he&#39;s running for senate! Oh dear!
2020-10-16T04:37:47Z,He’s better than Trump who promoted to Americans the disinfectants that kills.
2020-10-16T03:52:11Z,Great job 👌 😀😀
2020-10-16T03:51:43Z,he answered that so well. i can&#39;t believe people are thinking to vote for trump. scary times.
2020-10-18T14:47:53Z,Well I don’t want to be force to take a vaccine while on another lockdown
2020-10-16T03:51:27Z,ABC’s George Stephanopoulos Fails to Ask Joe Biden About Hunter Biden Emails
2020-10-16T03:51:02Z,"Yeah Trump isn&#39;t perfect. He says a lot of stupid stuff, but you can&#39;t tell me that ur voting for this clown. &quot;If you have a problem figuring out whether you&#39;re for me or Trump, then you ain&#39;t black.&quot;  &quot;I mean, you got the first mainstream African American who is articulate and bright and clean and a nice-looking guy,&quot; -Biden. Don&#39;t even get me started on Kamala. Months prior to her vp nomination she was calling Biden a racist and today she&#39;s here praising the man. Done with the rant, I just hope that people will begin to realize that Trump has exposed the hatred and animosity of the radical left. Trump 2020🇺🇸"
2020-10-16T09:49:47Z,"nature2rule Move to Venezuela, you’d love it there"
2020-10-16T03:50:46Z,Really
2020-10-16T03:50:23Z,You&#39;re too old to be president you need to go and retire .
2020-10-16T03:50:08Z,P R E S S E D 😂😂😂
2020-10-16T03:50:00Z,Biden did good on the questions.  However I&#39;m still voting for Trump who does excellent on the questions.
2020-10-16T03:49:03Z,"Simple if your sick,  give sick person regeneron... 100k lives we could save? He says? And we have 500k doses of regeneron? Joe does not do math very well"
2020-10-16T03:48:46Z,George thanks for helping Biden remember his last point “and avoid the lockdowns.....”
2021-08-06T16:45:03Z,"WE NOW KNOW THAT WAS ANOTHER LIE, i counted at least 4 lies just in this couple of minutes very sad."
2020-10-16T03:48:36Z,"You better believe these people will be trying to keep masks around if/when we get past Covid.  They’ll say you have to for regular flu season.  Why would they let 30-50k ppl die a year from the flu if they say you could reduce the amt by wearing a mask?  I’m not interested in wearing a mask for 6 months a year to keep 80 year olds from dying for a year or three.  Old people die, it’s part of life.  If you’re 80 &amp; afraid to die, that’s a personal problem.  F masks"
2020-10-16T03:47:19Z,lmfao &quot;you don&#39;t have to lockdown if you are wearing a mask&quot;. Fuckin mask mandates everywhere and cases galore...sooo wtf?
2020-10-16T03:47:09Z,"What a complete idiot!!! What kind of hard question was this??? He talks in a circle and has no clue if you are voting for this, you really don’t care about America or it’s future."
2020-10-16T03:47:05Z,"The simple answer is don&#39;t take the vaccine if most doctors think it is unsafe!  We need to have at least Phase 3 data before knowing how safe the vaccine is, otherwise very hard to tell what will happen when millions of people take of the vaccine.  We need to make sure the side effects of the vaccine are not worse than the disease."
2020-10-16T03:46:23Z,Trump Never said inject bleach
2020-10-16T03:46:10Z,Bla bla bla and nothing new 🥱<br>🛏😴
2020-10-16T03:45:46Z,"This is sick, fuckin theater right here."
2020-10-16T03:45:25Z,He never said inject bleach in your arm.  Never said it.  I’m so sick of this bullshit narrative.  Say facts - not rhetoric that props up your agenda.
2020-10-16T03:45:16Z,Soft ball with Joe urggh😢
2020-10-16T03:44:55Z,Trump2020
2020-10-16T03:44:37Z,"With all the big news about Twitter and Hunter Biden, Why wasn&#39;t he asked about his son Hunter? Because the media is owned by the cabal and they smear Trump and deliver FAKE NEWS. Do Not trust the CDC, WHO, Vaccine makers, Bill Gates, Dr. Fauci."
2020-10-16T03:43:26Z,"They could take a shot of water and say he took it.   Who would know, so it’s mute point."
2020-10-16T05:32:37Z,ONG Biden😱 TRUMP 2020🙏🙏🙏
