PublishedAt,Comment
2020-02-24T17:03:39Z,1995 italian Corona: Baby Baby<br><br>2020 italian Corona: I&#39;ll kill you
2020-02-24T17:03:19Z,"To protect your self from the infection, wearing masks or washing hands or gargling are effective more than do nothing. The virus doesn’t have nails like insects. You can remove the virus on your mouth and throat with gargling, you can remove the virus with washing hands.<br>If cannot get masks, it’s better to covering your mouth and nose with something. At least, it can avoid to touch your face with your hands directly. But it’s necessary that using something disposable. And please don’t touch the surface of outward."
2020-02-24T17:01:23Z,So to avoid the virus the only thing we can do is stock up and stay inside our homes and have plenty of ammo. This is what we are hearing?
2020-02-24T16:59:50Z,"I can&#39;t understand why in Italy this virus had a outbreak now. In the last 3 days. This week the school and all the public events are stopped. A lot scared. I don&#39;t have fear for me or my children, but for ancient sick  and persons with  serious pathology."
2020-02-24T16:59:25Z,"I think it is already through most of our population, just waiting for incubation rate.  This is serious and we are facing unprecedented action."
2020-02-24T16:57:26Z,I’m moving to Africa!
2020-02-24T17:06:16Z,"The medical facilities there are worse that those in South East Asian, what are you going to do when the virus gets there, plus there&#39;s a famine going on in Africa and I really don&#39;t want you to be part of a food shortage victim"
2020-02-24T19:17:49Z,No goto greenland
2020-02-24T16:57:03Z,THANKS CHINA
2020-02-24T16:55:21Z,It&#39;s not a good time to travel even in Europe. I blame authorities for not closing borders and cancelled flights. And it has worsen. Go Vegan for God sake!
2020-02-24T16:53:41Z,"Oh but remember guys, cases are declining according to WHO... 😑"
2020-02-24T19:19:13Z,Who believes WHO ? 😹😹
2020-02-24T20:04:23Z,"WHO, director is the most criminal, <br>He must be sent to quarantine in Wuhan hospital with covid-19 patient for 14th day&#39;s, immediately, than he will understand what the real situation is!"
2020-02-24T20:21:17Z,It&#39;s not going down. People in China are locked in their homes so how can they count the number of cases.
2020-02-24T20:27:45Z,Yes in China
2020-02-25T15:00:04Z,@@m.r.2953 The general population couldn&#39;t count them anyway...they have no access to that information.
2020-02-24T16:53:23Z,Going on the calculations of 3% mortality rate.. if that&#39;s even the true figure. Then Iran must have around 400 infections to get 12 deaths
2020-02-24T16:55:25Z,50 deaths*
2020-02-24T17:09:15Z,"@@cheapogamer8920 50? Since when, iv just read something the news posted an hour ago saying 12 deaths? <br>If its now 50 deaths in Iran then thats 1700 people infected"
2020-02-24T17:28:36Z,@@vampy8112 You can&#39;t think only with numbers... because if the infected people are all old and have already patologies they could have an higher percentage of dying. But for example here in italy the dying rate is 0.2% for an healthy person (and young too).
2020-02-24T16:51:57Z,My heart is with Italy at the moment. Italy is one of my Favourite countries in the world. Respect from England man 🇮🇹🙏
2020-02-24T17:11:14Z,Me too i grow up there when i was young and now I&#39;m from uk hope the best for Italy
2020-02-24T17:13:10Z,Abdi Ali exactly man 😔.
2020-02-24T17:18:54Z,@@lukegbrown.2888 i can&#39;t believe they also closed san siro stadium that is were my favourite football team play AC Milan ! Also Fc Inter play ther wow scary stuff at moment
2020-02-24T17:23:58Z,Abdi Ali My favourite car company is Alfa Romeo and that might be affected by it badly soon. So fingers crossed things are gonna be okay.
2020-02-24T17:40:24Z,@@lukegbrown.2888 yeah bro !
2020-02-24T16:51:48Z,"Don&#39;t mistake WHO&#39;s &quot;Doctor Tedros&quot; as a fumbling, dithering medical egghead humanitarian; this guy is a cold-blooded, self-serving political animal and he could care less how much of the Earth drops dead from the Wuhan virus. …. For decades Tedros was the right-hand hatchet-man of Prime Minister Meles Zenawi, leader of Ethiopia&#39;s &#39;Tigrayan People&#39;s Liberation Front,&#39; a brutal military dictatorship rooted in Marxist/Leninist ideology. Many Ethiopians view Tedros as a brutal dictator in his own right. Little wonder then that Tedros is comfortable glad-handing and pandering China&#39;s Xi Jinping. .... To ascend to Director-General of WHO, Tedros hired a professional American lobbying firm to campaign on his behalf that, among other things, spin-twisted Tedros&#39; nearly non-existent public health accomplishments (while appointed by Zenawi as Ethiopia&#39;s Ministry of Health) into holy water that converted Tedros into a global political darling. The truth of the matter is that, back in Ethiopia, Tedros remains accused of orchestrating several cover-ups of large cholera epidemics, so as not to tarnish his own reputation. <br><br>Anything &quot;Doctor Tedros&quot; says or does is about nothing other than increasing his own political capital. <br><br>And, btw, according to a 2017 AP article, WHO spends $200 million annually on travel expenses, no small part of that on five-star hotels, expensive dining and first-class airline tickets for its entitled bureaucrats. That&#39;s more than WHO spends to fight AIDS, malaria, hepatitis and tuberculosis -- combined. <br><br>Given all this it&#39;s quite the wonder that America foots the largest chunk of WHO&#39;s $4 billion annual budget and bows to its constant cries for even more handouts.<br><br>So there you go, now you know &quot;WHO&quot; &quot;Doctor Tedros&quot; and &quot;WHO&quot; really are."
2020-02-24T17:38:05Z,Looks like a perfect pick for an organization as corrupted as WHO
2020-02-24T17:51:21Z,So why does not America stop funding WHO. Clean up the swamp and rewamp the system
2020-02-24T18:14:18Z,:)
2020-02-24T19:24:13Z,Tedros is a dude from a 3rd world country. how on earth we let him leads WHO.
2020-02-24T22:03:16Z,"@Hiroo Advani Because the US is afraid of China. No one will admit it, but the fact is that the West’s #1 priority these days is to please Xi Jinping and keep the bastard happy. The CPC is one footstep away from becoming an omnipresent entity and that alone is just as scary as this fucking disaster."
2020-02-24T16:51:30Z,Stupid Humans - stay in your own Country.  Air and Sea travel did this.  Nature tired of over population and doing something about it.
2020-02-24T16:46:44Z,"Yeah this is officially a global pandemic and the window of opportunity is closed so stop towing the company line, cut the crap and tell the truth! We are not blind!"
2020-02-24T16:46:25Z,Too late.
2020-02-24T16:45:24Z,This virus act like a zombie it plaus dead then reanimated out of nowhere
2020-02-24T16:44:04Z,Let’s see how Europe handle this
2020-02-24T16:43:46Z,Damn Chinese. 😖😷
2020-02-24T16:52:13Z,Damn you too
2020-02-25T05:13:00Z,Ok that&#39;s rude and I&#39;m Italian
2020-02-24T16:42:17Z,Thank you china
2020-02-24T16:38:57Z,Statistically diabetes kills more people the news is messing w your emotions yet agian this is flu season
2020-02-24T16:38:56Z,"I am a time traveller come to warn everyone,this virus will end 70 percent of all species on earth,it spreads faster then anything ever seen,get food and your priorities straight,"
2020-02-24T16:48:20Z,John Teter I live off Uber eats and can barely keep myself alive now...
2020-02-24T16:50:14Z,"From what I see, only one quarter of this world will perish because of the virus, not 70%, however 2 billion people is still a lot"
2020-02-26T07:06:03Z,lmao
2020-02-26T07:06:47Z,"I too am a time traveler, I used to be a porn star with a 12 inch wiener but the virus made it fall off and ended my career. Wash your hands before peeing, men!"
2020-02-24T16:38:46Z,"I agree, sick people should not go to a area that has a high population. There are many locations deep in the desert that can be converted into a quarantine facility."
2020-02-24T16:38:01Z,Keep everyone safe!🙏🙏😷
2020-02-24T16:37:54Z,"I’m right next to a quarantine center in CA, it’s a quarantine, that means they can’t leave. They’re Americans, we should care for them and not be dumb like those people in the video. I’m surprised they didn’t riot like in the Ukraine. 🙄"
2020-02-24T16:51:20Z,Bob Alysia Haras Why can&#39;t they take them to Epsteins island. They will be comfy with wifi and away from us.
2020-02-24T16:37:50Z,"<a href=""https://www.youtube.com/watch?v=nRnf-mHBrF8&amp;t=2m06s"">2:06</a> your on your own Annie"
2020-02-24T16:37:42Z,Love all the people wearing the masks wrong.thats wonderful.
2020-02-24T16:37:01Z,"Importing our drug and essential medical supplies from overseas is a prescription for disaster. 90% of our medicine and personal protection products are produced in India and China. Vaccines are also produced overseas. It is terribly irresponsible for major, necessary medical supplies to be sourced outside of the USA."
2020-02-24T17:17:27Z,"What the hell has your president trump been trying to tell you guys for the past three years....<br>You wouldn&#39;t listen and continue to bag him out, your idiots, let that sink in..."
2020-02-24T16:36:43Z,This Chinese experiment gone wrong or on purpose is very effective.
2020-02-24T16:36:00Z,Eating disgusting foods. And the whole world suffers for their stupidity.
2020-02-24T16:35:06Z,LOL so you idiots going to avoid Italians now?   The original spreader in Italy never stepped foot in China.
2020-02-24T17:12:59Z,Secondary contact kills faster and spreads faster also.
2020-02-24T16:34:51Z,"I like how people are losing their minds over this, and basically becoming irrational beasts."
2020-02-24T17:06:51Z,"it is only effect sheep , people are fine enjoying the freak show :)"
2020-02-24T17:41:28Z,Sekai Ni Heiwa it’s a free movie.
2020-02-24T17:46:13Z,"@@luisruiz7729 A sitcom, season one about seasonal flu"
2020-02-24T17:51:11Z,Sekai Ni Heiwa yup. I’ll provide the laugh track.
2020-02-24T17:57:50Z,"@@luisruiz7729 We need, I&#39;m already listing my gym socks as an alternative to the N99 mask."
2020-02-24T16:34:37Z,"Wash your hands, buy hand sanitizer, clean your phone!!"
2020-02-24T23:34:02Z,"Cause that stops airborne viruses that can enter through your eyes, ears, nose or other open holes"
2020-02-25T06:11:21Z,"@@evilovesperry oh stop, &quot;your eyes&quot;, you&#39;re just making all that stuff up. stop getting all excited."
2020-02-25T12:39:34Z,@@vern9093 ? I&#39;m not go get an education.  Airborne viruses enter through holes
2020-02-24T16:34:20Z,"All because someone wanted to eat a bat, a damn little demon with wings smh 🙍🏻‍♀️🤦🏻‍♀️"
2020-02-24T20:43:56Z,I hate Batman.
2020-02-24T22:49:19Z,JillyBean yep
2020-02-24T23:02:40Z,It was not the &quot;bat soup&quot;.
2020-02-25T02:22:05Z,Fucking ozzy osbourne
2020-02-25T09:54:15Z,From a lab. Why else would Chinas&#39; premier say they  need to tighten up lab  safety.
2020-02-24T16:33:47Z,"coronavirus link <a href=""https://youtu.be/2SZrT2Nwnlg"">https://youtu.be/2SZrT2Nwnlg</a>"
2020-02-24T16:32:53Z,"Its amazing only residents have to wear mask,  what about the News reporters??? Ur at risk toooooooo"
2020-02-24T16:32:46Z,People from Alabama are the stupid of America.
2020-02-24T16:30:31Z,🎵🎶 I&#39;m gonna live like tomorrow doesn&#39;t exist 🎶🎵
2020-02-24T22:57:32Z,"<b>There never was a TOMORROW, there is ONLY now, the present!</b>"
2020-02-25T01:06:14Z,^^THIS
2020-02-29T13:23:15Z,Yesterday and tomoro are set ups to live like for a job and stuff realistically there is no yesterday or tomoro anyway there is just now.... Its a false concept
2020-02-24T16:30:26Z,This sounds bad.
2020-02-24T16:29:58Z,Earth is fighting back to revenge human pollution...................
2020-02-24T16:57:15Z,"Corona is man made, not nature."
2020-02-24T17:52:03Z,f:AKSDFKam.sd&#39;f it isn’t made made. Stop your conspiracy theories
2020-02-24T18:10:40Z,@@christianmayall8034 it was weponized by humans stop being so naive and blind
2020-02-24T18:32:45Z,Elizabet queen you’re just being ridiculous and you don’t even know what naive means
2020-02-24T18:54:53Z,It is a bio-weapon developed by China
2020-02-24T16:29:37Z,"Chinaaa coronavirus <a href=""http://www.youtube.com/results?search_query=%23ELIMINATE"">#ELIMINATE</a> CHINA FROM THE WORLD"
2020-02-24T17:00:58Z,"You can&#39;t even hastag properly, go back to school and get some education before you comment again. Try not to drop out this time"
2020-02-24T16:28:52Z,"Yes, I’m not far from Alabama and I don’t want that to come here to Georgia it can spread..."
2020-02-25T00:36:54Z,Heather Gaillard it’s all over the place... I’m praying for the best
2020-02-25T00:39:35Z,"Heather Gaillard well, my city said nothing about us. So, I’m going on with my daily routines."
2020-02-25T01:17:27Z,"Heather Gaillard well, take of care and your family..,"
2020-02-25T08:45:55Z,"Heather Gaillard Yes, we are living in our last days. But, again it’s going to get worst than a virus... more like hurricanes and floods, mass shootings..."
2020-02-24T16:27:32Z,Climate change really !!!
2020-02-24T16:26:11Z,VAFFANCULO CHINA
2020-02-24T16:24:53Z,Now that’s a lisp. Lmao. Why did they hire him? 🤣
2020-02-24T16:24:08Z,The Chinese must just apologize to bats and everything would be fine!😂😂😂
2020-02-24T16:47:30Z,"Apparently there&#39;s a rumor saying that a Chinese snuggled a virus sample from Canada into the lab in Wuhan prior to the out break and the seafood market is just a cover-up......looking back now at the virus is really look like a man-made one, then Canada REALLY owns china big time here"
2020-02-24T16:23:21Z,"150 cases I would like to see the difference between the common flu and this corona virus deaths and infected? Time periods and deaths remember h1 n1, zyka , chikunkuya or whatever fear mongering is what might kill us all ."
2020-02-24T16:23:02Z,7 deaths and one recovery.That&#39;s a death rate of 86%<br>Soon when the vacantionors return to Belgium<br>it will be the same in Belgium.Van Ranst has said<br>they won&#39;t control them anymore
2020-02-24T16:25:37Z,"Stop the panic, the death rate on a normal person who is infected by the coronavirus is at the moment at 0,9%."
2020-02-24T16:56:54Z,@@HohenEU you sure about that?
2020-02-26T07:12:43Z,"@@cheapogamer8920 Someone literally posted in the comments up above from a quarantined red zone in Italy. Mentioned that the 6 deaths were all elderly people and one 57 year old man in poor health. They&#39;re about as credible as any source on Youtube basically, since we can&#39;t confirm any of the doom and gloom and neither the sunshine and rainbows either."
2020-02-24T16:21:42Z,"The virus is highly contagious and the chances of containing it are narrowing each day.  It doesn&#39;t matter who is responsible for this pandemic , but now people should avoid social gatherings and stay indoors . We pray for this 🙏 will end peacefully."
2020-02-24T16:21:40Z,"I was having discussion in my online class with one of my 6 year old Chinese students and I asked what he would be doing this weekend. He told me he wasn&#39;t going anywhere. I said why not, he said... so he wouldn&#39;t die.... That was so heartbreaking to hear one of my students say that to me 😞💔 The government clearly has them all under strict rules and not allowed to go anywhere."
2020-02-24T16:31:58Z,we all human
2020-02-24T16:48:56Z,Aren&#39;t you suppose to be cautious as well seeing that people are dying of the virus around the world
2020-02-24T16:49:02Z,"Better safe than sorry..I actually live in Beijing and by the last week of January many universities had total ban-no students allowed outside the gates..my friends who went to their towns for the Chinese new year aren&#39;t able to go back to Beijing cause either their borders are closed or Beijing doesn&#39;t allow them to come back..all schools are closed since..its 1.3 Billion people out there, there only so much the government can do to help them otherwise there will be a total wipe out 😢"
2020-02-24T17:05:47Z,💔💔💔😪
2020-02-24T16:21:23Z,No worries..Trump trusts china and everything is fantastic..in fact better than ever before.
2020-02-24T16:20:47Z,Panic. Love it. Millions dump their stocks and the market crashes. They lose years of investment. Don&#39;t do it. Ride it out. Don&#39;t be one of the fools whose standing in the food bank line crying over their stupidity.
2020-02-24T16:19:19Z,Fly fly fly spread coronavirus all over world.. best way to control world population thou..
2020-02-24T16:16:34Z,Every doomsday prepper def a has a rager right now... like full mast
2020-02-24T17:40:41Z,"Naw, i was set for zombies. Viruses are no fun."
2020-02-24T18:44:00Z,lmaooo
2020-02-24T18:58:16Z,"BANE KITTY One leads to the other. With China on lockdown and other countries toppling mike dominos, the global supply chains gonna break and in two months there will be TERRIBLE shortages on most goods. Then people will riot and run on the stores...<br><br>You’ll get your zombies my guy"
2020-02-24T19:19:12Z,"Hayden killing real people is no fun, I want to kill zombies, so evolution better do the thing with corona, else I’ll have a serious conversation with god when I die"
2020-02-24T20:21:37Z,Burt Gummer will be on cloud nine
2020-02-24T16:16:32Z,Way to go corona chan &lt;3
2020-02-24T16:14:54Z,Deport all Chinese immediately
2020-02-24T16:14:32Z,"Quick, avoid Asians... It&#39;s not racism... Wait, what&#39;re Italians?"
2020-02-24T16:12:53Z,"I live in italy,we are in the s**t"
2020-02-24T18:45:25Z,Take care of yourself Mary Tab. South Carolina sending prayers
2020-02-24T19:29:45Z,"Mary Tab3 Same, near Torino...its getting scary here"
2020-02-25T00:02:32Z,How did the virus get to Italy
2020-02-25T02:49:25Z,Good luck
2020-02-24T16:11:29Z,"@ <a href=""https://www.youtube.com/watch?v=nRnf-mHBrF8&amp;t=1m42s"">1:42</a> <br>Two fools in suits with eye pro &amp; a mask that’s not covering their noses. 🤦‍♂️"
2020-02-24T16:10:04Z,I get shocked every time seeing the number change.
2020-02-24T22:10:02Z,Well expect it to rise until its in every human. its gonna be another new corona virus for humans to endure
2020-02-24T23:19:20Z,I&#39;ve heard a global 60% infection with 900 million fatalities. Scaaary!
2020-02-25T05:06:43Z,Source
2020-02-25T15:34:37Z,Dies to removal don’t listen to that fool who said 900 million dead
2020-02-26T06:13:57Z,"@@trainwrecktoldya5298 Haven&#39;t heard that anywhere. Sounds like some blatant bullshit trolling bro, try a little harder to be more subtle about it so it&#39;s more believable next time. lmao. The highest numbers I&#39;d read were like 150 million over the span of 2 years worst-case scenario, I believe. And who&#39;s to say if that&#39;s even credible at this point, I don&#39;t know what to go by and that sounds a bit nutty too since right now. Let&#39;s see where we&#39;re at in a month or two."
2020-02-24T16:09:48Z,Yawn. Mother nature is upset.
2020-02-24T16:09:36Z,Two idiots in full plastic suits.<br>Doesn&#39;t even cover their noses.<br>&quot;Ain&#39;t no virus gonna get us bro&quot;<br>&quot;You got that right bro&quot;
2020-02-24T17:55:34Z,"Si!! O madres que usan proteccion respiratoria y sus hijas pequeñas nada min <a href=""https://www.youtube.com/watch?v=nRnf-mHBrF8&amp;t=2m06s"">2:06</a> parece una broma."
2020-02-24T18:18:51Z,ꀯ more foreign comments get english replys than vice versa. Hypocritical
2020-02-24T18:30:22Z,"ꀯ Yes!! Or mothers that use respiratory protection and their daughters wear nothing min <a href=""https://www.youtube.com/watch?v=nRnf-mHBrF8&amp;t=2m06s"">2:06</a>, it seems like a joke. Translated for you, are you happy now? Maybe learn some languages"
2020-02-24T18:48:36Z,@@paucolome4298 thanks for translation ;)
2020-02-24T18:57:50Z,"ꀯ no, but whenever there&#39;s a language different than english people get mad. And it&#39;s spanish, one of the most spoken languages in the world"
2020-02-24T16:09:17Z,The government said to wear masks in Italy. But everywhere else people are saying to not wear masks.
2020-02-24T17:01:44Z,"People are in denial when it comes to life and death.....just like amberlynn Reid, whose going to eat herself to death"
2020-02-24T16:09:08Z,Don&#39;t Allow to come Italy black ppl and chaines atm
2020-02-24T16:07:34Z,This bloody man could spread Corona vires <br>No masks or hand gloves how stupid
2020-02-24T16:05:00Z,"2,600 deaths??!!! I thouggt it was less than that"
2020-02-24T16:04:21Z,The thumbnail is hipster
2020-02-24T16:03:42Z,"I went grocery shopping today 🙀 I knew I was forgetting something from Walmart,,, the face mask??? !"
2020-02-24T17:12:35Z,"You won’t find them, they’ve been out of stock since January."
2020-02-24T16:02:14Z,Allways fakes news
2020-02-24T16:01:54Z,italy struggles with everything.. what’s new
2020-02-24T16:30:52Z,"Life is &quot;struggle&quot;. Only the lazy and stupid ones don&#39;t struggle. Reading your comment, I thought that Coronavirus has come and will go away soon but human stupidity is here to stay, unfortunately."
2020-02-24T16:53:38Z,Wow an ignorant statement from an ignorant person.<br>Lacking knowledge just like this broadcasting network..
2020-02-24T20:37:09Z,Pretty sure your country is 1000 times worse
2020-02-25T05:59:48Z,yeah pay MY EU okay.. good.. good girls..  italy is just another little star on my blue flag
2020-02-25T06:00:29Z,Rick O im in the netherlands 😂😂 its so worse hahahahaha just stop
2020-02-24T16:01:20Z,"🙏❤🙏NO WEAPONS FORMED AGAINST US WILL PROSPER 🙏❤🙏<br>DEAR LORD, PLEASE HELP THE PEOPLE WHO ARE SICK TO GET WELL. AND PLACE A HEDGE OF PROTECTION AROUND THE PPL WHO DO NOT KNOW IF THEY HAVE BEEN EXPOSED. PLEASE PROVIDE THE SICK PPL WITH FOOD WATER AND OTHER PROVISIONS. BLESS THE DOCTORS WITH REST AND RENUAL. IN JESUS PRECIOUS AND MIGHTY NAME I PRAY AMEN.🙏🙏🙏🙏🙏🙏🙏🙏🙏🙏"
2020-02-24T16:01:07Z,I think if they quarantine to a compound and should be to the compound and not come out of that compound shouldn&#39;t matter where they&#39;re at but I do feel that we need to take extra precaution that they are not telling me American public maybe in the future they&#39;ll actually sell hazmat suits to go shopping or outside
2020-02-24T16:00:35Z,"the flu is worse. Yes, we should be a little bit concerned ab this virus but it’s not that much worse than the   flu"
2020-02-24T15:59:56Z,Denial created this situation . And denieng keeps going .
2020-02-24T19:56:27Z,"Exactly, i knew 2 months ago already and when the wuhan doctor warned about it but literally everyone ignored him/the &quot;flu&quot;, now that its in europe rising at fast speed and also in south korea and japan people are panicking and i&#39;m just mad at how stupid one can be.."
2020-02-24T20:52:12Z,Denying
2020-02-24T21:05:18Z,@@AP-wn8nd denieng
2020-02-25T05:04:19Z,@@luzsol1609 Denieng?<br>You must go back to school. <br>Or ask your school for a refund  <br>DENYING
2020-02-25T10:43:28Z,Labour Law Act why’s a spelling affecting you that much ??
2020-02-24T15:58:59Z,Were gonna start dying.
2020-02-24T15:58:00Z,😳😳😳
2020-02-24T15:57:54Z,I don’t understand how this is so bad.... the flu is worse... very confused. 12 million people 129 cases... someone explain to me please
2020-02-24T15:57:26Z,50 death in iran
2020-02-24T15:57:17Z,"Did you see at <a href=""https://www.youtube.com/watch?v=nRnf-mHBrF8&amp;t=2m07s"">2:07</a> - mom and child walking down the street? Mom had a mask but child did not!!"
2020-02-24T16:18:20Z,Oranjmuse Meyer I was just about to make a comment on that! Wtf!!! Pissed me off
2020-02-24T16:19:54Z,The mask doesn&#39;t stop you from contracting the virus. It is to prevent you from spreading it. Seriously if the disease is airborne that mask won&#39;t work at all.
2020-02-24T16:33:52Z,Well to be practical the disease hasn&#39;t killed children under 9 at all and the death likelihood in ppl the age of 20 to 30 is only 0.2%. It grows worse for older ppl. But then again if the child gets it they can pass it to the adult so both should be protected and also we still don&#39;t know everything about this virus.
2020-02-24T20:13:49Z,Oranjmuse Meyer .They say kids don’t get it
2020-02-24T23:07:35Z,Evolution...
2020-02-24T15:57:13Z,"These numbers are still way too low for this to be international headlines. More people are affected and killed by smoking cigarettes each day than this damned variant of the flu, people need to get their priorities straight.."
2020-02-24T15:56:51Z,tks to china...
2020-02-24T15:56:38Z,Every  country  should  stay  away  from  China because  China  keep  virus ever  where.
2020-02-24T15:54:50Z,"Most deaths are the elderly, who’s broken down bodies could potentially be shut down by a common health cold. Seeing my 30 year old friends who are in the condition of their lives panic about this acting like we’re all dead is getting annoying... If you’re healthy enough to go shopping in a mall and not get sick you’re strong enough to beat a virus"
2020-02-24T16:59:51Z,Says the one who saw the whistle blower doctor in his 30&#39;s dying from the virus
2020-02-24T15:54:28Z,"Nobody can help you anymore, people are so selfish, they don&#39;t even let their own citizens to be quarantined in their towns. Very sad. You can&#39;t be proud of being American anymore."
2020-02-24T15:54:11Z,Already. Already MSM using &quot;emergency&quot; instead of PANDEMIC
