PublishedAt,Comment
2020-10-16T02:11:45Z,"For Joe Bite Me and His Followers,<br><br>If you are a liberal who can’t stand Trump, and cannot possibly fathom why conservatives would ever vote for him, let me fill you in.<br> <br>First off, Pelosi enacting the 25th Amendment isn&#39;t for Trump, it&#39;s all for Biden.  If Biden wins the election, he won&#39;t last long  (even if he is propped up properly, or just descend into oblivion).  Then, Harris will be president and guess who will be vise president - Pelosi.  Both are from San Francisco - Yes, that&#39;s the place that has an app to tell you where the feces is on any given day.  And yes, the same Kamala at 29 began an affair with San Francisco politician Willie Brown, then 60 and married, who appointed her to two lucrative positions only to dump her after he was voted first black mayor of the city.  Harris will make a much better EX-HOOKER than she ever will a VP.  Also, why did (her buddy)  Newsom have an affair with his (then) best friends wife?  And, did THE FIRST PARTNER have anything to do with it???  Are these the type of people you hold higher than God?  In my book, these people are unfit to hold public office. <br><br>It’s not that we love Donald Trump so much. It’s that we can’t stand you. And we will do whatever it takes — even if that means electing a rude, obnoxious, unpredictable, narcissist (your words-not ours) to the office of President of the United States — because the only thing we find more dangerous to this nation than Donald Trump, is you.<br><br><br>How is that possible you might ask? Well, you have done everything in your power to destroy our country, from tearing down the police to tearing down our history, to tearing down our borders. You are systematically destroying our schools, and brainwashing our kids into believing socialism is the answer to anything (despite being an unmitigated failure everywhere), while demonizing religion and faith, and glorifying abortion, violence, and thug culture.<br><br><br>From calling us racists every time we expect every one of any skin color to follow our laws equally, to telling us that our “tolerance” of lifestyles we don’t agree with isn’t nearly enough....no, we must “celebrate” any lifestyle choice or gender option (forget science) you throw our direction, or you think it’s fine to calls us homophobic or some other degrading slur — and ironically, all while lecturing us on hate speech. While you gaslight us about 52 genders, polyamory, grown men in dresses sharing public locker rooms with little girls, and normalize the sexualization of young children, you simultaneously ridicule us for having the audacity to wish someone a “Merry Christmas” or hang a flag on the 4th of July, stand for the national anthem, or (horror of horrors) don a MAGA hat in public. So much for your “tolerance.” Do you see why we think you are hypocrites??<br><br><br>We’re also not interested in the fact that you think you can unilaterally decide that 250 years of the right-to-bear-arms against a tyrannical or ineffective government should be abolished because you can’t get the violence in the cities you manage under control. Free-speech should be tossed out the window, history erased, and those who disagree with your opinions, are fair game for public harassment or doxing. Spoiled children with nose-rings and tats who still live off their parent’s dime should be allowed to destroy cities and people&#39;s livelihoods without repercussions. That chaos, and lawlessness, and disrespect for authority should be the norm. This is your agenda. And you wonder why we find you more dangerous than Donald Trump?<br><br><br><br>Your narrative is a constant drone of oppressor/oppressed race-baiting intended to divide the country in as many ways as you possibly can. You love to sell “victim-hood” to people of color every chance you get because it’s such an easy sell, compared to actually teaching people to stand on their own two feet and take personal responsibility for their own lives, their own communities, and their own futures. But, you won’t do that. You will never do that because then you will lose control over people of color. They might actually start thinking for themselves, God forbid!<br><br><br><br>This is why we will vote for Donald Trump. It is not because he is the most charming character on the block, nor because he is the most polite politician to have ever graced the oval office. It is not because he is the most palatable choice, not that we love his moral character or because he never lies. It is because we are sick to death of you, and all of the destructive crap you are doing to this once beautiful and relatively safe country. Your ineffective and completely dysfunctional liberal “leadership”(?) has literally destroyed our most beautiful cities and done its damnedest to rip faith out of people’s lives.<br><br><br><br>However bad Donald Trump may be (and he is far from perfect), every day we look at you, and feel that no matter what Donald Trump says or does, there is no possible way he could be any worse for our country than you people are. We are sick to death of your stupid, destructive, ignorant, and intolerant behavior and beliefs — parading as “wokeness.” We are beyond sick of your hypocrisy and B.S.<br><br><br><br>We are fed up with your disrespectful divisiveness and constant unrelenting harping and whining and complaining (while you live in the most privileged nation in the world), while making literally zero contributions of anything positive to our society. Your entire focus is on ripping things down, never ever building anything up. Think about that as there is something fundamentally very wrong in the psychology of people who choose destruction as their primary modus operandi.<br><br><br><br>If Donald J Trump is reelected, rather than blame us, look in the mirror, and blame yourselves. Because you are the ones that are responsible for the rise of Donald Trump. You are the ones who have created this monster that you so despise, by your very actions, your refusal to respect your fellow Americans, and the things that are important to us. You have made fun of the “fly-over states,” the people who “cling to their guns and religion,” the middle-class factory workers and coal miners and underprivileged rural populations that you dismissively call “yahoos” and “deplorable.” You have mocked our faith and our religion. You have mocked our values and our patriotism. You have trampled our flag and insulted our veterans and treated our first responders with contempt and hatred.<br><br><br><br>You have made environmentalism your religion while trashing every city you have taken responsibility for. You scream from the rooftops about “global warming” and a “green new deal” while allowing tens of thousands of homeless people to cover your streets in literal sh*t, garbage, needles, and plastic waste without doing a single thing to help them solve the environmental crisis that your failed social policies are creating. But we’re supposed to put YOU in charge of the environment while gutting our entire economy to institute this plan when you can’t even clean up a single city?? You complain — endlessly — yet have failed to solve a single social problem anywhere. In fact, all you have done is create more of <br>them.<br><br><br><br>We’ve had enough. We are tired of quietly sitting by and being the “silent” majority. So don’t be surprised when the day comes when we finally respond. And trust me it’s coming, sooner than you might think. And also trust me when I say it won’t be pretty. Get ready.<br><br><br><br>If Donald Trump is reelected, it will be because you and your “comrades” have chosen to trash the police, harass law-abiding citizens, and go on rampages destroying public property that we have all paid for and you have zero respect for.<br><br><br><br>If Donald Trump is reelected it will be because we are sick of your complete and utter nonsense and destruction. How does it feel to know that half of this country finds you FAR more despicable than Donald J. Trump, the man you consider to be the anti-Christ? Let that sink in. We consider you to be more despicable, more dangerous, more stupid, and more narcissistic than Donald Trump. Maybe allow yourself a few seconds of self-reflection to let that sink in. This election isn’t about Donald Trump vs. Joe Biden. This is about Donald Trump vs. YOU.<br><br><br><br>So, if on the morning of November 4 (or more likely December 29 by the time the Supreme Court will weigh in on the mail-in ballot fiasco we are headed towards) if Donald J. Trump is reelected, the only people you have to blame is the left-wing media drones and yourselves. You did this. Yep, you!<br><br>Dave Mock - US Army - 1971-74"
2020-10-16T02:11:15Z,"🇺🇲Don&#39;t leave anything to chance!  🙏🇺🇸Please donate to President Trump and other Republicans...; <a href=""https://winred.com/"">https://winred.com</a> thanks!🇺🇲"
2020-10-16T02:10:55Z,The bleach comment from Biden is atrocious and unbelievable. Also when was Joe Biden &quot;pressed&quot;?
2020-10-16T02:22:41Z,"You didn&#39;t feel he was pressed because he answered the question, if he didn&#39;t answer the question you&#39;ll keep using that to shame Democrats until 2024 election."
2020-10-16T02:31:57Z,The bleach thing about Trump will stay for many years after him.
2020-10-16T02:10:45Z,"Sleepy Joe and George should have a town hall in his basement and tell bed time stories...very soothing, will put you to sleep...."
2020-10-16T02:10:44Z,Joe says one thing you know man do the right thing drop out
2020-10-16T02:10:28Z,Omg we are fd...be strong models work out get sun take vitamins ...
2020-10-16T02:10:06Z,These are the types of questions Biden is getting? Seriously a joke.
2020-10-16T02:09:50Z,🥰😍🤩 Donald Trump 4 Président 2Q2Q...
2020-10-16T02:09:48Z,"Also, he said the military would distribute. What a liar... or mis Informed candidate😂"
2020-10-16T02:09:46Z,Joe biden  for presdident or Pamela?
2020-10-16T02:09:36Z,"Mr Biden, I agree with everything you said.<br>A USA President should care very much for the people of America and by the sound of thing&#39;s you do. Listening to all the people of America is very important not just a minority and trying to move forward by saving lives, is I would say, the most important thing you could do if sworn in as the President of the USA  and then go from there. <br>I have been watching from Perth, Western Australia and the way Mr TRUMP has handled so many situations is appalling, specifically with the Coronavirus, he has blatantly put so many lives at risk and because of his disregard for humanity, many thousands of people have lost their lives and left so many grief stricken families behind and it&#39;s not over yet.<br>I know that if he acted in a responsible way in the beginning many people of your beautiful country would have had a better chance of survival.<br>I pray that you get voted in and do the right thing by your people as without them, where would any of you be ? <br>They need someone who will speak the truth and stand by it. <br>My heart goes out to all of those who have lost their lives and those who are left behind grief stricken.<br>🙏🦋 <br>ONE WORLD  🌍 never forget we are all in this together and we are all connected in every way.  😊"
2020-10-16T02:09:32Z,Biden definitely is more intelligent than Trump.
2020-10-16T02:14:09Z,He doesn’t have a single clear answer. Not one. His brains are scrambled. Sad.
2020-10-16T02:09:31Z,It’s clear that Joe doesn’t understand the science or the question.
2020-10-16T02:09:08Z,JOE HAS THE PERFECT VOICE FOR GIVING A BED TIME STORY
2020-10-16T02:31:56Z,"Now I got it, why he is sleeping 😴 Joe."
2020-10-16T03:08:32Z,He can Put anyone too Sleep ! He is that Boring !
2020-10-16T02:08:46Z,"<a href=""http://www.youtube.com/results?search_query=%23biden"">#Biden</a>/Harris 2020<br><br>Make America kind again.<br><br>🦅<br>🇺🇸"
2020-10-16T02:32:00Z,"Why dont you address all the false accusations stated against the President during the past 4 years.  I would venture to say that if someone built false accisation after false accusation about you, you would be as outraged.  Give your democrats a call and tell them to start acting kinder."
2020-10-16T02:08:38Z,No more mandates! Trump 2020
2020-10-16T02:08:29Z,Why are we jumping the gun and talking about a nonexistent Covid vaccine now? It may only become available next summer/fall. Do we really need to worry about its distribution and who takes it when nothing is available at this point? I&#39;m much more concerned about rising corona infections and failing economy!
2020-10-16T02:08:27Z,What a joke this is helping him out hes no leader
2020-10-16T02:38:53Z,And Trump isn’t a joke??? Trump is total narcissist who cares nothing about you dummy!
2020-10-16T03:19:01Z,Not Really ! This Makes him Weak and illegitimate.!
2020-10-19T20:26:18Z,@@stevesanzari7294 <br><br>GTFOH!!!
2020-10-16T02:08:26Z,Trump 2020 🇺🇸🇺🇸🇺🇸🇺🇸🇺🇸
2020-10-16T02:08:18Z,I guess she is going to vote for Trump again.
2020-10-16T02:37:00Z,Donal trump is not going to win...mark my words😏
2020-10-16T02:37:38Z,Trump 2020
2020-10-16T02:40:18Z,Everyone should
2020-10-16T02:41:36Z,Trump 2020
2020-10-16T02:08:04Z,Very different town hall. Trump townhall is real Biden is a joke
2020-10-16T02:08:04Z,Can you all upload the full town hall?
2020-10-16T02:08:03Z,"Gotta say Robin Williams rest his soul said it best about Joe Biden....🤣 <br>Watch &quot;Robin Williams Stand-Up Routine Mocking &#39;Ramblin’ Joe Biden&#39; Resurfaces&quot; on YouTube<br><a href=""https://youtu.be/h43q2n3GydU"">https://youtu.be/h43q2n3GydU</a>"
2020-10-16T02:08:01Z,The President never said bleach. What a misleading ass
2020-10-16T02:21:20Z,Disinfectant. Is that better? Oh wait! Bleach is a disinfectant.
2020-10-16T03:26:09Z,Oh wait so is the aerosol that people with Asthma intake. Disinfectants have been used internally for many years.
2020-10-16T03:40:12Z,"Project Pedro yes, but only in quantities sufficient to act as a preservative for the medication, which is way too small an amount to act as a disinfectant in the body."
2020-10-16T04:13:35Z,@@pixwillow I understand what you’re saying. I’m just saying the President isn’t a wordsmith. I always take him seriously but not always literally.
2020-10-16T02:07:55Z,what are two things?  he said 1 and start ramblings.  Yes he will take the vaccine.
2020-10-16T02:07:36Z,What plain does he have? what a clown
2020-10-16T02:07:18Z,Joe .. lol ... America wake up . This dude is lost !!!!  He becomes prez gas probably be $5 a gallon again
2020-10-16T02:42:28Z,The problem is that are of what is happening in 2017 2018-2019 in even worse on 20/20 because he he tried to make up at to America about to understand listening carefully and to be respectfully and to be responsibility for those four men and women that are up but it&#39;s happening right now and everyone needs to know that this is for telling the truth or and not a person says that a over this is a fantasy is not real but you can tell the difference Tyler of which one is fantasy which one is reality but I understand of a Giovanni what he says because it&#39;s going to be like the scientist need to understand her for this virus that offer to to beat the virus and then there will be other treatment or cure to everyone else&#39;s but listen to this very carefully everyone have a different symptoms like well he&#39;ll be less healthy or even data or something well some people got it in for the present and the past it would return it back into the future because this is not a brush thing just about to take plenty of time and patience and understanding of data numbers to the microscope and an end well people have a different blood symptoms data of well they&#39;ll not the same and even that well if when did the scientist that it and it is clear safe treatment or cure is going to be for everyone and that is the truth this is not a something it is not a fantasy this is reality well that we are here right now especially that Joe Budden has it inside and you got a normal life it is from the outside try to understand that especially that well everyone needs to be follow the guidelines wash your hands face and hands his hands low July together of when you go what type well how did things you know especially that well you know the rest
2020-10-16T02:07:15Z,Doc. Oz. today&#39;s show <br>was good. about the vacsean
2020-10-16T02:06:51Z,Why don&#39;t they ask him about his bribery and corruption in Ukraine?
2020-10-16T02:06:44Z,"ABC &quot; a Biden presidency would be a return to normalcy&quot;. sure deep state corruption, foreign payed lobbyist. inside the beltway whores. no thanks."
2020-10-16T02:06:27Z,I Love My Uncle Joe!!! ❤️👍👍💯Just wear a fkn mask. I said it for you Joe... Everybody Vote 🗳️📬🗳️
2020-10-16T08:49:27Z,🤢🤢🤢
2020-10-16T11:03:14Z,stop telling people what to do.  where do you get off on that?  wear one yourself and put a hazmat suit on too while you are at it.
2020-10-16T02:06:18Z,What a lier
2020-10-16T02:06:16Z,Mandate is a communist idea.
2020-10-16T02:06:00Z,Joe has to ease up on the coke-a-cola.  It&#39;s like he&#39;s on a sugar rush or something.  And man those eyes.
2020-10-16T02:28:12Z,probably out of the basement
2020-10-16T02:41:14Z,They finally placed him on Adderall. When he mumbles he&#39;s coming off of it.
2020-10-16T02:05:27Z,"Is there actually anyone left in the world other than uncontacted tribes, who is somehow not aware that they can wear a mask if they feel like it?"
2020-10-16T02:12:44Z,"If Joe wants to wear his magic mask, let him."
2020-10-16T11:08:13Z,"nature2rule I mean Biden didn&#39;t do crap for months while Trump held conferences and meeting,  and you know.. uphold his presidential duties. There is a difference."
2020-10-16T11:43:14Z,"nature2rule now the Harris camp has it, so explain that"
2020-10-16T11:45:28Z,nature2rule Biden isn&#39;t allowed to do anything without his wife&#39;s permission. She won&#39;t let him talk to reporters closely or have anyone near him. Biden is scared shitless of getting it because he would die. He had multiple brain surgeries in the past. Trump does not have those restrictions.
2020-10-16T16:15:20Z,nature2rule Biden has only seen the same 30 people since his campaign started. They are packed into a styrofome bus and shipped to his next rally.
2020-10-16T02:05:27Z,This gave me cancer
2020-10-16T02:05:20Z,Did he answer about packing the court????
2020-10-16T02:05:09Z,Why would Biden meet with scientists twice a week and discredit our President meeting with Medical Doctors of CDC who are directing the treatments for CoVid.? Why does Biden not tell how he will mandate treatment? Why would he have disposable mask in his hands now if he wears the 95 mask?
2020-10-16T05:59:33Z,"Watch this video for 1minute &amp; you will know the truth, it&#39;s Dangerous!!!:    https://www.youtube.com/watch?v=euukUI7FyHM"
2020-10-16T06:20:57Z,Why would trump inject bleach into himself and hit himself with a beam of light and still get covid ask yourself how makes more sense 🤔
2020-10-16T06:31:02Z,"Trump was NOT supporting the CDC as best as possible. <a href=""https://www.nytimes.com/2020/07/14/us/politics/trump-cdc-coronavirus.html"">https://www.nytimes.com/2020/07/14/us/politics/trump-cdc-coronavirus.html</a>"
2020-10-16T06:39:37Z,"@@fredinvest.2134 <br>Hydroxychloroquine with zinc ( bleach as you call it) was approved in 1955 by the FDA and has been used regularly and safely ever since.<br>Spoke to a woman at work who was using it....<br>Many businesses use blue light to sterilize items and equipment when dealing with the public.<br>The media is full of purposeful BS and misdirection, to say the least.<br>Large corporations own literally all media networks and they use the media to portray their interests.<br>I stopped watching them and now use independent news.<br>These same interests are ramping up censorship against anyone that disagrees.<br>This is not about hate speech, thats total BS, it is outright censorship.<br>Anyone supporting this crap had better wake up to whats actually happening."
2020-10-16T02:05:06Z,"Sorry Americans,they have to baby joe. He&#39;s old and his mind is slipping and he is easily confused, he also will get that im ready for a nursing home anger he has. They want biden to win really bad, they will not press him on nothing. Not till they hit him with the 25th amendment for being in capably of working are talking longer than 2 hours!!"
2020-10-16T02:04:58Z,"Why would anyone expect a fake news network like ABC to correct or give an actual quote by Trump.  Since he never even said the word bleach.  Bleach is a brand name.  But I&#39;ll do your job for you ABC &quot;News&quot;.<br><br>Remember.....What you say matters.<br><br>Trump actually said &quot; And then I see the disinfectant, where it knocks it out in one minute. And is there a way we can do something like that, by injection inside or almost a cleaning? Because you see it gets in the lungs and it does a tremendous number on the lungs, so it&#39;d be interesting to check that, so that you&#39;re going to have to use medical doctors with.  But it sounds interesting to me. &quot;<br><br>But why would a pretend news outlet like ABC news correct Joe Biden?<br><br>Remember everyone.  What you say matters!<br><br>Even if your lying to the American people.  That a President told them to inject bleach.<br><br>Do words matter when your son&#39;s demanding more money from China and Ukraine?  By saying &quot;I want the $25k before my dads visit.&quot;<br><br>What we say must matter.  Twitter and Facebook keep banning us from saying it.<br><br>Thanks for making easy yet again ABC.  To show that your not actually a news source.  Your activists.<br><br>I&#39;ll be eagerly awaiting the ABC &quot;News&quot; &quot;fact check&quot; on Joe Bidens words.  Just kidding.  They don&#39;t do that for Democrats."
2020-10-16T02:04:57Z,He&#39;s too old to care about defects
2020-10-16T02:09:31Z,Right. Older than Trump but way more coherent. I take Biden.
2020-10-16T02:12:07Z,@@mikeweave uhhhhh mister gaffe for DAYS?!
2020-10-16T02:17:46Z,"@@baileygregg6567 come on now. He stutters, yes. I rather that than some who really doesn&#39;t give a 2 fucks about nothing except his OWN success."
2020-10-16T03:00:09Z,@@mikeweave uh considering the man&#39;s made three peace deals and he&#39;s trying to get people money and Nancy Pelosi&#39;s the one standing in the way of it😒
2020-10-16T02:04:50Z,It is a tool
2020-10-16T02:04:31Z,"Wow, what a contrast.  Watch the moderator scream at and talk over President Trump and then come to this.  I feel like they were having kindergartners asking questions in the local library.  And what I heard is YES, he will mandate vaccines."
2020-10-16T05:17:20Z,"Wow, what a contrast!!! You are completely right! The journalist talking over President Trump is disgusting!"
2020-10-16T05:36:49Z,"Smileyface Smileyface dawg. The White House has been giving press briefings on COVID-19 so many times every week. He was reporting on future treatments, yes he butchered the explanation but he did not tell people to snort Lysol and drink bleach. He initiated the travel ban and Biden came out of his basement to call it xenophobic. Open your eyes and ears with the reality."
2020-10-16T13:01:42Z,"Exactly what I heard. And while I was 100% Joe it wasn&#39;t until he uttered the word yes. I do not like being told what to do with myself. Especially because I&#39;m stuck living in this body and dealing with ANY repercussions that vaccine offers, while Joe gets to say &quot;I&#39;m sorry&quot;. Sorry won&#39;t fix what whatever I&#39;d be dealing with. So his vote from me is a NO."
2020-10-17T19:04:53Z,@@oliviapg4002 Did you think it was disgusting when Trump talked over Biden?
2020-10-17T19:39:24Z,@@freddiejonesy6168 agree. Talk over the other is disgusting. Always
2020-10-16T02:04:22Z,The title on this video is joke much like ABC. &quot;Joe Biden pressed&quot; LMAO
2020-10-16T02:04:12Z,damm these trump supporters only speak likes
2020-10-16T02:03:47Z,"Joe, China owns you. You have been compromised."
2020-10-16T02:03:43Z,70% of covid cases are people who wear masks regularly.
2020-10-16T02:08:41Z,Lies
2020-10-16T02:10:00Z,Show the proof of where you got that statistic from. I&#39;ll wait
2020-10-16T02:03:43Z,Joe you are going to loose and lose big. You are such a lier and story teller how can anyone believe what you say. I can’t watch this hypocrite anymore. Up yours you criminal and traitor ! I bet no one will ask you about how much money you made from China Ukraine and <br>Russia . He sold out America and joe you have no plans for the virus . Millions of people would have died under your watch. I hope that the f b I. <br>Arrests the crook that yo are
2020-10-16T02:03:38Z,"OH MY GOD, LOOK!!<br><br>A normal, rational answer without interruptions or showboating. Is this what you want, you fascists? 😂"
2020-10-16T03:18:03Z,<b>I believe this was an attempt at Humor but it wasnt actually funny.</b>
2020-10-16T08:51:25Z,"It ain&#39;t supposed to be funny, but it is where we are at. Remember President Rambo didn&#39;t want to debate."
2020-10-16T11:54:37Z,Anime Fan Don&#39;t quit your day job.
