PublishedAt,Comment
2020-03-28T15:16:13Z,Also first potential zombie
2020-03-28T13:48:56Z,"Special thanks to this hero and all the others that will be unsung heros I hope she goes and others down in history for those who helped with the covid-19 virus, my love and prayers are with them all"
2020-03-28T12:28:34Z,Am not taking this vaccine good luck lady with the after effects
2020-03-28T11:39:33Z,14 months? Thats too long
2020-03-28T10:53:29Z,Like
2020-03-28T09:47:29Z,did it work?
2020-03-28T09:47:02Z,Any update on her?
2020-03-28T09:46:34Z,Its been a week and they didn&#39;t mention if the vaccine result
2020-03-28T09:42:38Z,The best cure is a few nuclear shrooms for china
2020-03-28T07:29:27Z,Whats the update on this vaccine?
2020-03-28T07:10:59Z,"Everyone who will is willing to risk their life’s during this time, are heroes! Pretty courageous, I commend her for her bravery and for risking her life to potentially save life’s."
2020-04-01T02:20:12Z,Has she given an update on her status?
2020-04-02T23:04:22Z,Christine Smith she not risking her life she killing herself they giving people the virus 🤦🏿‍♂️
2020-04-03T08:49:07Z,For real I would be pretty nervous to test any vaccine that&#39;s one brave women right there. The government does not have a good track record with drug trials.
2020-04-09T21:50:53Z,Do you wanna be one of them?
2020-04-10T02:03:08Z,Christine Smith she is fake. She isn’t who she says she is. And her “friends” on ig
2020-03-28T06:38:12Z,Oh god she could die. Who knows what might happen during this whole process its just scary.
2020-03-30T16:09:09Z,"I COPIED THIS VIDEO INCASE THEY TRY AND CHANGE IT BECAUS EI JUST EXPOSED THE LIE! PAY CLOSE ATTENTION TO THIS SO CALLED INJECTION! YOU NEVER SEE THE NEEDLE GO IN AND THEN IT SWITCHES EXTREMELY FAST SO MOST PEOPLE MISS IT BUT THE CAP APPEARS ALL BY ITSELF ON A SPLIT SCREEN WITHOUT THE PERSON PLACING THE CAP BACK ON...THEY BLOCK THE VIEW OF ANY NEEDLE GOING INTO HER ARM, THIS IS A HUGE HOAX YOU SHEEP"
2020-03-28T06:18:34Z,She crazy
2020-03-28T06:18:08Z,Nope not spoken me
2020-03-28T05:31:42Z,WHEN AND IF THE COVID-19 VACCINE BECOMES AVAILABLE WOULD YOU GET IT ?
2020-03-29T14:10:49Z,"Nope, even if forced!"
2020-03-29T16:11:01Z,Bobby Clemente if ur forced than youll get it anyways bc ur probably too weak to hold back two buff fbi agents dragging you to a hospital
2020-03-29T16:43:01Z,@@momlover6036 You haven&#39;t heard of guns?  Too weak as in already have it?  Not sure if you realize how vaccines are &quot;supposed to work&quot;.
2020-03-29T16:43:25Z,"@@momlover6036 You better be one of the first ones in line to get it or <a href=""http://www.youtube.com/results?search_query=%23HYPOCRITE"">#HYPOCRITE</a>!"
2020-03-29T17:46:20Z,"Bobby Clemente ill do it, not to save people i just feel like it would be fun even if i put my life in danger. I never said anything about how the vaccine works btw."
2020-03-28T05:23:46Z,That makes her a carrier
2020-03-28T05:23:00Z,Injected...With ..it.......they say
2020-03-28T05:18:23Z,&quot;Would you be excited if this works out?&quot;<br><br>Bless his heart lord... 🤦🏽‍♂️
2020-03-30T02:07:10Z,Rivalfnm where did you get that information from
2020-04-05T03:15:54Z,Rivalfnm 😳
2020-03-28T05:04:49Z,"They say she&#39;s taking a risk. Yep, 2  actually,  coronavirus and  &#39;cure&#39;.  Which risk is greater? At least she acknowledged the cure. Didn&#39;t ask to poison her in the first place."
2020-03-28T04:49:43Z,Jennifer thank you for all your help and I hope we&#39;re willing to put this coronavirus to an end
2020-03-28T04:42:23Z,2nd dose is probably when they install a RIFD
2020-03-28T03:00:36Z,"I have no word for this lady. It takes a big balls to do some like that. If this really works, she will definitely be remembered forever. I wish you luck."
2020-03-28T02:04:34Z,Any update on this?
2020-03-28T01:47:57Z,Why are they acting like another country doesn&#39;t own the patent for the coronavirus vaccine?
2020-03-28T23:23:03Z,@npgoalkeeper _ coronavirus  patent US2006257852 2006 coronavirus vaccine European patent EP3172319B1 2014 granted in 2019
2020-03-29T01:52:02Z,@npgoalkeeper _ the ful that the us injects as a vaccine all the time kills more people in a year than this so called new stain that their basically calling a disease not a virus <br>but you believe this is a new strain 🤣🤣🤣 lead to the water but cant force you to drink . The news talking about this so called new virus/ disease that&#39;s on a pandemic but not talking about 5g... not talking about takings away encryption from the internet/ text ...not talking about the meteor that&#39;s supposed to possibly be to close to the  earth at the end of April... I could go on. I see how they world has been fool to go along as sheep and depend on the government like slaves.
2020-03-29T02:16:34Z,@npgoalkeeper _ not arguing but exchanging information! Thank you for your insight.
2020-03-29T02:19:12Z,@npgoalkeeper _ by the way boil water add lemon and a teaspoon of baking soda   .  Drink it everyone will be alright.  Israel has been doing that and their fine.
2020-03-29T04:51:35Z,"@npgoalkeeper _ well having an alkaline diet, good gut health helps overall. Your body will do as it should, what&#39;s its supposed to do. Kinda like a vaccine but with out the mercury."
2020-03-28T01:32:11Z,Is she speaking morso code   or is she nervous
2020-03-28T01:18:41Z,Volunteer? They didn’t even test it... probably gonna give you aids like the people in Africa when they said they were helping by giving vaccines...
2020-03-30T02:02:56Z,alondro paul where did you get this information from?
2020-03-28T01:18:40Z,Volunteer? They didn’t even test it... probably gonna give you aids like the people in Africa when they said they were helping by giving vaccines...
2020-03-28T01:11:09Z,Did the vaccine work for her? Any results
2020-03-27T23:20:10Z,There is no vaccine for this virus they are lying about it there wasn&#39;t even a sars vaccine . Don&#39;t get the vaccine. A virologist said there&#39;s no vaccine
2020-03-27T23:20:06Z,Keep us updated on what happens with you
2020-03-27T23:22:03Z,Who Agree?
2020-03-27T22:54:26Z,If she hasn&#39;t been exposed or has the virus...how are we supposed to believe it works??? Are they going to take her to New York where people are dying???
2020-03-27T22:06:32Z,B R A V E R Y ✊🏾
2020-03-27T22:01:19Z,14 months!!   So it should reach the general  public in about 2-3 yrs or longer....by then I will probably hmless/broke...
2020-03-30T16:10:20Z,"I COPIED THIS VIDEO INCASE THEY TRY AND CHANGE IT BECAUS EI JUST EXPOSED THE LIE! PAY CLOSE ATTENTION TO THIS SO CALLED INJECTION! YOU NEVER SEE THE NEEDLE GO IN AND THEN IT SWITCHES EXTREMELY FAST SO MOST PEOPLE MISS IT BUT THE CAP APPEARS ALL BY ITSELF ON A SPLIT SCREEN WITHOUT THE PERSON PLACING THE CAP BACK ON...THEY BLOCK THE VIEW OF ANY NEEDLE GOING INTO HER ARM, THIS IS A HUGE HOAX YOU SHEEP"
2020-03-27T21:37:05Z,"They are setting us up, time to make your choices."
2020-03-27T21:01:36Z,"Shes the first but how many people are getting it..how can they know if it works,expose themselves?"
2020-03-27T20:39:49Z,Now yu know she dead.. UGK
2020-03-27T20:23:40Z,"Does Covid-19 even exist?<br>A song about the Panic Pandemic<br><a href=""https://m.youtube.com/watch?v=WnsmPKOmHN0"">https://m.youtube.com/watch?v=WnsmPKOmHN0</a>"
2020-03-27T20:02:25Z,A true all American heroine 👏🏽
2020-03-27T19:38:59Z,You guys are amazing! Thanks for being so brave
2020-03-27T19:23:49Z,So she should volunteer at a hospital how else you know if it works. The sooner the result the better to speed it up. A year is too long most will only survive 2 weeks. Those dying should be allow to take this option.
2020-03-27T19:09:43Z,Doesn’t she have to be exposed to see if it works
2020-03-27T18:42:58Z,"Well that was dumb, a virus can not be combated with a vaccine, now she has the Corona virus, so she will have to be quarentined and wait for the antibiotics ( which cures the virus) to come out! Vaccines don&#39;t stop you from getting the virus! It makes you a carrier of it."
2020-03-27T17:43:39Z,What about people who can&#39;t afford it??? Is this going out to everyone??! I hope that people are not being charged for this. This should be free to the public.
2020-03-27T17:13:12Z,Gave the poor lady anything<br><br>Basically an experiment
2020-03-27T17:03:13Z,God bless her 🙏 and protect her... Hopefully it works.
2020-03-27T16:45:29Z,Is this where the zombies come in?
2021-01-04T21:36:30Z,Think so
2020-03-27T16:41:15Z,I’ll I got to say is if you find something that works better use it right away and cut the political bull crap.
2020-03-27T16:30:57Z,God bless you for risking Corneavirus
2020-03-27T15:33:53Z,Sad she don’t know what they put inside her.
2020-03-27T15:20:39Z,God bless you Jennifer
2020-03-27T14:51:09Z,"This is the person that should have fans, not the ones who can play a game or make a movie which anyone could do."
2020-03-27T14:28:57Z,May God be with u
2020-03-27T13:09:35Z,Oh look she got the mark of the beast
2020-03-27T12:21:55Z,Has she got the virus tho
2020-03-27T11:26:13Z,Conspiracy Theorist: check her for a chip and signs of mind control.
2020-03-28T22:02:04Z,Really ? Why would you say that 🤔
2020-03-29T05:04:28Z,a1tyrese on snapchat lmaoo
2020-03-29T18:29:39Z,@@stephanchevrier2937 because there are conspiracy theories  that think th vaccine will be a way for the government to inject all people with mind controlling  agents willingly but un knowingly  during the hysteria
2020-03-30T02:25:49Z,"The Duke never said i agree, dis  agree or care... was just explaining  where the comment  came from"
2020-03-27T10:42:11Z,How dumb can you be
2020-03-27T10:10:01Z,"WE DO NOT HAVE THE CURE YET !!  BUT WE ARE GIVEN THEM THE VIRUS ??  <br>Now we have The Flu shots Virus from China!  And the Corona Virus shots   from ???  China ?   <br><a href=""http://www.youtube.com/results?search_query=%23coronavirus"">#coronavirus</a>"
2020-03-27T08:58:58Z,No forced vaccinations live free
2020-03-27T07:54:22Z,"The ones who created that vaccine (in record time too, even if it’s in testing), and Haller could be responsible for saving countless people."
2020-03-27T06:24:10Z,Great lady👌👌👏👏👏
2020-03-27T05:37:48Z,Shutdown the Nation in the mean time! Save lives.
2020-03-27T05:10:14Z,Where: School Prince Sultan Military Medical City.
2020-03-27T05:09:13Z,"Since Dec 2012, Albarrak AM, documented Recoveries"
2020-03-27T05:06:46Z,"Recoveries Tom Hanks- USA, Clare  Gerada-UK, and Armanprees documentaries."
2020-03-27T05:04:36Z,Research others recoveries online.
2020-03-27T05:00:30Z,Liberty. livingston2001 yahoo com
2020-03-27T05:03:41Z,"Dec 2012, Documented recoveries Albarrak AM"
2020-03-27T04:59:46Z,She knows the rich will stay rich but moderate will become poor and the poor i cant imagine what stage they will be in
2020-03-27T04:55:24Z,I&#39;m scared everytime I cough or sneeze. Damnit.
2020-03-29T23:49:03Z,Blunts Smoking 🔫
2020-03-31T05:19:13Z,Trust God and follow directions stay at home unless you really necessarily have to go out
2020-04-01T23:25:37Z,Lambochaser you’re going to get through this I promise
2020-04-02T07:52:26Z,"Same here, I also have asthma and scared to have an asthma attach."
2020-04-02T14:01:44Z,Bro the feeling is mutual. Your not the only one. I&#39;m paranoid everytime I cough or sneeze. Turns out it was my allergies all along.
2020-03-27T04:37:09Z,"Chances are she was injected with something benign like saline-solution: so that she can appear so healthy on TV interviews and start the hype for people to take the coming vaccine.<br>BUT before YOU do this consider the following - every year flu (ie including corona) comes around and mutates so that in hundreds of years we could never develop a vaccine against flu that would work. So now, since January - a mere 2 - 3 months magically we have a wonder vaccine that is going to do what couldn’t be achieved in generations? Are you really willing to be a lab rat for the pharmaceutical corporations?<br>Historically vaccines contained all sorts of highly dangerous substances such as Mercury, Aluminum (both known neurotoxins), foreign DNA (such as monkey DNA), shelf-life extenders such as polysorbate-40/80 (40days / 80days), squaline and many other artificial adjuvants for the immune system... People - if you value your health - STAY AWAY FROM THIS DANGEROUS FILTH CALLED ‘VACCINE’. On top of all that, there might be nano-technology in this one to enable tracking of people: check out Bill Gates and his ID2020 project. Give yourself a chance and do not inject toxins straight into your veins.<br><a href=""https://www.coreysdigs.com/vaccines-pharmaceuticals/measles-masterminds-millions/"">https://www.coreysdigs.com/vaccines-pharmaceuticals/measles-masterminds-millions/</a>"
2020-03-29T15:04:57Z,First of all vaccines aren&#39;t given intravenously 2ndly goodbye
2020-03-27T03:46:53Z,WOWW SOMETHING POSITIVE 👏🏾👏🏾
2020-03-27T03:36:07Z,She&#39;s a superhero indeed
2020-03-27T03:26:27Z,She’s not even sick so how can you treat her 🙄🤔
2020-03-29T04:30:40Z,"TheRealOne Brown This test Vaccine is to create anti bodies so that when the real thing hits, the body is able to react immediately."
2020-03-29T09:58:36Z,You are referring to medication but this is vaccine
2020-03-29T15:31:49Z,Alexander C. Cariaso I get it but how can you confuse someone’s immune system with a unknown substance which at any given time that person can be subjected to contract any harmful disease/virus? So could you then say whatever substance was injected into her body was to prevent that disease/virus or what?
2020-03-29T15:34:36Z,Anirudh Kumar I should’ve stated the key word “prevent”
2020-03-29T15:42:26Z,"Our immune system is naturally equipped to protect us from harmful diseases/viruses, why can’t they find a natural way to facilitate that instead of possibly compromising someone health?  I’m no doctor but it’s common sense"
2020-03-27T03:16:24Z,She is as you can see not functioning the correct way ‼️‼️ stay away from them vaccine’s plsssssssss they will backfire on you
2020-03-27T02:44:42Z,Something not right with  this
2020-03-27T01:46:43Z,Hurry up with a dam cure
2020-03-27T01:28:04Z,A coward like her will def except the mark of the beast.  She’s not a hero. She’s the problem
2020-03-27T01:13:34Z,Why don&#39;t they test on the people who have the covid19? Their the ones who will benefit from it.Closely monitor the patients and ease the pain of the ones who have it.
2020-03-27T01:02:04Z,She a hero
2020-03-27T00:52:34Z,Why haven’t we heard updates from these volunteers? 🤨
2020-04-02T10:02:07Z,"Because there’s no virus, it’s 5G"
2020-04-02T20:53:36Z,Onearl Parker y’all dumb asf
2020-04-03T06:06:24Z,Think they&#39;re all dead.
2020-04-04T18:08:29Z,Juan Mendoza    (●__●)...
2020-04-05T09:55:46Z,Juan Mendoza That&#39;s not funny!!
2020-03-27T00:49:49Z,"Wow <a href=""http://www.youtube.com/results?search_query=%23subscribeback"">#subscribeback</a> &amp; <a href=""http://www.youtube.com/results?search_query=%23download"">#download</a> COVID-19 - Dj Smiley &amp; TreeDogg Mr. Atm (prodby JamesWilkins) <a href=""http://www.youtube.com/results?search_query=%23follow"">#follow</a> <a href=""http://www.youtube.com/results?search_query=%23dallasworldstarnewsmusic"">#dallasworldstarnewsmusic</a> on <a href=""http://www.youtube.com/results?search_query=%23ReverbNation"">#ReverbNation</a> <a href=""http://www.reverbnation.com/open_graph/song/31649224"">http://www.reverbnation.com/open_graph/song/31649224</a> <a href=""http://www.youtube.com/results?search_query=%23subscribenow"">#subscribenow</a> on <a href=""http://www.youtube.com/results?search_query=%23Dallas"">#Dallas</a> <a href=""http://www.youtube.com/results?search_query=%23WorldStarNews"">#WorldStarNews</a> <a href=""http://www.youtube.com/results?search_query=%23YouTube"">#YouTube</a> <a href=""https://youtu.be/tqUwQpq3i8Q"">https://youtu.be/tqUwQpq3i8Q</a> <a href=""http://www.youtube.com/results?search_query=%23twitter"">#twitter</a> @TREEDOGGMRATM @YGRATMBOYS @dallasworldstar <a href=""http://www.youtube.com/results?search_query=%23covid"">#covid</a>_19 <a href=""http://www.youtube.com/results?search_query=%23covid"">#covid</a> <a href=""http://www.youtube.com/results?search_query=%23cov%C4%B1d19"">#covıd19</a> <a href=""http://www.youtube.com/results?search_query=%23covidvirus"">#covidvirus</a> <a href=""http://www.youtube.com/results?search_query=%23covid19song"">#covid19song</a> <a href=""http://www.youtube.com/results?search_query=%23covidanthem"">#covidanthem</a> <a href=""http://www.youtube.com/results?search_query=%23covid19italia"">#covid19italia</a> <a href=""http://www.youtube.com/results?search_query=%23instagram"">#instagram</a> @mratmygr @dallasworldstarnews @arkansasworldstarnews @treedoggmratmigking @YGRATMBOYS"
2020-03-27T00:27:22Z,lol watch this video closely.
2020-03-26T23:55:01Z,And.... what happen????  Trump has already been talking about that drug combo - the French Doctor came up with and Dr Oz has been pushing more than a week ago!!
2020-03-26T23:27:13Z,DO NOT GET THE VACCINE!!! THE DISEASE IS IN THE SHOT!!
2020-03-26T23:12:53Z,thanks you Jennifer your superwoman.
2020-03-26T22:46:27Z,Lord surround her with you grace and mercy as she embarks on a journey w/a  possible vaccine. Hold her hand and continue to protect her as she is taking a selfless risk to heal others. In Jesus name Amen!
2020-03-26T22:05:06Z,"Am a muslim n i dont know in whom u believe .<br>Prophet Muhammad (peace b upon him) said <br>That the one who have a single seed of black seeds in there digestive system , that person will eliminate every disease except death.<br>This man never lied in his whole life .<br>Am Jus telling this for humanity .<br>ppl trying so many things .<br>Its easy n very effective just a pinch of black seeds jus try it .<br>Wheather u believe me or not it will work inshallah."
2020-03-26T21:23:12Z,She doesn’t look or sound sick.
2020-03-28T16:29:40Z,"Shes not,its a vaccine so she doesnt have corona. The vaccine just allows the body to make the antibodies for the corona when it does hit"
2020-03-28T16:35:33Z,"a vaccine is there to prevent you from getting it after being exposed, which means she&#39;s going to be exposed to the virus later to see of it works"
2020-03-28T16:51:15Z,"@@FANI-NI no, this vaccine was just to test the side affects of it and see its flaws. Maybe later but i doubt they would expose the virus to her. That&#39;s too dangerous"
2020-03-29T16:27:00Z,Blitzburgh 43 she said she was healthy and didnt have the virsus.this is to prevent from us contract the virus like the other vaccines we get as children
2020-03-29T16:28:48Z,Alicia Huntsman yeah I know. My bad.
2020-03-26T20:33:51Z,Well that brings new meaning to ‘taking one for the team’. <br>What a beautiful soul and thank you for your bravery. Best wishes.
2020-04-26T17:52:54Z,"Glad im not in your team , dumb sheeples."
2020-10-29T04:24:52Z,@@lmaolmfao7590 right lol the sheep are far worse now 🤦🏽‍♂️
2020-03-26T19:56:04Z,Who else though she would just blast during the video?
2020-03-26T19:43:05Z,Cant a vaccine be made from bats since theyre immune?
2020-03-26T17:50:46Z,Not fair: Trump who is so brave and who has been belittling the danger Covid-19 poses to the community should have volunteered to be Volunteer #1
2020-03-26T17:41:59Z,How much are they paying her?
2020-03-26T17:04:23Z,God bless you
2020-03-26T16:37:49Z,Two hours later<br><br>She died<br><br>Peter Griffin Wait what!<br><br>She died.
2020-03-26T16:22:30Z,Why is this sickness such a big deal? It’s like a flu? Why are we shutting down the world for a flu? If you get it you get it if you don’t you don’t.
2020-03-26T16:14:29Z,Ma aapko lambi umra mile
2020-03-26T16:03:30Z,She is a fantastic person.
2020-03-26T15:50:27Z,"Welp, she&#39;s gonna become a zombie."
2020-03-26T15:41:02Z,"We need heros like this brave lady, u are the real hero"
2020-03-26T15:32:37Z,Waste of shot
2020-03-26T15:22:16Z,Today u  r not just a women to this world.. now u r like a mother..<br>Brave lady and hatsoff to Ur courage..  🙏🙏🙏
2020-03-26T14:39:51Z,I feel bad for the anti-vax parents
2020-03-27T06:55:43Z,Lol anti vax moms
2020-03-27T17:54:29Z,"I almost died from normal childhood vaccines in Nursing School. There are always larger reasons for some, as to why they can’t or won’t vaccinate."
2020-03-26T14:33:58Z,Still looking for volunteer on covid19 vaccine? Im more than willing to do that..
2020-03-26T14:32:13Z,Heads off
2020-03-26T14:17:13Z,Big mistake I won&#39;t take it period
2020-03-26T13:05:52Z,"I don&#39;t know what to think especially there is so much controversy regarding the vaccination, that is it a chip that is being in planted in the human body"
2020-03-26T12:33:07Z,Im curious what are the chances of a test vaccine killing you or physical hurting you? does it happen often or does it just not work most of the time
2020-03-26T11:45:07Z,"This should be a lesson to us as humans, that God created all animals and their those that God selected for us to feed ourselves with. Not all animals can be eaten. God please forgive us."
2020-03-27T23:23:51Z,lebs lion it’s a man made virus 🦠 saying it was from the Wuhan market was just something to blame
2020-03-26T11:20:39Z,Risking her life. Brave women. Humanity will thankyou when success is made
2020-03-26T10:56:42Z,She was a lab rat she needed that extra cash it look like she needed the extra cash this was a lab rat
2020-03-26T10:56:00Z,The process that goes from here is death if this b*<b>*</b> ain&#39;t healed cured vaccinated
2020-03-26T10:52:26Z,"Tell me her face don&#39;t look dumb Like she&#39;s stupid, she don&#39;t look stupid to you like look at her face she look like she she look like she just sleep she&#39;s snoring show me what the f*** going on in this earth I should go to the police real quick tell on you over a f*<b>***</b> gummy bear or something"
2020-03-26T10:50:40Z,This b*<b>*</b> is stupid they done injected her with the virus now wait for it that b*<b>*</b> going to get sick soon I&#39;ll give it 14 to 20 days
2020-03-26T10:24:24Z,"I SALUTE YOU JENNIFER HALLER, YOU ARE A BRAND NEW HERO."
2020-03-26T07:30:02Z,"Stay home: <a href=""https://www.youtube.com/watch?v=JtxLaLJO830"">https://www.youtube.com/watch?v=JtxLaLJO830</a>"
2020-03-26T07:23:24Z,I&#39;ll volunteer!
2020-04-26T18:01:56Z,Enjoy getting sicker.
2020-03-26T07:10:56Z,Smh. They won&#39;t get me..
2020-03-26T06:57:25Z,Thank you 💖💖💖
2020-03-26T06:56:10Z,Wow thank you lady for this selfless act... I respect  your bravery! 100%
2020-03-26T06:43:36Z,This is all so fake it’s ridiculous 🤦🏻‍♀️
2020-03-26T06:09:41Z,God Bless
2020-03-26T05:55:39Z,"Jennifer Haller is a hero ,she gonna save a lot of us from Coronavirus...Wishing her the best of luck and good health..."
2020-03-26T05:51:35Z,Jenifer Haller is brave lady🙏🙏🙏🙏💪💪💪
2020-03-26T05:40:16Z,Thanks from tunisia
2020-03-26T05:30:29Z,Thanks lady
2020-03-26T05:11:05Z,"Fake news, dont be fooled people,  dont get vaccinated,  tell the old people!"
2020-03-28T02:56:08Z,Something is wrong with you mate this is real not ALL news is fake sone of it might be but this is real
2020-03-28T02:56:42Z,The fact that you call them &quot;old people&quot; just proves that your childish
2020-03-26T05:10:48Z,From one old warrior to another.. salute to a brave lady.
2020-03-26T04:59:20Z,So they already have a vaccine?
2020-03-26T04:56:35Z,Wow so when she just took a hormone interrupter and she goes into menopause early? Of just ruined her large intestines alveoli? Crohn’s or some other autoimmune disease here she comes
2020-03-26T04:43:23Z,God bless you
2020-03-26T04:12:09Z,"Today is 26/3, how&#39;s she doing now? Any updates??"
2020-03-26T03:56:33Z,Thank you jan!
2020-03-26T03:49:31Z,What’s the update on this? How’s she doing?
2020-03-26T03:25:52Z,How is that going to work if she doesn&#39;t have the VIRUS??? Shes getting a vaccine for something that she does not have????? I dont get it?
2020-03-26T03:13:39Z,Oh christ I swear all am thinking about is resident evil I hope she doesn&#39;t mutate into something like those movies
2020-03-26T03:12:06Z,What happened?
2020-03-26T02:59:25Z,Wow even though we got to wait 14 months for the final results she&#39;s really brave🙏
2020-03-26T02:34:28Z,I wonder how she recovered or if she hasn&#39;t..I need to see
2020-03-26T02:32:26Z,Adrenochrome
2020-03-26T02:22:55Z,Thank you thank you Jennifer.  May God bless you for your bravery
2020-03-26T02:11:55Z,"this is all apart of the plan, that’s on spiritual so"
2020-04-02T04:15:58Z,"D.L. Schum exactly, these people gotta wake up 👁"
2020-12-13T16:55:58Z,@@olab9300 wel Dey either takin my head or I’m takin ders
2020-03-26T02:07:30Z,Haller vaccine..God bless her
2020-03-26T02:00:06Z,I’ll be a tester for free
2020-03-26T01:56:34Z,I am legend🤨
2020-03-26T01:41:13Z,wow
2020-03-26T01:26:24Z,U can&#39;t treat DNA virus only God and Chinese
2020-03-26T01:14:16Z,"I receive a check each month,I need a answer to get rid of this invisible virus, money not going to cure this virus , where is the vaccine that&#39;s what on"
2020-03-26T01:13:19Z,God bless you!!!
2020-03-26T01:12:08Z,Aloe eggs honey cream brown liqueur mix raw and drink do not refrigerate good luck out there
2020-03-26T00:26:20Z,Did she had the  Corona virus?
2020-03-26T00:21:36Z,She lowkey a baddie
2020-03-26T00:13:34Z,Heroes
