PublishedAt,Comment
2020-03-17T23:18:06Z,Very brave. In the sci-fi movie it always turns out bad. Doctor discovers a vaccine and it turns the population into brain eating zombies.
2020-03-17T23:16:37Z,Gracias Jennifer !!!!!  Thank you
2020-03-17T23:13:07Z,"What a lovely lady! Hero . Hope it works, quick!"
2020-03-17T23:05:13Z,This virus is becoming very scarily similar to the Krippen virus in &quot;I Am LEGEND&quot;
2020-03-17T23:04:14Z,Don&#39;t do it sheeple!!!!!!!!!!
2020-03-17T23:03:07Z,"What!!!!!!!<br>You are a hero <br>God bless all the doctors, nurses,and lab technicians.......with the help of God we can overcome"
2020-03-17T22:57:03Z,Im giving this lady and anyone involved the side eye....
2020-03-17T22:54:30Z,Yes I am Happy to be here!! Wtf :)))
2020-03-17T22:53:50Z,Wishing she will recover.
2020-03-17T22:48:28Z,is she a ncov positive?
2020-03-17T22:36:24Z,Great acting in display
2020-03-17T22:34:49Z,Does anyone know if COVID-19 postive people are dropping dead or collapsing in the streets like those in Wuhan?
2020-03-17T22:26:55Z,"Learn and remember her name, a pioneer in the battle to win against Covid-19!"
2020-03-17T22:24:07Z,"COVID-19 MUSIC 22022020 Pandemia ---  <a href=""https://www.youtube.com/watch?v=GqhkWEyKG0o&amp;t=8s"">https://www.youtube.com/watch?v=GqhkWEyKG0o&amp;t=8s</a>"
2020-03-17T22:24:02Z,"ActivePure Air And Surface Purification - Explanation And Science Data!<br><br><a href=""https://youtu.be/Ib21IorQ1pI"">https://youtu.be/Ib21IorQ1pI</a>"
2020-03-17T22:22:44Z,Should be retitled first guinea pig.
2020-03-17T22:13:14Z,Never exposed to the virus... not THAT courageous. Make me possibly immune? DUH.
2020-03-17T22:07:33Z,Damnit
2020-03-17T22:01:46Z,"Trying to fast track a vaccine is dangerous. From history we&#39;ve seen vaccines that were attempted to go through trials quickly ended of fizzing out by phase 2 or 3. Not saying a vaccine is needed, but if we have one that&#39;s working by 2021 that will still be in record speed. She will need to be monitored for weeks, months even as antibodies are created, then phase 2 will start which will take another 3 or so months, then phase 4 with a higher number group for another 3 months, and it will go on for at least 4 phases. So at the earliest we might have one by 2021 March. I have no idea what the crazy German dude is going on about saying we might have it by this autumn. No, we won&#39;t, and if we do, it will not have been thoroughly tested enough."
2020-03-17T21:57:40Z,Give her a cape. Thank you 🙏
2020-03-17T21:38:52Z,"Thank you, Jennifer.  You are one courageous woman!  Bless your heart."
2020-03-17T21:27:10Z,This courage is what makes America Great! God speed.
2020-03-17T21:26:16Z,Dr Fauci said that trials would be 13 months away. How is this possible?
2020-03-17T21:23:21Z,Mass public inoculations... all apart of the agenda
2020-03-17T21:17:26Z,May allah give you rite path and grant you janah
2020-03-17T21:16:01Z,Vaccines HAVE NEVER saved us!!! 🐑🐑🤮🤮
2020-03-19T03:59:42Z,Ur a boome
2020-03-17T21:07:07Z,Can anyone imagine Mr Trump or any of his self-serving Republican friends making such a sacrifice for other humans?
2020-03-19T04:06:38Z,44Wynter even worse all the democrats who are poor entering congress and are multimillionaires when they retire.
2020-03-17T21:06:11Z,coronavirus left the chat .....
2020-03-17T20:59:30Z,"THANK U JENNIFER, AND I PRAY UR ALL WELL"
2020-03-17T20:56:35Z,I don&#39;t get it. so will they infect her with the virus on purpose as to see if she can still get it? or how does it work?
2020-03-17T20:49:09Z,it&#39;s a placebo
2020-03-17T20:43:57Z,She&#39;s our brad Pitt of wwz
2020-03-17T20:37:11Z,And what is the point of giving a healthy person the vaccine? Give it to someone who is sick to see if it cures them.
2020-03-22T22:51:59Z,"SnoopyDoo Ditto! Connect the dot. Don’t you sense something isn’t quite adding up? <a href=""http://www.youtube.com/results?search_query=%23thegreatdeception"">#thegreatdeception</a>"
2020-03-17T20:36:44Z,This women is a GRIFFINDOR!
2020-03-17T20:36:20Z,I wish all the best to this woman !!!
2020-03-17T20:29:00Z,This lady is radiating positive just by looking at her and hearing her speak out.  Receiving and sending her best energy.
2020-03-17T20:17:04Z,Lmao theres an fake news saying that china found the vaccine and is distributing it
2020-03-17T20:13:25Z,Adding my thanks to this brave soul and wishing her the best of luck.
2020-03-17T20:09:30Z,A sign of hope as this woman was the first to test the coronavirus vaccine.
2020-03-17T20:03:33Z,HOLLER FOR HALLER!
2020-03-17T19:56:00Z,Hero
2020-03-17T19:54:58Z,Thanks for your contribution
2020-03-17T19:47:33Z,Respect for her decision to help us all. I hope this test succeeds so we can go back to normal
2020-03-17T19:44:08Z,"This warning is for the chosen ones. DO NOT get these “vaccines” for the Coronavirus, it will affect you later on along with 5G. ⚠️👁"
2020-03-17T20:22:16Z,"If I remember correctly, you should be able to request the ingredients that is in the vaccine, if there are metallic particles, including Thimerosal in the ingredients, then there can be some serious side effects and even damage when interacting with 5G frequencies.<br><br>Those ingredients are also mainly found in the yearly influenza vaccine (Hepatitis B, Measles etc. vaccines are usually safe.) <br>Upon request you can get a flu shot without those ingredients.<br><br>G.W.E.N. towers (when turned on to a set frequency) can have harmful effects on people also.<br><br>All this can be researched, it&#39;s a lot of reading, but it&#39;s out there, don&#39;t take my word for it."
2020-03-17T20:26:51Z,"Mother nature&#39;s &#39;vaccine&#39; is called &quot;antioxidants&quot; found in grapefruits and pomegranates. That&#39;s the real cure. Vitamin C tablets(all natural) can help fight any flu, including this one.<br><br>Glutathione is very helpful also, a powerful antioxidant, found in broccoli, onions and garlic."
2020-03-17T19:36:48Z,I think some death row inmates should volunteer.
2020-03-17T19:36:40Z,zombieeeeee
2020-03-17T19:36:23Z,God bless you.  I&#39;m sure they&#39;ve tested this on someone else however thank you.
2020-03-17T19:27:31Z,It will all work out.  I celebrate anyway for her bravery and humanity.
2020-03-17T19:25:40Z,Thank you Jennifer H.
2020-03-17T19:21:14Z,So the doctor doesn’t have a mask 😷 😐😳👍 hope this vaccine is real
2020-03-17T19:20:37Z,"unselfish but crazy. human guinea pig.<br><a href=""http://www.youtube.com/results?search_query=%23Healthcare"">#Healthcare</a> is a human right.<br>Vote <a href=""http://www.youtube.com/results?search_query=%23Bernie"">#Bernie</a> 🔥"
2020-03-17T19:19:17Z,Dear world<br>How its going to lockdown<br>Yours sincerely<br>Kashmir
2020-03-17T19:18:05Z,"Reporter: “Right, right...So have you seen the movie ‘I Am Legend’ Jennifer?” 🤔"
2020-03-18T23:32:02Z,I just said that on Facebook today....kisses
2020-03-17T19:17:48Z,she kinda cute tho
2020-03-17T18:58:23Z,Wow wow wow she’s our HEROOOOOOOOOOOOO  . Sending you love from 🇦🇪🇦🇪🇦🇪🇦🇪🇰🇪🇰🇪🇰🇪🇰🇪
2020-03-17T18:57:45Z,she&#39;s a saint. god bless her heart.
2020-03-20T09:01:02Z,Maybe u should get one
2020-03-17T18:55:23Z,I don’t get the flu shot and I wouldn’t get this either.
2020-03-17T18:54:18Z,"I hope she got that $7,000 I heard was being offered."
2020-03-19T22:19:04Z,mia moni links?
2020-03-17T18:53:32Z,But the doctor wore a mask to give the injection?
2020-03-17T18:51:30Z,How much money will the vaccine profit? 💰
2020-03-17T18:51:03Z,Soon to be infected...  😟
2020-03-17T18:50:39Z,Thank you so much! I wish I could do so too but they’d never take someone with a chronic health condition already.
2020-03-17T18:48:08Z,Totally selfless act!  Jennifer Heller is a real hero.  I really hope this works out.
2020-03-17T18:46:43Z,They are true heros I hope the vaccine works - this bat virus is the worst one maybe in the history of the human race just looking at how instant it has spread.
2020-03-17T18:27:25Z,"Obviously she is excited, proud, scared and all the things that are there in the book. I have hardly met such a person. Good woman, you are a beacon of hope for the humanity."
2020-03-17T18:24:37Z,How can you develop a vaccine for human trials when your so lacking even the test kits. Trump is scrambling to do something that will look good for us presidency
2020-03-19T17:57:24Z,Booom!!!
2020-03-17T18:24:20Z,THIS IS WHAT A TRULY UNSELFISH PERSON LOOKS LIKE . THANK YOU!
2020-03-17T18:24:14Z,"This was a great video, the first, test study, wow, she&#39;s brave an d a proud American, much success and love to her <br>🌺🌻🌹🌼"
2020-03-17T18:22:49Z,She&#39;s braver than I am. We wouldn&#39;t be where we are now if it weren&#39;t for pioneers like this woman. Wishing her the best!
2020-03-17T18:21:06Z,China and WHO wasted people for the COVID-19.  USA saved people from the COVID-19.  Shame on China and WHO!
2020-03-17T18:20:05Z,I hope if we all could get cured or if they make a vaccine  💉  to write the name of the all doctors 🥼 nurses 👩‍⚕️ and scientists 👨‍🔬 of the world in the book of being real heroes 🦸‍♀️They are the real one ☝️ who is helping all 24*7 to make us live I hope and pray everything will be Alright and prayers to the people who are right now fighting the virus 🦠 thanks to the doctor nurse and scientist and you to 🙏🙏
2020-03-17T18:16:34Z,Hopefully it works because there is a flu vaccine and people are still constantly getting the flu
2020-03-17T18:15:29Z,"Thank you Jennifer for taking a risk,  to impact many others."
2020-03-17T18:06:54Z,"all hail queen Jennifer Haller for saving us all, Thank you :&#39;)"
2020-03-17T18:04:18Z,a free coffin for all testd dnated by doofus funeral. Their ad is we provided coffin for all
2020-03-17T18:00:40Z,Will she be purposefully exposed to the virus?
2020-03-17T17:56:49Z,👏🏼👏🏼👏🏼👏🏼Applaud and admire her for her selflessness...we need more people like her.
2020-03-17T17:53:17Z,How  she  is now ? From 🇮🇳 india
2020-03-17T17:52:39Z,Right to try?
2020-03-17T17:49:10Z,I personally protect my and my family with natural meds called garlic ginger red onion lemon and black seeds. Do not use too much black seeds
2020-03-17T17:47:35Z,Does she have the virus ?   and if not why aren&#39;t they testing on someone who would volunteer who has it...
2020-03-17T17:45:18Z,thanks Jen
2020-03-17T17:45:12Z,How would they know if med is going to work for her or not while she&#39;s not sick with the virus. 🤔
2020-03-17T17:42:25Z,Telehealth now available for seniors.  They do not realize that most seniors don&#39;t have the computer equipment and/or  skill necessary to set the computer up to do on-line appointments.  It&#39;s an easy fix to spout off but they didn&#39;t think it through.  Seniors did not grow up with computers and majority don&#39;t have them.  I bet DJT couldn&#39;t set up a computer to do a telehealth on his own following the instructions provided.   Solution sounds good but not realistic.
2020-03-17T17:40:37Z,Is it true?????
2020-03-17T17:38:29Z,"Everyone is eating this up.... you all believe in this crap... sheep.. obey... just make a soup of garlic an onions, it is high it vitamin c"
2020-03-17T17:36:19Z,why is there a stock ticker.  I&#39;m inclined not to believe this report
2020-03-17T17:32:27Z,"While I certainly do applaud her initiative and wanting to contribute to the effort to eventually prevent this COVID-19 virus from creating this level of pandemic, remember that there are thousands of people like her who volunteer for clinical trials all the time when a new drug is tested. She is participating in a phase I trial, which is healthy volunteers, to test the safety of the vaccine and determine maximum safe dosage as well as monitor any potential side effects.  After many months of data collection and analysis, if it is safe for human use with minimum adverse effects, they will move to Phase II, consisting of a much larger sample of patients who are actually sick, to measure the efficacy of the vaccine, again for many months. This is the regulatory process for all new drugs, including vaccines, to make sure it is generally safe and delivers the desired patient outcomes.  The approval process can also take some time as all the clinical and safety data needs to be reviewed and proven before they move forward to introduce it on the market.  So while that happens, we need to keep ourselves healthy, hygienic and following guidelines shared by health professionals and regulatory officials.  Stay home, keep your distance and stay positive! 💪🏼😀"
2020-03-17T17:37:17Z,Busy Mama Thank you for this! You too. 🙂.
2020-03-17T17:30:46Z,And they gave her a small amount of the virus
2020-03-17T17:29:41Z,I don’t trust it may be a chip in side or something
2020-03-19T17:44:31Z,Do you have schizophrenia?
2020-03-17T17:20:11Z,"God willing this works, god bless"
2020-03-17T17:15:42Z,She&#39;s courageous than me. She&#39;s a hero. The world&#39;s hero
2020-03-19T08:29:37Z,don&#39;t forget the doctors nurses and scientist they r our Front liner on this pandemic covid-19.
2020-03-20T09:43:54Z,Mrssewhardtoplease so she is not a fool
2020-03-17T17:11:13Z,Congrats
2020-03-17T17:06:50Z,Thanks 🙏.. from 🇰🇼 kuwait .
2020-03-17T17:01:47Z,"THANK YOU SO MUCH, FOR VOLUNTEERING... THANK YOU"
2020-03-17T17:00:17Z,May God have mercy on all of us. Thank u Jenny for your contribution to human kind.
2020-03-17T16:58:26Z,"You are such a hero it’s really spreading I mean it’s just crazy schools closing people dieing acters getting it it’s so so so much a risk but I still feel the stocking up in shops in the uk manly England I think it’s a bit silly like why stock up on 7 bags of chips when it’s 7 of March and they go out of date on the 10th like are you gonna eat 7 bags of chips in 3 days it’s just silly this virus has came from fruit bats originally it’s passes on to dogs cats and more house animals and yknow Chinese people eat dogs and bats so it started with one kid eating a bat and catching the corona virus and its just spreaded and spreaded in Preston close to were a live there has been 55 deaths it’s crazy and in the total of 2 months it has killed over 100,0 people in the hole states luckily for some people who live in Antarctica and the desert it’s to hot in the desert and it would die and in Antarctica it’s to cold so it will die I have so much respect for the people stepping up and helping god bless you 🤞🙏🥰😘😘😘 good luck xxxx 💝💝💝💝💝💝❤️❤️❤️❤️❤️❤️💖💖💖💖💝💝💝💝💖💝💝💖💝💖💖💖💖💖💖💖💖💖💖"
2020-03-17T16:57:11Z,"So are they going to try to infect her with COVID-19, so they know it works? Edit: <a href=""https://www.youtube.com/watch?v=F8aueQXQ2H4&amp;t=3m11s"">3:11</a> the answer is no, so I guess we won&#39;t know unless she catches it."
2020-03-17T17:38:01Z,"Luis Mendez This is phase I, they need to test it on healthy patients to see the effect of the vaccine first."
2020-03-17T16:44:54Z,She will be in history of the world
2020-03-17T16:44:52Z,You&#39;re an angel without wings..thank you so much for what you&#39;re doing..we love you Jen..🙏♥️
2020-03-17T16:43:56Z,Jannifer  hellar   its happy to see you and god  bless  you  dear  .hope  this  works
2020-03-17T16:43:55Z,Why don&#39;t they try on a older persons??? you know someone over 60?????
2020-03-17T16:36:49Z,Respect may Allah bless her
2020-03-17T16:34:39Z,I hope they paid her well.
2020-03-17T16:32:50Z,THERE ARE NO WORDS....SO WITH A GREATFUL HEART THANK YOU..WILL PRAY FOR YOU ALL......GOD BLESS YOU......THANK YOU.......
2020-03-17T16:31:46Z,Thank you❤
2020-03-17T16:24:59Z,"I pray to Allah that you recover soon, Jennifer. Truly you are a gem! Thank you so much for volunteering. Let&#39;s all pray and hope that this vaccine works. ❤"
2020-03-17T16:24:43Z,Sooooo there’s a cure????
2020-03-17T16:24:28Z,Thanks a lot to the courageous women.. Hats off.. Singapenney!!!!!!!
2020-03-17T16:22:50Z,💙💙💙💙💙💙💙💙👏👏👏👏👏👏👏👏👏👏👏
2020-03-17T16:21:26Z,Is this a vaccine to prevent  the coronavirus  or is it to actually cure you from the virus because if it&#39;s not a cure I find it not worth it it&#39;s just like another flu shot just my opinion
2020-03-17T17:38:56Z,Brooklyn Pretty sure to cure you.
2020-03-17T16:19:51Z,"I&#39;m in a city just North of Seattle, and absolutely EVERYTHING is shut down around here! <br><br>There&#39;s something to be said about living in the apparent epicenter of the vaccine race, though. <br>And, I would honestly prefer to live NOWHERE else in a time like this. <br><br>I just hope we&#39;re really on the verge of discovering a remedy, wherever that process takes place and whether I have the virus myself or not. Because, maybe this whole crisis can pass before it gets much worse."
2020-03-17T16:19:04Z,Meanwhile in Walmart selfish people fighting for toilet paper
2020-03-17T16:14:21Z,Thank you Jennifer that&#39;s amazing
2020-03-17T16:11:44Z,When there is a pandemic and your president is Donald Trump ...
2020-03-17T16:11:44Z,When there is a pandemic and your president is Donald Trump ...
2020-03-17T16:10:12Z,Am here malaysia  try me
2020-03-17T16:08:19Z,"If it succeed,then her name must be used as the antidote&#39;s name<br><br>Lets say:<br>JH19A (Jennifer Haller&#39;s Covid19 Antidote)<br><br>Make it Happen!<br><br>Proud of you Jen!<br>Greeting From Indonesia"
2020-03-20T09:31:18Z,What about all of the other volunteers?
2020-03-20T18:03:40Z,"Good idea though we should name vaccine after Dr Li Wenliang, the whistle-blower doctor."
2020-03-20T18:07:46Z,@@keruanne1 Or the people that created the vaccine.
2020-03-20T23:47:13Z,Greetings from wakanda!
2020-03-17T16:04:09Z,Y’all better line up and thank this woman if this works.
2020-03-17T16:03:04Z,China did this two weeks ago. Lead researcher did this to herself.
2020-03-17T15:59:12Z,MSNBC you are the best! That&#39;s why I am always tuned many thanks from me and my family.
2020-03-17T15:57:20Z,👏🏻👏🏻👏🏻
2020-03-17T15:51:32Z,https://youtu.be/PwXAU4cY19U      share share share
2020-03-17T15:51:06Z,She is help the whole world and God blessed her
2020-03-17T15:48:44Z,"<b>So brave, she’s a hero!</b>"
2020-03-17T15:45:09Z,Wishing the lady the very best .much appreciation x
2020-03-17T15:36:36Z,I volunteer as tribute! She&#39;s a hero.
2020-03-17T15:33:51Z,THANK YOU JENNIFER for doing this for the Rest of the Population.
2020-03-17T15:33:13Z,I lobe you
2020-03-17T15:30:16Z,I stand up and applaud her!! I hope all goes well. My prayers are with her and with the world. <br>THANK YOU JENNIFER!👏👏👏⚘🌻⚘🌻⚘
2020-03-17T15:27:43Z,Hope it works......GODSPEED JEN!  Seem like a good strong healthy woman.
2020-03-17T15:18:56Z,The Chinese pharm company that made this virus has kept a death target once that is crossed they will release the vaccine and sell it at very high rates ... I got this news from the dark web just wait and watch.
2020-03-17T15:17:35Z,she is more brave than me
2020-03-17T15:17:00Z,And we are OFF THE SHOTS HAVE ARRIVED
2020-03-17T15:16:27Z,These volunteers will be remembered and big applause for them
2020-03-20T09:37:09Z,Yup just lile those volunteers for all the other vaccines like... old whats his name and thingy... yup good people.
2020-03-17T15:16:09Z,If the scientists are right on the first try (this “vaccine”) it may speed up the end of the pandemic.
2020-03-20T23:10:32Z,Let’s hope this first trial really works
2020-03-21T05:37:26Z,@Dave m you&#39;re the reason children are dying
2020-03-22T03:58:37Z,The end of the pandemic isn&#39;t the cure
2020-03-17T15:01:40Z,Can the vaccine developing fast?
2020-03-17T15:01:40Z,When will the results come out ?
2020-03-17T17:40:20Z,black beauty The moment something happens to her body I presume.
2020-03-17T14:58:59Z,Thank you for your contribution to save human life.
2020-03-17T14:53:03Z,"Talk about Sacrifice and turning the feeling of helplessness into purpose. Too few things in this life are both Noble and Doable=Thank You, Jennifer💛 A very GOOD Egg🙏🏻"
2020-03-17T14:46:29Z,"So instead of fixing our crappy mwdical and putting in measures to prevent these outbreaks in the future we do the cheap metgod and vaccinate everyone.. It is a fact that natural immunization is not only more effective and longer lasting but actually safer for the people!! . vaccines can give you the disease, not give you a full immunity, does not tranfer to breast milk like real antibodies do, take years to test properly, and have additives that cause complications in some. We used to have parties and camps to make sure kids got measels, mumps, and chicken pox and studies show vaccines have actually made people more likely to get these diseases overall because of thw lack of natural/strong immunities.. And this vaccine needs years to be deemed safe. It could react with other vaccines or blood abnormalities.. Wake up.. The facts are out there.. Im not telling you how to think but think for yourselves and stop believing people with no proof or flimsy logic."
2020-03-17T14:43:24Z,i watched &quot;I AM LEGEND&quot;  i know what about to happen next ....
2020-03-18T05:23:24Z,50TNCSA 👍🏾
2020-03-17T14:43:12Z,F
2020-03-17T14:41:12Z,So brave 😰
2020-03-17T14:38:19Z,Jennifer Haller<br>Some day our children will read this name in a History Books. <br>THANK YOU!
2020-03-17T14:30:41Z,"you are doing a great job, hats up to you"
2020-03-17T14:29:56Z,"Jennifer, you are my hero.  You are so brave!  My daughter is on dialysis, and totally at risk...I sure hope it produces the antibodies needed to fight this dread virus, my kid has got enough on her plate. Thank you. ❤️"
2020-03-17T17:40:59Z,P.E.&amp; The D’Vinyls I’m sure she’ll be alright in the end. ☺️.
2020-03-17T14:27:01Z,God:oof I&#39;m just gonna mutate it humans hasant learn their lesson
2020-03-17T14:25:12Z,"<a href=""https://youtu.be/hO-UiPoi3iI"">https://youtu.be/hO-UiPoi3iI</a>"
2020-03-17T14:23:32Z,Why she aint coughing
2020-03-17T17:41:21Z,"M 80 She doesn’t have coronavirus, they need to test the vaccine on healthy people first."
2020-03-17T14:22:36Z,"Am helping by Social Distancing! No Vaccine for me... Thanks, Jennifer!"
2020-03-17T14:21:59Z,Zombie alert ⚠
2020-03-17T14:21:05Z,"God bless y’all, stay safe, don’t hoard, be considerate of your neighbors as you would want them to be considerate of you as well. Pray, it’s always darkest before the dawn but ain’t nothing new under the sun."
2020-03-20T00:33:06Z,1 2 Shut up stupid smart pants.
2020-03-20T03:54:00Z,Amen! Thank you for this!
2020-03-17T14:11:26Z,Big thumb up for you! you are a step-up hero without cape.
2020-03-17T14:06:37Z,My doctor just gives me the same vaccine. I am 64 years old and don&#39;t care anymore.
2020-03-21T17:45:57Z,Your lucky to get it
2020-03-17T14:04:18Z,"She brought tears to my eyes but I haven&#39;t been vaccinated, so I can&#39;t wipe my face."
2020-03-18T20:42:04Z,Now that&#39;s comedy.
2020-03-18T21:47:53Z,Lol
2020-03-18T22:05:26Z,@@samfrank4629 😁
2020-03-18T22:05:49Z,@@mariluornelas7914 <br>😁
2020-03-19T03:10:35Z,😂😂😂 good one 😂😂😂
2020-03-17T13:57:46Z,I wonder what symptoms she had that indicated that she has the coronavirus
2020-03-17T13:41:53Z,Respect to everyone that volunteers as first human trial of the vaccine!!! Our modern HEROES!
2020-03-17T13:41:00Z,Why does this feel scripted to me.
2020-03-17T13:39:27Z,Salute to this women. Great job
2020-03-17T13:30:38Z,hope her system can handle the toxins. have they shared the ingredients yet?
2020-03-17T13:30:07Z,If the covic9 works appropriately <br>Jennifer will select to give the Nobel Prize....From Bangladesh
2020-03-17T13:26:47Z,If so confident why not person who made it take it... think about..
2020-03-17T13:19:55Z,Is this the British vaccine or the Canadian vaccine<br>Both were front runners
2020-03-17T13:17:50Z,Oh man! Got lightheaded seeing that huge needle come out. Hate shots! But she’s a brave person to volunteer for testing. Hope everything works out and that this works!
2020-03-17T13:15:22Z,Our love is with u. U will be strong to fight this and make this mission successful
2020-03-17T13:08:50Z,God bless her!... We will win the battle! 💕💕
2020-03-17T13:07:45Z,"Ok..this is great, but let me ask this question. China and Taiwan have approved Favilivar for the treatment of the virus and it has been shown to be effective. Why are we not exploring their solution??"
