PublishedAt,Comment
2020-03-20T17:50:33Z,U r angel for us . For whole world .
2020-03-20T17:49:03Z,If at no time will she be exposed to the virus... How do they know it works?
2020-03-20T21:44:25Z,that&#39;s why they&#39;re testing it.
2020-03-20T17:45:55Z,does the study eventually involve her to be exposed to the virus to see if it works?....that&#39;s the scary part.
2020-03-21T20:34:38Z,That&#39;s what I would like to know
2020-03-22T01:22:48Z,"Well, how else are they supposed to know if the vaccine works on a human?"
2020-03-22T02:15:08Z,"Dustin Stich Okay, fair enough."
2020-03-23T00:57:42Z,"<a href=""https://www.youtube.com/watch?v=F8aueQXQ2H4&amp;t=3m15s"">3:15</a>"
2020-03-23T00:58:16Z,"@@animegirl2245 <a href=""https://www.youtube.com/watch?v=F8aueQXQ2H4&amp;t=3m13s"">3:13</a> did you even listen?"
2020-03-20T17:45:21Z,She stuttering and looks shaky 🤔🤔🤔
2020-03-20T17:00:25Z,Sister you are going to give life to the world. Jesus will help you sister. Amen
2020-03-20T16:05:28Z,"What do they do though, do they make someone cough in her face and see if she gets sick"
2020-03-20T15:22:14Z,They left out the 7000 dollars they pay for being the test dummy
2020-03-21T04:12:33Z,Flyboi Clarkston you go be the test dummy and make that money
2020-03-21T10:29:15Z,@@georgiadeerhunting8337 looks like they already found their dummy
2020-03-20T15:19:16Z,"Coronavirus is categorized as the common cold in the encyclopedia of medicine. There is no cure for the common cold, no vaccine for the common cold or any coronavirus has ever been made and yet this CV-19 they alleged was brand new, discovered early January, one month after it appeared and a mere TWO MONTHS later they have a vaccine ready to test? Millions of dollars and decades of research has gone into HIV and no cure, cancer and no cure. But two months and there’s a vaccines to test on humans? How dumb do you think we are?"
2020-03-20T15:08:49Z,SHE&#39;S DUMB!
2020-03-20T14:53:02Z,Thank you !
2020-03-20T14:47:19Z,Thank you !!!
2020-03-20T14:43:34Z,12 to 18 months for vaccine!? We don&#39;t have that long! The world is on shutdown right now! We can&#39;t afford to keep it like that for that long!
2020-03-20T14:30:32Z,"Stop pretending ,,,, is Americans and Israeli behind coronavirus ,they have vaccine already , many years they been working in this bioweapon, they used it against China,but they failed totally their plans ,they thought Chinese will be fighting"
2020-03-20T13:45:29Z,Vaccine will be probably be ready a A YEAR FROM NOW!!! 😱
2020-03-20T13:25:13Z,Isn&#39;t this how that Will Smith movie started?
2020-03-21T19:18:24Z,What Will Smith movie?
2020-03-21T19:23:25Z,@@treesaraeI think. i am legend
2020-03-21T23:32:38Z,Bruh
2020-03-21T23:59:26Z,Ikr
2020-03-22T00:01:25Z,name of it?
2020-03-20T13:25:01Z,Now come the Antivaxxers
2020-03-20T13:21:56Z,Why test it on somebody without the virus?
2020-03-21T22:03:44Z,Emmanuel A <br>Because vaccines are supposed to create antibodies (immunity) so the vaccinated person has a better chance of fighting the virus off IF they get it. Vaccines aren’t used to “cure” people that have the virus already.
2020-03-22T14:34:35Z,@@madilynn_0660 😊
2020-03-20T13:18:23Z,It took 18 months to create vaccines 💉 😷
2020-03-20T13:16:37Z,They should use prisoners for their lab rats not hard working people
2020-03-20T13:13:40Z,"Pay attention to these CEOs stepping down They’re not stepping down for no reason including Bill Gates <br>They know something, this virus is a distraction <br><br>Repent and be baptized Acts <a href=""https://www.youtube.com/watch?v=F8aueQXQ2H4&amp;t=2m38s"">2:38</a>"
2020-03-20T16:31:05Z,Wyse Lion exactly what I been wondering and asking people about . Stay woke . Something is coming about this situation and the distractions are playing in their favor
2020-03-20T17:43:42Z,"willie lowe likewise my woke brother keep your eye on the prize, and Jesus is he. Use your platform for God’s glory and don’t be ashamed bro. People may call you crazy but love it, embrace it and keep it pushin homie <br>Read Matt <a href=""https://www.youtube.com/watch?v=F8aueQXQ2H4&amp;t=10m28s"">10:28</a> it brings power💪🏾✊🏾👑"
2020-03-21T17:37:25Z,Repent yourself stupid bigot we need a cure not your nasty bible thumping
2020-03-28T18:25:38Z,Diane Miller God is the cure🙏🏾😊 be blessed
2020-03-31T00:02:31Z,I&#39;ve already been baptized your not wise lion we have a higher power we also need a cure pray for that
2020-03-20T13:06:19Z,Yeah I&#39;m sure that use a lot of minorities first as guinea pigs and then they put the white person on TV to take the credit the hero more like the zero 🤪
2020-03-21T17:44:18Z,Oh your so stupid
2020-03-20T13:01:14Z,fighting with the death but still smiling. . .thats called hope brother
2020-03-20T12:55:02Z,"people, can you stop it with the plot twist thing. She is a great and brave woman. She could have the right cure!"
2020-03-20T12:30:27Z,"go to <a href=""https://www.youtube.com/watch?v=3J6zm6zgah0"">https://www.youtube.com/watch?v=3J6zm6zgah0</a>  for analysis of covid-19 must read"
2020-03-20T12:21:10Z,God bless u
2020-03-20T12:18:37Z,"Thanks for being a True Patriot , American at her finest hour right there!!! ;Thank you so much. You&#39;re  already a Hero ."
2020-03-20T12:15:56Z,"Ari Melba (toast) needs more ppl positive FOR coronavirus to interview, not ppl who have positive news in the fight AGAINST this thing. Melber looked like Wyle E. Coyote about to fall off a cliff upon looking down. Foolish!!"
2020-03-20T11:56:24Z,"That woman is a brave woman , i wouldn&#39;t be suprised if the cure is found because if this woman"
2020-03-21T16:56:45Z,ghost rider how can you get a cure from a vaccine for a virus that you can’t get immunity for?
2020-03-21T18:30:13Z,trolzilalol Nobody is immune...and if you get the virus...doesn’t matter... if you are in contact with it you can get it again...vaccine or not
2020-03-21T21:19:26Z,ghost rider Let’s pray
2020-03-22T01:09:52Z,Shes a actor. Its not real. The &quot;vaccine&quot; actually has the real virus. The gov generals threw a chemical in the wuhang area which gives you symptoms of a flu. Which makes you go to the doctor and they scare you that you have a virus. They tell you to get the flu shot which was already planned to give to ppl. Wake up dont get the shot. They programmed her to say what she said.
2020-03-22T04:56:48Z,So you&#39;re saying the U.S. started this virus which China went along with and the other countries in the world. also you&#39;re saying that they made a fake vaccine which has the virus. What&#39;s the point of starting it if it kills everyone including them. Smh
2020-03-20T11:46:23Z,First off not one time did they ever say that this lady actually had &quot;coronavirus&quot;. So how does she become a survivor 😂🤣😂🤣?
2020-03-21T17:00:43Z,Do you not know how vaccines work?
2020-03-22T00:41:28Z,@@ye9018 apparently they dont understand🙄
2020-03-22T00:48:08Z,@@jae41this is a big bruh moment
2020-03-20T11:39:21Z,Who is makeing the vaccine?
2020-03-20T10:51:08Z,Is this vaccine working or not
2020-03-20T10:44:39Z,❤️❤️❤️❤️
2020-03-20T10:19:16Z,We thank God for the healing
2020-03-20T10:03:59Z,Shooting up cool- aid. Fooling America.
2020-03-20T10:02:19Z,Who&#39;s this actress? She doesn&#39;t know how to act much
2020-03-21T13:37:43Z,😁
2020-03-21T13:59:03Z,🤣🤣
2020-03-20T09:45:09Z,"God bless you and your love one, you will safe A lot of Americans people. Thank you 🙏."
2020-03-20T09:29:54Z,It is phase-1!  <br>There are four more phases to go before it is available in market!  <br>Why is he so excited?<br>God Bless the successful trail!  <br>I hope it will work!
2020-03-20T08:50:18Z,Give it to a death row inmate tf
2020-03-20T08:47:26Z,I want some
2020-03-20T08:45:38Z,Good what’s the cure?
2020-03-20T08:37:18Z,Thank goodness. 🙏🏻
2020-03-20T08:34:30Z,The vaccine uses Facebook messenger
2020-03-20T08:33:48Z,when people will get the the vaccine 5
2020-03-20T08:04:55Z,21st March any update s on the lady who took the vaccine is she doing well or cured
2020-03-20T08:01:36Z,She is great.
2020-03-20T07:30:31Z,"God bless you Jennifer, thank you."
2020-03-20T07:21:42Z,I think she is the first in america
2020-03-20T06:57:43Z,Someone happy to do something for there country not something I&#39;m used to seeing on fake news..
2020-03-21T17:54:49Z,*their
2020-03-20T06:22:35Z,Why are yall so... idk E X T R A
2020-03-20T06:18:06Z,So how would she know if the vaccine works? Is she going to be exposed to the virus to see if she contracts it?
2020-03-22T03:07:21Z,Lteo Hrnt Maybe they draw her blood and expose it to the virus and see how it reacts.
2020-03-20T05:49:38Z,"<a href=""http://www.youtube.com/results?search_query=%23JenniferHallerFor"">#JenniferHallerFor</a> President <a href=""http://www.youtube.com/results?search_query=%23JenniferHaller"">#JenniferHaller</a> 2020<br><br>God bless her heart for all of us, she should be our <a href=""http://www.youtube.com/results?search_query=%23President"">#President</a> real talk. I’ll vote for her I’m putting her name in Ballard when it comes time too 💁🏽‍♀️ no one better then someone like her that’s taking real risk for all of us. She the mother of this Country for real."
2020-03-20T05:21:41Z,"Thank you, precious lady. So grateful.❤"
2020-03-20T05:20:03Z,God bless you!!! You&#39;re a true hero
2020-03-20T04:51:39Z,Admire her..
2020-03-20T04:47:03Z,One year whe are going to died
2020-03-20T04:35:31Z,"I know there&#39;s a chance this vaccine could have side effects, but i&#39;m willing to see other people try it."
2020-03-20T03:57:54Z,we will never know if this vaccine works cause this woman is not exposed to the corona virus..  this woman is always at home..  this makes no sense..  almost a phony act
2020-03-20T03:28:41Z,Yal seen I am Legend Right??
2020-03-20T03:22:26Z,does it works？ coronavirus will be killed？
2020-03-20T03:19:37Z,Thanks for putting out the quality information.
2020-03-20T03:17:10Z,So does this mean we’re close to the vaccine ?
2020-03-20T02:34:45Z,Well prepare for alien attack this April
2020-03-20T02:28:49Z,i only came to look for anti-vaxer comments...
2020-03-20T02:21:30Z,This is what they were trying to tell us all along the cure will change the infected into zombies
2020-03-20T02:13:59Z,Did anybody listen &quot;14 months study&quot; !
2020-03-20T02:01:16Z,Hope they get well🙏🙏
2020-03-20T01:39:07Z,she is literally helping to save thousands and thousands of lives. Bravo!!
2020-03-25T14:17:27Z,she is brave 😭
2020-03-20T01:23:37Z,Thank you so much for helping or at least trying to get rid of this horrible Depression
2020-03-20T01:17:18Z,The question is do it work?.. 🤔
2020-03-20T01:11:30Z,yes she does love people. At least some care about others. And realized people are dying from this dreadful disease. I hate having to b fare away from people. I miss normal life already. Just to say hello to a stranger means so much to me. miss that. ❤️
2020-03-22T16:52:51Z,Weak
2020-03-22T17:55:29Z,"Chris Main You’re not admirable, strong, interesting, or clever enough to affect amusing edginess. Nothing “weak” about risking one’s life for the greater good of humanity."
2020-03-23T02:14:28Z,"@@vinnie6133 yes because you know who i am. If you cant be alone with yourself for a little bit and rely on people being around constantly in order to not have a mental breakdown, you&#39;re weak. End of story. You clown. Keep patting yourself on the back atop your tp throne you sheep."
2020-03-20T01:08:11Z,great job. I&#39;d love to get her a ribbon and flowers. Thank u for ur bravery.  Finally something is coming to help. well... we hope.  🤞
2020-03-20T01:05:31Z,"THANKS TO THE VOLUNTEER .....PRESIDENT  TRUMP HAS 10,000 DOCTORS AND SCIENTIST WORKING TO FIND COVID 19 CURE"
2020-03-20T01:16:58Z,"I have much respect for this woman, this is real bravery, but trump just stole 500000 test kits from italy, brescia, the epicenter of the virus right now, they toke the test kits in the night, load it on a army plane and flew to USA. Test kits made by a nationalized pharma company, so how&#39;s capitalism working for you when you have to steal from sick people? <a href=""https://www.repubblica.it/cronaca/2020/03/19/news/coronavirus_tamponi_da_brescia_a_stati_uniti-251735473/?ref=RHPPTP-BL-I251736270-C12-P3-S1.12-T1"">https://www.repubblica.it/cronaca/2020/03/19/news/coronavirus_tamponi_da_brescia_a_stati_uniti-251735473/?ref=RHPPTP-BL-I251736270-C12-P3-S1.12-T1</a>"
2020-03-20T01:05:06Z,Thank you Jennifer for all you do!
2020-03-20T00:36:46Z,This woman did her part - now the rest of us need to do our part and self-isolate.
2020-03-21T16:50:26Z,Yes Mam
2020-03-21T17:44:30Z,U mean by more toilet paper.
2020-03-21T19:20:22Z,There are people that are very poor and have no money saved up to buy food for those dependent on them including their pets.. people with money are able to go to the stores and stockpile and then take it easy at home but people like me.. what are we supposed to do..
2020-03-22T21:13:50Z,💯
2020-03-23T22:30:10Z,@@PickyPickPlay 😂
2020-03-20T00:33:18Z,I’m willing to be a test person as long as it helps people move on from this! I pray this works god bless her!
2020-03-20T00:25:30Z,Bless your heart ❤️
2020-03-20T00:06:32Z,She is a hero!! Thank you so much brave lady!!
2020-03-19T23:59:37Z,Respect this woman. Big thumbs up to her. I also really like this male  tv presentor. He is handsome and seems to be very good at interviewing ppl.
2020-03-19T23:54:37Z,The &quot; vaccines &quot; is really the chip mark of the beast .
2020-03-19T23:52:53Z,"If this vaccine works and her name is eve, I’m giving religion another look."
2020-03-19T23:51:14Z,Its   this is truh
2020-03-19T23:32:42Z,"Oh man, I hope this works. I’m tired of being locked in the house. I always thought working from home would be cool, but it kinda sucks when it’s been too long, 😭😭😭"
2020-03-19T23:28:17Z,So many ways to serve your country. This is one of them. Thank you for your service!
2020-03-19T22:59:47Z,Why are people doing it for free ? They should be getting paid to be a science experiment
2020-03-19T22:49:07Z,F*** ya mad props give her a million dollars
2020-03-19T22:27:02Z,Hats offf u lady...today u proved women are courageous 🎀
2020-03-19T22:09:17Z,Don&#39;t mind me. Just looking for antivaxx comments for laughs.
2020-03-19T22:09:06Z,Tig ol bitties
2020-03-19T22:06:53Z,I hope it works otherwise if it goes bad for her she’ll come up missing
2020-03-19T22:06:03Z,"People who think about suicide, they better volunteer for such a vaccine .It is a win win situation."
2020-03-19T22:04:42Z,"Thank you sweet lady, your very brave , God bless you"
2020-03-19T21:59:41Z,A year lol why bother that does no good for anyone thousand will die before then
2020-03-19T21:57:46Z,Their is 1000s of people infected a month
2020-03-19T21:47:50Z,"they skipped an important step by Not tested on mouses, its so rushed!"
2020-03-19T21:31:48Z,If she has corona why the doctor have no mask protection ? Government lies
2020-03-21T16:38:41Z,Treated she doesn’t have it. That’s not how vaccines work.
2020-03-19T21:26:18Z,"So proud of yourself too mam and sir , it’s very brave to take such step ."
2020-03-19T21:19:54Z,Heroic Woman!! God Bless you!!
2020-03-19T21:01:26Z,"If this was a guy nobody would care, she&#39;s obviously getting paid stop acting like she&#39;s a saint"
2020-03-19T21:01:01Z,GOD BLESS THIS WOMAN FOR PUTTING HER LIFE ON THE LINE FOR ALL!!🙏🙏🙏
2020-03-19T20:55:53Z,They should test it on death row prisoners.
2020-03-19T20:52:36Z,"Jennifer is first vaccine tester: <a href=""https://www.earth.columbia.edu/articles/view/2437"">https://www.earth.columbia.edu/articles/view/2437</a><br>... Haller figured her degree in environmental science would be enough to prepare her for a career in implementing environmental change."
2020-03-19T20:25:52Z,This is how I Am Legend started...
2020-03-19T20:14:20Z,She and the other volunteers are American heroes. She/they may very well help save 10s of millions of lives. God bless her.
2020-03-19T19:58:03Z,all news networks in the US have been saying a test vaccine wouldn&#39;t be available till mid summer. How do they already have an available test vac for her to try so soon?
2020-03-19T19:46:21Z,Just time pass
2020-03-19T19:39:50Z,If she start turning like i am Legend im dipping
2020-03-22T23:28:09Z,Lmao
2020-03-23T17:37:12Z,DonnyFusion lol
2020-03-23T20:39:05Z,😂😂😂😂
2020-03-25T09:46:55Z,DonnyFusion 😭😭😭😭😭
2020-03-25T23:40:23Z,Oh my gosh that’s what I thought too . Please don’t say ugly things to me now because of that But I am so scared .
2020-03-19T19:33:54Z,Nobody suspect the vaccine&#39;s development are so fast? It only takes month to develop a Vaccine? It usually takes years to develop a vaccine. The reasonable guesses is that the government already got their hand on the virus strain long before the outbreak in U.S  or there is some super genius biologist figure out the virus in days.
2020-03-19T18:56:18Z,"The woman was Brave, but we should also be grate to every single doctor and scientist that are still working to help us deal with this pandemic"
2020-03-19T18:43:20Z,already has neurological damage
2020-03-19T18:41:45Z,what a dumb sheep
2020-03-19T18:36:35Z,she is iron man<br>covid 19 is thanos<br>God bless her
2020-03-19T18:31:26Z,"...what a hero, so strong and confident in that cool and composed demeanor. we all thank you!"
2020-03-19T18:18:43Z,Thts crazy to gt an actual vaccine within a yr.. look how many ppl tht are going to die within a yr..
2020-03-19T18:06:52Z,I hope this is the real thing
2020-03-19T18:01:31Z,Fake
