PublishedAt,Comment
2021-06-09T21:20:28Z,"Unfortunately, Dr. Fauci uses words with that intimidate some and we have developed a defensive reaction to that as a country. Instead of trying to learn, grow, swallow our egos, a large amount of Americans in that category automatically shut down and feel slighted."
2021-06-09T21:48:38Z,"Damian it is NOT YT censors moron, it is how they have the channel page is set up or it is because you are SPAMMING, I would go with the second one,"
2021-06-09T21:19:12Z,What&#39;s in the redacted emails fauci??
2021-06-09T21:18:34Z,Stop lying.
2021-06-09T21:18:24Z,They have to trash reality and science because its the only way they can even try to cover up their miss deeds and genocidal platform.  Anyone who refuses the vaccine deserves to get sick. It&#39;s their innocent victims that don&#39;t.
2021-06-09T21:18:16Z,Usual tactic of playing the man not the ball
2021-06-09T21:17:34Z,Another lie. The virus was made in that lab.
2021-06-09T21:15:46Z,"It is called projecting..... reapublicans do nothing but attack, gather money from their Hump unleader, and sow division. They wouldn&#39;t know virtue or leadership if God came down to their level and tried to lead them by the hand in the right direction. Dr. Fauci the majority of people globally know you were the only true voice among the Humpers."
2021-06-09T21:15:31Z,"I&#39;m an alternative girl.  I haven&#39;t been to a doctor in decades because I live a healthy lifestyle and treat myself with natural remedies.  That being said, if at any time I needed mainstream medical assistance, I would trust this man&#39;s advice as the best science has to offer.  The world is a better place because of his contributions."
2021-06-09T21:30:11Z,"You are another fool! Can&#39;t you think for yourself, to see for yourself the truth!"
2021-06-09T21:32:13Z,So you believe everything he says yet he’s been wrong at every projection he’s made and changed his position on makes multiple times.
2021-06-09T21:35:12Z,@@ukoben4960 obviously sciences and maths are NOT your strengths 🙄
2021-06-09T21:35:50Z,@@Floki_631 obviously sciences and maths are NOT your strengths 🙄
2021-06-09T22:10:12Z,@@robinwelty4819 maybe you’re right - what ha that got to do with Fauci being changing his position on saying masks are useless and then saying masks should be worn then saying 2 masks is better than one mask.
2021-06-09T21:14:07Z,"the republican war on science, and experts in all fields - has a goal of dead americans and a weak economy."
2021-06-10T02:54:02Z,Woketards that mostly reside on the left would have us believe a man can be a woman and Vice versa. Taht there’s no difference in the sexes. Talk about science deniers.
2021-06-10T03:22:30Z,"The fact that liberals think like this is insane.  Do you honestly believe that liberals have the market cornered on scientists and engineers?  You are supposed to challenge scientific hypotheses.  If they can&#39;t hold up to scrutiny then you develop new ones.  Disallowing dissent and demonizing the challenging of scientific theory is anti-science.  I&#39;m so tired of liberal arts majors, who don&#39;t know what the scientific method is, screaming about science incessantly."
2021-06-09T21:13:23Z,Lies lies lies. Bull. Go Fauci yourself
2021-06-09T21:13:07Z,"fascist republicans always attack experts, in any field.  I don&#39;t know how republicans get votes from even the dumbest americans."
2021-06-09T21:11:24Z,"ALL I CAN SAY AS A CIVILIAN, IS THAT THE CHEM TRAILS IN THE AIR HAVE STOPPED.<br><br>ALL OF A SUDDEN ONLY CERTAIN PEOPLE GET THE CORONA 19 VIRUS. THE UNAFFECTED ARE IMMUNE.<br><br>NOW THEY WANT EVERYONE TO GET THE VACCINE, INCLUDING THE IMMUNE.<br><br>COINCIDENCE, I THINK NOT. <br><br>BUT HEY IM JUST A CIVILIAN WITH SOME COMMON SENSE, THAT HAS SOME AWARENESS OF THINGS TRANSPIRED THROUGHOUT THE YEARS<br><br>BUT WHAT DO I KNOW. LOL 😆🤣😂"
2021-06-09T21:10:55Z,"Love you, Dr. Fauci, you&#39;re a hero and a national treasure."
2021-06-09T22:42:56Z,🤮
2021-06-11T02:06:58Z,Scary. People loves Fauci like the Nazies loved Der Fuhrer.
2021-06-09T21:08:25Z,I think the main issue with things like this is that the average person doesn&#39;t have a solid science education.
2021-06-09T21:46:26Z,"The average &quot;person&quot; is not interested in the solid science -- they are ACTIVELY SERCHING ONLY FOR SOMETHING NEGATIVE -- SOMETHING THAT WILL BRING THEIR daddy diaper donnie back into OUR WHITE HOUSE. That&#39;s their only agenda. They have nothing against the vaccine -- it&#39;s an excuse to try to make our present DEMOCRATIC ADMINISTRATION look bad in every/any way they can so they have a chance at taking back OUR WHITE HOUSE next election -- OR BEFORE, WITH VIOLENCE."
2021-06-09T21:59:25Z,Fraudci is a liar!!! The vaccine was here 3 hours after the virus was announced. A company called Inovio had the vaccine. Fauci silenced them so he could sell MurdeRNA
2021-06-09T22:05:24Z,You don&#39;t understand pharmaceutical companies bribing and dictating government and media.
2021-06-09T22:07:26Z,two Ph.Ds here and one senior scientist in Pharma.  Stay away from this vaccine.
2021-06-10T00:03:41Z,@@gingermiller1087 democratic and republican party members both take a lot of money from pharmaceutical companies.  You really think they are unbiased and putting people&#39;s health first.  Are you serious?
2021-06-09T21:06:32Z,"As a scientist myself, I often find that many intelligent lay people are wide open to conspiracy theories as they just don&#39;t understand how mother nature works or how capable she is. It&#39;s a process that may have taken a decade or more to learn and cannot be summed up in a few words. I personally think that a STEM education should be mandatory or built into all curriculums but that&#39;s a whole other topic. But as far as this topic, we are seeing variants which are emerging on their own (without any human intervention) in the same way that the corona virus may have mutated in the first place"
2021-06-09T21:14:01Z,If you have this conviction I&#39;d suggest you to watch Peak Prosperity channel (2 last episodes) and you will get enlightened.
2021-06-09T21:22:56Z,@@aleksey2243 so I looked it up and it lead me to Chris Martenson and.... no
2021-06-09T22:08:08Z,@@jerrystephenson6198 What do you have against Chris that prompted you to not watch his episodes?
2021-06-09T22:12:55Z,"You as a person of zero common sense don’t understand how the “intelligent lay people” work or how  they can be underestimated by so-called scientist! We always come out on top of the fascist theory based lunacy that the ignorant intellectuals spew out on a daily basis! Fauci is a genocidal lunatic that should put in prison, he has claims of genocide against him long before the virus!"
2021-06-10T03:50:46Z,"The problem is, you really can&#39;t understand science without math, at least some calculus and statistics. A lot of people just don&#39;t have the brain power to learn the basics needed to understand science. These are the same mouth breathers who worry about a one in a million chance of a deleterious side effect of a vaccine, but not the one in twenty chance they&#39;ll be damaged, or killed, by the virus. They just don&#39;t have a grasp on math. They refuse to believe in evolution, because they cannot come to terms with the idea that events can be driven by chance, and don&#39;t need divine intervention. And they certainly cannot understand how a disease can emerge, and go from infecting non-humans to humans. This despite all the zoonotic diseases that have emerged in the last 50 years."
2021-06-09T21:05:29Z,People need to research how much these vaccines are killing people and having adverse side effects
2021-06-09T21:05:02Z,haha &quot;we want to continue&quot;<br><br>to play with everyone lives
2021-06-09T21:03:41Z,These new variants EVOLVE just like the original virus EVOLVED from natural viruses... this is what these viruses do... the REPURVICONS are just deflecting...
2021-06-09T21:12:23Z,Well and republicans can&#39;t understand basic science.
2021-06-09T21:21:43Z,Damian no one believes your conspiracies clown.
2021-06-09T21:35:10Z,Damian Yea. Sorry. YouTube tries its best to remove false information. Maybe have some facts to back up your tin foil conspiracies?
2021-06-09T21:49:23Z,@@god_is_gay_for_satan yeah just like they said it didn&#39;t come from a lab and now Facebook had to go back on that.
2021-06-09T22:41:00Z,@@JeffConard what evidence there for it coming from a lab. Present it.
2021-06-09T21:03:08Z,"So he just refuses to believe there was a leak. Hummm...okay.  It was never brought up before. Where are the farmers and truck drivers if this was natural. Wouldn&#39;t they get sick during transportation? Why were the Chinese doctors, who tried to speak out, disappear, died, or are gone? The Chinese have the geom, they can make their own vaccine. I think Fauci has a lot at stake, so he tries very, very, hard to play it down. From what I read or know, the NIH gave funds to the Wuhan lab for covid research.  Listen to Senator Rand Paul, he&#39;s a doctor too! The American people are not stupid."
2021-06-09T21:02:12Z,"I can shed the light that it is scientific impossible Wuhan is the origin because the virus found spreading in Wuhan is the second generation, not the first generation - strain A, &quot;mother&quot; of other other strains ( B,C ...)  Virus in Wuhan was imported."
2021-06-09T21:01:40Z,This guy just lied. Go read the emails. Masks do nothing HQC works..
2021-06-09T21:01:13Z,"HE IS COMPLICIT, needs to be investigated. Follow the money and you&#39;ll see he is more than responsible. And see if he has stocks or monies involved with the VACCINNE. <br><br>THIS ALL FEKING STINKS"
2021-06-09T21:01:07Z,What a hack
2021-06-09T21:00:56Z,"&quot;We live in a society exquisitely dependent on science and technology, in which hardly anyone knows anything about science and technology. &quot; -    Carl Sagan"
2021-06-09T21:21:56Z,@ThE DuCk. BRILLIANT!!
2021-06-09T21:30:29Z,... because many Choose to live in ignorance...
2021-06-09T21:33:26Z,its proven  a better bet to go with new  science as far as health . even if we dont know  .if we want  because  of science we can just search it.
2021-06-09T21:55:19Z,"Get real &lt;--  Joined Jun 6, 2021<br>Got suspended huh  ?"
2021-06-09T22:14:20Z,@@AndiDuck Also you: I&#39;m going to claim 2016 was stolen and all evil Trumpers are evil people who should be superseded or banned despite never being given a chance to explain their position!!! <br><br>Also still you: I&#39;m a hero who has never invented anything other than my shallow ego
2021-06-09T21:00:29Z,Tony knew what was happening in China !
2021-06-09T20:58:35Z,Idek what to say anymore.
2021-06-09T20:57:42Z,"I’m not sure Chuck is exactly an unbiased commentator here. He framed this interview from the start as ‘nothing to see here’. Dr Fauci has some questions to answer around ‘gain of function’ funding. On the face of it, he endeavoured to circumvent the Obama administration’s ban on this type of research. He is being somewhat disingenuous in suggesting that he was “always open minded” Last year he was very emphatic that the virus did NOT come from a lab. Very few are suggesting Dr Fauci has not done his best to manage this crisis, however he may be complicit by indirectly funding the activities in the Wuhan laboratory."
2021-06-09T21:32:35Z,He always said it is not likely it was not made up n a lab 🥼 not leaked from a lab.
2021-06-09T20:57:01Z,People need to stop being stupid. Everything is relative. Those emails can be interpret it anyway a person wants!  These people are adults &amp; what they are doing to get vacs is ridiculous. There are consequences for choices &amp; they are making them. I don’t care about any of them anymore.
2021-06-09T20:56:49Z,how him  now
2021-06-09T20:55:26Z,*Is at Third world war!(Biological warfare)  CCP Virus!     WHO=CHO !<br>CCP =Troublemaker!
2021-06-09T20:54:09Z,This better not be happening in the fall more American people need to be serious and get vaccinated by 4th of July
2021-06-09T20:53:12Z,"There&#39;s no more questions about it how stupid will they press it the liberal media for Dr. Fauci lied too protect himself, protect his scientist buddies and his chinese colleagues in China."
2021-06-09T20:53:04Z,Why should I take a vaccine if there&#39;s ivermectin with the same efficacy and it&#39;s been around 30+ years and has proven it&#39;s safety unlike your vaccines where we have no clue how severe consequences might be in long term.
2021-06-09T20:52:39Z,"Dr Fauci ,please note that viruses were created ages before man was created so this covid 19 must be &amp; should be natural;my question for you Dr Fauci ,can man manipulate a natural virus to be more dangerous???"
2021-06-09T20:51:54Z,"He got the world sick!!!! He AND the Current admin should ALL be arrested..<br>And for all you Biden worshippers... These emails are public knowledge.. Its not some shady hidden thing. You can get on the congress site and listen to them being read.. Its not hard, for all of you tards trying to politically aware, would know these things if you truly were are aware of how our system works.. Im 44 , i remember all about it.. It was 4th grade economics and social studies.. Cmon, dont tell me they dont teach you kids about how the govt works?? Sheesh, learn the facts about your GOVT, its never always just Trump and Biden.. 4th Social studies people..."
2021-06-09T21:00:22Z,Seriously?? Is that what you get out of this???
2021-06-09T21:57:22Z,What does the current administration have to do with this? Anything to deflect Blame from trump
2021-06-09T22:00:24Z,....I think you&#39;ll find the majority of covid deaths were on the Republican watch
2021-06-09T22:31:14Z,"@@shaungarrett5291 you will recall when Trump said China did it, he was called Racist? And the dems blocked almost every bill to reopen. The current admin is responsible for making our military look like a cheerleading squad. They are responsible for the highest immigration numbers in 30 years in less than 3 months. This current admin also has the ability to arrest Fauci for using YOUR and MY tax dollars to fund the Wuhan lab. If you dont believe that, all you have to do is watch some Fauci videos. And the emails have been leaked, they are all over youtube, in congress they have read some aloud. Hes been asked about it, and pulls a Jen Psaki.. This admin has destroyed the nation.. The whole world went ham almost the first day he &quot;Took Office&quot;, nobody fears nor respects this admin,  neither here nor overseas..<br>The same kids are still in the same cages. Violence has shot up 200% nationwide AFTER Biden took office.  And last but not, the whole admin eont answer questions about the connection between Fauci and Wuhan.. Fauci is  guilty of manufacturing biological weapons with YOUR tax dollars. Open your eyes"
2021-06-09T22:38:03Z,"@@islandwanderer1173 conspiracy after conspiracy after conspiracy. Look, make up your mind, either the virus is just the flu,  or it&#39;s deadly. Either the virus killed 20,000 or 600,000. Everything that&#39;s going on with you people is just trying to divert  blame Way from trump. Carry on dude"
2021-06-09T20:51:02Z,"Dont treat Fauci with kid gloves.  He absolutely knew what he was.doing!!! What he hid is very bad!!! He esrns more than a President,  hes all about the fame snd fortune this brings and he flip flops on everything ALL the time. Hes not an innocent little old man !!!"
2021-06-09T20:49:46Z,Fully vax but I still wear my mask... Most of my Asians brothers and sisters are wearing theirs so I will follow since it&#39;s new to us but not them. Precaution is better than cure!
2021-06-09T21:39:46Z,You are already dead inside if you are doing all that STILL!!
2021-06-09T20:49:29Z,"Crazy Repubs are trying to keep the eye of Justice off of their entire party but, especially Doty’s President!"
2021-06-09T20:54:51Z,The eye of Justice falls with both Republicans and Democrats. Neither side is 100% innocent.
2021-06-09T20:48:29Z,Thank you for your decades of service Dr. Fauci. I hope you win a Nobel Prize.
2021-06-09T22:40:20Z,🤮
2021-06-10T03:37:05Z,@@JamesJuice321 you disgust us too 🤮
2021-06-11T12:46:25Z,"Has to do better than slave markets in Lybia. High bar, but i think he can do it."
2022-06-17T20:36:59Z,hopefully from within a jail cell.
2021-06-09T20:47:27Z,67% by july 4th
2021-06-10T00:25:30Z,No…70%! USA USA USA #1!
2021-06-10T02:47:27Z,It&#39;s not happening
2021-06-10T13:25:26Z,I doubt that
2021-06-09T20:47:18Z,"I despair for the US.  It is being destroyed  by ignorance and associated racism, anti-science, as well as power-seeking corruption of the political right. I&#39;m  stressed out and I&#39;m  a new zealander living on the other side of the planet in a relatively covid-free environment (at the moment). My best wishes to the intelligent Americans. Hang in there. I hope you will overcome."
2021-06-09T20:58:30Z,"yeah right, and i&#39;m from mars.  why don&#39;t we see new zealand/s news videos and comment on them?   agenda 21 is worldwide."
2021-06-09T21:55:56Z,Thank you for that nice comment.
2021-06-09T21:59:21Z,Good thing you live in NZ.  You sound like a puppet.
2021-06-09T22:46:35Z,"@@bluelagoon1875 There is nothing stopping you accessing N.Z. news, or news from literally any other country in the world. Actually,  you might learn a few things."
2021-06-09T22:56:54Z,@@TheUMIA And she sounds like a bitter puppet to boot.  Who the heck jumps on a comment section from &quot;half way around the world&quot; to throw around a bunch of slurs and insults?  What a nut.
2021-06-09T20:46:24Z,Still blaming President Trump and ignoring the fact that Trump was right about the origins of Covid-19
2021-06-09T20:49:55Z,"Oh that fixes everything! Forget about the insurrection, how dumbo turned his back on us"
2021-06-09T21:29:19Z,"The man didn&#39;t even know what the 19 stood for!! He knows nothing, so he ignored it"
2021-06-10T18:16:03Z,"@@megawalsh4712 Not sure how you felt that President Trump “turned his back on us”.  There was chaos brought us the last four years, especially the past year.  Battling COVID-19 while Fauci knew more than he shared. Fauci admitted several key points about Covid-19 that MSM, Democratic politicians and Fauci, who was supposed to be advising him on, were always there on the news to contradict whatever President Trump said.  At this time he had been going through the impeachment and an election. The Russian-Steele Dossier should been made into a front page/top of the news hour story -it was when the Schiff, Schumer, Pelosi accused him. When it was all proven false through a huge investigation that took time, $$$$ and further division of our nation-there should have been a retraction . Not a 3 sentence paragraph buried in the middle. It wasn’t accidental, it was created. A British spy was hired by_____(can you fill in the blank?) to create this web of collusion and prostitutes. Yet we have video and audio proof, along with emails, of all the threats to a foreign country, using the Office of the VP of the USA for financial gains, etc.  How do you think Kamala is doing? Joe with the border(after he opened the floodgates at the border and then put K in charge)?, energy? Foreign relations?"
2021-06-09T20:43:58Z,Fauci knew about “gain of function” research in Wuhan lab 💯 US funds were used.
2021-06-09T20:42:31Z,Glad i dont need to be chipped...😁😁😁
2021-06-09T20:42:24Z,"It&#39;s certainly not Bidens fault there are so many stupid, selfish people who won&#39;t get vaccinated."
2021-06-09T20:41:52Z,News anchor said:give the american virus...he meant vaccine🤔🤔🤔🤔
2021-06-09T20:55:03Z,He is implying US is the origin of the virus.
2021-06-09T21:05:22Z,@@albertleung5823 he misspoke...nothing more...he should have corrected himself though. Positive vibes from New Hampshire and remember to be kind to each other and yourself during this pandemic and social crisis.
2021-06-09T20:41:45Z,The confusion fauci? <br>The most arrogant group of ppl over. <br>Enjoy your Neurenburg 2.0. Mr supersmart
2021-06-09T20:40:33Z,"To say nothing explosive is outright disingenuous or Chuck Todd is stupid... being both is not being rule out.  The virus being generated in nature is also a baseless claim. Politicizing the virus is pathetic, by establishing Republicans vs Democrats is creating a straw man."
2021-06-09T20:39:53Z,Republicans have NO RIGHT to question Dr  Fauchi...they have no moral values at all.. narcissistic ppl blaming others
2021-06-09T20:56:14Z,Fauci has ties to the Wuhan lab
2021-06-09T20:57:16Z,Your not actually being serious are you?
2021-06-09T20:39:39Z,Chancellor Palpatine: &quot;I am the senate.&quot;<br>Dr. Fauci: &quot;I am science.&quot;
2021-06-09T20:52:15Z,He actually is science...he is a scientist
2021-06-10T00:34:53Z,Except he denies the science that doesn’t support the media narrative
2021-06-10T02:29:56Z,"@@Pixie6969 &quot;Tony Fauci does not mind going on television in front of the people to pay his salary and lie directly into the camera.&quot; -Kary Mullis inventor of PCR Test^1<br><br><br>citation<br>1:on my channel"
2021-06-10T02:35:06Z,@@MTS2024 prove it...where is your evidence???
2021-06-11T00:13:23Z,"​@@Pixie6969 Science isn&#39;t a title, it&#39;s a philosophy and a process that relies on objective and critical thinking and no, he does not follow it.  He wasn&#39;t following it when he shut down lab leak stories and he wasn&#39;t following it when he made this statement insinuating that he&#39;s beyond reproach.  He is a bureaucrat, a politician, and now we see he&#39;s a megalomaniac but he&#39;s no scientist."
2021-06-09T20:39:38Z,Go Dr. Fauci go.  We trust you more than the politicians who constantly screw us.
2021-06-10T02:36:49Z,... he works with those politicians
2021-06-11T02:00:41Z,You love Fauci like the Germans loved Der Fuhrer.
2021-06-09T20:37:30Z,"Should we bring up FAUCI&#39;S LONG CRIMINAL RECORDS and the CRIMINAL RECORDS of GATES, CDC, WHO..."
2021-06-09T20:37:21Z,Biden admin. just announced 500 million Pfizer vaccine doses will be donated to poorest countries.
2021-06-09T20:36:28Z,SARs Came From Bats The Same Way AIDs Came From Monkeys <br>Dr Fauci&#39;s Lab
2021-06-09T20:34:54Z,"Dr Fauci has had the hardest job through this Pandemic. Facing the reality of a worst case scenario of a Pandemic spreading around the entire world, and standing his ground not making his life&#39;s work political.  All the while, having this stupid moron president Trump saying that &quot;It will magickly disappear.&quot;  Trump was/is the moron at the top of a heap, being the biggest super spreader of Covid 19 across America.  All the while, Dr Fauci has continued to do his best, withstanding hours of stupid idiotic questions form the likes of Rand Paul.  Trump was right about one thing.  The people do like Dr Fauci more than they like our Twice Impeached, lie Master, Ex-president Trump."
2021-06-09T20:34:47Z,"only is america do you have what many around the world want, while many americans reject it"
2021-06-09T21:19:27Z,"Natural Selection....it works just fine.  If you don&#39;t want it, don&#39;t get it, and likely 1% of those that don&#39;t will die in the fall and winter, and that&#39;s fine, people need to own their own decisions."
2021-06-09T20:34:37Z,Who put the curley toed weirdo back on the media?  The guy behind the guy behind the &quot;vaccine&quot; for which the &quot;virus&quot; was created and not the first time!
2021-06-09T20:32:03Z,"Desire forMoney, power = lies, hatred, misinformation, more Covid deaths."
2021-06-09T20:29:45Z,"I respect Dr Fauci. He has always been honest. He’s right. The Scientific Method doesn’t always move quickly. This attack is the GOP trying to keep their ignorant base happy. Screw science, trust DT. 🤮"
2021-06-09T20:27:45Z,"Who honestly cares what those ignorant old racists say,think or do. I&#39;m so very over the ignorance and racist fear that makes up the totality of their political platform. They need to have the decency to go out on the ice flow and make way for the rest of us."
2021-06-09T20:26:47Z,We are in a low intensity conflict with China. COVID-19 is a war crime. Any Americans who worked with China to release this our traders in this war. It’s time for justice.
2021-06-09T20:25:49Z,ASk him where it all started.
2021-06-09T20:39:00Z,RIGHT!
2021-06-09T20:25:30Z,If all else fails blame aliens <br>With the recent ufology in the  news mix this will sound plausible.
2021-06-09T20:35:02Z,"I was thinking the same thing. I saw a lot of alien talk on the news lately, tryna coverup their fake pandemic!"
2021-06-09T20:45:38Z,Aliens don&#39;t think we are intelligent enough to deal with... Why do you think all our radars are pointed at the sky and not at earth??? No intelligence on this planet!!!!
2021-06-09T20:25:10Z,He is not telling the truth
2021-06-09T20:24:46Z,You have a rapid effect to any not consolatory  comments disappear . It is awful though that when we want to find out how this Virus started. Time seems unlimited despite Millions and Millions dead
2021-06-09T20:24:45Z,"Republicans are trying to use Fauci as a scapegoat as a way to side step all their wrong doings and lies. Trying to redirect people to look at a something besides their disgraceful &quot;Big Lie&quot; , voter suppression, the &#39;INSURRECTION&#39; and on and on the list continues. They are a disgraceful lot!!!   People will not be &quot;hoodwinked&quot; by their nasty deceitful attack on Dr. Fauci. He is a scientist doing his job, unlike the Republican Party."
