PublishedAt,Comment
2021-06-10T02:27:18Z,"新一波福奇郵件洩露! 揭秘科學界如何運用公關活動, 保護中國合作夥伴? 疫情爆發之初, 福奇為何全面封殺“實驗室洩漏說”？真觀點｜真飛 2021-06-04 <a href=""https://www.youtube.com/watch?v=3P11TsAUJH4&amp;t=09m17s"">09:17</a><br>李辉林评论：20年来从我揭发人类伪动力科学（中国上世纪80年代末购买并仿造70-80年代国际铁道动力领先科技的“不等分三段桥式变流牵引机车”，因而有几个科技权贵以此为依据成功申报了工程院院士。被我在本世纪初就发现并科学论证是“倒退地伪科学”的初期他们还自我辩解：他们是模仿的国际领先科学技术。似乎这也道出了国内国际伪科学命运共同体在那时就开始确立了相互维护，共同欺骗人类社会的厉害关系。特别是在总书记传承邓小平“挂社会主义羊头，卖封建权贵垄断资本主义狗肉”而发展到“与伪科学和谐的社会发展观”，更是成为全世界伪科学精英积极拥护呼应的救世主！）到证明牛顿力学与爱因斯坦能量学共同地缺失，再到发现宇宙客观真理及人类科学家们近半个多世纪编造地虚假基本物质与其物理结构。并向国内国际发出警示，而被人类的所有方面都一致地封杀。使伪科学在人类无所顾忌、为所欲为。对于杨振宁被我揭露其搞伪科学、压制抢劫我创新的科学真理，就弃美投中共用抢劫我的“宇宙客观真理”否定欧美现代科学文明的奠基人“牛顿与爱因斯坦全都错得离谱！”。这时候他们的“意识形态阵营斗争理论”就全部哑火了？因为他们的“文明精神领袖”才是高于一切的！得到欧美文明世界全体国家体制都是一致的隐忍并竭尽全力地保护。直到出现他们（中国科学家在美国科学家和政要地科技支持与财政资助下）科学创新出的“人造病毒”，一亿多人被感染、数百万人死亡了。人类才被伪科学权威、伪文化权威、伪知识权威让人类付出如此的代价中初醒吗？人类一定要谨记：没有监督制约的权威与没有监督制约的权利一样是必然会腐败惰落，同样会给人类造成无穷无尽地痛苦与灾难的。（具体实证内容，网络不允许上网。都放弃“民主法制”而陷于忙于按照中国传统文化人地思维，用主观意识形态两大对立阵营犯罪去取代客观刑事犯罪地斗争去了！）<br><br>中共建黨敏感日 大規模維穩 多人失聯；美軍機來台 中共官方態度反常引議論；真相車隊南加遊行：認清中共 安度疫情；翻牆被定罪 中國留學生談國內恐怖遭遇。 【@/%E7%92%B0%E7%90%83%E7%9B%B4%E6%93%8A】｜@/%E6%96%B0%E5%94%90%E4%BA%BA%E9%9B%BB%E8%A6%96%E5%8F%B0<br>49,392次观看•首播开始于 19小时之前<br>李辉林评论：你们说现在中共又在国内抓捕迫害毛左！这不是在向你们表示他们政治上积极地与你们中华民主海外兵团保持一致性了？本来邓共从开始全盘否定文革实行“封建权贵垄断资本主义”就是得到了你们封建统治文化奴才狗腿子们几十年坚定当作“真理”吹嘘、支持、共享的。你们所要反的中共只是害怕脱离了或者要改变邓小平封建强盗统治真理路线的中共。<br><br>【 @/%E6%99%82%E4%BA%8B%E7%B8%B1%E6%A9%AB 】習重提湘江血戰，氣氛詭異不祥？中共發反間諜新規；美艦逼近遼寧號；「戰鼓」 已擂響？| @/%E6%96%B0%E5%94%90%E4%BA%BA%E9%9B%BB%E8%A6%96%E5%8F%B0<br>直播开始日期：2021年4月28日<br>李辉林评论：“湘江血戰”是在中共诞生之初，其历史还基本上是一张白纸待自己如何书写时书写下的历史错误惨败地见证。如果不是后来中共下定决心坚决纠错，湘江血戰就是中共覆灭地血本。邓小平复辟封建统治文化制度，全盘否定毛泽东的“人民大于党、是党地上帝”，将其颠覆成“枪指挥党、党大于人民”！是在中共获取统治政权后的成熟期地彻底背叛人民，涂鸦浑乱了自己的成长历史。也就是中共快速地蜕化变质走向衰败，自行结束了合法存在地自然生命规律。所以中共真正地敌人并不是外来的，而正是来自于自身行为对内对外都狂妄自大地反动腐败所招致。<br><br>美国高层正被靠嘴巴制造各种社会矛盾事端，讨生存的中国封建文化奴才地团团包围，看来想不像国民党、中共那样被腐败堕落都不行的了。难道国民党与共产党都是与中国历朝历代一样，被自认为是千年圣人传世的文化精英们，无论怎么一个一个地竭尽全力去挽救都是没有用，都完全是自己将自己搞垮的？不把天下搞乱，他们文人存在的价值就无法体现出来，天下大乱时他们就能发挥出最大地存在价值的。能够达到杨振宁那样玩弄人类，挑起中美全面开打，就是当今天下文人无限崇拜、决不允许出现有任何污点、拼命都要维护的活圣人。如果不解决中国数千年的“封建统治文化真理理论与制度”成功地在近代将“家国天下”演变成“党国天下”，用挂新型社会主义羊头文化、卖腐朽封建权贵垄断资本主义狗肉统治中国人民。并轻易地得到人类所谓文明世界百年的大力支持，不论中国政治如何发生变化，其封建统治文化却是始终一起在配合演变。杨振宁、李政道、丁肇中都是民国（生母）生长、美国（养母）培养、最终认根复辟传统（后妈）的。在得到“宇宙真理理论”第一手论证资料后，没有向民主的台湾社会传递、也没有向人类文明社会介绍。而是要与中共一起占有，要归属于中国传统封建强盗统治文明的发展成就，就具有了客观科学权威性否定欧美现实文明的。欧美文明连他们所谓最讲客观真理的科学家都无法有任何文明影响改变，甚至还要协助配合、暗中保护封建文化奴才们抢劫“客观科学真理理论”，被用来攻击摧毁自己的文明基础！就以为去信任依靠那些完全靠嘴巴如此搬弄政治是非，共同坚决压制能够彻底揭露“伪科学真理”的“自然科学真理”的中国文人，就能协同解决中国文明进步问题？只有被其不断向全球渗透，终于造成世界性地危机恐慌。却不知道中国的主流文化就是“具有不择手段、无孔不入、无限扩张力，权力就是真理的政治”！他们对于美国封杀“孔子学院”、“抖音”并不会在乎，他们在乎的只是可能会发生在之后的，封杀同样没有诚信与底线（读书、修身、齐家、治国、平天下，能够将人家、大家、国家、天下全弄进个人小家的，就达到了将中国圣人封建强盗统治文化理论与制度推行全人类地最高境界。），靠攻击虚假的“挂社会主义的羊头”伪装外衣，而捍卫“卖封建权贵垄断资本主义狗肉”实质地封建政治文化需求，服务换取利益谋生的“华人网站”。<br>毛泽东的“人民中心论”在去世后被中共全盘否定，连一个所谓的接班人都不被中共权贵们容忍。而邓小平潜规则的“权力中心论”成功地政变华国锋、指定又废除了两个小弟做接班人、再成功地指定一个儿子辈的接班人、还成功地指定了一个孙子辈接班人，最终成为中共坐江山的祖制铁律。即使不是邓小平指定的接班人，中共统治权贵们也都一致沿袭套用邓小平的“真理标准”，潜规则成功地牢牢控制、操纵傀儡皇帝。现在中共的天下还与毛泽东有什么关系呢？国内外所谓的中国文人都一致地挺邓反毛，不过都是靠吸中共封建权贵地奶活命的奴才狗腿子，只是为了自己的利益在选边站队。与中共封建权贵们捆绑在一起，将自己的一切幸福建立在人民地苦难上。"
2021-06-10T02:23:58Z,&quot;I&#39;ll develop some disease and say i have to resign&quot; -joe biden
2021-06-10T02:23:38Z,I suspect many who are making comments here do not believe in evolution which is a pity as I also suspect some may win Darwin awards.
2021-06-10T03:32:47Z,Which part of the science text book establishes chain of command based on government position?
2021-06-10T04:01:09Z,"@@baigandinel7956 None, and from what I can see he&#39;s not speaking here as the person in command, he&#39;s speaking as any reputable, much published, (not that I&#39;d expect you to understand the significance of &quot;published&quot;)scientist would with the information he possesses while also trying to not miss lead people who don&#39;t appreciate, how science works and are desperately trying to win their Darwin awards."
2021-06-10T02:22:43Z,This proven liar gets all the screen time while YouTube censors and demonitizes Bret Weinstein who is at least open and honest about his work and intentions
2021-06-10T02:52:37Z,"They don&#39;t want honesty, they want team players."
2021-06-10T04:46:56Z,"The funding was to find out what this virus that was found was. Named it covid 19 Dr Fauci told Trump what was found in the wu han lab there is video proof of this on youtube. When the Pres tells you shut up and follow orders you do what the capital rioters did ,follow those orders"
2021-06-10T05:06:35Z,"I guess you would know about liars since you voted for a psychotic liar like trump, huh?"
2021-06-10T05:35:30Z,This is not normal. these viruses have a narrative and an agenda. This is genocide. They are unleashing the facts it&#39;s right in our faces. In plane site.
2021-06-10T06:20:18Z,The virus was not accidentally released.
2021-06-10T02:22:20Z,This guy is a paid propagandist for the elite white Marxist.
2021-06-10T02:21:27Z,"Of Course a New Variant!!!<br>Got to make sure that age group 12-20 get vaccinated!!!<br>When is the The Fall Néw Variant? Right before school starts so teachers can set guidelines, or November Election Time ?"
2021-06-10T02:20:18Z,The GOP is having a witch hunt with Dr Fauci to smoke screen their handling of covid outbreak in US. What a sorry state of affairs.
2021-06-10T03:16:30Z,Keep that degree from The University of MSM spit shined
2021-06-10T02:20:16Z,Kudos to Dr Fauci always  give us trust worthy information!
2021-06-10T02:15:16Z,Remember when YouTube was the place that you came to get away from the LAMEstream
2021-06-10T03:20:53Z,"You still can, bee. No one is forcing you to obsess over biased media."
2021-06-10T08:15:00Z,You can go anywhere else but your <i>choice</i> is to be here.
2021-06-10T12:36:51Z,"I never watch msnbc, so I&#39;m not sure how this video keeps showing up in my feed when channels i actually subscribe to are being suppressed. Seems the &quot;algorithm&quot; is 🐂 💩"
2021-06-10T13:08:52Z,"@@beeb6809 click &quot;not interested&quot; or &quot;don&#39;t recommend this channel.&quot;<br><br>The more you comment on videos and interact with them, the more it will recommend them for you."
2021-06-10T23:41:59Z,@@beeb6809 I wondered the same thing 🤔
2021-06-10T02:10:16Z,Dr. Fauci is a nut case...
2021-06-10T02:08:50Z,MSNBC and Fauci are to be locked up!!! Murderers!!!
2021-06-10T02:07:23Z,Hydroxychloroquin...
2021-06-10T02:11:30Z,What is that word ?
2021-06-10T02:01:30Z,"This is the ex President Trump&#39;s strategy. Trump has nothing good to offer in this world except scheming for his own personal interest. Sadly..those Republicans share the same interest. US is lagging behind and it is a reality. <br>China will be the next superpower whether US likes it or not. <br><br>US, your internal problems is dragging you behind. You cant even get united with an agreed direction and not to mention having this mad man Trump continues to stir and divide.<br><br>Look at yrself first...China and Asia are emerging..next India and Africa...sorry US..you are going to be history  soon."
2021-06-10T02:01:28Z,Faucism is strong in this comment section. Yikes. The legacy media and so called health experts obliterated any shred of credibility they had when they sided with big tech to censor anybody who questioned the origins of covid. Obviously anybody with 2 brain cells could have reasonably assumed that a level 4 bio lab mere miles away from the epicenter of the original outbreak may have had something to do with it. But people were smeared as conspiracy peddling and many times out right banned and censored. I don&#39;t believe anything these clowns have to say because they have been proven wrong on literally everything they say.
2021-06-10T02:01:19Z,"The Republicans are always looking to blame everyone else, especially Dr Fauci because he failed to lie for Trump, plus they never take responsibility for their own actions.  Their corruption and cheating is well known among these traitors."
2021-06-10T02:00:33Z,G O F ..... 🐑 🐑
2021-06-10T12:19:45Z,Fu
2021-06-10T14:43:32Z,@@lotusflower2411 why don’t you come and do that?
2021-06-10T14:44:11Z,🐑🐑🐑🐑🐑🐑🐑🐑🐑🐑☠️☠️☠️☠️💉💉💉💉💉💉💉💉💉💉
2021-06-11T12:23:06Z,@@soredem ooohh.. pictionary!
2021-06-10T01:57:45Z,Nice job trying to downplay this one Chucky 👏👏👏🤦‍♂️👎
2021-06-10T02:55:45Z,Dr Chucky in existential crisis mode.
2021-06-10T01:50:09Z,"Dead end for virus?  Wait what?<br><br>Vaccine does not prevent infection. <br>Research still does not prove that infected vaccinated persons do not spread.<br><br>Bit disingenuous at worst and rushed at best. <br>Funny how all through COVID, they knew so little and were so wrong. NOW…so sure. <br>Hmmmm"
2021-06-10T01:47:47Z,Time to come clean on the vaccines.
2021-06-10T02:06:02Z,"SF Woodley , You didn&#39;t ask that same question about the virus did you ?  Check yourself but don&#39;t wreck yourself !"
2021-06-10T02:59:21Z,@@cynthianoll4115  Virus they invented for vaccine ??
2021-06-10T15:10:39Z,@@cynthianoll4115 I started questioning the narrative back in January 2020.
2021-06-10T01:44:15Z,"<a href=""https://www.youtube.com/watch?v=3P11TsAUJH4&amp;t=17m57s"">17:57</a>  There is problem with Dr. Faucis therory and it deals with the timeline.  An important piece of info that DRASTIC has found is that the WIV Data base was taken offline on Sept 12, 2019. This contradicts another of Dr. Shi statements, but more importantly if one is to believe that the act of taking down the data bases (16 in all) was part of the conspiracy then this moves the timeline way back. This means the virus had to be already out prior to Sept 12th. It takes 7 days for incubation. Thus, we have a new start date of Sept 5th, though I believe it would have taken the WIV much longer to realize this was a major problem and that the data bases must come down. <br>This early start date is weird since many have said the genomic history points to a release/emergence of late Oct at the absolute earliest (Dr. Robert Garry) There is also Cambridge study that puts the start date based on genomic history to Nov. So, if the release happened in Nov./Oct., what does the pulling of the data bases on Sept 12th tell us? Premeditation? I know Trump always thought this was all about him, but he is neglecting to recognize the person who gained more than anyone else in the world from this release and that person is Pres. Xi. Before the upcoming fall 2019 National People’s Congress (NPC)—and its advisory body—the Chinese People’s Political Consultative Conference (CPPCC) Pres. Xi was in trouble. There were many questions about his handling of US trade tariffs. His ability to run the vibrant Chinese economy was also in question. Let us not forget all the enemies he had gained from his purges. Press Xi was on the ropes. In fact, Premier Li Keqiang, Xi&#39;s archrival, was ready to pounce. After the outbreak, Press Xi fortunes have never been more secured. He is still guaranteed to be President for life and his desired position as Chairman is now within reach."
2021-06-10T01:39:21Z,I love you Dr. Fauci..you are the ongoing voice of reason in the midst of craziness and conspiracy theories.
2021-06-10T01:55:33Z,"&quot;Tony Fauci does not mind going on television in front of the people to pay his salary and lie directly into the camera.&quot; -Kary Mullis inventor of PCR Test^1<br><br><br>citation<br>1:on my channel"
2021-06-10T01:37:21Z,Oh snap it got out
2021-06-10T01:37:01Z,Let&#39;s add a few genetic traits to said virus and harvest a vaccine!
2021-06-10T01:35:29Z,Let&#39;s extract virus
2021-06-10T01:34:28Z,Let&#39;s see what It is
2021-06-10T01:29:44Z,People are still listening to this proven LIAR. The same guy who used our tax dollars to do gain of function research that created coronavirus IN CHINA!   You can&#39;t make this up.
2021-06-10T01:29:14Z,"<a href=""https://www.youtube.com/watch?v=3P11TsAUJH4&amp;t=15m38s"">15:38</a> &quot;We dont see any fingerprints that look like that. &quot; Dr. Fauci. This is why you need to know science Chuck because you just got played. There is the double CGG in the furin site. Only one “CGG is rarely used in the class of coronaviruses that can recombine with CoV-2. In fact, in the entire class of coronaviruses that includes CoV-2, the CGG-CGG combination has never been found naturally” (WSJ Quay Muller 6/6/21)  See Chuck your to dumb to ask a direct question on this and that is probaly why you got played."
2021-06-10T01:28:41Z,Oh yes Chuck Todd- do you not see what the emails are saying?  That he knew about the the lab leak last February?  MSM.
2021-06-10T01:28:16Z,"Now, I don’t believe a word that he says."
2021-06-10T01:26:31Z,"If you find yourself thanking Fauci..<br>I promise you that you voted Demoncrat🇺🇸🇺🇸🇺🇸<br>And if you comment negatively it proves my point🤓😆<br>Jesus is the answer, not Dr. Falsey"
2021-06-10T01:25:45Z,Fauci doing his deflection cover campaign?
2021-06-10T01:23:29Z,"<a href=""https://www.youtube.com/watch?v=3P11TsAUJH4&amp;t=14m22s"">14:22</a> &quot;I am not a scientist&quot; -Chuck Todd Boy is that is obvious. At least read some science books or watch some science programs."
2021-06-17T00:57:23Z,"Chuck was hired for his lack of curiosity, not his abundance of it."
2021-06-10T01:20:32Z,Dr. Fauci we want to know what science you are doing in a lab and hiding with China
2021-06-10T01:19:28Z,What a sad existence you live chuck.
2021-06-10T01:15:57Z,Fauci under the NIH funded $3.7 million to the Wuhan Institute of Virology for dangerous coronavirus gain of function study.  Why study how to create bioweapons?
2021-06-10T01:12:03Z,Fraudci
2021-06-10T01:09:56Z,The emails showed that Fauci thought there was a possibility of lab origin. He then meet with others including many virologist and then they all said there was no possibility of lab origin. What changed his mind? Why is that info redacted ?   Chuck why no direct questions.  Is this to complicated of an issue for you?
2021-06-10T01:07:23Z,Trump is the only one that should be in jail.
2021-06-10T01:00:22Z,"Who listens to this fraud still? Read the emails, and why are some redacted"
2021-06-10T00:53:42Z,Is Fauci in jail yet? He is a ghoul!
2021-06-10T00:52:51Z,Propaganda
2021-06-10T00:52:44Z,Liar
2021-06-10T00:48:34Z,Fauci is a weisel and I would use the title &quot;doctor&quot; with extreme caution.
2021-06-10T01:15:55Z,"Use the title &quot; sorcerer &quot; .. you know , with all the sorcery and such lmao"
2021-06-10T00:44:26Z,&quot;Handing out our VIRUS around the world&quot;
2021-06-10T00:42:23Z,Fauci is covering up for China. He probably gets money from them.
2021-06-10T00:41:04Z,Pathetic interview by chuck tood
2021-06-10T00:36:08Z,You can&#39;t have an intellectual conversation with ignorant Republicans who are only concerned in confusing the average American and why we have lost so many lives.
2021-06-10T00:52:12Z,Why should the public understand?  It’s too complicated.  Thanks Doc
2021-06-10T01:43:16Z,Epiphany ahead.
2021-06-10T01:47:47Z,"People mired in the Republican/Democrat argument are as guilty as anyone of a narrow view, selective reality and cognitive dissonance. <br>It’s easy though right?  Ya pick your team, you pick your facts…viola!  No further effort or thought required."
2021-06-10T08:54:52Z,"@@digitalperson108 I agree with you your thoughts are of now substance. Real facts speak for themselves where are liars have to keep lying. I don&#39;t have a team, I am from the planet earth and I an here to help."
2021-06-10T09:19:25Z,@@sfwoodley8878 It would be nice the problem in order to have an epiphany you have to understand most peoples minds are so noisy they only hear their on own thoughts which always leads to ignorance.
2021-06-10T00:35:53Z,"Covid-19 started in the Wuhan lab in China. Dr fauci knew it a year ago, he helped fund gain of function research on it for that lab he knew it, he lied about it to the American people and to Congress time for him to go. My opinion"
2021-06-10T00:36:25Z,Yes
2021-06-10T00:34:46Z,"The one man that was try to advise Donald Stump on how to mitigate the COVID crisis more than a year ago, is the one that&#39;s supposed to be in trouble??!!!! BULLCRAP!!!"
2021-06-10T00:34:41Z,"I&#39;m telling ya, these SOBS will SELL YOU OUT for a DOLLAR! The virus is not gone, it mutates quickly, vaccines will not work against the coming variants   AUTOMATION AND UBI NOW drone deliveries, permanent home school FUND IT work it out, it is doable, work from home AUTOMATION NOW!!!!!! UBI NOW       ACT       DON&#39;T JUST       RE ACT"
2021-06-10T00:33:22Z,Find RFK jr and hear from him if there is &quot; nothing in those emails&quot;<br>He&#39;s not a Republican
2021-06-10T05:41:05Z,"The Pfizer &quot;vaccine&quot; isn&#39;t really a vaccine because it doesn&#39;t limit the spread of the disease it just lessens the symptoms. In the several months it&#39;s been out it already accounts for more deaths than all other vaccines over the past 20 years combined. I&#39;m no antivaccer, but that is terrible for early data. This one is truly not worth the risks, unless maybe you&#39;re over 70 or otherwise high risk. It&#39;s madness. The NIH became politicized in the Clinton years and all we seem to hear now is dogma and proclamations. There&#39;s too many scientists afraid of losing their funding and just running with the herd, following lifetime appointees like this guy."
2021-06-10T06:35:32Z,@@bobk9656 100% agree.<br>By the time the rest comes out..<br>There will be legal action against many of these grifters.<br>Fauci is just the tip of the spear.
2021-06-10T00:33:15Z,The Chinese are very willing to do in a hundred million of their people. They have a billion and a half. Lol
2021-06-10T00:38:37Z,That is China&#39;s low to no income labor pool you are talking about.
2021-06-10T00:31:35Z,i hope i do catch it and die.
2021-06-10T00:37:00Z,Why?
2021-06-10T00:29:30Z,"Lies, fake quack"
2021-06-10T00:25:55Z,China: It was USA<br>USA: It was China<br>Who did it exactly?
2021-06-10T00:38:00Z,Democrap + ccp
2021-06-10T00:22:42Z,"Can I suggest that all those people who comment here and distrust so called MSM, and who think that Fauci is a liar, go to the top right hand corner of your screen, press the little magnifying glass symbol and look up the news in other countries around the world and their Covid reporting. DW (Germany), BBC (Britain), France 24,<br>ABC (Australia), India Now are some suggestions Unsurprisingly, you&#39;ll find that their take on Covid is in step with reputable American news sources. How strange!"
2021-06-10T00:16:31Z,Money fauci its always about money
2021-06-10T00:13:53Z,"Who gives AF about origins, stains, variants.  Americans, get vaccinated. If you chose not to, don&#39;t be proud of yourself."
2021-06-10T00:07:24Z,For all you Free (Hate)Speech people. Apparently Trump calling for Twitter to be shut down because his speech ( if any normal human being could call it that) was shut down and his failed platform has him crying ..As it should have been. You can’t toss out death threats. It’s against the law..so that’s not equivalent to Free Speech. It sure is nice to see him squirm and feel the loss of the use of his filthy tongue to the masses. Loser!
2021-06-10T00:03:33Z,The Republicans can&#39;t hit anything but low lying fruit. They have to start with the assumption that we are ALL stupid. We aren&#39;t.
2021-06-10T00:07:16Z,Well your political party believes millions of genders exist and that men get pregnant and refer to woman as “birthing people” so...😂
2021-06-10T00:02:32Z,How much did the CDC exactly give Wuhan to develope COVID-19?
2021-06-10T00:10:02Z,as far as i remember from articles a year ago.....the CDC didnt fund them  the NIH and Fauci did for studies on coronavirus&#39;s
2021-06-10T00:01:37Z,"Dr. Campbell just posted a report on Virus in Italy September 2019 several days earlier. And he also pointed out Spanish scientists found it in Barcelona sewage water in March 2019. I believe that&#39;s something important, because that confirms the earliest patient in Wunan (Dec 8th 2019) is not the earliest anymore, and it is possible that this virus has been circulating the world outside Asian for a long time."
2021-06-09T23:58:26Z,You forgot Sky News Aust.
2021-06-09T23:56:03Z,Dr. Fauci is guilty
2021-06-09T23:55:44Z,Nothing explosive? LOL... wow
