PublishedAt,Comment
2021-06-10T23:40:16Z,"After listening to him for 1-2 years he does not know anything…..makes no masks, where it started he said animals but gave money to the woohan lab…. So…."
2021-06-10T23:36:32Z,Thank you For your information.  You have my respect and trust Dr.
2021-06-11T01:21:59Z,You respect and trust someone who has repeatedly lied to millions of people for over a year?
2021-06-11T13:01:46Z,Rasta pastaaa brapbrrapp
2021-06-10T23:30:45Z,Republican senators need to look in a huge mirror and stop calling the kettle black
2021-06-10T23:28:22Z,I thought they wanted to use Roman Numerals in place of Country linked names for different variants.
2021-06-14T10:21:57Z,It&#39;s now Greek letters not Roman numerals.
2021-06-10T23:25:14Z,Fauci lied people died
2021-06-10T23:22:29Z,the general public doesnt understand science... even the host lol
2021-06-11T03:23:30Z,they say trust the science but the first thing in its method is ask question all the way to observation to hypothesis and coming with your own conclusion... I do trust the science alright .....lolol
2021-06-11T04:05:24Z,thanks to &quot;No Child Left Behind&quot;.
2021-06-11T05:41:03Z,@@ddre8834 yeah... its easier to believe what i want to believe whenever its convenient
2021-06-11T12:09:23Z,@@akocleol3856 Like Fauci. Good ole Fauc.
2021-06-11T14:31:32Z,DDRe Yes but ‘you’ do not have access to the information necessary to ask the right questions or find the correct answers. Just the fact that so many people dont see this within their own common sense supports Fauci’s statement that many people do not understand science.
2021-06-10T23:21:31Z,I see the lying liar is still lying!
2021-06-11T02:15:12Z,I see the delusional person is still delusional.
2021-06-11T02:20:28Z,"State the so called lies attributed to Fauci. Please spare us the stupidity that comes from Facebook or Fox news, don&#39;t bother with that.<br>I&#39;m waiting."
2021-06-10T23:18:50Z,"Seems like Fauci is the only doctor in the entire world, who can speak on COVID."
2021-06-11T00:33:54Z,Red Zun facts...Wonder how much China is paying him? Because he obviously is very aware not to offend them.
2021-06-11T01:30:52Z,"@@joshualei98 China? Or Big Pharma? Vaccines to infinity and beyond. Now, we&#39;re gonna pay for 500 million doses for the world."
2021-06-11T06:04:10Z,"@@janetg.1477 derrrrr, as long as the virus is out there, it still endangers even the US. It’s in our interest to vax as many people possible everywhere. You know?"
2021-06-11T06:46:46Z,i never believed him and now even so more.. I am not even a republican.
2021-06-11T10:21:12Z,.....who can &quot;LIE&quot; on covid.<br>FTFY
2021-06-10T23:07:44Z,I am tired of this dude.
2021-06-10T23:06:43Z,Invention of Remdesivir? mRNA vaccine in 7 months? Suspicious too?
2021-06-10T23:05:34Z,Fort Detrick!!!!
2021-06-11T12:57:11Z,Astronauts invented Tang. I like the commercials in the early 2000&#39;s. They had an orangutan in them.
2021-06-10T23:02:36Z,Must also include likelihood of a leak from Fort Detrick if you are sincere about getting to the bottom of the origin of the virus and are non-political in motive.
2021-06-10T22:57:57Z,Lock him up!!!! He was in and is in LockStep with Communist China... Don&#39;t do this GeneTherapy.. Not a Vaccine..Folks..don&#39;t trust these Demons...
2021-06-10T22:55:52Z,Most Republicans would benefit from a lobotomy.
2021-06-10T22:48:00Z,"Times up , the audit is up give us the codes to the machines right now!  We have the facts you’re hiding the evidence it’s going to come out!"
2021-06-11T02:18:14Z,Lol! Thanks for being the comedy relief!
2021-06-10T22:45:58Z,🤮💩
2021-06-10T22:45:08Z,I see fauci as a bat
2021-06-10T22:42:51Z,We caught covid 4 days before vaccine was available to us. CDC recommends waiting 90 days after sickness to get vaccinated. This may be one reason vaccinations dropped???
2021-06-11T14:38:11Z,"Red Zun It was approved for emergency use.....which is simply supporting the fact  of transparency. They explain to all that there is not enough time to perform the typical numbers of testing to acquire FDA approval, but  that the FDA (who u feel needs to support this before u trust the vaccine) DOES support the fact that this crisis poses a strong enough threat to instead rely on emergency protocols &amp; that these vaccines have met those standards. <br>U eat &amp; drink &amp; live around products every day that have not been held to even a quarter of these standards. Get vaccinated &amp; stop waiting for a variant that actually hurts u. 🙄"
2021-06-12T05:09:18Z,@@friedricengravy6646 tldr version: bahhhhhhh 🐑🐑🐑🐑
2021-06-12T15:01:55Z,@@friedricengravy6646 it won’t hurt you. It’s only approved for emergency use. So trails haven’t been finished nor effectively been done. Biden administration is to blame for the drop in vaccines. Dr. Fuckhead should be jailed for lying and creating this scandal.
2021-06-13T14:44:19Z,"Dan Matthews Sure, &amp; the Earth is flat too. 🤦🏼‍♂️"
2021-06-13T14:47:22Z,Ronnie Trejos Always the ‘sheeple’ guy in every thread. What is the chosen economic philosophy of each party? What r the guiding principles listed within those 2 philosophies?? <br>U r not a sheep because sheep at least know they r following the group. U r a goldfish who thinks he is swimming miles ahead while moving in circles.
2021-06-10T22:38:15Z,Why did u run a simulation and predict what was gonna happen cause u created it with gain of function peace of crap
2021-06-11T23:30:29Z,Why did you decide to be a moron?
2021-06-12T03:08:33Z,"@@pdoylemi pat, google “event 201” if you can peel yourself away from name calling in comment sections. ;)"
2021-06-27T15:22:42Z,"@@davegundry8189 -- When the mindless herd has no argument they resort to insults &amp; ignore the truth because it conflicts with their pre conceived notions. They are trapped in the mindless folly they were warned about in their introductory college courses. They are trapped in the spiraling toilet bowl of bias &amp; groupthink. They&#39;ve become the disgraceful epitome of what they were warned about. Stubborn &amp; arrogant until the end. They will never accept the truth because it flys in the face of their fool headed convictions.<br> Mindless fools them all! Facts are that Fauci said that he never financially supported the Wuhan institute with our tax money. Then when it was revealed that he did give such &quot;grants&quot; the mendacious mouse faced midget spins his lies into, &quot;well I did approve the  funding but it wasn&#39;t for that research&quot;<br>  And these mindless fools still believe he&#39;s being honest."
2021-06-10T22:37:59Z,Did he just declare himself infallible?
2021-06-10T22:36:50Z,Secret society liar ego maniac we see your lies faucci coronavirus equals get Trump outta office even if it means hurting innocent people
2021-06-10T22:36:45Z,(Emperor palpitine) I am the science!
2021-06-10T22:35:42Z,Interviewer-&quot;There seem to be inconsistencies in your story.&quot;<br><br>Fauci- &quot;It&#39;s treason then.&quot;
2021-06-10T22:28:05Z,Dems turned a blind eye to possibility of lab leak because of hatred for a man. That is very unscientific
2021-06-10T23:13:23Z,Not all dems feel that way. It’s not really political (it’s becoming that way because of media publications) and how divided the country is.
2021-06-11T12:53:44Z,"But Trump distracted them soo, impeach againn.."
2021-06-10T22:22:31Z,Trump should have fired Fauci long time ago
2021-06-10T22:08:49Z,Conflating himself with science..... that is like saying criticizing the Pope or the catholic church is the same as attacking God...please...Faucci needs to go!!!!
2021-06-10T21:49:11Z,"Fauci: I am become science, destroyer of worlds"
2021-06-10T21:29:24Z,"What a Con Man!!!<br>We must hold Dr. fraud ,Bill Gates and China  accountable for the genocide they are trying to commit at this time!!!"
2021-06-10T21:25:35Z,"So tired of his lies he caught he needs to admit his mistake like a man, And not the little weasel that he is the old staying will you contribute to gain a function research that&#39;s all he wants to do and now he&#39;s caught on it lock him up if he won&#39;t admit it"
2021-06-10T21:16:49Z,Lock him up
2021-06-10T21:12:17Z,"CHUCK TODD AND &quot;GAIN-OF-FUNCTION FAUCI&quot; ARE PROPAGANDA MOUTHPIECES FOR THE MARXIST/COMMUNIST LEFT WING, DEMOCRATIC SOCIALIST PARTY. 👍"
2021-06-10T21:09:13Z,Christian Anderson said it looked engineered in his email to you in February 2020. Fauci says repeatedly to keep an open mind but helped organize shouting down anyone who asked about lab origin earlier in the pandemic. If all options were on the table why does social media censor anything controversial about the wuhan lab…… Fauci abused our trust.
2021-06-10T21:07:47Z,"Fauci is a smooth, New Yorker, knows how to spin you a story, all narcissists. Liars. $$$$$ driven."
2021-06-10T21:03:23Z,What a sociopathic narcissist this guy is.
2021-06-10T20:55:41Z,You know not everything has to be about Trump or Biden. Fauci hasn’t been giving us a straight answer on funding WIV and covid origins.
2021-06-10T20:33:14Z,"Close the border , we wouldn’t get so many variants. This creep needs to retire , he’s made millions off people, makes 400,000 a year, more then a President."
2021-06-10T20:32:51Z,It’s appalling ....
2021-06-10T20:31:52Z,"Fauci is fake news, very fake news"
2021-06-10T20:25:04Z,Why is this guy still relevant after the emails? No one should even listen to this narcissist anymore.
2021-06-10T20:18:51Z,A theory? You condemned Trump for telling everyone where it came from at the beginning  you are a total<br>Hypocrite and should just keep<br>Wearing a mask for the rest of your days Chuck.
2021-06-10T20:14:44Z,"He&#39;s a liar! If you think nothing is in the emails, go read them yourselves! He funded gain of function research and then lied to congress about it. There is literally evidence and a statement from him, prior to Trump even becoming president, where he completely supports and funded that research. Even said the risk of a pandemic was worth the research. Also, there is scientific evidence from a study saying that over 52 thousand people were studied and showed those who got the vaccine compared to those who have natural antibodies from having covid prior, show NO difference. These people are straight up liars! Fire Fauci!"
2021-06-10T20:00:02Z,Fort Detrick is ground zero for the corona virus
2021-06-11T05:16:14Z,Wumao ?
2021-06-11T05:22:03Z,@@oceania2385 <br><br>Afraid of the truth?
2021-06-11T12:10:47Z,@@3nien What&#39;s a wumoa?
2021-06-11T13:39:39Z,@@richardtyler3498 <br><br>Look up Kong Tsung Gan.
2021-06-10T19:42:02Z,This new reporters reporting is so biased.
2021-06-10T19:40:55Z,Lock Up Dr. Fauci! Lock Up Dr. Fauci! Lock Up Dr. Fauci! Lock Up Dr. Fauci! Lock Up Dr. Fauci!
2021-06-10T19:12:29Z,“Science is not a sacred cow. It is a horse. Don’t worship it. Feed it!”<br>Ask science: Who created Covid 19?
2021-06-10T19:11:08Z,"I do not care, frankly, what Chuck Todd thinks. I do not pay any attention to the &quot;good doctor&quot;, either. They have absolutely zero influence in my life."
2021-06-10T19:08:44Z,Are many Americans now skeptical about Dr.Fauchi??<br>I am not American.
2021-06-10T21:50:43Z,Only white supremacists  but Biden is build death camps
2021-06-11T12:27:15Z,@@silverpairaducks Biden needs help passing stool.
2021-06-10T18:55:29Z,"Dan  bongino has the email showing their lying to you as usual,,fauci lied and people died"
2021-06-10T18:45:25Z,He is so guilty
2021-06-11T00:33:37Z,Crimes against humanity
2021-06-10T18:44:40Z,He never  Include in this virus he always says you use the word you need to you need to do that he never includes himself hes an American he shouldn&#39;t include himself in the word should be we should do or shouldn&#39;t include we not you
2021-06-10T18:43:40Z,Looks to me like doctor fouchi is tired you must be scrambling around and see what other emails are in there that he can take out or cover up or whatever he does whatever he does it isn&#39;t good
2021-06-10T18:42:50Z,Facci is a fraud
2021-06-10T18:38:18Z,You are just as guilty for creating this issue that you blame Trump for.
2021-06-10T18:31:39Z,"Notice when he is asked about the origin of the virus, he goes to the straw man argument. (Eg “most scientists believe...”). The issue is that after 16 months they haven’t been able to prove a natural origin of the virus. Ebola, Avian Flu, and other previous viruses were identified as coming from natural sources fairly quickly. In logic, it’s tough to prove a negative. That said, typically the most plausible explanation is typically the answer to the question. <br><br>In this case, because the Wuhan lab was engaged in GOF science with novel Corona viruses pre-pandemic, 400 yards from the wet market of supposed origin, the most plausible and likely explanation is that researchers in the Wuhan lab fell ill, shopped at the wet market, and thereby “patient ZERO” was established."
2021-06-10T18:31:13Z,dr. Anthony Fauci = Josef Mengele
2021-06-10T18:26:46Z,"Instead of reporting on the fraud, msnbc is hard a work trying to control the fallout. But I’m probably writing to myself since YT is part of it."
2021-06-10T18:22:43Z,sad part is he will never get cought take the blame or be punished for all hes done  !
2021-06-10T18:22:19Z,"1K+ 👍 and 700+👎 combined with 1700+ comments in less than 24 hours.  This may be the most fair, and balanced group of people to view MSM since Trump won the Republican primaries.  LOOK AT THE RATINGS MSNBC; look and see how polarized the public is, then figure out what you&#39;ve been doing wrong as newscasters over the last 5 years!!!"
2021-06-10T18:19:49Z,"Fauci created this cloud of doubt that surrounds him. <br><br>1. His involvement with indirect grant funding for GOF in Wuhan lab;<br><br>2. His participation in the IP and patent monetization for the vaccines <br><br>3. Create the problem (#1 above/pandemic), Own the solution (#2 above/mRNA vaccine). Brilliant business model. <br><br>4. Inconsistent and often inaccurate messaging over the last 16 months that was NOT based in all cases by “science”. <br><br>Dr. Fauci has done very well for himself. A true entrepreneur by definition."
2021-06-10T18:09:39Z,Why should we get an experimental vaccine (that&#39;s what &quot;emergency use&quot; means) when we are 99.995% going to survive it??  But main stream media ignores that fact--facts from the CDC no less.
2021-06-10T18:09:18Z,You won’t poke me!
2021-06-10T18:06:28Z,Off with his head
2021-06-10T18:06:15Z,Hahaha! Build your pesky little tower of Babel. We all know how this goes down at the end
2021-06-11T13:42:31Z,"Yeah, you&#39;re still outnumbered by at least 7 or 8 million registered voters.  And most of the younger voters who will vote for the first time in 2022 are disgusted with what they saw during the Trump administration and are pro-voting rights, equality, police reform,  solving the climate crisis, SCIENCE...you get the idea.  People 40 and younger will soon be the largest voting block in this country.  And the previous group that has historically been the largest and most faithful voters?  Trump&#39;s handling of the pandemic definitely contributed to thinning out their numbers.  Also, time is not on their side.  If it&#39;s &quot;woke&quot; to accept reality and try to be proactive in changing destructive things, then we all need to wake the he.ll up.  The way this ends is still TBD.  Either things change so future generations can live and thrive or we continue to spiral downward into destruction.  I choose to protect the future for my children and grandchildren.  And their freedoms."
2021-06-11T14:09:31Z,MitziK Well said.
2021-06-13T18:23:13Z,"@@warpthumr47 Wrong. Conservative youth is larger than ever simply because of the constant lies drama and corruption from the left (and Rino&#39;s) meanwhile the psycho left is aborting in the largest numbers, changing their sexes, corrupting their children 😂 Seems to me y&#39;all are taking yourselves out of the gene pool. May not see it now but you will in 20 yrs."
2021-06-14T11:53:47Z,@@cwest2301 this seems to be wishful thinking. statistic show younger people are more for democrats. in the age 18-29 62 % voted blue and 35 % red. In the age 65+ 48 % voted blue and 51 % red and its because leftish values.
2021-06-10T17:51:28Z,"WARNING FAKE NEWS! WATCHING THIS BULLCRAP CAN LOWER YOUR IQ! PLEASE MY FELLOW AMERICANS DON&#39;T BUY INTO THIS POLITICALLY BIASED FAKE NEWS! THEY ONLY REPORT THE SOCIAL COMMUNIST AGENDA,<br>YOU ARE SMARTER THEN THIS!!!!"
2021-06-10T17:50:15Z,Yes MSNBC you got it wrong.. Again!! You were and still are putting Fauci on a pedestal and now you’re backtracking.. You blame Trump saying he did a poor job on Covid.. when in fact it was because in the beginning he was listening to Fauci!! You need to just close up shop and start watching Newsmax !! because Everything they said n say has been right so far EVERYTHING!! And it’s not over the truth still coming to the light.. just like what’s going on with Hunter is conspiracy theory .. the fraudulent election you call it a conspiracy theory.. you will soon be swallowing those words too!!!
2021-06-10T17:47:48Z,Msnbc is the pits!
2021-06-10T17:47:13Z,As my grandma said &quot;dog poop is much nastier and smellier when chickens spread it around&quot;.
2021-06-10T17:46:22Z,"MSM smeared HCQ because President Trump promoted it, but Anthony&#39;s motive for discrediting HCQ was more nefarious. In spite of his own 2005 study showing the effectiveness of HCQ against coronaviruses, in spite of him prescribing it to family &amp; recommending it to his  friends, Anthony went on an all out PR campaign to bring a life saving drug into disrepute within the trusting public &amp; medical community. Why? <br>If there was any alternative theraputic drug, the FDA would have been forced to block emergency authorization of his precious MRNA vaccines. Thousands of people who died from SARS2 were denied  a proven effective, safe, cheap, readily available drug by the very man who funded the dangerous research leading to the disease itself. Much blood on this megalomaniacs hands."
2021-06-10T17:45:00Z,"Ironic, Fake News Progressive Chuck who shouldn’t be on a network comes to Fake News Fauci’s aid ..  ?   Is it Covid19 or Fauci19? He is like a bad penny, keep trying to throw away and keeps showing up ...    His 15 minutes have long been over ...  His job DOES NOT REQUIRE he be in front of a camera,  EVER!!!     Get him before Congress on emails defending a China coverup ... Creating a false narrative with media networks ... He is defending a corrupt W.H.O in bed with Communist China ...  He didn’t want his role in funding Gain of Function coming to light either ..."
2021-06-10T17:44:43Z,MUCH BLOOD ON FAUCI &amp; HIS MSM ACCOMPLICES HANDS.
2021-06-10T17:41:39Z,Fauci = Mengele
2021-06-10T17:39:31Z,Fauci you are not science but you are absolutely arrogant FRAUD. Maybe get you head checked.
2021-06-10T17:33:56Z,Msnbc defending him makes him complicit
2021-06-10T17:31:04Z,Dr. Fauci = Mengele
2021-06-10T17:17:55Z,Arrest Fauci and Gates for Crimes Against Humanity
2021-06-10T17:05:14Z,How much money is dr fauci making off this virus including what hes making from the vaccines ?
2021-06-10T17:04:24Z,Without Mr. Trump we would have never had a vaccine for Mr. Biden to take credit for.
2021-06-10T16:46:28Z,Pov: Looking for trump supporters in the comments 👀
2021-06-11T03:49:25Z,Red Zun Wait until 3 am they will appear out of nowhere.
2021-06-11T04:36:36Z,👀
2021-06-11T10:51:00Z,Red Zun Who knew baiting could be so easy 🤡
2021-06-11T12:15:48Z,@@roadtohero Libs are crying into their cheerios. But but Cuomo had a great jawline.
2021-06-11T13:15:10Z,@@richardtyler3498 No one cried more in presidential history then Chump and his supporters! Oh I have to wear a mask whaaaaaaaa talk about snow flake cry babies!
2021-06-10T16:34:20Z,Of course GOP wants Dr. Fauci fired. GOP wants to stop any success during Biden’s tenure. Dr. Fauci is our brave hero who refused to lie during Trump’s presidency and spoke facts in spite of Trump’s duress and gagging.<br><br>Americans need to rally around him as he was the only voice we could trust and thankfully Biden sees how priceless is Dr. Fauci. Biden continues to give Dr. Fauci’s the platform. Biden doesn’t gag Dr. Fauci.
2021-06-10T17:32:00Z,🤮
2021-06-10T16:32:34Z,Is this clown still talking?
2021-06-10T16:30:38Z,"Wipe your chin, Chuck. <br>     Does Chuck get a paycheck from the Democratic Party? And what&#39;s funny, Chuck, is that conservatives suspicions pointed to the lab in early 2020. But do your damage control. There is plenty."
2021-06-10T16:09:22Z,Go door to door; see how that goes.
2021-06-10T16:08:45Z,Making money so fast he can&#39;t retire. He will die with that suit on! At work! All that money will make some one happy.
2021-06-10T16:02:11Z,I am sorry I don&#39;t blive Fauci  😂
2021-06-10T17:48:42Z,About what?
2021-06-10T18:07:50Z,You do NOT need to apologize for that :)
2021-06-10T18:09:11Z,You do NOT need to apologize for that :)
2021-06-10T15:58:48Z,Harmless 500000 Americans dead Ivermectin could have cured this a year ago. Engineered with Fouci  tax payer currency. Hang em High
2021-06-10T15:53:34Z,Why would anyone listen to this murderer?
2021-06-10T15:50:48Z,He is a part of cover up with CCP. dont Believe him.
2021-06-10T17:34:08Z,MSNBCCP🇨🇳 accomplice to Fauci&#39;s crimes!
2021-06-10T15:44:51Z,"Done with this guy. Can someone hand him a tissue. Because if this fraud, WHO and the others is why we now question the fake silence that has been pushed upon us.. Fauci is a fraud..."
2021-06-10T15:44:21Z,How is he still allowed to walk around freely ?
2021-06-10T15:32:37Z,Wow this is so spot on the news reporting. Not
2021-06-10T15:31:34Z,Off w Fauci’s head!
2021-06-10T15:14:01Z,“Attempt to weaponize something that is kind of harmless and create controversy”<br><br>That statement reveals too much.
2021-06-10T15:08:13Z,Fauci is a liar.   Please fire him   <br>Fauci Betrayed American people <br>We are not guinypigs for your fauci experimental vaccine.  Mask nazi&#39;s
2021-06-10T15:00:52Z,Clown Network <br>Featuring a Clown
2021-06-10T14:49:51Z,When logic makes too much sense and goes above the heads of the unappreciative feeble who’ve been restricted for their own good and now looking for a scapegoat……….<br>.<br>.<br>.<br>You get a comment room full of ignorant haters.
2021-06-10T14:47:28Z,"Anthony Fauci is just the newest example of science fraud. Nobody needs to try to tie Fauci to anything, he did it all on his own."
2021-06-10T14:46:15Z,Fuaci is a hack
2021-06-10T14:38:38Z,&quot;I am Science incarnated&quot; -Fauci
2021-06-10T14:34:39Z,Fauci is compromised.  You need someone who is not.
2021-06-10T14:34:31Z,"Their only making it political so they can distract you I’m not democrat or republican , but I am truth-seeker. Wake up y’all ♥️✝️"
2021-06-10T14:19:38Z,"Fauci, the criminal, said &#39;&#39;Why would the Chinese want to make a virus that equally kills them?&#39; on June the 4th, 2021. The Chinese authority killed tens of thousands of its own citizens 32 years ago on the day."
2021-06-10T14:13:04Z,"Fauci said President Trump did EVERYTHING he asked him to. Now, I think that was a mistake by the President, personally. One of the few he made, but....how does that translate into President Trump mishandling the whole thing WITHOUT indicting Fauci&#39; own advice??? How can anyone trust ANYTHING these people tell us???"
2021-06-10T17:29:45Z,tRUMP is a con man... his followers are dupped... simple man...
2021-06-10T21:37:53Z,"@@JL-fx2cd uhhhhh...that would be &quot; duped&quot; there, JL....Here&#39;s yer sign...."
2021-06-12T01:10:10Z,@@Bear-kt1pl hey bare... how about duppped...
2021-06-12T01:21:07Z,"@@Bear-kt1pl its a shame u missed the point of MY comment... or maybe, just maybe... it nailed u between the eyes..."
2021-06-10T14:06:57Z,"This is not aconspiracy theory, it&#39;s what REALLY HAPPENED but main stream media fails to report the truth. Listen how he phrases his questions..."
2021-06-10T16:53:26Z,mostly peaceful emails
2021-06-10T22:52:07Z,@@jaylockwood5030 You are a fool!
2021-06-10T22:52:48Z,There&#39;s a evidence by the things he said back in 2017
2021-06-11T04:20:55Z,@@mariatheresafloresca4166 have you taken your anti-depressants today?
2021-06-11T14:01:45Z,@@jaylockwood5030 lol...yes mostly peaceful!! Best response to date!!!!
2021-06-10T13:55:09Z,"Hmm, lab leak vs wet market origin??? Let&#39;s do some critical thinking...<br><br>It has been 17 months and there is NO proof provided of the wet market theory. If there was proof of the virus origin in the wet market then common sense would be that China would provide that evidence to dispel the lab leak theory. China has not provided a single BAT or piece of evidence of the wet market virus origin. <br><br>Over 3.5 million deaths due to the virus and the world does not know the origin of the virus and China has closed the investigation with NO transparency. I do not trust China as US Health officials have and do not want the US Taxpayer money going to ANY lab in the WORLD where the US scientist do not have FULL access. <br><br>Please let me know if you think the US should be funding experiments in countries where we do not have FULL access. <br><br>Please let me know if you have bee provided data or evidence of the lab leak theory or the wet market theory as the origin of the virus. I would love to hear thoughts."
