PublishedAt,Comment
2020-03-10T12:28:32Z,"Incorrect. Reasoning: No he is wrong. He is also racist.<br><br>1. The Shocking truth is that We need to SALUTE THE NATION OF CHINA !!!!  Why? <br><br><br>The virus is from &quot;China&quot; but it is not a &quot;Chinese virus&quot;. Mother nature creates virus using evolution [which itself is blind].  It could have happened anywhere on earth. There is no &quot;blaming&quot; China - as far as America is concerned.<br><br>In fact we need to praise China for &quot;sharing all the information, inviting W.H.O and Americans&quot; as soon as they were able to do that - DESPITE officially being communist and a &quot;Closed nation when it comes to information&quot; . They did us a HUGE favor by being ahead of things and on top of their game.  They went against their own internal historic policy of secrecy for us, for Uncle Sam. We salute all of the Chinese government as Americans.<br><br>As Chinese citizens they can legit be mad at their government for initial secrecy. That&#39;s none of our business.<br><br>As for Tucker: he is directly racist against the Chinese. He is knowingly racist.<br><br>2.  Globalism is bad? Someone said that! I replied:<br><br>You are correct. But &quot;how so&quot; ? <br><br>Capitalism is embedded in a democracy. So the law must always apply against fraud or force. Further, the governments job is to make certain vital products to national interests must NEVER be from any &quot;one&quot; source or nation [e.g. China]. <br><br>How are you wrong? You assume that government can interfere in economic affairs. It can not and must not - because to do so is &quot;Anti capitalism&quot; meaning it is socialism (regardless of the name of the party as Republican or other).<br><br>Upon MY premises the U.S.A was formed, found and lived from 1776 to 1916 when there was interference by government into economics starting with taxation upon the very rich. Eventually with each generation, once there&#39;s a tear , they kept on tearing the sheet until you pay for this daily even reading THIS post - you pay tax on utilities (e.g. to charge your phone or charged).<br><br>In summary and to repeat: Globalism IS capitalism. But Globalism does NOT mean one has to RELY on emergency and vital items from any ONE source. In fact it is GLOBALISM that will enable us to have RESILIENCE by having MANY MORE sources - not just &quot;America&quot;, nor just &quot;China&quot; to <b>supply</b> and/or * make the products*** and make them far cheaper just like China does AND THEREFORE we the U.S.A benefit.  ALWAYS SUPPORT LIBERTY: this means capitalism. That means globalism."
2020-03-10T12:33:54Z,"Phil Hall No he is wrong. He is also racist.<br><br>1. The Shocking truth is that We need to SALUTE THE NATION OF CHINA !!!!  Why? <br><br><br>The virus is from &quot;China&quot; but it is not a &quot;Chinese virus&quot;. Mother nature creates virus using evolution [which itself is blind].  It could have happened anywhere on earth. There is no &quot;blaming&quot; China - as far as America is concerned.<br><br>In fact we need to praise China for &quot;sharing all the information, inviting W.H.O and Americans&quot; as soon as they were able to do that - DESPITE officially being communist and a &quot;Closed nation when it comes to information&quot; . They did us a HUGE favor by being ahead of things and on top of their game.  They went against their own internal historic policy of secrecy for us, for Uncle Sam. We salute all of the Chinese government as Americans.<br><br>As Chinese citizens they can legit be mad at their government for initial secrecy. That&#39;s none of our business.<br><br>As for Tucker: he is directly racist against the Chinese. He is knowingly racist.<br><br>2.  Globalism is bad? Someone said that! I replied:<br><br>You are correct. But &quot;how so&quot; ? <br><br>Capitalism is embedded in a democracy. So the law must always apply against fraud or force. Further, the governments job is to make certain vital products to national interests must NEVER be from any &quot;one&quot; source or nation [e.g. China]. <br><br>How are you wrong? You assume that government can interfere in economic affairs. It can not and must not - because to do so is &quot;Anti capitalism&quot; meaning it is socialism (regardless of the name of the party as Republican or other).<br><br>Upon MY premises the U.S.A was formed, found and lived from 1776 to 1916 when there was interference by government into economics starting with taxation upon the very rich. Eventually with each generation, once there&#39;s a tear , they kept on tearing the sheet until you pay for this daily even reading THIS post - you pay tax on utilities (e.g. to charge your phone or charged).<br><br>In summary and to repeat: Globalism IS capitalism. But Globalism does NOT mean one has to RELY on emergency and vital items from any ONE source. In fact it is GLOBALISM that will enable us to have RESILIENCE by having MANY MORE sources - not just &quot;America&quot;, nor just &quot;China&quot; to <b>supply</b> and/or * make the products*** and make them far cheaper just like China does AND THEREFORE we the U.S.A benefit.  ALWAYS SUPPORT LIBERTY: this means capitalism. That means globalism."
2020-03-10T02:25:50Z,I am happy that Tucker placed &quot;chinese&quot; and &quot;coronavirus&quot; on the same sentence without caring to &quot;hurt the feelings of the chinese people&quot;
2020-03-10T04:07:10Z,Why
2020-03-10T04:20:27Z,@@jamesmelon9676 <br>Why what?
2020-03-10T04:23:06Z,cnordegren we live in a country where we&#39;re only allowed to blame white people for everything whether guilty or not
2020-03-10T04:25:30Z,Agreed. COVID-19 was created specifically to deflect blame from China. Call it what it is: Chinese Coronavirus. Never let them forget.
2020-03-10T04:37:57Z,I am half chinese.   know that they are bad.
2020-03-10T02:25:25Z,Heard when they test they test for sars2 so uh yea it’s outta china just don’t know why it got renamed it’s sars juts faster spreads an not at deadly..
2020-03-10T02:25:20Z,"This is scary and true, what was the government thinking mass producing everything of importance to China, they signed, sealed and delivered the U.S. to them on a silver platter."
2020-03-10T08:51:05Z,What was that saying about having &quot;all your eggs in one basket&quot; ...especially medicine?
2020-03-10T09:09:02Z,You want things on the cheap?<br>That&#39;s what happened.
2020-03-10T09:24:03Z,Don&#39;t blame this on the government. Blame it on the people that voted for the Clintons.
2020-03-10T09:44:54Z,"This is what we get for letting market forces determine strategic needs. It isn&#39;t just a matter of pharmaceuticals. It&#39;s also about electronics, rare earth elements, steel, automobiles, etc. Furthermore, what&#39;s going to happen when Saudi Arabia dumps vast quantities of oil on the world market? Answer: It will drive our domestic producers out of business and we&#39;ll be just as dependent on them as we were in the 1970s. <br>I&#39;m not in favor of total protectionism, but the difference between medicine and poison is the amount. If we continue to outsource all of our strategic needs, we will be in this situation, time and time again.  Will we ever learn our lesson?"
2020-03-10T10:36:36Z,They were lining their pockets and those of their donors
2020-03-10T02:24:40Z,"Packing people into small urban cubicles may be good economics, but also very good for spreading disease."
2020-03-10T02:24:36Z,"This happened to Italy in basically 13 days... On Ash Wednesday the pope was sick with a supposed cold, kissing and touching hundreds of people. Next thing the Iranian Amassador to the Vatican dies of the coronavirus, then two weeks later the whole country is on lockdown"
2020-03-10T02:24:26Z,"Is it really necessary to call this the Chinese Corona virus??? This is just another attempt to be divisive. People need to stop having an us vs them mentality! Yes, this virus originated in China, but now it’s global. Also, it is not a hoax or smear campaign put on by the dems to make Trump look bad. This is a real virus that is affecting people of all walks of life and political affiliation. What we need to do is be a united front and take precautions to stop the spread of this virus until a vaccine is in place within the next year to year and a half. Also, I’m not trolling I too vote for some republicans, I’m just someone who is tired of the divisive rhetoric that is continuously pushed. Again, there is no need to label COVID 19 as Chinese Corona Virus unless Fox is trying to play to xenophobics that watch🤷🏾‍♀️Fox you need to do better!"
2020-03-10T03:14:37Z,"Lloyd Braun can you read? I’m not trying to be funny nor am I trying to be rude, but I stated that in my comment. I’m well aware where the virus originated from. The official name for this virus is COVID 19 not Chinese Corona Virus! Fox is purposefully using that terminology to create division and make racist people who tune in have something against Chinese people. This is my personal opinion and I think Fox needs to do better and call the virus by its official name and not use the verbiage it’s using! This virus doesn’t care what nationality a person is, what race a person is, or even what political party you associate yourself with! Anyone can get COVID 19 bottom line!"
2020-03-10T02:24:24Z,We can all thank the globalists and corporate types who put profits ahead of a secure country.
2020-03-10T09:05:54Z,"I told friends and family almost 20 yrs ago that our own govt, and people sold us out to China. This is how our govt, and corporate america made their money den. Its also what happens when people put money before god, humanity is sick with power, and greed. We ve truly lost our way, we all need to change in order for us to survive. May god help us all, and pity us"
2020-03-10T09:48:52Z,CaptainsDen they have to pay their employees🤷‍♂️
2020-03-10T10:18:30Z,"Derek Buckler <br><br>Wasn’t it your conservative godly party with support from greedy corporations in the name of “freedom” that outsource to China. Maybe if you vote for Bernie, you’d know he would keep the manufacturing in the US."
2020-03-10T11:30:28Z,"This is incorrect. Globalism IS capitalism. But Globalism does NOT mean one has to RELY on emergency and vital items from any ONE source. In fact it is GLOBALISM that will enable us to have RESILIENCE by having MANY MORE sources - not just &quot;America&quot;, nor just &quot;China&quot; to <b>*supply*</b> and/or * make the products*** and make them far cheaper just like China does AND THEREFORE we the U.S.A benefit.  ALWAYS SUPPORT LIBERTY: this means capitalism. That means globalism."
2020-03-10T13:46:43Z,Z yeah sure because communism has such a great track record. Read a history book sometime.
2020-03-10T02:24:22Z,Seems to double faster than every six days. It’s 2 maybe 3 days doubling.
2020-03-10T02:24:22Z,Socialist public health care New Zealand has 7 cases and no new cases in 3 days.
2020-03-10T06:06:46Z,All nations appear to be substantially reducing their counts of Covid19 by the criteria they are using to determine who has the virus. Many people are not counted as having the virus and are not tested unless they have traveled to the nation&#39;s that have an ongoing epidemic or are one of the close contacts or family of a person who has been diagnosed with Covid19.
2020-03-10T07:11:23Z,"Dirty Harry No, socialism is good."
2020-03-10T02:24:17Z,Thats why I’ve always said F China.
2020-03-10T02:24:15Z,"By far the best MSM coverage on this from either the right or left. Well done, Tucker."
2020-03-10T02:24:13Z,"United States should start producing our own drugs and medical supplies. I believe that we have here in the United States a smart and good chemist people, that&#39;s why people from different parts of the world come to ourcountry to studied. We should start producing our own drugs so that we are preferred from viruses."
2020-03-10T02:24:03Z,Thats good let china do that we need to feel enough pain so we CHANGE our ways
2020-03-10T02:23:57Z,Very interesting as I am watching  Biden&#39;s  rally ....is the left immune?
2020-03-10T05:23:51Z,"Soon political rallies will be staged without audiences, livestreamed only, with cellphones in the seats cheering for the candidates remotely."
2020-03-10T06:29:51Z,@@rpbajb LOL... but it doesn&#39;t answer the question. Hugging?
2020-03-10T09:49:37Z,@@irenegold3969 Good point. Poor Uncle Joe; withdrawal cold turkey is gonna&#39; be hell.
2020-03-10T02:23:49Z,Less children being molested by priests in Italy at the moment that&#39;s a plus
2020-03-10T02:23:42Z,Ugh! I have asthma. I’m scared.
2020-03-10T03:02:58Z,Yeah... I&#39;m not feeling so good after this segment myself... Hopefully he is trying to be extra cautious.
2020-03-10T02:23:26Z,"Curiously enough, Dean Koontz called this, a bit too specific and close for comfort, in his book, &quot;The Eyes of Darkness&quot; , first published in 1981 and again in 2008.   Life imitating art, as it were.   Spooky."
2020-03-10T02:23:18Z,"Tucker! You&#39;re wrong, you don&#39;t yell fire in a crowded theater even if there is a fire. Fear will ruin the American economy, just close borders and keep people quarantined"
2020-03-10T02:23:18Z,China can price gouge to get back at Trump. They can use the pandemic to sway voters and set themselves up better than before.
2020-03-10T02:23:05Z,I wish my prime minister could hear this
2020-03-10T02:22:24Z,&quot; Made in China&quot;  🚢
2020-03-10T02:22:22Z,"Tucker Carlson is the best and trusted TV Journalist  of our time. True facts  are hard to digest these days , specially when country n it’s ppl are is fooled by these fake media’s."
2020-03-10T02:22:19Z,The US is probably next to be locked down. Smh
2020-03-10T02:22:09Z,"Wow, very rarely do I disagree with tucker but I definitely do here. This virus is nothing to panic over. While it&#39;s nothing good, its definitely NOT a pandemic."
2020-03-10T02:21:59Z,We need to Waterboard Bill Gates for the truth
2020-03-10T02:21:38Z,"Bring factories back and jobs , to our people and our country. America first . 😘🇺🇸"
2020-03-10T02:21:37Z,"I am sorry Tucker. China is hostile bc America has been hostile for a long time. Go back to all that the US has done to thwart China&#39;s progress &amp; growth. America is, and has been hostile to any nations that are not maleable to its whims. Cuba, Venezuela, Bolivia, and other Latin American countries have tasted that vicious and bloody hostility. Iraq, Libya, Syria, Iran, Afghanistan, Yemen, Vietnam, Cambodia, Laos, N &amp; S Koreas, Russia, the list goes on, have bloody history w/America. So Tucker, it is disingenuous to label others as threatening, backward, or hostile to America, who has been the antagonist for far too long. You are not helping America come to terms w/its own egregious behaviour in the world. To be great is to be able to acknowledge its mistakes &amp; sins, reform &amp; transform - that is the only way forward in the 21st century. Win-lose must not be the motto for any country any more. We see the upheaval &amp; major seismic changes in the fault line of the int&#39;l platform of diplomacy, trade, foreign relationships &amp; cooperation. America is  left increasingly w/very little to stand on as it is. So wise up. Trump wants friendly relationships &amp; trade to take America forward. What is not to like about this very sensible goal?"
2020-03-10T02:21:15Z,Lebron James will say that Americans are to blame while trying to make a sale on tennis shoes!
2020-03-10T02:20:59Z,"Tucker Carlson is one side of the American Gollum. Smart, selfish, mean,  aggressive, offensive, and hypocritical.  Sometimes very jealous."
2020-03-10T02:20:38Z,"someone better reminder China, when push comes to shove, WE&#39;LL JUST TAKE WHAT WE WANT"
2020-03-10T12:52:38Z,"Haha...even though china has all of our technology and then some, stolen from us or otherwise, and a billion or so more people?...haha..I&#39;m sure theyd welcome us to come try and take it"
2020-03-10T12:59:58Z,"But I will say, if they invaded us and tried to take our stuff theyd probably lose...only because we have an armed citizenry...for now at least"
2020-03-10T02:20:31Z,"Be protective of chronically ill people.   They are the ones who might lose their lives, just like with flu.."
2020-03-10T02:20:09Z,Evening brother hope you and your family are nicely settled in
2020-03-10T02:20:09Z,Why have a government at all if this is how they respond to this. We are only as safe as the least insured among us. Medicare for all. Let’s get one thing from the government besides war and subsides for corporations. Either that or bank runs and tax revolt. What am I paying taxes for?
2020-03-10T02:19:34Z,Can&#39;t believe Tucker lately. He sounds like the rest of the msm! This is all ds hype to bring down the economy and make our president look bad before the election. This virus is no deadlier than the regular flu
2020-03-11T08:13:48Z,Wow. Certainly can&#39;t help a cultist like you. At least wash your hands and cover your coughs. Spare the high risk people of your ignorance.
2020-03-10T02:19:32Z,The Wuflu.
2020-03-10T02:19:13Z,Recession? TRUMPS BLOOD PRESSURE IS ABOUT TO GO UP
2020-03-10T02:18:26Z,"And yet AGAIN...<br>Trump was CORRECT <br>that America is too dependent on Foreign Nations, &amp; our <br>NATIONAL SECURITY <br>depends on bringing manufacturing HOME❗️<br>Give him credit ,<br>he sees the future‼️"
2020-03-10T02:18:12Z,I believe this will change the world. China has seen it&#39;s best days.
2020-03-10T02:17:54Z,"You go to Walmart online or Amazon and the prices for disinfectants, masks, gloves, alcohol etc has doubled or tripled."
2020-03-10T02:20:00Z,*Trippled
2020-03-10T02:17:52Z,We will make the vaccine and sell it to China bahhhh hahaha
2020-03-10T02:17:47Z,It was China’s plan all along trump backed them in a corner no president in history has they let them  steal our property and so on they was just forced into the phase 1 deal soon to be phase 2 and now was the time to strike
2020-03-10T02:17:21Z,Completely agree. Upset at both sides. This isn’t political. We can’t get mad about the left making it political... and then make it political. It isn’t the end of the world but it needs to be slowed down.
2020-03-10T02:17:17Z,Ground the planes until its gone
2020-03-10T02:16:52Z,🤣
2020-03-10T02:16:46Z,"The 3.5% mortality rate may not be wholly accurate, as persons who contract the virus and recover may never even know that it was the coronavirus they were suffering from. Additionally, is Tucker intimating that everyone who has contracted the virus has been tested for it? I doubt that is true. Right now, the outbreak is still occurring. What some people are saying in regards to the coronavirus is like saying a tornado is killing 25 people per mile while the tornado is still tearing through a populated area - before it reaches an open field and travels for miles without encountering anyone. Be cautious and don&#39;t allow numbers that are not being used judiciously to put you in a panic."
2020-03-10T02:16:29Z,"It&#39;s highly convenient that after President Trump completely demolished the Chinese economy by bringing America back to greatness, suddenly out of nowhere a new strain of the virus popped up and now as the world is on the verge of an economic crisis, China, who is a massive exporter of essential products, is threatening to halt medical supplies to the US. The US and all western nations need to become more self-sufficient and less dependent on other nations. Bringing steel and oil production back to the US was a massive first step made by Trump but more needs to be done!"
2020-03-10T02:16:10Z,It&#39;s CCP virus!
2020-03-10T02:15:52Z,Now tucker is a fear monger
2020-03-10T02:21:45Z,"I&#39;m finding this to be more and more the case.  I listen to him now because he&#39;s informative.  I take the good and sift through the nonsense, though I&#39;d really prefer not to have to do that."
2020-03-10T02:15:50Z,"Now, wait.  Harris Faulkner had an hour long segment today with Dr. Oz stating if you&#39;re healthy, under 60...go out and live life..travel, do the normal things but always wash your hands.  If you get COVID-19, chances are, you won&#39;t even know it bc symptoms will be little to none.  It&#39;s the over 60 who need to take precautions.  This evening, we have Tucker Carlson saying life is changing as we know it and even tho remain calm don&#39;t be complacent b/c this is a big deal.  We have so many mixed messages the public doesn&#39;t know what to do."
2020-03-10T02:15:46Z,"Madical supplies come from India,Israel and Ireland too,but the problem is the primary ingredients they get itfrom China too."
2020-03-10T02:15:44Z,Wow Tucker I could have sworn you were still working at CNN!! How much fear do you want to spread?
2020-03-10T02:15:37Z,"What Tucker Carlson is saying here is dangerous. He&#39;s claiming that the fatality rate is higher than it probably is because there are people infected who might not even know they&#39;re affected and will get well. The family of the lawyer in Rochester who is one of the first cases in New York been tested positive yet the children and the wife have a minor cough and a fever, while their father is in critical care and probably will survive. There is no actual indication that the fatality rate is 3.4% that as it may right now cannot be calculated. Tucker would do well to have dr. Drew on his show and actual doctor Who is stating the right things. This is not worse than the flu , it&#39;s not worse than SARS, it&#39;s not worse than MERS , and it&#39;s certainly not worse than Ebola,  none of those diseases from 2009 on were met with such Hysteria then this virus"
2020-03-10T02:15:25Z,Dogs &amp; cats living together...
2020-03-10T02:15:11Z,Send those deaths rate numbers to TRUMP please
2020-03-10T02:14:53Z,Dont blame China for your own incompetenc.
2020-03-10T02:14:34Z,No good news to report tonight <br>Trump failed the American people. <br>And the soldiers that fought and died for this country.
2020-03-10T02:14:16Z,That’s TRUMP position
2020-03-10T02:14:16Z,"Wow Tucker, I appreciate you for this segment. Not sure how much you said are fact but I’ll give you a much higher percentage than other Fox News shows. Those morons on “The Five” have feed false facts and poor opinions. Please stay on track and give our people solid journalism and facts the best you know them. Thank you from a non fan of Fox. I watch to see what both sides are saying FOX/CNN and you’re telling the information closely to medical experts.  Thank You."
2020-03-10T02:13:59Z,If China throws Sanctions at us then We will be In a Great Depression far greater then the Great Depression of 1929-1930&#39;s. Since were so dependent on them
2020-03-10T02:13:39Z,The biggest problem BY FAR is that the healthcare system is not going to be able to handle it. The hospitals will be overwhelmed and eventually (soon) ppl suffering from severe Covid19 will not be able to get proper medical treatment and neither will ppl who are suffering from other non-Covid 19 life-threatening events.
2020-03-10T02:13:24Z,Finally Tucker is making sense!!!
2020-03-10T02:13:24Z,45000 vs 24.... im rushing out to buy hand sanitizer...lol
2020-03-10T02:13:16Z,"I lived through SARS in 2003, the current coronovirus is a much less lethal virus. In Singapore, we have been through 6 weeks of coronovirus, but businesses have already started to recover... As long as the government takes enough preventive measures, and there isn&#39;t exponential growth in infections, consumers will come out again. We have been through what the US has been going through, the first 3 weeks of the coronovirus everyone acted as if the world is coming to an end, stock markets crashed, but now, shopping centers are full again, the proportion of people wearing masks have decreased from 50% to 10%...It is still very important to take hygiene way more seriously and be wary about getting infected but as long as all the measures are taken, sure enough we are still getting like a handful of new cases a day, but it isn&#39;t exponential growth... People are not falling ill and dying left right center. I&#39;m pretty sure the market will stop their panic. When temperatures rise a bit more, i&#39;m pretty sure the virus will naturally slow down. If you look at the numbers coming out from countries near the equator, the spread of the virus is kinda constant or linear growth, exponential growth was only seen in temperate countries like Korea and China. Likewise in 2003 SARS was really bad because it happened in winter, come half year later in summer, it was gone."
2020-03-10T02:13:08Z,Only reason the governments are not criticizing the Chinese is because of money and being deny access to their marketa
2020-03-10T02:13:07Z,One thing that will come out of this is maybe I&#39;ll be able to buy  a  can opener made in the USA not some thing that breaks after two uses...
2020-03-10T02:12:37Z,Zinc in the cells is really important to help protect. There have been recent studies showing this. It takes a while for zinc to build up inside the cells.
2020-03-10T03:33:25Z,What zinc supplement do you recommend?
2020-03-10T02:12:27Z,"Every year 45,000 die from the common flu in the usa, where is that panic...."
2020-03-10T02:29:58Z,"this is a new virus, higher mortality rate"
2020-03-10T10:41:48Z,@@davids.2703 only 3800 have dead from this so far. For the love of God stop saying it&#39;s higher.
2020-03-10T13:55:14Z,"@@evacody1249 it&#39;s only going to go higher, especially if Trump keeps downplaying the risk and saying people are okay to go to work sick"
