PublishedAt,Comment
2020-03-10T10:31:03Z,Also to have blackmail over us when they make their move on Taiwan.
2020-03-10T07:40:33Z,"Christ is king, in him I trust, and at his feet I lay down my worries."
2020-03-10T09:59:10Z,Americandog83 good luck bro. X
2020-03-10T07:38:51Z,Coronavirus is Chinese bio warfare.
2020-03-10T11:07:10Z,Yeah but it was only a spread test with a weaker strain. They have the real deadly version ready to go in case of war.
2020-03-10T07:37:17Z,They are using simple colloidal silver vaporizer mists in Chinese hospitals. US pharma and docs will ignore that fact and go for a vaccine etc. No &quot;scare&quot; profit in something people can make easily at home.
2020-03-10T07:36:03Z,Everything bad is Obama&#39;s fault! The Chosen One is perfect and always tells the truth.
2020-03-10T07:35:41Z,Fox is so racist
2020-03-10T07:35:29Z,"Most straightforward message I’ve heard in weeks, and it speaks the true!! There only one point it is false accused which is &quot;Chinese people don&#39;t hate American!! But the Chinese Communist Party hated all Democratic countries!!! Cuz Communist country are dictatorships country, there is no true freedom in any form of Communist country, I am Chinese and I know so well!&quot;&quot;"
2020-03-10T12:30:39Z,"Not straight forward. Reasoning: No he is wrong. He is also racist.<br><br>1. The Shocking truth is that We need to SALUTE THE NATION OF CHINA !!!!  Why? <br><br><br>The virus is from &quot;China&quot; but it is not a &quot;Chinese virus&quot;. Mother nature creates virus using evolution [which itself is blind].  It could have happened anywhere on earth. There is no &quot;blaming&quot; China - as far as America is concerned.<br><br>In fact we need to praise China for &quot;sharing all the information, inviting W.H.O and Americans&quot; as soon as they were able to do that - DESPITE officially being communist and a &quot;Closed nation when it comes to information&quot; . They did us a HUGE favor by being ahead of things and on top of their game.  They went against their own internal historic policy of secrecy for us, for Uncle Sam. We salute all of the Chinese government as Americans.<br><br>As Chinese citizens they can legit be mad at their government for initial secrecy. That&#39;s none of our business.<br><br>As for Tucker: he is directly racist against the Chinese. He is knowingly racist.<br><br>2.  Globalism is bad? Someone said that! I replied:<br><br>You are correct. But &quot;how so&quot; ? <br><br>Capitalism is embedded in a democracy. So the law must always apply against fraud or force. Further, the governments job is to make certain vital products to national interests must NEVER be from any &quot;one&quot; source or nation [e.g. China]. <br><br>How are you wrong? You assume that government can interfere in economic affairs. It can not and must not - because to do so is &quot;Anti capitalism&quot; meaning it is socialism (regardless of the name of the party as Republican or other).<br><br>Upon MY premises the U.S.A was formed, found and lived from 1776 to 1916 when there was interference by government into economics starting with taxation upon the very rich. Eventually with each generation, once there&#39;s a tear , they kept on tearing the sheet until you pay for this daily even reading THIS post - you pay tax on utilities (e.g. to charge your phone or charged).<br><br>In summary and to repeat: Globalism IS capitalism. But Globalism does NOT mean one has to RELY on emergency and vital items from any ONE source. In fact it is GLOBALISM that will enable us to have RESILIENCE by having MANY MORE sources - not just &quot;America&quot;, nor just &quot;China&quot; to <b>supply</b> and/or * make the products*** and make them far cheaper just like China does AND THEREFORE we the U.S.A benefit.  ALWAYS SUPPORT LIBERTY: this means capitalism. That means globalism."
2020-03-10T07:29:49Z,Here in Australia our corrupt government is still selling everything they can to China
2020-03-10T07:27:47Z,Tucker 2020
2020-03-10T07:25:16Z,Tucker is one of the few voices not trying to spin this serious crisis as a bad flu.
2020-03-12T15:05:56Z,Steve Bannon has been sounding the alarm for months on Coronavirus.
2020-03-12T15:22:51Z,"@@Jake-Day, true! In contrast Limbaugh, last I heard a few weeks ago, was arguing that it&#39;s just a bad flu hyped by the media to hurt Trump. Just wow! Gotta take those political-colored glasses off now and then Rush. I hope he doesn&#39;t end up getting some of his fans killed. One of my friends is a fan of his and she reduced her concern about Covid19 after he started gaslighting about it."
2020-03-10T07:25:01Z,"This is a man made virus, like HIV!!!!!"
2020-03-10T07:22:37Z,"Is the coronavirus a form of biological warfare similar to that used by white settlers to weaken and exterminate Native American? China claims it is not a weapon but a natural occurrence, for which they were prepared and willing to lose a number of their own people given there billion plus population. Clever and sinister."
2020-03-10T07:20:23Z,"Jesus tucker, you sound like a leftist."
2020-03-10T07:16:21Z,Use raw garlic it works
2020-03-10T07:15:06Z,U whent together with the Devil for dollars Who is in now the Devil 🤒🤒😠😠😈😈
2020-03-10T07:14:48Z,&quot;From a meat market in Wuhan&quot;  Hey if you say so bro.
2020-03-10T07:14:40Z,"<a href=""https://www.youtube.com/watch?v=EbyPW8lJX2E&amp;t=2m33s"">2:33</a> “Italy is a modern developed western country- like our country” yeah ok maybe similar in that we both have incompetent corrupt governments and trillions of looming debt."
2020-03-10T07:13:23Z,"Finally, a good monolog from Tucker."
2020-03-10T07:12:12Z,Boycott
2020-03-10T07:08:26Z,It is like the flu..just a dif strain! I had a good friend who died from the flu 3 yrs ago 64 yrs old. It wasn&#39;t the Corona virus but it still killed him
2020-03-10T16:01:08Z,It is a completely different agent.
2020-03-10T16:43:25Z,It is not like the flu at all. It is much much worse.
2020-03-10T17:23:12Z,The flu is caused by the flu virus. The Coronavirus is a different virus altogether. Why insist on repeating this?
2020-03-10T07:08:20Z,now its getting real? Is this real ? is it deep state ? Hillary reptilian take over ? Is Fox to be trusted? I bow to my Savior <br><br><br><br><br><br><br><br><br>TRUMP  I WORSHIP THEE YOU ARE TRULY GOD INCARNATE
2020-03-10T07:07:18Z,Dollar dollar 😎😎
2020-03-10T07:07:16Z,"Well, it&#39;s about time somebody at Fox started telling the blind followers of this president the truth about what is really going on in the real World as he refers to as FAKE NEWS. Instead of the lies to cover up for this inadequate and incompetent president who wants to paint a rosy picture like everything is fine and there&#39;s nothing to worry about. He changes the narrative and lies to the American people every time he has a press conference or tweet. It has been a long time coming but the blind eyes are finally beginning to open now. This virus doesn&#39;t care about politics, party affiliation; whether you&#39;re rich, poor, in between and etc... We need a leader who is open and honest and knows how to LEAD and protect us. Who is concern about people&#39;s lives, not concern about numbers and how this is going to affect his chances of reelection. He was playing the fiddle or tweeting a bunch of nonsense while Rome was burning. He should have started preparing for this virus outbreak way back in late December and early January when this first started. No, he wants to play around on twitter instead of being on the JOB. Now Rome is burning! And this is affecting everybody, republicans, democrats, and independents like myself. Thanks for being asleep at the wheel trump and causing the situation to be far worse and greater than it needed to be had you prepared in advance. And I hope he gets out of the way and let the experts handle things. As it is too little and too late for him to play catch up...way behind the 8 ball here..."
2020-03-10T07:07:07Z,"The windfall is causing corona; the metoos, the chilling, the ignorance, the complacency, the scuffing, the defaming, the blaspheming and so on. Well, precursor to preventing corona is doing what my video orders. If anyone sees my comments. G-d forbid anyone sees my comments. laughter, laughter, laughter not loudly."
2020-03-10T07:05:26Z,China owes everyone reparations
2020-03-10T07:04:33Z,Slowly turning his coat.
2020-03-10T07:04:27Z,"Not a huge fan of FOX, CNN makes me cringe but Tucker, I like."
2020-03-10T07:03:48Z,"It&#39;s not scary. But the intensity of the second coming of corona is the worst. I doubt that this corona will stop before I get married. Guess what? I picked up the entire thing and I said, &#39;easy.&#39; but I will not do it. aint nothing of my business. Help! at that moment, corona. watch my videos and follow the steps. Corona is gone. It&#39;s good to check right?"
2020-03-10T07:02:22Z,"Tucker nails it again! The Clinton’s sold you to China and now you are waking up to what that means, you are so lucky Trump won, he knows this and is again exposing the lefts agenda and sick evil and disgusting went on so long!"
2020-03-10T07:02:15Z,"Had a long comment,but really words are useless without actions."
2020-03-10T07:02:05Z,"Finally something I agree with tucker . China’s definitely if  not THE , than one of the most Racist country in the Modern world , I don’t know why people always try to sugarcoat that fact ."
2020-03-10T07:01:44Z,"To be honest, I don&#39;t think Chinese hate Americans, but the competition is real. And sometimes competition can be deadly."
2020-03-10T11:46:38Z,The CCP hates us. This type of competition leads to war... I’m afraid that war has already started.
2020-03-10T07:01:11Z,The voice of reason
2020-03-10T06:59:09Z,"work from home, do you think everyone works at a desk?"
2020-03-10T06:58:32Z,Where is the actual origins of the virus? It is another BS staged event...once again by the Oligarchs/Establishment.
2020-03-10T06:58:13Z,"Thank you, Tucker for telling the absolute truth about this virus. Too many people are asleep and need to wake up! America will be the next China in a couple of weeks."
2020-03-10T06:58:13Z,"Bring all the industries BACK HOME. Then you don&#39;t have to worry about some foreign power destroying health by trojan horse, AND there will be employment for everybody. Also stop the rise of A.I technology where robots and automated systems are causing unemployment left right and center."
2020-03-10T06:57:49Z,I believe your reports and have no reason not to. There are so many reports on CV19. So much contradiction in the reports. How did you come to the conclusion that your information is correct. I must say the reasoning you used surely make sense.
2020-03-10T06:56:47Z,We now see China unmasked.
2020-03-10T06:56:24Z,That is already here. Medications if u can do 3 to 6 months pick up all at once if u can. Better to be prepared then s.o.l.
2020-03-10T06:56:19Z,tucker the hood loves you
2020-03-10T06:55:33Z,Globalism doesn’t work.
2020-03-10T06:55:05Z,When Tucker starts getting serious you can bet others will follow
2020-03-10T12:30:49Z,"But he is not serious. No he is wrong. He is also racist.<br><br>1. The Shocking truth is that We need to SALUTE THE NATION OF CHINA !!!!  Why? <br><br><br>The virus is from &quot;China&quot; but it is not a &quot;Chinese virus&quot;. Mother nature creates virus using evolution [which itself is blind].  It could have happened anywhere on earth. There is no &quot;blaming&quot; China - as far as America is concerned.<br><br>In fact we need to praise China for &quot;sharing all the information, inviting W.H.O and Americans&quot; as soon as they were able to do that - DESPITE officially being communist and a &quot;Closed nation when it comes to information&quot; . They did us a HUGE favor by being ahead of things and on top of their game.  They went against their own internal historic policy of secrecy for us, for Uncle Sam. We salute all of the Chinese government as Americans.<br><br>As Chinese citizens they can legit be mad at their government for initial secrecy. That&#39;s none of our business.<br><br>As for Tucker: he is directly racist against the Chinese. He is knowingly racist.<br><br>2.  Globalism is bad? Someone said that! I replied:<br><br>You are correct. But &quot;how so&quot; ? <br><br>Capitalism is embedded in a democracy. So the law must always apply against fraud or force. Further, the governments job is to make certain vital products to national interests must NEVER be from any &quot;one&quot; source or nation [e.g. China]. <br><br>How are you wrong? You assume that government can interfere in economic affairs. It can not and must not - because to do so is &quot;Anti capitalism&quot; meaning it is socialism (regardless of the name of the party as Republican or other).<br><br>Upon MY premises the U.S.A was formed, found and lived from 1776 to 1916 when there was interference by government into economics starting with taxation upon the very rich. Eventually with each generation, once there&#39;s a tear , they kept on tearing the sheet until you pay for this daily even reading THIS post - you pay tax on utilities (e.g. to charge your phone or charged).<br><br>In summary and to repeat: Globalism IS capitalism. But Globalism does NOT mean one has to RELY on emergency and vital items from any ONE source. In fact it is GLOBALISM that will enable us to have RESILIENCE by having MANY MORE sources - not just &quot;America&quot;, nor just &quot;China&quot; to <b>supply</b> and/or * make the products*** and make them far cheaper just like China does AND THEREFORE we the U.S.A benefit.  ALWAYS SUPPORT LIBERTY: this means capitalism. That means globalism."
2020-03-10T12:35:50Z,@@marytsmith6762 I appreciate you shedding gaslight on this subject.
2020-03-10T12:39:35Z,"​@@galkema most welcome. But please read this again to really grasp how I am correct as in fully correct. <br><br><br>1. ​ galkema  -&gt; We need to SALUTE THE NATION OF CHINA !!!!  Do you understand the reasoning ? <br><br>Remember this - The virus is from &quot;China&quot; but it is not a &quot;Chinese virus&quot;. Mother nature creates virus using evolution [which itself is blind].  It could have happened anywhere on earth. There is no &quot;blaming&quot; China - as far as America is concerned.<br><br>In fact we need to praise China for &quot;sharing all the information, inviting W.H.O and Americans&quot; as soon as they were able to do that - DESPITE officially being communist and a &quot;Closed nation when it comes to information&quot; . They did us a HUGE favor by being ahead of things and on top of their game.  They went against their own internal historic policy of secrecy for us, for Uncle Sam. We salute all of the Chinese government as Americans.<br><br>As Chinese citizens they can legit be mad at their government for initial secrecy. That&#39;s none of our business.<br><br>As for Tucker: he is directly racist against the Chinese. He is knowingly racist.<br><br>2.  Globalism is bad? Someone said that! I replied:<br><br>You are correct. But &quot;how so&quot; ? <br><br>Capitalism is embedded in a democracy. So the law must always apply against fraud or force. Further, the governments job is to make certain vital products to national interests must NEVER be from any &quot;one&quot; source or nation [e.g. China]. <br><br>How are you wrong? You assume that government can interfere in economic affairs. It can not and must not - because to do so is &quot;Anti capitalism&quot; meaning it is socialism (regardless of the name of the party as Republican or other).<br><br>Upon MY premises the U.S.A was formed, found and lived from 1776 to 1916 when there was interference by government into economics starting with taxation upon the very rich. Eventually with each generation, once there&#39;s a tear , they kept on tearing the sheet until you pay for this daily even reading THIS post - you pay tax on utilities (e.g. to charge your phone or charged).<br><br>In summary and to repeat: Globalism IS capitalism. But Globalism does NOT mean one has to RELY on emergency and vital items from any ONE source. In fact it is GLOBALISM that will enable us to have RESILIENCE by having MANY MORE sources - not just &quot;America&quot;, nor just &quot;China&quot; to <b>supply</b> and/or * make the products*** and make them far cheaper just like China does AND THEREFORE we the U.S.A benefit.  ALWAYS SUPPORT LIBERTY: this means capitalism. That means globalism."
2020-03-10T06:50:15Z,The 1NH1 was far deadlier and killed a lot more people. Covered up by the Obama’s media.
2020-03-10T06:46:56Z,Thats it Tucker is a fear monger. Its not that big of a deal. The rest of the world is gross and we are too nice.
2020-03-10T06:45:55Z,The Chinese need to be taught a lesson.
2020-03-10T10:31:24Z,Laser tag is a good start.
2020-03-12T06:32:09Z,"John Sanders Yeah, and sterilization of all males."
2020-03-10T06:40:59Z,"Sorry, but there is no sense in framing this as “Chinese”. Yes, it originated in China. Yes, most cases have been in China, but western countries fail to respond to this as well"
2020-03-10T06:42:33Z,NOT. TRUE. TRUMP WAS THE FIRST TO ACT BY STOPPING ALL FLIGHTS FROM CHINA IMMEDIATELY.
2020-03-10T06:40:26Z,Hoping Tucker Carlson will remain &#39;Heroically Honest&#39; during a Crisis of this magnitude..! Best of luck to all Americans..!
2020-03-10T09:55:45Z,"Good Reporting👍<br><br>Coronavirus is Epic News-of<br>Sounds Surreal, but is True  Reality 🌎<br><b>Stay Ready</b> and Take Care of  <br>Yourself and Your Family"
2020-03-10T13:25:31Z,"@rgsand01 I don&#39;t usually comment, but I&#39;m sorry - this is not true. I saw the headline about this and then went and listened to the whole Trump interview with Hannity. Trump said that there are probably a multitude of smaller cases of people who have the virus and experiencing mild cold symptoms that aren&#39;t reported and that we don&#39;t even know about - people who are going to work and living their lives, etc. He did not instruct people who knowingly have the virus to &quot;go to work&quot;."
2020-03-11T00:58:47Z,@rgsand01 enjoy burning in hell
2020-03-11T23:05:26Z,"@@rachaelsmith4981 The left are showing their true colors during this serious crisis, and falsely claiming round the clock that Trump said something he never said. They&#39;re pulling out all the stops in their rabid efforts to smear and defame him."
2020-03-12T01:28:32Z,@rgsand01 he didn&#39;t say that. He said there&#39;s people that go to work that have mild symptoms and don&#39;t even know it. Not go to work if you have symptoms.
2020-03-10T06:39:53Z,Best commentary of the decade.
2020-03-10T06:35:04Z,"THIS WILL COLLAPSE THE U.S MEDICAL SYSTEM!  We need lock down, NOW.  It happened in Wuhan, Iran, and Italy, doctors are absolutely overwhelmed and exposed to a high viral load which is killing them, this virus is going to infect too many people for hospitals to handle, that is the true danger.  We have no &quot;herd immunity&quot;, which is basically people that have built up immunity to the virus acting as &quot;blockers&quot; to the virus, which it then dies out so it can&#39;t spread further, but with this there is nothing blocking it, the entire U.S can become infected within this year and that is potentially the end of this country."
2020-03-10T06:34:11Z,Coronavirus popped up when impeachment was calming down
2020-03-10T12:43:12Z,Adam D this could be started and created for distraction but doesn’t take away that is not real issue.
2020-03-10T13:56:50Z,"its a chinese bioweapon, &quot;patient zero&quot; right near wu han biolab"
2020-03-10T17:56:00Z,It’s Pelosi that cooked it in her basement pot just to impeach Trump. Lmao dumbass
2020-03-11T13:14:48Z,It &quot;popped up&quot; months ago...
2020-03-11T15:52:32Z,"The virus popped up months before it was actually publicized, the CCP kept quiet about it to save face. So no it has nothing to do with the impeachment"
2020-03-10T06:32:44Z,Why am I listening to Tucker Carlson more and more often... not all of it but geez he seems to be a source of reason lately... RESPECT for his telling the truth as he sees it
2020-03-10T11:38:40Z,...I bet you’re far from admitting he is just echoing what the left is saying.
2020-03-10T16:59:16Z,He&#39;s a total reactionary and I <i>LOVE</i> it!  We need more reporters and great men like him!
2020-03-10T18:29:33Z,Because YouTube constantly puts him in your feed?
2020-03-10T18:40:13Z,Love how well thought out his arguments are.  He&#39;d be an amazing prez ;-)
2020-03-10T21:20:58Z,"@@tbz1551 that would be a lie, why would they admit a lie?"
2020-03-10T06:32:15Z,"The American worker should not have to compete with the desperate workers of China and Mexico. There needs to be an international minimum wage for American businesses, to counteract American business from going overseas. It’s sounds simple; because it is. This is something that can be done by executive order"
2020-03-10T06:37:39Z,Tucker Carlson voice: whattttta world
2020-03-10T06:31:28Z,So China started this epidemic know don’t want to help. It’s time for another Moab.
2020-03-10T06:27:20Z,How is tucker so real??
2020-03-10T06:26:47Z,All these things we should have been doing already.  Greedy and gluttony behavior is never a good thing.
2020-03-10T06:26:44Z,"Fox News + Bill Gates Biological Canadian Lab created the Virus and apparently  was sent to the CCP Biological Warfare level 4 lab and leaked out into China. When will Zinka Misquito creating B. Gates be prosecuted for his Eugenic crimes?"
2020-03-10T06:26:20Z,"The irony of all of the folks scoffing at this particular subject, just one month ago....OOPS."
2020-03-10T06:26:07Z,"It’s the WUHAN Virus, not the Fakely named Coronavirus"
2020-03-10T06:25:24Z,"SARS-CoV-2, Tucker, the virus is called SARS-CoV-2. The disease is called Covid-19. This is a global pandemic. It&#39;s to early to know a lot but it&#39;s not called the Chinese Corona virus."
2020-03-10T06:20:08Z,"I love how Tucker calls it the Chinese coronavirus, which is what it should be called. It started there because of uncivilized and unsanitary food practices so it’s fine with me."
2020-03-10T06:18:37Z,TUKER THE REAL QUESTION IS WHY RUSSIA IS IN A GOOD SHAPE WHILE IT HAS LONG BORDERS WITH CHINA? WE ARE IN ANOTHER SIDE OF THE WORLD!! THATS STRANGE!!!
2020-03-10T06:17:22Z,This is why Trump was right. He said we shouldn’t be relying on other countries we should be self sistine. I agree. Look we’re we are now.
2020-03-11T01:58:35Z,If only Trump were in a position to do something about America&#39;s foreign policy.
2020-03-10T06:11:17Z,"I said repeatedly over the past few decades, if China, a communist country,  ever got their lip down with the West and decided to close their borders, it would ignite a world wide recession.  Needless to say, most people thought I was crazy, but the fact is, that China is and always has been a sleeping giant.  Politicians, govts and big corp from the West have put China into a position of control and power because they wanted to make more money and used China and her cheap labor source to do so.   China for some countries, is their largest importer and for many countries, we are theirs.   In effect though, they have us by the short and curlies....they know it and we are being made to realise just how serious and in control they can be if they want to be.   The biggest mistake made decades ago (worldwide) was closing down local businesses and importing almost everything from a Communist country, which is... a sleeping giant."
2020-03-10T06:11:06Z,Was only a matter of time before the weaknesses of the Global system were exposed.
2020-03-10T06:10:59Z,Work from home? I build homes
2020-03-10T06:10:46Z,"How can I stay calm...my life, my family&#39;s life...everything is on the line!! We dont even have masks!! This stand still should have been in place at the beginning just for a month...poor managment"
2020-03-10T13:13:16Z,Special Person you tube - you can make your own masks at home.
2020-03-10T06:10:45Z,Fear mongering for $$$$cash cash$$$$ news is news ay tucker? MaGa KaGa also china can slurp my
2020-03-10T06:19:27Z,"It&#39;s going to collapse the medical system, 20% of patients need to be in the ICU and we do not have the resources, our doctors will be infected and slammed at an incredible rate like Italy&#39;s which is why they have locked down their entire country."
2020-03-10T06:10:44Z,"If Trump explains that when more testing is done, more mild cases of corona 19 will be discovered so total cases will go up, he will be called callus and unfeeling and the left will claim the increase is due to his inaction.  When he imposed a limited travel ban in january to end direct flights from china the left called him racist; now they say he didn&#39;t do enough.  When Trump accurately and correctly pointed out that healthy individuals had little to feat from corona he was called unfeeling toward the aged.  The left is dividing this country on every faultline.  The behavior of the left and Democrats is outright treasonous."
2020-03-10T06:09:42Z,"Tucker, I respect you for this so much and appreciate you telling it like it is. This is what I have been trying to do as well. The comparisons to the common flu are irresponsible and reckless. People need to have a heightened sense of awareness, change their behavior and prepare. This is happened in the past and it will happen again. This is not a drill."
2020-03-10T06:09:29Z,amen
2020-03-10T06:08:46Z,The Chinese is underestimating the resolve of the US. I think  they shouldn&#39;t  poke  the bear noises.
2020-03-10T06:06:47Z,It attacks old white Republicans.
