PublishedAt,Comment
2023-09-12T17:34:18Z,Pathetic fear mongering
2023-04-30T01:25:50Z,Prophetic
2023-03-16T01:08:48Z,Hey! First comment of 2023! Is it anniversary day for China Virus??
2022-09-12T13:13:04Z,It&#39;s kind of surreal to watch this now given how much Tucker would become a skeptic
2022-07-10T19:02:06Z,"I know I am 2 years late, but when did Tucker trust science?"
2022-03-10T16:44:12Z,This is still relevant after exactly 2 years.
2021-08-30T17:22:21Z,"If you’re reading this, never forget what happened on January 8, 2020 Al Asad airbase. Our troops were mercilessly attacked and neglected afterwards."
2021-07-17T03:45:40Z,"You were spot on when it comes to Coronavirus Tucker, keep up the great work."
2021-05-21T00:07:46Z,This was before conservatives knew Trump wanted them to stick their heads in the sand about COVID-19
2021-03-26T03:41:34Z,"Lora of good warnings here... that unfortunately became ALL TOO TRUE!. But saying the &quot;people that made us dependent on China for medical and other items&quot; should be held responsible.- means EVERY AMERICAN who shops at or encourages Walmart and ALL The others to keep prices down and buy from China!, i.e. ALL of our fellow Americans. It was NOT the &#39;Dems&#39; who allowed China business, but unabashed low-price sourcing that caused ALL our our dependence!  Tucker STOP Scapegoating  and name calling!  WE allowed EVERYONE to come in from everywhere without testing or isolation or even instructions... to mingle at will  China did not &quot;send&quot; the virus to us, anymore than the west wind across the Pacific is &#39;sent:  from China&#39; ! <br>Use your BRAIN ! !"
2020-10-07T01:48:24Z,"Tucker, you called it man. The powers at be hid the danger from us, and now over 200,000 are dead. Crazy."
2020-10-06T21:15:12Z,Thanks for falling into the Dems trap..... idiot
2020-10-04T00:06:24Z,"why is tucker say our leaders are the one minimizing  the effect of the virus . TRUMP is the one who was minimizing it, trump said it will miraculously disappear. IT WAS ALL TRUMP"
2020-10-03T11:07:17Z,"Well, 6 months down in October,  and Democrats are NOT rotting in hospital, whereas, the Orangeman and his cronies are festering in COVID juices! Maybe even GOD doesn’t like Republicans- f*cking dropping like flies- it’s called comeuppance! Love it!"
2020-09-26T00:20:58Z,THANK YOU TUCKER. You are &quot;THE PEOPLE&#39;S Reporter&quot;.  YOU TOLD THE TRUTH!
2020-08-06T02:10:31Z,"Watching this in August, it&#39;s clear Tucker was completely vindicated."
2020-08-03T19:20:11Z,"To Carlson’s credit, he was the first host on Fox who actually took COVID seriously and sounded the alarm. The rest of the talking heads naturally stuck with the party line until it turned up coughing at their doorstep."
2020-07-22T16:22:27Z,Was the pandemic THAT bad??
2020-06-22T04:44:04Z,The Chinese Coronavirus.
2020-06-22T04:43:23Z,500 cases.  This Douchebagg was denying it. Him and his Uncle Sean and Mark Levin and Rushbo.
2020-06-15T16:09:11Z,Just wait until the nation of these here United States of the Americas must has go on mandatory lock down. And March baseball madness say cancel of events??
2020-06-09T06:50:42Z,I bet his favorite food is Chinese food. Gtfoh
2020-06-02T04:09:54Z,lmao didn&#39;t fox news say early on that the corona virus was &quot;just a flu&quot; too??
2020-05-19T00:16:29Z,Did he just said that China is the most racist country in the world ?
2020-05-12T16:20:49Z,They&#39;re gonna play this video in history classes
2020-05-11T15:14:41Z,March Madness was cancelled?
2020-05-04T06:04:27Z,"Hey! I thought Trump was a good mate of President Xi. Referring to COVID-19 earlier this year, Trump said,  &quot;He (Xi) is working really, really hard.  They are very tough and very smart.&quot;  In the same video Trump then said, &quot;The relationship with China is a very good one.&quot;  The two mates had only just agreed on a new trade agreement.  There is no value in terminating a trade PARTNER when each RELIES on the other, but then Trump needed to blame someone for his abysmal response to the pandemic. China, WHO, a Democrat hoax, State Governors are on his hit list...I fear Fauci may be next.  God Bless America."
2020-04-23T14:07:10Z,The foresight of a gnat
2020-04-20T13:07:21Z,THE DOCTORS ARE STILL SAYING THE NUMBERS ARE WAYYYYYY   OFF. . THE NUMBERS SAY THIS VIRUS IS NOT EVEN AS BAD AS THE FLU.
2020-04-27T04:48:36Z,The numbers say this is way worse than flu.
2020-04-15T20:30:40Z,"Obviously it&#39;s not like the flu. You can be infected and spreading it without any symptoms for at least 4 days until symptoms finally show up. But, they didn&#39;t know that until recently."
2020-04-14T07:10:48Z,even a broken clock is right twice a day
2020-04-14T07:05:35Z,"i think every country is having a long hard look at its reliance on things made in china, the silver lining i suppose"
2020-04-10T08:23:09Z,"The only solution is extreme social distancing. If this is not implemented this will get far worse and millions and even billions will die.<br>All this business about the economy, they are crashing it on purpose.  If people are logical the economy won’t collapse, and we’ll have a chance against the virus."
2020-04-07T04:42:30Z,"<a href=""https://www.youtube.com/watch?v=EbyPW8lJX2E&amp;t=6m48s"">6:48</a> who made us so dependent on a hostile foreign power like china anyway? i wish he’d tell us"
2020-04-06T05:03:21Z,"Is he...saying that...trump didn&#39;t do anything for the US? Oh no...he did...he said this was a Hoax, nothing to worry...is so beautiful to have such an optimistic president."
2020-04-05T09:24:36Z,@ Bill Gates &amp; World Economic Forum ran @ Outbreak Simulation just 6 Weeks Before The Real Outbreak in China..... Hmmm...  What a coincidence?!
2020-04-05T09:24:26Z,I’m as left as it gets but I can respect real journalism.
2020-04-04T19:24:03Z,You just contradicted your self here April 4th about why we shouldn’t shut the country. Foolishish man
2020-04-04T02:47:24Z,Nobody listened to Tucker =(
2020-03-31T06:46:01Z,"Never miss your program, never👌👌👌👌👌"
2020-03-29T08:41:35Z,WE ARE ALL GOING TO DIE.  WE ARE ALL GOING TO DIE.  SO WHAT.
2020-03-29T00:43:11Z,DOUBLE FACE
2020-03-28T04:31:27Z,"I feel like this is a hundred years ago when he says that Italy has 100 deaths per day. Today Italy had 919 people die in one day and now we are on lockdown, borders are closed and the Olympics are cancelled and Tucker is quarantined for coronavirus exposure."
2020-03-22T11:17:26Z,"The government is the fault for this situation by its complacency, china lied to its citizens and the world with deadly consequences, and is not going to be held accountable. We are going to pay with our lives."
2020-03-22T11:05:08Z,We must remain calm says hysterical pansy-boy Tucker. <br>Talk to you in 3 weeks. You will be shutting yourself in the streets by then. We&#39;ll see who&#39;s racist by then. <br>Greetings from Geneva.
2020-03-21T23:28:50Z,Trump announced Europe travel ban after this video
2020-03-21T08:49:22Z,"Viruses have no passports, nor nationalities! And btw, what do you have to say about all the Europeans who brought all kinds of viruses to the native people of North America, and South America. Do you call those viruses &quot;European&quot; viruses??? Are you proud of your ancestors for bringing infectious diseases that killed thousands in the Americas? If the Chinese have to be blamed for something, it is for having live animal markets, i.e. &quot;wet markets,&quot; and having no animal welfare, and no animal cruelty laws. If those markets were shut down, there might be no covid-19, the same way that there might be no Ebola if African countries did not consume certain animals."
2020-03-20T19:49:19Z,"&#39;Our leaders need to prepare Americans for what&#39;s coming and mitigate the damage that China caused.&#39; How is a virus mutation a result of Chinese action? This could have just of easily started anywhere. This is a world problem not an issue of blame. As for why most items are produced there...economics. If you&#39;re happy to pay then U.S. drugs are available as are Swiss &amp; Norwegian but you&#39;ll pay twice the price because of the staffing costs. The most effective way of dealing with this is &#39;Herd Immunity&#39; but to see if this has been achieved, you&#39;ll need  &#39;Prick&#39; tests that look at specific Covid-19 IgG &amp; IgM and test everyone monthly."
2020-03-19T20:08:36Z,Don&#39;t say the naughty word
2020-03-19T12:41:36Z,Wait a minute… I thought this whole thing was a liberal hoax?
2020-03-19T02:52:22Z,Thank you Tucker I feel you were the first on Fox to really take it this seriously.
2020-03-19T00:40:57Z,Tucker you&#39;re awesome...tell it as it is. 👍👍
2020-03-18T14:43:28Z,In this worldwide pandemic crisis there will arise a leader with solutions to solve the world&#39;s problems . And the world will follow him. The ANTICHRIST will deceive many. I am a US NAVY VETERAN. Tucker is right. China is the enemy and I believe they will attack. But the real enemy is the Devil .
2020-03-18T07:49:40Z,Very fair coverage. both sides are idiots. Good work Tucker1
2020-03-18T05:37:52Z,When do we return the bioweapon to China? bs this was not planned.
2020-03-18T05:20:05Z,based and corona chan pilled
2020-03-18T04:00:53Z,Communists love to rewrite history when it serves their purposes. It’s what they do. They also just disappeared a Chinese billionaire who criticized Xi Kingpin. Tell me again why we should be trading with these people?
2020-03-17T15:49:25Z,I didn&#39;t like the sound of that threat... At all.
2020-03-17T15:34:23Z,"I&#39;m sorry, but that is extremely sick of China to threaten such a thing at this time, when they know darn well they are the cause of this. Downright evil. Shows they are not friendly toward us. Almost makes you question if they did this on purpose..."
2020-03-17T08:50:20Z,"In all circumstances take up the shield of faith, with which you can extinguish all the flaming darts of the evil one"
2020-03-17T07:05:12Z,Tucker is one of the only people in media who cares about every day Americans and is not just a shill for the elites
2020-03-17T03:06:08Z,Aliens dont come to earth as they fear being eaten by the chinese.
2020-03-16T22:02:31Z,Tucker is forced to promote the virus. BS
2020-03-16T16:47:59Z,This is must be god telling all the boomers its time to go.. Maybe to hell who knowable
2020-03-16T16:21:36Z,The damage Republicans have caused in the past 20 years is immeasurable
2020-03-16T15:18:03Z,Michael Scott was right
2020-03-16T14:44:45Z,Who is the people responsible?  Insurance CFO&#39;s. Tell us who to punish Tucker!
2020-03-16T14:03:05Z,Fool you are backward
2020-03-16T13:58:43Z,"The goal of this coronavirus BS is to collapse small and medium sized businesses; force people to live their lives in enclosed isolated spaces wasting their whole time away in front of a touchscreen; all food, goods and items are delivered by drones; and, in the end, otherwise install some form of technocratic communism once the economy collapses: So the trillion trillion dollar question is WHO BENEFITS????: Bill Gates and the technocratic elite, Chinese Communist Party, socialism, etc.... This is the dystopian future that is on the horizon."
2020-03-16T12:03:39Z,"As of 3-16-2020, COVID-19 has killed about 69 people in the US, <br> the regular FLU has already killed over 22,000 according to the CDC  - as it does EVERY YEAR.<br>DO YOUR RESEARCH PEOPLE - Don&#39;t buy into mass media HYSTERIA."
2020-03-16T08:43:28Z,"And the Democratic Party wants &quot;YOU&quot; to believe that Russia is the REAL problem! I&#39;m glad I&#39;m Woke since last year! Time to bring back &quot;Made in America!&quot; so &quot;We the People, of the United States of America&quot;, can thrive, as we did in the far past!"
2020-03-16T08:14:47Z,maybe it&#39;s time to start learn Chinese language
2020-03-16T07:57:19Z,Thank you for saying how it is
2020-03-16T06:09:33Z,Has Tucker been crying? His eyes look strange; I watch him a lot.
2020-03-16T04:52:11Z,"I said effectively the same thing regarding panic in a social media post and immediately slammed for it. While I understood some points being made, I was either incapable of properly expressing my point, or it was simply falling on deaf ears."
2020-03-16T02:09:27Z,"OMG - Tucker is saying it&#39;s better to always tell the truth. LOL that&#39;s a change for him. but I&#39;m sure his other Fox cohorts won&#39;t give up on their faux news agenda. Let this show you how serious this outbreak might be.  The great Trump is very gently being criticized by one of his own.  Doesn&#39;t happen often so when it does, hope you Fox listeners take it seriously.  Or like Devon Nunez suggested, go have a drink at the local bar.  Wtcrap - when you vote Republican now days it&#39;s just sad.  They don&#39;t care about America anymore so wise up."
2020-03-16T01:10:53Z,While we&#39;re being honest and Mr. Tucker I respect you for doing so. For all we know it could of been made in USA.
2020-03-16T00:15:00Z,"Corona virus a lie , go out to eat ,visit your elderly parents, live your life  !"
2020-03-15T23:44:11Z,Flu is 1 in a thousand<br>Cov-19 may be 3.4 in a thousand. <br>Is that 34 times more deadly?<br>Asking for a friend.
2020-03-15T23:10:44Z,Thanks Obama Biden
2020-03-15T20:14:28Z,"And yet, Still fewer deaths than people who had information on Hillary. 🤔"
2020-03-15T19:18:36Z,"No one really knows the mortality rate to be honest. What if someone had the virus but didn&#39;t report it and survived it? The 3% is inaccurate since no one has the real numbers. Also, Italy has a large elderly population, especially in the north."
2020-03-15T18:30:15Z,"I wonder if those dolts at YouTube are still demonetizing videos that mention Corona-Chan. 🤔 If so, it’s a good thing this is made by Fox News."
2020-03-15T16:58:54Z,"I still think this is a hoax. I also think 75,000 tests are enough to help whole country. People on your network we’re pushing this so I believe it."
2020-03-15T15:43:30Z,You guys got nothing to do but complain...?!...😏😏😏
2020-03-15T15:37:18Z,This is what we get depending on commies to make our stuff. This is why we need to end ALL trade with china. Wake up America!
2020-03-15T15:07:36Z,"The stats on COVID-19 are incomplete.  You can say it&#39;s 30 times more deadly than than flu if you want, but in time when more complete stats are gathered the percentages will decrease significantly."
2020-03-15T14:38:31Z,"How are we not taking recovered vs ded? When calculating stats for an early disease, we shouldn&#39;t assume total infected will all recover if bot ded already"
2020-03-15T13:45:13Z,"The problem with the mortality rate being quoted is that they say for instance 10,000 cases confirmed, 300 deaths therefore 3% mortality. But that is only tested and confirmed cases, many more are unconfirmed"
2020-03-15T11:53:31Z,We must remain calm.. So let&#39;s freak everybody out! 😂🤣😂🤣
2020-03-15T11:20:54Z,Coronavirus is a joke. I’m not even convinced it’s real.
2020-03-15T10:03:14Z,The number of times the Flu killed me is 0 <br>0 x 34 = 0  This is the amount the Corona Virus will effect my life.
2020-03-15T10:00:20Z,I&#39;m starting to get the idea that Tucker doesn&#39;t like Chinese people
2020-03-16T23:48:09Z,"Hate the Chinese Govt not the people, many of the people are just like you and me trying to get through the day."
2020-03-17T02:22:02Z,We are  at war
2020-03-17T06:33:23Z,who cares. They don&#39;t like us either
2020-03-15T05:42:36Z,As a half Chinese I can confirm that we are the most racist people on earth.
2020-03-16T17:40:00Z,Jason Pham ...and your better half is telling you to go live in China.
2020-03-18T00:56:03Z,Well the dems seem to profit and benefit from it. What&#39;s that tell you?
2020-03-18T02:16:24Z,Herculydia are you even listening to what you’re saying? The only ones benefiting are short traders and big corporations off people’s stupidity
2020-04-04T18:13:09Z,"Well, that&#39;s why you&#39;re only half... human"
2020-04-04T18:24:54Z,"@@Joshuaaa245 Can&#39;t we all just get along ? Josh i was an agent for a brokerage firm in commodities. Saw enough corruption, lies and scam profiting to leave the industry and make an even buck without rubbing shoulders with Piranha &amp; criminals. Saw $100&#39;s of thousands lost by good people monthly. Now i work for living. Peace out."
2020-03-15T05:12:38Z,&quot;...people you trust and voted for&quot;??? Tucker seems to be implying that the president has been either deceitfully or ignorantly misleading about the seriousness of the situation!  I say he should go work for CNN along with that sly DemonRat Chris Wallace.
2020-03-15T04:46:40Z,You thought Buddah was a joke.  He made it happen LoL
2020-03-15T04:40:59Z,China just needs to be liberated from the CCP. TRUMP FOR CHINESE PRESIDENT 2020
2020-03-15T04:38:24Z,The coronavirus makes your &quot;extortion from China&quot; video have more meaning!!!
2020-03-15T03:59:21Z,"We should have never put are selfs to be reliant on another country for anything. Ive told people , but no Im a close minded  racist . Enjoy your globalism and diversity when your love ones are dying."
2020-03-15T01:51:04Z,Fox news pushing the propaganda too...
2020-03-15T00:32:57Z,"Well to start with why don&#39;t we stop lying about it being called the Chinese coronavirus, because it was Canada who created the virus and had it in a biological weapons facility, and probably a handout from a US biological weapons agency most likely,  the rest of the world already knows it came from the US, but one thing that you can count on is the people of the US won&#39;t be getting cure handed out to them"
2020-03-14T23:54:11Z,we should invade china and take over the factories and create china 2.0
2020-03-14T23:37:19Z,Thanks Nixon.
2020-03-14T22:11:28Z,Greed pushing our manufacturing overseas. America use to make solid products that didn’t break after a few uses. Hell we have building that took 3-4 round of dynamite before going down and some didn’t fall from that and had to be taken down piece by piece. We can traded power for money and are now seeing how bad it is and how much worse it could get.
2020-03-14T20:51:59Z,HAHA I&#39;m proxying thru U.S.MONTANA CALIFORNIAAND UTAH AND GRABDMA SAY CHINA STINKY BUTTS ON WHEELS. SLAMMED JAMMED HAMMED N THANK U MAMMED<br><br>RODOTODO BIG BOI IN DA PHOTO.
2020-03-14T17:31:40Z,Straight up is better than the lies. Keep up the straight talk Tucker!
2020-03-14T17:16:56Z,“A country that hates” lol I think USA hates chine first lol <br>“Damage that they are causing us”<br>I think the USA did all the hurting first and now we are paying for it. Ask your president. He is probably graving some pu s s y as the apocalypse is getting closer
2020-03-14T17:09:47Z,Why tucker after this epsiode is <br> Named it chinese corona virus. The whole month prior it was just corona virus. Always dividing ppl. There is alot of vigilantes out here in NYC attacking Asian is sad there ppl like Tucker iut there. You will never hear Hanitty say Chinesse corona virus
2020-03-14T16:34:43Z,"Tucker, for Jesse Watters to fan anti-Chinese sentiments, people know that he is dumb and shallow. But for you, the smart one to go so low to condemn China?  Why blame everything on China?  Your giant American corporations buy $1.00 from China factory and sell for $50. Who makes all the profits? Your Wall Street smart guys suck up all the average American families&#39; money, blame China again? Your govt is protecting the American giant corps.  Never for once, your favourite politician tells you that the selling price of a Made-in-USA will be 20 to 50 x higher than not just products from China but India, Vietnam, Indonesia, Cambodia, Malaysia, Africa, Korea and even Japan, Mexico, Brazil. American consumers will have to pay much higher Retail price and the giant Americans will have lesser profits or find themselves unable to retail at high prices. There are better ways to prosper USA than to put the blame totally on one country."
2020-03-14T16:10:16Z,"Tucker, The Chinese Coronavirus? What about The American H1N1? H1N1 killed more than 500,000 people!!"
2020-03-14T15:55:17Z,I am surprised tucker drifted away from the presidents opinion that this was a hoax and no big deal . I guess his comments finally got the president to come around but I think he still believes we will be out of the woods by April . Markets finally saw government working on the problem (the virus ) than the symptom ( the economic consequence ) and this lifted markets and maybe that will help Trump to understand .  Fox knows they have the presidents ear and they have a responsibility to give him a kick in the butt to see reality . We are all in this together and blaming who and what is not productive . There will be plenty of that after its over . Its to bad most did not save for a rainy day
2020-03-14T15:51:21Z,Corporate greed will be our undoing.
2020-03-14T15:28:43Z,it was completely irresponsible for trump to shut down the offices and agencies that had been put in place to plan for and combat these types of outbreaks with the excuse to drain the swamp and save money now we see how shortsighted and ridiculous it is when people denigrate the government then complain it hasn&#39;t done enough...remember it was Reagan that said government is the problem....not so anymore eh?
2020-03-14T15:15:43Z,"Many are stating the reason why the elderly with conditions are dying it’s due to so many medications they are taking, including flu shots!!"
2020-03-14T13:44:01Z,I&#39;m not a fox news viewer..but he is correct. Well said. Let&#39;s just hope we get a handle on it before it gets worse. We have got to help our fellow citizens out.
2020-03-14T12:44:49Z,Dems finally found somthing that will work aginst Pres Trump .
2020-03-14T12:00:05Z,"Tucker: Don’t panic, but PANIC!!<br><br>Oh, and FUK China!"
2020-03-14T09:35:09Z,Don’t spread hatred
2020-03-14T08:10:38Z,Ahh I love it the end of Globalism as we know it
2020-03-14T07:53:45Z,Who&#39;s down to rename the Coronavirus the Chinci Bat Soup Flu?
2020-03-29T12:23:58Z,I prefer CCP Virus
2020-03-14T06:28:38Z,Nuke China. Got it
2020-03-14T05:55:34Z,It didnt come from a meat market it was a level 4 lab located in wuhan the meat market is just an easy patsy.
2020-03-14T05:46:13Z,"Corona virus will pass. And when it does, we will feel foolish for not realizing that sooner."
2020-03-14T05:36:00Z,So who all deserves to be punished for America&#39;s &quot;supine position&quot; to China?
2020-03-15T14:45:14Z,"Brian de Riancho You doggone right. Including the orange clown.  Some worse than others.  There is no one in the Whitehouse, Senate, Congress or Fortune 500 innocent in the past 50-60 yrs. Every time you sign or vote for something you don&#39;t pay for you&#39;re guilty one way or another."
2020-03-15T14:57:19Z,Brian de Riancho Wow. Thought we were vibin&#39;. I&#39;ve been alive for all six. That&#39;s not true at all. Both the deficit and debt are increasing with the new spending of this administration.  They&#39;re part of the problem.
2020-03-15T15:47:14Z,Brian de Riancho We definitely see some things the same and others different.
2020-03-14T05:32:59Z,Nice to se an honest assessment on fox for a change
2020-03-14T05:23:36Z,we should nuke china and get it over with already
2020-03-14T04:29:47Z,"Fox growing a conscious, lol. Or war with China."
2020-03-14T04:24:52Z,Decent segment
2020-03-14T03:54:32Z,Not all people can work from home
2020-03-14T03:50:50Z,"So much BS, the reality is that thousands die on the highways every day because of Wreckless and Careless drivers but our polititians won&#39;t deal with this problem."
2020-03-14T03:40:08Z,"He&#39;s right, it&#39;s not JUST the flu, its the flu with respiratory issues. It&#39;s not comparable to the average flu, but is comparable to H1N1 aka swine flu. He mentions Italy, but not the fact that the population of Italy has a higher percentage of older citizens since the younger ones usually leave to other countries to make a future, which was reported on years ago. <br>He is right, we do need to remain calm about it, but I believe he also is causing a bit of extra fear. Some people need that dose of fear though as plenty of people have been oblivious for way too long and have not at all been preparing for whats been happening and could further spread the virus to people that are more susceptible to its harsher effects. With this virus we need to remain calm and alert or else it will be exactly like another swine flu."
2020-03-14T03:33:56Z,Truth from fox news. The end days are here this week
2020-03-14T03:21:31Z,Ugh great after hearing this piece I think things are only going to get worse.   If Tucker is right then we are going into a deep depression.
2020-03-14T02:28:35Z,Chines stop eating bats
2020-03-14T02:17:57Z,Fox gives you the facts.  And that is what we all need at this moment in time
2020-03-14T01:58:43Z,This is the first FoxNews segment I agree with. Wow. It’s actually fair and balanced... like it’s supposed to be! No BS. Appreciate this.
2020-03-14T01:51:12Z,Thanks Tucker.
2020-03-14T01:37:46Z,"Back when America used to make its own stuff and not ship off work to countries where they eat bats and rats, we didn&#39;t have these problems!!"
2020-03-14T00:46:05Z,Ok Tucker so it wasn&#39;t developed at the University of North Carolina doing gang of function research!
2020-03-14T00:21:48Z,tucker has good points
