PublishedAt,Comment
2022-12-10T18:46:34Z,How about now?
2021-12-23T16:07:18Z,Your propaganda doesn&#39;t work.
2021-12-06T22:03:44Z,"Folks, there have now been over 50,000 breakthrough cases in Arizona, USA alone (fully vaccinated that felt sick enough to go in and be seen at hospital).<br><br>But, it&#39;s a &quot;pandemic of the unvaccinated&quot;?"
2021-10-10T19:12:22Z,I enjoyed to watch your video and your YT channel also. Your team do good content. When shall we hope for another video?<br>🤝🤝🤝
2021-10-06T23:51:04Z,This is not accurate
2021-10-06T10:17:18Z,It&#39;s only overwhelming because you keep firing employees for not getting the Vax.  Also have no seen a SINGLE packed hospital or urgent care and I&#39;m in the worst state supposedly So stop this lying fiasco
2021-10-06T10:09:11Z,Buck Fiden and MSNBS!
2021-10-06T10:02:47Z,If only there were more employed health care workers.  Oops!
2021-10-06T10:02:09Z,"Wonder what this doctor has to say about the fat people who choose not to exercise and eat a healthy diet? Would he say, I told you to start dieting and exercising, so I can’t do anything for your congestive heart.  All these affirmative action doctors need to loose their licenses to practice. Screw this doctor!"
2021-10-06T09:51:37Z,"They are pushing this crap even harder in 2021. I thought it would stop once Biden was declared the winner. Obviously, this is bigger."
2021-10-06T09:51:09Z,You know how I know they aren’t? Msnbc says they are lol
2021-10-06T09:44:50Z,Fake
2021-10-06T09:26:26Z,Just shut up of the unvaccinated and take care of your people… Trump did it before the vaccine!!!
2021-10-05T19:18:10Z,Wow! Shilling it hardcore
2021-10-05T12:48:01Z,Here in indiana they filled the hospitals with refugees and then called it a surge of the unvaccinated. All treated for free while they turned ambulances away. Why do they lie?
2021-10-05T06:48:22Z,Yeah the system tends to get over burdened when you fire a third of your staff.  This is a self made problem.
2021-10-05T06:29:43Z,It’s a pandemic of the criminally insane.
2021-10-05T06:19:48Z,The protected need to be protected from the unprotected by forcing the unprotected to use the same protection that didn&#39;t protect the protected!
2021-10-05T06:32:27Z,And here we have folks proof for another busted condom.
2021-10-05T07:17:26Z,@@PerspectiveEngineer yup I&#39;m looking at another case of it right now🤣.. cuz I guess that&#39;s how we ended up with u?🤣
2021-10-06T10:45:21Z,No No uh oh k.. sooo how&#39;s this make sense.. isreal 90% jab yet of all nations of the world!  They&#39;re the highest in cases and more!  The natural immunity is better as admitted have u not seen the latest project veritas expose them?  New video out tomorrow!  From Pfizer themselves!  But how&#39;s natural immunity create &quot;variants&quot;?! Yet the jab which isn&#39;t made for any variant is actually creating them is the facts if u actually get off TV msm PROPAGANDA and the old tech fb yt Twitter Google e.t.c then ya wont find truth unless u go to rumble and watch the creator of the thing even say not to do it cuz they are so dangerous n deadly. The medias got blood on its hands from covering up alt therapy n cures treatments e.t.c!  It&#39;s not exactly creating trust!  The other things are facts just cuz a &quot;fact checker&quot; claims without proof that something is false! By doing so they shift the burden of proof to themselves! And then must prove w/ sources just how they came to that conclusion!! Ffs man its crazy how many ppl are just falling for the PROPAGANDA and not doing research into it themselves yet wanna try to talk at us who have been looking into it since Jan 21 2019! I lost my dad to this thing before it was even known wth it was!  So I did my own research cuz I saw thr lies myself. Besides how u gonna ignore fauxi being guilty?  Wtf u can&#39;t even talk about it or question it criticize e.t.c wonder why? If it works n was sooo good u wouldn&#39;t need force it on ppl they&#39;d take it of their own free will!  The lack of common sense that ppl are still getting it even tho they already got the &quot;protection&quot; and then the again circular &quot;logic&quot; of mine wont work unless u get your&#39;s! That meant it didn&#39;t work! Ffs but u said it was &quot;debunked&quot; ok how?  Where? Receipts? Link?  I can show u telegram rumble watch Brett Weinstein and the drs u can watch the vaers the reports from those who took it believed in it now are harmed by such things we can&#39;t say and they are being censored their stories silenced millions of them!  But ya na sure debunked how? U can&#39;t just say debunked see it..a debunked doesn&#39;t work that way
2021-10-05T06:11:15Z,Lies and propaganda
2021-10-05T06:09:37Z,God Bless Stay Safe
2021-10-05T06:09:36Z,What does this have to do with Nicki Minaj&#39;s cousin&#39;s friend&#39;s swollen testicles?
2021-10-05T06:06:09Z,"2020: Nurses, doctors, police, teachers, grocery store employees, delivery people = essential workers = HEROES<br><br>2021: Nurses, doctors, police, teachers, grocery store employees, delivery people = unvaccinated = unemployment line"
2021-10-05T05:59:52Z,gtfoh alternative therapies
2021-10-05T05:56:18Z,Fake news
2021-10-05T05:54:53Z,"Interesting that they know its Delta, but there is no way to confirm a Delta infection.......ask the testing centers."
2021-10-05T05:52:31Z,"I was thinking...since this pandemic has opened our eyes to how easily medical staff can be overwhelmed, maybe in the future we should, ya know, encourage a lot more people to go into the field. Ya know, get medical degrees instead of gender studies degrees, degrees in racism, art history or how to be a buzzfeed writer."
2021-10-05T06:41:11Z,What are the numbers on people with those degrees?  What degree do you have?
2021-10-05T05:47:15Z,<b>Willie Brown/Heels Up Harris 2024</b> 🇨🇳😘
2021-10-05T13:02:29Z,I thought she was on her knees?
2021-10-05T05:46:56Z,They said 70% for heard immunity what is it now??? He just said 25% unvaccinated. These people are tyrants all of em.
2021-10-05T05:45:52Z,Misinformation = alternative viewpoints
2021-10-05T05:43:40Z,As Biden forces health care workers to be fired. Thanks China
2021-10-05T05:30:04Z,What about vaccinated patients
2021-10-05T05:29:30Z,April 2019 Scott Gottlieb stepped down as the 23rd commissioner of the FDA. June 2019 he was elected to the board of directors for Pfizer.<br>Msm lies.
2021-10-05T05:27:33Z,"No, more like hospitals are overwhelmed because they are understaffed because off all the workers they&#39;ve fired because they didn&#39;t want to get vaccinated."
2021-10-05T05:25:56Z,Show us unvaccinated and sick... stop the propaganda
2021-10-05T05:16:59Z,No it&#39;s mostly vaccinated people natural immunity is the best protection.Out of all of the people that I know that have gotten covid have got over it and are fine my 58 year old chain smoking alcoholic aunt got it and she&#39;s fine  People you need to wake up
2021-10-05T05:16:40Z,"I find this situation (what healthcare workers have to deal with) to be the most offensive and repugnant part of this whole pandemic. Look, these &quot;anti-vax&#39;ers&quot; pretend that this is a personal choice and a matter of &quot;freedom&quot;. By now the vaccine is available to pretty much EVERYONE and yet they are &quot;making the choice to be vaccine free&quot;. Oh Kay, then they should also be willing to live with the consequences of that choice. If (not when!) they get sick with COVID-19 and think they deserve medical treatment, they should be tested for the presence of the vaccine before being admitted. If the vaccine is not present and they do no have a medical reason for not getting vaccinated; give them 2 aspirin and send them home. Let them live or die because of the choice that they made. Empty out the IC units of anyone that has not been vaccinated. Medical resources should be for those people that deserve treatment; not the stupid and ignorant."
2021-10-05T05:16:35Z,Ridiculous. Healthcare workers are being fired and vaxxed are still getting sick and spreading. What&#39;s the point?
2021-10-05T05:08:02Z,"Since they wont tell you the real percentages except for those unvaccinated ( and most likely inflated ) ! When will we find out the numbers of how many of those have had the jab ? As we are finding out slowly,  there are &quot; MANY &quot; that have had the shot that are sick ! Facts ."
2021-10-05T05:06:44Z,And churches are still passing the collection plate as they scream don&#39;t get that shot. Even though the preacher and his family all got it.
2021-10-05T06:22:22Z,I know many pastors that have not taken it. Stop being silly
2021-10-05T21:34:22Z,A lot of good it would do if all their parishioners die from covid.... Obviously you&#39;re coming from a place of bitterness.
2021-10-05T21:37:14Z,@@carlablizard8514 you act like every single person that even comes into contact with covid will automatically die. Stop listening to MSM BS. Covid has a 99.997% natural recovery rate
2021-10-05T05:01:59Z,But it&#39;s no problem letting thousands flood through the border without any tests or  any vaccines... Rich🤡
2021-10-05T04:48:22Z,Probably because you all FIRED the unvaxxed workers LMAO
2021-10-05T04:47:49Z,"LOL, can&#39;t even prove the truth on this channel or say phrases of fact without it being deleted..."
2021-10-05T06:13:10Z,Do you have any idea how stupid you sound Elkysium?
2021-10-05T07:13:02Z,Marty Baldwin Facts are facts for a reason.  They are indisputable and proven with common sense.  Facts don&#39;t change period.  The only nonsense I see here is this channel and you.
2021-10-05T07:22:06Z,The very foundation of society is based on a lie(history/education) to keep you in a lie(science/math) so you make good little slaves(jobs/debt cycle) and don&#39;t fuss much(religions).<br><br>Science and religion are one and the same.  They both feed you lies and most believe it to be the truth when in fact the truth is so far from what you actually believe it isn&#39;t even funny.
2021-10-05T07:25:05Z,@@Elkysium LOL is this satire?  What do you do just ask a Magic 8-ball for all the answers?  Maybe squint at the sun and read off the purple lines burned into your retina?
2021-10-05T16:10:34Z,@@vaels5682 It&#39;s called extensive research fool...
2021-10-05T04:46:06Z,Boooooollllsssshhhhiiiiitttt
2021-10-05T04:45:16Z,"In the words of Greta T.........blah, blah, blah!"
2021-10-05T04:44:40Z,This is what happened last year its called waves this isnt going away with or with out a vacation.  Be real .you want to go back in time and  destroy the lab .
2021-10-05T04:43:41Z,"When they are firing medical personnel for not tami h the jab , now you want to whine about hospital overflow. Government creates problem so they can steal from citizens when giving a “solution” to the problem"
2021-10-05T04:42:15Z,"Unvaccinated, unmasked, and still COVID-free...<br>Or I&#39;m just immune.  Either way, I will never take your fake vaccine or do what I know is detrimental to my health."
2021-10-05T04:40:38Z,How about that Biden and his now 10 month long continuous super spreader party at the border. As of aug 43 of ours dead. Awesome job. And where&#39;s the numbers for the vaccinated cases? Why are they hiding that?
2021-10-05T04:39:16Z,If they want to die that on them.
2021-10-05T06:14:09Z,Unvaxxinated people that get hospital treatment for covid should have to pay for it out of pocket.  I think that&#39;s fair.
2021-10-05T04:37:39Z,"Approx. 30% of healthcare workers remain unvaccinated by choice, you propaganda spewing big pharma hacks."
2021-10-05T04:36:46Z,"The unvaccinated are the draft dodgers of today. They refuse to support America, because they have never supported America. They hate tax they hate vaccines they really hate America like Trump does. No tax, no service (bone spurs), America is all about my personal profit. I&#39;m smarter than you, because I take your money."
2021-10-05T03:23:18Z,Show me a vaccine first
2021-10-05T02:43:24Z,"Why don’t you stick to the science of natural immunity?  This Dr. seems butt hurt af, probably getting checks from Phizer…"
2021-10-05T02:33:42Z,"Except, that isn&#39;t true. Like, at all."
2021-10-05T06:16:43Z,Enlighten us about what is untrue here jenny. Since you seem so sure.
2021-10-05T02:27:12Z,Ya you fired a major chunk of the Healthcare workers who didn&#39;t agree with your agenda.<br>Your hospitals are not overwhelmed. They are simply under staffed. On top of that you peope are attempting to strip those same health care workers of thier unemployment they have payed into and severance pay. It&#39;s pathetic. A mandatory vaccine that doesn&#39;t protect the vaccinated.. we got headlines like the vaccinated need protection from the unvaccinated... seriously? This makes sense to you. The real question you should consider is why ... those Healthcare workers refuse the vaccine. Why they are willing to literally have thier lifes and livelihoods they spent years on. Thousands on education for.<br>Destroyed!! Rather than just get a few shots.  That&#39;s what should actually concern america
2021-10-05T02:22:11Z,Media that swears Biden got 85 million votes claims they are protecting you from misinformation
2021-10-05T02:13:41Z,You mean vacinated surge
2021-10-05T02:08:58Z,F__k their vaccine. I don&#39;t believe any of this.
2021-10-05T02:06:27Z,Ask your local hospitals how overwhelmed they really are. I have nurse friends in local hospitals and it’s nothing like what is being reported. This will give you a better idea of what’s happening around you.
2021-10-05T05:08:01Z,"I have and it&#39;s very bad here in southern Ohio. I mean very, very horribly overwhelming for them."
2021-10-05T05:43:58Z,"Cool, you&#39;re lying."
2021-10-05T02:03:49Z,If you don’t see what they are doing you aren’t paying attention.
2021-10-05T02:03:28Z,"Not true, most are vaccinated people."
2021-10-05T02:00:27Z,"Overwhelming health care workers?  Why not fire some of them, who are not vaccinated.  That&#39;s an easy solution."
2021-10-05T01:59:25Z,"Sorry doc, im not making decisions for my life and my family’s life based on your frustrations with your job. You JOB by the way, is, was, and always has been- to TAKE CARE OF SICK PEOPLE. Well that and get paid to promote propaganda and the erosion of civil liberties through the media."
2021-10-05T01:58:40Z,"If YouTube is suppose to be monitoring false information on their venue, then they need to start FACT checking this kind of 💩!!!!!"
2021-10-05T06:08:30Z,Explain to me what was incorrect in this video.  I&#39;ll wait
2021-10-05T06:51:13Z,Its all a big joke.  Social media and youtube have started removing CDC data and quotes from its heads.
2021-10-06T09:36:37Z,The fact checkers and checking sites are owned by the same people making billions off this scamdemic.
2021-10-05T01:58:14Z,Probably because the vaccinated are being careless and not taking precautions spreading it everywhere. The vaccine is causing this surge
2021-10-05T01:58:03Z,Demons
2021-10-05T01:57:56Z,They probably caught it from the suddenly invincible vaxxed ppl
2021-10-05T01:57:53Z,"My question is if you get vaccinated, why is it that you can still get and spread the virus the same as a unvaccinated person ?"
2021-10-05T05:24:57Z,All part of the plan.... its why it doesn&#39;t work.. i know more vaxxed people who have gotten that covid thing  than unvaxxed..  WHY?
2021-10-05T06:16:18Z,Because they&#39;re lying to you because it&#39;s all about power and control and money 💰
2021-10-05T12:57:43Z,"Exactly. I got vax for polio and never got polio, I got vax for measles and never got measles..so...why is this different? Because the GOVT is FORCING YOU which is unconstitutional."
2021-10-05T12:58:57Z,Marty Baldwin Ask who? Flip Flop Fauci?? Fuggeddaboudit!!
2021-10-09T00:14:30Z,@@RubyTwilite I contracted mumps and survive not sure if I was ever exposed to measles or polio no way of knowing if that s*** really works
2021-10-05T01:57:44Z,I thought the surge was in vaxxed people.
2021-10-05T01:57:40Z,Unvaccinated includes those who got their second shot less than two weeks ago. That has been true for a time now
2021-10-05T05:44:41Z,no.
2021-10-05T01:56:46Z,You guys really think that we are stupid. I&#39;m curious to see the effects of these spike proteins on this society.
2021-10-05T02:30:30Z,Mc Donald&#39;s used to proudly display the use of nanotechnology in thier food. Used to be a little bulletin right next to the entrance about it.  Now they denie it ever happened. Claim they only used synthetic proteins in thier packaging.. cause your packaging needs nanotechnology
2021-10-05T05:44:25Z,What flavor koolaid you bots drinking?
2021-10-05T06:16:09Z,@@Laurannah101 forreal lmao these people are pathetic
2021-10-05T06:40:55Z,Marty Baldwin is this satire? I legitimately can&#39;t tell at this point 🙃
2021-10-05T01:56:45Z,Just in the unvaccinated are 95% more likely to get STD.
2021-10-05T01:56:40Z,"Do these &#39;horrible&#39; unvaccinated people, include members of congress who are EXEMPT from the Federal vaccine mandate? Hmm?"
2021-10-05T01:56:02Z,Liars the information is already out there stating the opposite you MEDIA IS DISGUSTING you are literally a plague on humanity and you have earned a nice long stay IN H🔥LL!
2021-10-05T01:55:18Z,"Why is it that the reserve vaccine from the USA was sent to Australia and in one town , 87% of those hospitalized were previously vaccinated ?"
2021-10-05T01:52:17Z,They made the virus an a vaccine that what makes it sketchy. Also vaccinated doesnt stop you from getting it
2021-10-05T01:48:31Z,"What they won’t talk about is Australia.  Get vaccinated, then the vaccinated will glut the emergency rooms.  But hey, good luck with that!"
2021-10-05T08:32:10Z,Demonically possessed fools
2021-10-05T01:46:48Z,LMAO
2021-10-05T01:46:21Z,MSNBC your Lying and it&#39;s the Vaccinated that are in the ICUs and very bad things are happening to them.
2021-10-05T01:43:52Z,I live by a city that has 21% vaccinated....barely any covid patients in the hospital. Liars.<br>More fear mongering to scare people into poisoning themselves
2021-10-05T01:42:40Z,On today&#39;s episode of vaccine propaganda.  If the jab works why you scared lmao
2021-10-05T05:43:24Z,You trump cultists still dont get it do you? Most people in the hospital are not vaccinated. You&#39;re a deathcult.
2021-10-05T06:42:28Z,"A vaccine is also not advertised as a cure, so there&#39;s still a risk. Why are there flu vaccines every year, do you whine about that too?"
2021-10-05T17:23:40Z,@@direktive4 no because I don&#39;t take it ever and nobody cares lol what a stupid counter argument
2021-10-06T00:57:37Z,"@@defund-the-media4530 right, cause &#39;nobody cares&#39; and &#39;what a stupid argument&#39; are such great arguments"
2021-10-06T03:05:07Z,"@@defund-the-media4530 oh so you cherry pick which vaccines you want to make a fuss about? Inconsistent, what a surprise."
2021-10-05T01:42:35Z,When the Democrat party media rules it seems people lose trust in the government.
2021-10-05T01:42:32Z,The treatment once in hospitals is wrong  treatment thats why people are dying and they know it
2021-10-05T01:42:15Z,Liars
2021-10-05T01:40:13Z,Project Veritas and the scientists at Pfizer say different. Bahhhh baaahhh
2021-10-05T01:40:09Z,GIVE THE UNVACCINATED PATIENTS TO THE UNVACCINATED NURSES YOU IDIOTS
2021-10-05T01:39:12Z,Once again no evidence or studies cited that show people who had Covid benefit from the shot. Unvaccinated doesn’t mean lack of immunity.
2021-10-05T01:36:13Z,Lies and more lies
2021-10-05T01:35:16Z,"This doctor is lying why is it in other develop countries the vaccinated are more then half in hospitals the numbers in the u.s. are not accurately reported, if vaccination works why do vaccinated people need protection. This is fear propaganda to control you. Just like what happened in Germany and how Hitler over took their democracy turn into a dictatorship."
2021-10-05T01:34:24Z,Vacinne makers aren&#39;t liable for ALL the side effects(proof everywhere) and the tyrants mandating signed there own bill preventing them and there staff from getting it...who with a brain would get that shot ? Seriously and also proof everything these tyrants don&#39;t even follow there own mask mandates either
2021-10-05T01:33:16Z,To the extent they fire help for not getting the jab.
2021-10-21T23:24:15Z,they replace them with unvaxed national guard they actually care about your health dont they...?
2021-10-05T01:32:53Z,Lies lies lies
2021-10-05T01:32:08Z,Lies!
2021-10-05T01:30:34Z,LIES!
2021-10-05T01:28:30Z,Stop with the Americans. What about the illegals.  They count heart attacks and cancer deaths as covid.    I do not believe anything from fauci or Biden.
2021-10-05T01:25:50Z,Liars!
2021-10-05T01:24:41Z,FAKE NEWS ! You guys are sooooooo silly. 🤣🤣🤣
2021-10-05T01:24:16Z,Why you always lieing OMG stop effin lieing
2021-10-05T01:24:16Z,Why don&#39;t you fake news media&#39;s start telling the truth. People who have had the evil shots are getting covid. People quit watching the fake news and you won&#39;t know covid still exists.
2021-10-05T01:21:49Z,Let them die
2021-10-05T01:21:41Z,WOW!!!! I can&#39;t believe how authoritarian y&#39;all people are.<br>Burning freedom of speech and silencing the voices that are exposing the corruption of the FDA and The CDC.
2021-10-05T01:20:00Z,F Joe Biden 👏👏👏👏😂 f Joe Biden 👏👏👏😂
2021-10-05T01:19:32Z,This is msdnc doing their part of keeping division in this country going. Why isn’t msdnc down on the borders reporting on the various covid strains coming into this country.
2021-10-05T01:16:02Z,How many from side effects? Since so many in the medical field are now reporting on this?
2021-10-05T04:40:19Z,A sore arm is not a reason to be hospitalized. 🤣
2021-10-05T06:40:17Z,Why don&#39;t you tell us since you&#39;re claiming &#39;so many&#39; do
2021-10-05T12:28:21Z,@@direktive4 why not do some research instead of being ignorant? Why so many doctors and nurses speaking out then?
2021-10-06T00:52:10Z,"@@mylo7148 so you just like to make claims and not back it up, got it"
2021-10-06T01:22:39Z,@@direktive4 how dumb is some ? You see the claims you just got know way of understanding...small mind and all
2021-10-05T01:15:50Z,Pro-science and anti-death
2021-10-05T01:12:32Z,The protected need to be protected from the unprotected by forcing the unprotected to use the protection that doesn’t protect the protected
2021-10-05T01:48:52Z,Ahhh...what he said...I guess!
2021-10-05T01:54:04Z,Yes!
2021-10-05T01:56:20Z,EXACTLY
2021-10-05T02:15:37Z,Nailed it!!!
2021-10-05T04:35:06Z,"Ignorant person offers their opinion. I failed math, do not understand statistics, but trust me. Because I know everything."
2021-10-05T01:12:17Z,"Pandemic, never heard of her?"
2021-10-05T01:11:17Z,Has nothing to do with the over 1.4 million health care workers layed off since 2020...
2021-10-05T01:11:11Z,I would guess forcing nurses and doctors being forced to quit might have a lot to do with it. Why is that not a issue?
2021-10-05T06:27:09Z,Marty Baldwin no it’s actually really not. Even if you lost 40-50/400 of your staff that’s still a lot when talking about medical care
2021-10-05T06:38:26Z,@@chiefgstar8966 No it’s not because when you’re talking about percentages in 0045 and then we split the difference between your IQ and your grade level
2021-10-05T01:11:02Z,"I am Elvis Presley himself. This is a test because anything and everything I post anywhere on youtube that is true, gets deleted within a few seconds. If this is still here, well, you know."
2021-10-05T01:10:11Z,The only overwhelming issue for c19 care at this point is the shortage of health care workers that were fired for being unvaccinated.
2021-10-05T01:22:29Z,Yes.
2021-10-05T02:23:05Z,Nothing like getting rid of nurses who have been essential from the beginning.
2021-10-05T01:09:53Z,Tell that to the people who engage in risky behaviors by choice and still demand the government treat them.
2021-10-05T01:36:50Z,"it is not the government responsibility to treat me, I have insurance and want the government to do its job , my health  is not their business"
2021-10-05T01:09:31Z,"NOPE, NONE OF THIS IS TRUE"
2021-10-05T01:07:43Z,I can&#39;t believe how many fake bot comments are below. I knew YouTube was going to censor any channel that spoke the truth but I didn&#39;t realize they&#39;d release so many fake comment accounts. LOL Pathetic
2021-10-05T01:07:25Z,"What a lie, the people in the hospital are vaccine related. We, the ones with natural immunity have not been in the hospital in at least a couple of years."
2021-10-05T01:02:13Z,"Liars. I had Covid and went to get infusion, half people there were vaccinated. Just as sick as I was"
2021-10-05T01:01:45Z,Why are you lying? The data proves that the majority of people in the hospital with &quot;covid&quot; are vaccinated. Several nurses are speaking out on this as well. YouTube is so censored and full of nothing but propaganda and bot comment accounts pretending to be in favor of this. It&#39;s hilarious really.
2021-10-05T00:54:18Z,Stop lying. <br>Those are the people with vaccine.<br>And y’all dont even have test for delta how can you know someone have it?
2021-10-05T00:51:42Z,FALSE
2021-10-05T00:49:40Z,Not surprised Biden and Harris are killing Americans daily should be prosecuted and impeached along with prison for spreading covid and drugs and criminals across the United States by the millions. Democrats are totally responsible for many lives in the United States.
