PublishedAt,Comment
2021-01-10T21:25:41Z,Thank you for being blunt we need to hear this. <br><br>Save our
2021-01-10T21:27:04Z,"Save our carers, nurses, doctors, wear a mask"
2021-01-11T02:18:01Z,I did not hear her say that smoking pot was going to help this. So why do you say she was being blunt? (jk)
2021-01-11T07:07:08Z,"Because I was trying say save our American&#39;s  wear a mask , but the phone went cranky and send it off early"
2021-01-10T21:24:55Z,This should be renamed the TRUMP VIRUS to commemorate the person responsible above all else for American deaths.
2021-01-10T21:24:20Z,"COVID-19 patient treated with experimental .......: <a href=""https://youtu.be/1LbYYWvotAg"">https://youtu.be/1LbYYWvotAg</a>"
2021-01-10T21:23:20Z,Come now I&#39;m surprised you guys are a surprised at the amount of virus you have was warned over and over and over again
2021-01-10T21:23:15Z,"He must be one of the meanest on this world. Playing Golf talk nonence when thousends of americans lost their lives, job, homes. Then he hired national sect members. Who was his propaganda minisister Himmler, Goering or Hess."
2021-01-11T00:07:52Z,None of them!  It is Stephen &#39;Goebbels&#39; Miller.
2021-01-10T21:23:00Z,"&quot;I CAN&#39;T KEEP DOING THIS&quot;: Doctor pleads for review of data during COVID-19 Senate hearing: <a href=""https://youtu.be/Tq8SXOBy-4w?t=85"">https://youtu.be/Tq8SXOBy-4w?t=85</a>"
2021-01-10T21:22:42Z,"<a href=""http://www.youtube.com/results?search_query=%23thetrumplegacy"">#TheTrumpLegacy</a>. <a href=""http://www.youtube.com/results?search_query=%23trumpplague2020"">#TrumpPlague2020</a>"
2021-01-10T21:22:33Z,Trump is responsible.<br><br>Trump&#39;s refusal to wear a mask caused tens of thousands of deaths alone.
2021-01-10T21:21:48Z,"Friends don&#39;t let moron hate trumpcult member friends breed or internet, people."
2021-01-10T21:21:16Z,"Even many &quot;3rd-World&quot; counties, like Thailand &amp; Uganda, have universal care.<br><b>What Thailand Can Teach the World About Universal Health Coverage</b><br><a href=""https://www.theguardian.com/health-revolution/2016/may/24/thailand-universal-healthcare-ucs-patients-government-political"">https://www.theguardian.com/health-revolution/2016/may/24/thailand-universal-healthcare-ucs-patients-government-political</a><br><i>&quot;Thai citizens gain universal access to essential health services at zero cost—and reap major benefits as babies get healthier, workers increase productivity, and households reduce financial risk&quot;</i><br><br>Moreover, according to the US National Library of Medicine - National Institutes of Health, Thailand is the #1 destination for medical tourism.<br><b>Thailand top destination for medical tourists</b><br><a href=""https://www.ncbi.nlm.nih.gov/pmc/articles/PMC3883860/"">https://www.ncbi.nlm.nih.gov/pmc/articles/PMC3883860/</a><br><br>There is only <b>ONE</b> &quot;developed&quot; nation on Earth that does not have some kind of single-payer, universal health coverage.   Guess what one?<br><br>So, you have to ask, can we really be classified as a &quot;developed&quot; nation?"
2021-01-10T21:20:01Z,"Trump is a MASS Murderer, he KNEW this was coming and did NOTHING and eventually admitted it.. Operation Warp Speed is a Warp FAILURE, Just like Trump... The Defense production act needs to be implemented immediately to get the vaccines out faster and then a COMPETENT Plan to get them to the people on a grand scale..."
2021-01-10T21:17:40Z,"Hey Kelley Mc Kinney  what did you say ,under Trump covid will not come to America. 370 thousand dead!!!!!!."
2021-01-10T21:15:57Z,Meanwhile; Trump plays games.
2021-01-10T21:14:05Z,"I reckon the entire country will be infected eventually, it&#39;s enviable with half the country thinking the virus is fake."
2021-01-12T08:37:34Z,"When do you think all 330M people will become infected? I don&#39;t think it&#39;s fake, just greatly exaggerated."
2021-01-15T17:31:42Z,@@loveisthemostpowerfulforce1397 Greatly exaggerated? I just saw on the news that America has about 3000~4000 deaths EVERYDAY so idk about you but I&#39;d totally panic. Remember that 9/11 deaths are 2977 and it shook your whole country for a very long time. I wonder where the America back then went.
2021-01-15T18:17:11Z,@@UltraRedPotato It&#39;s a Virus it&#39;s there now we have to live with it. Don&#39;t be a coward
2021-01-15T22:25:19Z,@@UltraRedPotato Yeah no I will not panic. I don&#39;t believe those statistics either. The virus has a 99.9% survival rate.
2021-01-29T21:37:31Z,I think that was the plan.
2021-01-10T21:13:46Z,This is not news for most of the countries in the world. I&#39;ve seen how trump treats everything and everyone around him for many years before he was elected. He ruined everything he touches. The only reason he ran for president was to raise money and hopefully escape prosecution in the first place! He is a plague!
2021-01-10T21:12:04Z,MAGA crowds probably still disregard the science about these viruses and mingle in protest to support their loser &quot;Don the Con&quot;. More dark times ahead for America by the looks of things ... :-(
2021-01-10T21:10:32Z,"People don&#39;t care about covid, they rather go out and party 😡"
2021-01-10T21:10:04Z,murderers
2021-01-10T21:10:02Z,"In his tenure, Trump will have killed more Americans than the Axis Powers combined, during WWII"
2021-01-10T21:35:56Z,"If Biden doesn&#39;t have his cabinet sworn in so they can get going, it could very easily exceed WWII deaths."
2021-01-10T22:48:08Z,"@M T <br>Not quite yet, but it may soon enough."
2021-01-10T22:52:30Z,"@M T It&#39;s long been difficult not to see the swine as a de facto political serial killer engaged in his own version of an ethnic and demographic cleansing. On a level with wellknown persons from history like Pol Pot or Tamerlane. Trump&#39;s administration&#39;s role should not be forgotten. &#39;But we just followed orders&#39;, will be their refrain for years to come. When asked to explain and defend why they didn&#39;t try to put a stop to this ruthless &#39;health&#39; policy. It&#39;s probably a matter of statistics only, if the amount of deaths RELATED to this murderous Covid &#39;strategy&#39; ought to be raised considerably. As I understand it, the statistics only include persons dying during &#39;treatment&#39; or stay in hospitals? Hope I&#39;m wrong. If not, we talk about probably several hundred thousands more at this point. Thank Heaven this man did not get four more years... It&#39;s bad enough as it is."
2021-01-11T01:34:10Z,Adolf Benedict Trump the pro-virus president
2021-01-11T01:55:38Z,@M T The Civil War was over 600k and WW2 was over 400k so you are incorrect. I&#39;m not downplaying the seriousness of Covid though. It&#39;s almost at 400k and still climbing rapidly. There&#39;s a very good chance Covid will pass the Civil War death count. <br><br>If we had a president who took the virus seriously we could have saved many lives.
2021-01-10T21:07:12Z,How many new COVID-19 cases will come from the mask-free insurrection at the Capitol a few days ago? A few thousand at least.
2021-01-11T05:48:50Z,Diego A Have you conducted a randomized controlled trial to show they don’t work? Are you an infectious disease epidemiologist?
2021-01-11T08:40:14Z,Diego A Right that&#39;s exactly why Japan is facing such a huge problem due to their population density in Tokyo. Oh wait that&#39;s right they wear their masks and numbers are way lower than America&#39;s. Go figure.
2021-01-11T11:50:43Z,"Diego A on which planet do you see “everybody” wearing masks?<br>Not at Trump events. And masks only REDUCE the spread of the virus. If people continue to gather in smaller groups of friends and family and not wear masks, the virus will continue to spread. The surge we are experiencing now is from the Christmas celebrations including airline travel. Not everyone is masking, distancing and staying home which are the combination of elements to reduce transmission."
2021-01-11T18:45:05Z,"@@menchum1 yes that trial has been done on cloth ones &amp; yes, that is exactly what it showed! More infections in the cloth clusters than in the control clusters not wearing anything! Surgical ones did get a better result"
2021-01-11T18:51:11Z,"​@@asheronwindspear552 And Australia &amp; New Zealand eliminated it completely with their march import without a single mask in public!<br><br>Tokyo &amp; Sydney both got 1 new import in the first week of July, Sydney went mask free in the middle of winter, Tokyo wore them (in the middle of summer where covid&#39;s much easier to control), Sydney did NO lockdown &amp; didn&#39;t go beyond teens in daily case numbers all outbreak &amp; within 4 months had it eliminated with only around 1000 cases total. Tokyo is STILL getting that many cases every day from that outbreak while Sydney returned to stadiums of 30,000 (maskless) people less than 2 months after getting that highly infectious variant outbreak in the middle of winter<br><br>You people need to learn that despite the correlation, reducing ice cream sales doesn&#39;t stop shark attacks!"
2021-01-10T21:06:52Z,Good. I wait for love from you 💝💖
2021-01-10T21:06:12Z,"<a href=""https://www.endcoronavirus.org/countries"">https://www.endcoronavirus.org/countries</a>  1st world countries are fairing better."
2021-01-10T21:05:45Z,Hi Boys 😍💋 💝💖♥️❤️
2021-01-10T21:05:43Z,Why do Republicans hate frontline workers so much?
2021-01-11T08:47:51Z,Diego A You spelled Republicans wrong.
2021-01-11T14:03:36Z,Diego A Interesting. We are watching from outside US. Just last night the discussion was about how US conservatism and fundamental Christians seems so intent on destruction.
2021-01-10T21:04:25Z,Daddy what is science? Don&#39;t worry about that son we are Republicans.
2021-01-11T12:25:50Z,"Daddy, what&#39;s truth? Ask the world&#39;s most notorious liar."
2021-01-11T21:34:02Z,"Real science is TV news reports.  No other medical experts need to be consulted.  If they don’t agree with the news, they are wrong."
2021-01-12T08:39:31Z,"Science can change, nothing is for sure, it does not matter how sure 99.9% of scientists feel about something. Before 1900 people laughed at those who thought you could build a machine that looked like a bird and could fly across oceans."
2021-01-13T00:52:30Z,"Daddy, are the lockdowns working? Don’t worry about that son, we know the truth."
2021-01-10T21:03:44Z,Really nice 👌 😍💋 💝💖❤️
2021-01-10T21:02:41Z,"Ahh, i get it now! Trump always said ”Make America great again”, so when covid came along he found a way to actually keep that promise, by letting a good portion of the population die, then start over with new americans! It all makes sence now"
2021-01-10T21:01:21Z,Canada has committed to having all Canadians vaccinated by September.  US need to hold Republicans and Trump accountable for taking out more Americans than any war.<br>Looking pretty dumb and weak right now US.
2021-01-10T21:55:36Z,"Canada population less than 38 million, USA 332 million. It will  take USA  a longer time  to both ,get the vaccines and citizens  vaccinated .Heaven  help us all."
2021-01-10T21:01:00Z,Remember Trump said if there&#39;s no test there&#39;s no cases. It takes someone really stupid to weaponize ignorance.
2021-01-11T00:33:35Z,Well said
2021-01-11T04:48:32Z,"I don&#39;t really want to disagree with your comment but I think that person has to have an evil, malignant personality as well."
2021-01-10T21:00:53Z,Trump really sh?t the bed on this and so much else. Thanks a pant load MAGA morons. Does MAGA stand fo make america get aids?
2021-01-10T21:00:26Z,Here in the UK we have a massive spike in COVID-19 due to the new variant ( discovered here NOT originating in the UK. We just have better genome sequencing than the US) and that is despite our universal mask wearing and total lockdown. The US is sadly heading for a heap of pain unless you ALL wear masks and STAY AT HOME.
2021-01-10T21:07:00Z,"Lucky for us Biden is going to be president in 10 days. Then, we will finally have a leader and fight Covid. WhaT a NIGHTMARE."
2021-01-10T22:52:57Z,Very well said!!!
2021-01-11T00:38:39Z,@@JosedeJezeus The US is totally lost. They could&#39;ve even shut down the whole country now. It&#39;s too late. 2 million deaths minimum. Good luck!
2021-01-11T01:51:31Z,"@@traumadiffuser3705 the last 4 years have made you forget how Epic America is. <br><br>You&#39;re gonna remember real quick how awesome America (a country made of immigrants) is when Joe Biden takes over and unleashes America&#39;s greatness. <br><br>Thanks for wishing us luck, but we don&#39;t need it. What we need is real leadership, and it&#39;s arriving January 20th."
2021-01-11T02:12:05Z,@@JosedeJezeus 😂
2021-01-10T21:00:06Z,REPUBLICANS can NEVER claim to be PRO-LIFE EVER  again after refusing to wear a MASK that could stop the spread of CoronaVirus and DEATHS!!!!! They should be known as the PARTY of DEATH!
2021-01-10T22:45:31Z,I saw the Democrats dancing in the street without masks in passing around a champagne bottle On the night of Joe Biden was elected. I guess the Republicans we do some stupid things too.
2021-01-11T00:43:04Z,They were never pro-life in the first place. More like forced birth.
2021-01-11T00:43:12Z,"Don&#39;t believe the lie the media is lying to you about covid watch this informational documentary<br><a href=""https://www.bitchute.com/video/pyczBzMfOnuo/"">https://www.bitchute.com/video/pyczBzMfOnuo/</a>"
2021-01-11T00:44:08Z,Covid has a 99.9 recovery rate
2021-01-11T00:47:09Z,"@@cesar7924 <a href=""https://www.adl.org/blog/bitchute-a-hotbed-of-hate"">https://www.adl.org/blog/bitchute-a-hotbed-of-hate</a><br><br>What&#39;s with Republicans falling so easily for fake news?"
2021-01-10T20:59:59Z,"<a href=""https://www.youtube.com/watch?v=PkHDgkiKRdU&amp;t=13m43s"">13:43</a> I love that. Do you love me? 😍💋 💝💖❤️"
2021-01-10T20:58:53Z,under Joe rule it will quadruple ..Dark winter
2021-01-10T21:02:41Z,"And all thanks to Trump,. who did nothing to stem the spread. His is an international disgrace."
2021-01-10T21:10:25Z,"naw man,President Joe Biden will make sure folks get the vaccine ,no more of this stupid herd immunity bs and folks will get back to work.trump is responsible for this 100%,Hillary would have put a stop to this over a year ago.i guess you don`t want the vaccine,stick with your flat earth lizard cannibal conspiracy theories it`s really working-LOL"
2021-01-10T21:18:38Z,"Didn’t Trump say:<br>* &quot;it goes away in April...with the heat... as the heat comes.... typically, that will go away in April&quot;?! *"
2021-01-10T21:19:21Z,@@mcrestwood7378 &quot;flat earth lizard cannibal conspiracy theories&quot;.  A perfect description.  Well done!
2021-01-10T20:58:03Z,"False. The US has 572,000 deaths from Covid. 1,000,000 will be reached in early april. Watch report on all deaths on NBC:<br><a href=""https://www.youtube.com/watch?v=Of5DYjt1aCg&amp;list=PLwGgWkDA5PVi4faRZG_A7osxtN_E12kXI&amp;index=1"">https://www.youtube.com/watch?v=Of5DYjt1aCg&amp;list=PLwGgWkDA5PVi4faRZG_A7osxtN_E12kXI&amp;index=1</a>"
2021-01-10T20:57:52Z,IMPEACH  TRUMP  NOW
2021-01-10T20:57:16Z,It was predictable with even a basic understanding of the US n it’s systems n cultures
2021-01-10T21:31:11Z,"It is sad that this pandemic is raging on when a month ago a doctor testifying before a senate committee hearing said: &quot;I CAN&#39;T KEEP DOING THIS&quot;: <a href=""https://youtu.be/Tq8SXOBy-4w?t=85"">https://youtu.be/Tq8SXOBy-4w?t=85</a>"
2021-01-10T20:57:01Z,"Orange jelly in The WH, never took it seriously right from the beginning calling it a hoax, inject bleach etc, even saying it now is horrific, and still he and his followers have super spreader events, they dumb as a bucket of rocks."
2021-01-11T11:55:11Z,Dumber than a bucket of broken hammers.
2021-01-11T12:54:44Z,"Your 99% accurate, you forgot people travelling, governors trying to create revenue( ie restaurants opening) and BLM events."
2021-01-11T12:58:51Z,"@@michaelsmith5583 no I didn’t forget, you are perfectly correct of course, I was just leaving that for those who like to make excuses for their own spreader event, as if it’s ok because others have been silly. 2 wrongs don’t make a right. Also I couldn’t be bothered typing all that 👍🏻😂"
2021-01-11T13:00:23Z,Following Dr Fauci worked wonders for AIDS didn&#39;t it?
2021-01-10T20:56:58Z,LIES! There is no pandemic.
2021-01-10T20:55:09Z,Anyone want to be my Boyfriend 😍💋 💝💖♥️❤️
2021-01-10T20:54:45Z,Hi Boys 😍💋 💝💖♥️❤️
2021-01-10T20:51:20Z,Baloney Ivermectin cures and prevents Never Fear Ivermectin s here to save the day CHEAP!! 🤫🤫🤫🤫🤫🤫🤫🤫🤫🤫🤫🤫🤫
2021-01-10T21:18:08Z,"<a href=""https://apnews.com/article/fact-checking-afs:Content:9768999400"">https://apnews.com/article/fact-checking-afs:Content:9768999400</a>"
2021-01-10T20:50:09Z,"And watch Republicans try to blame this on Biden, despite having only been in office a handful of months, while he has to pick up this and every other mess Trump left behind."
2021-01-10T21:47:01Z,Of course they will.
2021-01-10T23:11:56Z,They’ll blame Obama
2021-01-11T00:38:00Z,The Republicans blamed and still blame President Obama for the mess Bush left no thanks for having saved the economy no thanks from trump for having inherited a strong economy! So I wouldn’t be surprised if the GOP Republicans and fox fake news will start criticising President elect Biden when he takes office! The American people should vote this people out of office in 2022 they should clean the mess this enablers have contributed! And I think trump should be prosecuted and jailed! He should be made an example for any other crazy future President who thinks he can also can get away with everything and not pay the price!😢
2021-01-10T20:49:00Z,"Much like the stupidity of the maga cult, the corona ain&#39;t going away, even after t&#39;rump&#39;s incompetence is gone from the public spotlight."
2021-01-10T20:48:08Z,Love you 💋💋😘😘❤️💯
2021-01-10T21:02:12Z,"same, love me too"
2021-01-10T20:44:03Z,"If you aren&#39;t wearing a mask in a public place, you should be arrested and/or fined more than you can afford. <br>I can&#39;t imagine telling someone their family member died from a disease they don&#39;t believe exists."
2021-01-10T20:57:03Z,Yes!!
2021-01-10T21:02:23Z,It’s fake.... it’s all fake! It will be exposed soon
2021-01-11T18:57:52Z,stop punishing &amp; attacking &amp; start caring &amp; educating!
2021-01-11T21:14:15Z,There is no virus! This is the devils work! It is completely fake. EVERYTHING you’ve seen or read or watched a video about completely does not exit!. Pray to GOD ALL MIGHTY. He is the only one that can stop the evil!
2021-01-12T04:05:24Z,@@bigdaddyjim9135 you&#39;re the devil&#39;s work!
2021-01-10T20:43:48Z,"What kind of countries censor voices and writings? Let&#39;s see, China, North Korea, Cuba, Nazi Germany come to mind. Who do they censor, the good guys or the bad guys? They always censor the truth tellers. Why do they censor? Because they are afraid the truth will get out. So now, who is being censored in America right now? Who has been banned on &quot;social&quot; media? Is it Joe Biden? Nancy Pelosi? No? Then surely it must be the militant ANTIFA or perhaps the Iranian leaders? Nope, they all have Twitter accounts. Believe it or not, this country has censored it&#39;s own President and his close allies by banning them from social media and now they are going after the alternate social media companies for allowing them a voice. Extremely telling, I&#39;d say. And if you agree with this censorship then you would have been a great Nazi because Nazis hated any message or idea or person that did not agree with them."
2021-01-10T20:48:51Z,It&#39;s a free country isn&#39;t it? trump can go on Parler and continue to speak to his supporters. I thought republicans were all about giving more freedoms to private business..
2021-01-10T20:58:26Z,"It&#39;s called &quot;capitalism&quot;, sweetheart. Facebook and Twitter are private companies with a Terms of Service. If you violate that ToS, you lose the privilege of using their services. Stop pretending you&#39;re a victim, crybaby loser."
2021-01-11T01:10:32Z,"@@howdoesthatmakesense the victimhood that is coming makes me wanna puke. Poor trump, had the House and senate, in 4 years never hit 50% approval rating, and lost it all. BUT they think he should have won a landslide!?"
2021-01-10T20:43:12Z,Private sector HEALTHCARE has failed 🇺🇸 for its built for profits not a national emergency
2021-01-10T20:59:08Z,Our Universal healthcare ain’t perfect.. but ffs..... if nothing else.. it fn there fir us👍
2021-01-10T21:16:13Z,"It&#39;s not healthcare that went wrong, it was public health policy, or rather lack thereof. The vaccine is being given for free, but there just isn&#39;t enough of it, because Trump lacked the foresight to order enough. Also, there were not adequate containment measure, as other countries initiated. It doesn&#39;t matter how one&#39;s healthcare is paid for, when there are countless idiots partying without masks."
2021-01-10T21:32:58Z,"@@deborahfreedman333 <br>Somewhat true.., cause doesn’t the healthcare system (type of system) you get .. go 🤚 in 🤚 with how it chosen , developed, funded... the culture n intentions behind it... &amp; isn’t it just more of the same at any aspect of this in the US...(&amp; multi state nations like US) different states n their independence n their demand for their own way/ culture... etc etc... realise the US is big.. but like Aussie having a different traffic signage system for each state.👍🙄.... the lack of willingness to be common/ uniform/ one nation n system.. 1 people all putting into a system where they all get good standard care -as a nation n get ahead as a community not independent n insular... standing up as a community n nation a declaring the healthcare is a human right... etc etc e blah<br>Yet still being capitalist n have private extra insurance if ya fn want..<br>And 2- isn’t the problem with the ability to vaccinate , you can manufacture plenty...<br>Trump is merely a symptom of an insanely highly individualistic and extreme capitalist culture ... worship of me n my $<br>Lol I’m a white capitalist in a western nation n that’s my view of the US from near 60yrs of watching 😂👍🌹🇺🇸🇳🇿"
2021-01-10T22:19:29Z,"@@deborahfreedman333 You need an ID to get it in Florida, and there&#39;s millions of people here without a valid ID."
2021-01-10T20:43:12Z,"God bless America, feel sorry 4 u thou am also bedridden with similar symptoms"
2021-01-10T20:40:44Z,"Thanks a lot, Republicans, for ignoring a global pandemic and denying science."
2021-01-10T20:59:28Z,Yea they are all self serving pigs
2021-01-10T21:02:58Z,The ones downvoting will probably be amongst that million dead by COVID-19.
2021-01-10T21:19:29Z,@UC93OQ6cUJbNXrDgKtTMTn5g really? 😂🤣😂🤣😂🤣😂 ok 🤣😂🤣😂🤣😂
2021-01-10T21:57:42Z,If most of those so called deaths are Biden supporters then it&#39;s a win
2021-01-10T22:14:00Z,"@@fallingiguanas6326 and that&#39;s why I know you aren&#39;t American.  On top of that, the Republican party is destroying itself because of Trump, so now more Dems like Biden are going to keep winning.  Just like they did in Georgia.  <br>Have fun watching your favorite, orange man get completely defrauded in the next coming months."
2021-01-10T20:39:32Z,"America is<br><br>23 in education.<br>25 in democracy index.<br>34 in raising a family index.<br>37 in healthcare.<br>No high speed train.<br>Highest number of homeless people.<br>Highest number of incarcerated people.<br>78% of people live paycheck to paycheck.<br><br>Stock market is not economy of Americans, where 90% of money belongs to top 10% of population, it&#39;s wallet of the rich!<br><br>Let&#39;s talk like adults, instead of name calling!<br><br>I have left ample of proof on my playlist, if you would like to check.<br><br>Let&#39;s make our country better together.. . ."
2021-01-10T21:27:22Z,"Even many &quot;3rd-World&quot; counties, like Thailand &amp; Uganda, have universal care.<br><b>What Thailand Can Teach the World About Universal Health Coverage</b><br><a href=""https://www.theguardian.com/health-revolution/2016/may/24/thailand-universal-healthcare-ucs-patients-government-political"">https://www.theguardian.com/health-revolution/2016/may/24/thailand-universal-healthcare-ucs-patients-government-political</a><br><i>&quot;Thai citizens gain universal access to essential health services at zero cost—and reap major benefits as babies get healthier, workers increase productivity, and households reduce financial risk&quot;</i><br><br>Moreover, according to the US National Library of Medicine - National Institutes of Health, Thailand is the #1 destination for medical tourism.<br><b>Thailand top destination for medical tourists</b><br><a href=""https://www.ncbi.nlm.nih.gov/pmc/articles/PMC3883860/"">https://www.ncbi.nlm.nih.gov/pmc/articles/PMC3883860/</a><br><br>There is only <b>ONE</b> &quot;developed&quot; nation on Earth that does not have some kind of single-payer, universal health coverage.   Guess what one?<br><br>So, you have to ask, can we really be classified as a &quot;developed&quot; nation?"
2021-01-10T20:39:28Z,"Do Americans use their taxes for wars and bailouts, instead of helping each other ?"
2021-01-10T20:49:51Z,Its for the wars and bailouts.
2021-01-10T20:38:39Z,Great job Joe 👏 👍
