PublishedAt,Comment
2021-01-11T01:47:44Z,"Your Salary will never grow in your bank account,you must acknowledge that fact💪 Investment is the key to success...<br><br>Work from the comfort of your home now with an investment of $200-$500 and you and confidently earn $2500-$5500 in 48 hours<br><br>Contact Mr Smith on whatsapp <br><br>+1 870-912-2931"
2021-01-11T01:30:57Z,Trump must be removed from office and  charged with crimes against HUMANITY
2021-01-11T01:29:18Z,"USA crappy health care system and hospitals on verge of collapse due to the huge amount of hospitalizations when other civilians need medical assistance yet can&#39;t get it due to Covid-19.<br><br>Primary deaths: Caused from Covid-19. Secondary deaths: Covid-19 patients taking up beds / medical aid from other people who then die.<br><br>All due to Trump&#39;s miniscule amount of interest in dealing with the virus and then eventually abandoning all efforts in the end while giving friends / family / politicians who have ZERO experience lead positions in the Covid-19 team. Trump is a mass murderer - he is <a href=""http://www.youtube.com/results?search_query=%23presidentbodybags"">#PresidentBodyBags</a>"
2021-01-11T01:26:02Z,more fake covid numbers
2021-01-11T01:22:57Z,"&quot;the 15 within a couple of days is going to be down to close to zero, that’s a pretty good job we’ve done&quot; - Trump<br>&quot;It’s going to disappear. One day — it’s like a miracle — it will disappear&quot; - Trump"
2021-01-11T00:59:14Z,"That&#39;s what happens when a country with conspiracy theorists , evangelical christians,  scientifically illiterate and science denying idiots have too much power and political influence  !   <br>      Here in Australia  ,  we have had less than a thousand deaths from Covid19 out of a population of 26 million.  <br>      We&#39;ve locked down hard and fast  ,  mass tested and enforced lockdowns and social distancing and our economy is recovering  ! 👍🇦🇺"
2021-01-11T00:44:02Z,It is unavoidable and a mathematical certainty.
2021-01-11T00:41:55Z,"Don&#39;t believe the media covid is a scam watch this informational documentary<br><a href=""https://www.bitchute.com/video/pyczBzMfOnuo/"">https://www.bitchute.com/video/pyczBzMfOnuo/</a>"
2021-01-11T00:39:40Z,"Not wanting to introduce worse news, but there is mounting evidence the UK variant is making younger people critically ill too. The average age of those in ICU keeps falling. Worse still, the South African strain of Covid is even more virulent and as well as having the same 501 mutation the UK variant has, it also possesses, 2 other major mutations."
2021-01-11T00:34:14Z,"Hopefully piglosi,  Biden and jamaican voodoo queen harris are included"
2021-01-11T00:30:11Z,"Trump said without his actions America would have two million deaths, in fact he has contributed to at least 200,000 deaths. Deaths per million 6th worse globally at 1,154, here in New Zealand 5 per million. Yes NZ has no land borders compared to Americas two, Canada 447 deaths per million, Mexico 1,027. Mexico poor, America rich."
2021-01-11T19:43:51Z,"Mexico did fine in managing it until eventually it was overwhelmed by the illegal drug runners importing it on mass into their country at levels that were beyond realistic to control. One of these days the US is going to start providing insulin for it&#39;s people at a decent cost so they don&#39;t have to engage in illegal drug running to get it from Mexico<br><br>You might want to throw Vietnam&#39;s numbers in there too, just to show them that the rice farmers beet them yet again :) Land border to China, yet Vietnam&#39;s had no trouble with it! 95 million people &amp; I think it&#39;s 35 deaths"
2021-01-11T00:28:01Z,"My humble opinion: don&#39;t think so. And I am pessimist.  500K maybe. Vaccine will be given to 80% 65 and older by May, conservatively.  The death rate will plummet by early March.  90% of death are all &gt; 65 years old.  Vaccines are &gt; 95% effective.  People keep talking about herd immunity which is indeed important, but it&#39;s really the elderly that contributes to hospitalization and death."
2021-01-11T00:22:15Z,Barona Casino has infected 100’s maybe 1000’s of people. Worst Covid spreader in the world. Sovereign Nation lawless establishment can do anything they want.
2021-01-11T00:16:18Z,"Jesus Christ saves from sin.<br>Romans 3: 23<br>For all have sinned, and come short of the glory of God;<br>Hebrews 9: 27 <br>And as it is appointed unto men once to die, but after this the judgment:<br>Isaiah 64: 6 <br>But we are all as an unclean thing, and all our righteousnesses are as filthy rags; and we all do fade as a leaf; and our iniquities, like the wind, have taken us away.<br>Revelation 21: 8<br>But the fearful, and unbelieving, and the abominable, and murderers, and whoremongers, and sorcerers, and idolaters, and all liars, shall have their part in the lake which burneth with fire and brimstone: which is the second death.<br>Romans 5: 8 <br>But God commendeth his love toward us, in that, while we were yet sinners, Christ died for us.<br>John 3: 16 <br>For God so loved the world, that he gave his only begotten Son, that whosoever believeth in him should not perish, but have everlasting life.<br>John 14: 6<br>Jesus saith unto him, I am the way, the truth, and the life: no man cometh unto the Father, but by me.<br>Romans 10: 9-10. <br>That if thou shalt confess with thy mouth the Lord Jesus, and shalt believe in thine heart that God hath raised him from the dead, thou shalt be saved.<br>For with the heart man believeth unto righteousness; and with the mouth confession is made unto salvation.<br>Jesus said John 5: 24 <br>Verily, verily, I say unto you, He that heareth my word, and believeth on him that sent me, hath everlasting life, and shall not come into condemnation; but is passed from death unto life.<br>1John 5: 10-13<br>He that believeth on the Son of God hath the witness in himself: he that believeth not God hath made him a liar; because he believeth not the record that God gave of his Son.<br>And this is the record, that God hath given to us eternal life, and this life is in his Son.<br>He that hath the Son hath life; and he that hath not the Son of God hath not life.<br>These things have I written unto you that believe on the name of the Son of God; that ye may know that ye have eternal life, and that ye may believe on the name of the Son of God.<br>Ephesians 2: 8-9 <br>For by grace are ye saved through faith; and that not of yourselves: it is the gift of God:<br>Not of works, lest any man should boast.<br>Romans 8: 1 <br>There is therefore now no condemnation to them which are in Christ Jesus, who walk not after the flesh, but after the Spirit.<br>1 Corinthians 15: 3-4<br>For I delivered unto you first of all that which I also received, how that Christ died for our sins according to the scriptures;<br>And that he was buried, and that he rose again the third day according to the scriptures:<br>2 Corinthians 5: 21<br>For he hath made him to be sin for us, who knew no sin; that we might be made the righteousness of God in him.<br>............................................................................."
2021-01-11T00:12:18Z,"Almost every family in America will know a family member or neighbour who has died or been infected by this contagious virus and yet almost half of Americans believe the pandemic is either a hoax or little more than a seasonal flu strain.  Politics has become so partisan that common sense, health and safety become victims of lies and mistruths."
2021-01-10T23:50:25Z,Brisbane Australia just came out of a 3 day lockdown and a mask mandate because of a single community spread of the UK strain. This pandemic can be managed many countries have demonstrated it is possible
2021-01-11T19:05:49Z,"and in doing so proved this new UK variant is a total dud! intimate partner infected, but not a single person in her 5 days out &amp; about in the community! Imagine how much different things would look if it was the traditional UK variant, as seen in Adelaide, or the US variant seen in Berela Sydney. Brisbane certainly showed how to follow directions so as to end the virus problem though didn&#39;t they!"
2021-01-10T23:48:22Z,"Sadly, many don’t care, and people like Peroxide Barbie arguing that there’s a “97/98% survival rate” only makes it worse. 🤦🏻‍♀️"
2021-01-11T04:49:22Z,Thank god she&#39;s disappeared
2021-01-11T08:47:11Z,"Yes, people don&#39;t seem to understand that surviving doesn&#39;t mean that you go back 100% health. There&#39;s just no knowing what long term effects this virus could have on people."
2021-01-11T12:00:07Z,"It&#39;s not about 97-98% survival rate. It&#39;s more about overwhelming hospitals which have no room for more COVID patients and other injuries. When the healthcare system collapses, there&#39;s no return."
2021-01-10T23:47:00Z,Well done Donald!!!!!!
2021-01-10T23:36:44Z,"Sorry government is busy at the moment. Your call is important to us, please call again in 10 days."
2021-01-10T23:36:21Z,"This number one million is horrifying! I&#39;m 69, and have been in my bubble since March! Going crazy yes, but not taking any chances! Waiting for vaccine in Las Vegas, who happens to be the slowest city getting the vaccine out!!! But yet, the Hotels and Casino resorts want to stay open, and expects employees too show up! Shame"
2021-01-11T00:30:07Z,Hang in there! We’ve been strict on our distancing too. 🤗
2021-01-10T23:32:59Z,Criminal Trumpanzee and GOP must held accountable
2021-01-10T23:28:06Z,"A million, + ...as I predicted. I co-developed Ebola protocol at the VA hospital in Louisville KY. <br>Read the Forbes article about me.<br>Guess what..... we&#39;re not done yet."
2021-01-11T19:06:53Z,so do you think state borders should have been closed like they have been in Australia?
2021-01-10T23:17:33Z,"I know we’re tired of masks and lockdowns, but we need one last push while the shots take effect. This is turning into The Stand."
2021-01-11T10:06:36Z,South Africa variant is making scientists very concerned. There is a reasonable chance SA variant could evade vaccines. Its not determined yet but it has multiple mutations from strain that vaccines initially tested for.
2021-01-10T23:02:25Z,Must watch!! https://youtu.be/8VFngRmp1HE
2021-01-10T22:59:13Z,Lies lies and more lies
2021-01-10T22:47:58Z,OMG! This is awful!  This is what happens when trump and the republicans don&#39;t deal with Covid-19 and promote lies to the American people!  How do we  move forward with this?? Especially when you have people who don&#39;t believe there is a virus or even wear masks!  We have traveled down this path for almost a year and are worst than we started!
2021-01-10T22:44:30Z,We have to get Joe inaugurated so we could lead us out of this COVID-19 nightmare.
2021-01-11T08:43:04Z,Watch this space. I guaranty that when Biden takes over the office Republicans are going to blame the Democrats for the poor state of the health service and the lack of jobs etc.
2021-01-11T14:08:53Z,"@@asheronwindspear552   Joe was given an excellent foundation on which to work. A few days ago even Joe had to admit that Trump did an excellent job in rolling out the COVID-19 vaccine. Remember when we saw breathless media people standing out in front of a pharmaceutical company with trucks rolling out filled with vaccine headed to the airport with police escort?  We saw FedEx aircraft leaving to deliver the vaccine. <br>    All of what we saw did not just happen. The trucks the aircraft all of this was planned and put in place. Even the early rollout of the vaccine save lives.<br>     So Joe and his new administration were given a very good foundation on which to build. What Joe needs to be concerned with now is to lower the infection and the death rate. Yes after several months infections continue to increase and people continue to die in deed, Joe is going to be blamed because it is now his administration, his policy and his procedure.<br>    Joe said he was going to solve the COVID-19 problem so now we are all counting on him to lower the infection rate, lower the death rate and you are indeed correct that if we do not see progress he will be blamed and rightly so."
2021-01-10T22:41:20Z,"ALL  BECAUSE  OF  TRUMP.  He undermined the response and decried the first safety measure, Masks. Trump is the new Hitler"
2021-01-10T22:39:55Z,Im from Europe. I think Trump messed up! I hope the new president will help all the Americans soon!
2021-01-10T22:36:41Z,"Congratulations Trump, now are we not only dealing worse with the pandemic than any other country on Earth, but we are going to be worse than we were 100 years ago."
2021-01-10T22:33:44Z,Donald Trump is a Psychopathic murderer who is using the virus as a weapon against the United States of America.
2021-01-10T22:22:01Z,It didn&#39;t have to be this way .... but the Trump administration made it so.
2021-01-10T22:19:50Z,"Trump&#39;s base they are spreading the coronavirus intentionally, they know that it&#39;s not fake, it&#39;s a way of killing people to them, just ask one that&#39;s exactly what they will tell you."
2021-01-10T22:11:40Z,"Covid-19 did hardly nothing to the people around here. Most were sick for a few days, all recovered."
2021-01-10T22:08:39Z,"Pretty sad, but not unexpected, given Trump’s response to the virus since day 1."
2021-01-11T13:56:33Z,But it is more than Trump. US culture places individual freedom over responsibility to each other.
2021-01-12T02:55:43Z,"@@vicj2141 really is that what you believe? What about all the people who take an oath to take care of the sick and injured. Should they just say “Screw it, I’m okay.” What about all the people who take an oath to serve in the county, should they say “Hey, this isn’t my fight.” With freedom comes frigging responsibility - man up for crying out loud. It is just a mask and it is frigging saving lives. Take part in what will give you back your freedom and your jobs. Stop looking at restrictions and being the enemy and start fighting the virus."
2021-01-10T22:07:38Z,"Hope it&#39;s trump, his family and his supporters."
2021-01-11T00:36:31Z,They’ll get all the best treatments. 🤷🏻‍♀️
2021-01-10T22:05:47Z,Republican leaders: &quot;Those who die have lazy immune systems. Just pray harder and get back to work. Where&#39;s our American fortitude gone? No handouts!&quot;<br>Meanwhile they get routine checkups and a top secret antiserum made from freshly squeezed fetal steam cells. Thoughts and prayers are good enough for you.
2021-01-10T22:02:31Z,"Hard to believe that Congress went right back into the capitol building just after all of those unscreened people were running around in it. Nobody disinfected the place, so at least some people can see what&#39;s going on"
2021-01-10T22:14:45Z,Guess you missed the footage of the janitorial staff ahead of them.
2021-01-11T18:56:56Z,no proper bomb checks either! Amazing there wasn&#39;t a total decapitation of the entire US government! There was certainly the ability for that to occur!
2021-01-10T21:59:53Z,"On top of everything else, the insurrectionist attack on the Capitol was a massive super-spreader event."
2021-01-11T04:46:31Z,"It&#39;s just too bad it will effect others more then them. If all they were doing was spreading it amount themselves and killing their selves, I&#39;d be all for it. But they spread it to innocent people and they are who is hurt. And these morons don&#39;t get that. They think, well it&#39;s just myself I&#39;m putting in danger, but it&#39;s not. I don&#39;t know why they can&#39;t understand this."
2021-01-10T21:59:17Z,"On top of everything else, the insurrectionist attack on the Capitol was a massive super-spreader event."
2021-01-10T23:57:29Z,"As a Canadian, I will simply say this: it is pretty bad when a once in a century pandemic that is running rampant across your country takes second place in the news to the nonsense generated by the people in the White House."
2021-01-10T21:55:32Z,"It&#39;s amazing that wuflu disappears when they think Biden is winning but now that they know Trump is going to put the Biden crime family in jail, wuflu is back. Does anyone on the left see any trends??"
2021-01-10T22:03:06Z,Jose Hernandez Trump isn&#39;t done yet and MSM knows this that&#39;s why big tech is removing MAGA from social media and MSM continues to gaslight because they are panicking!! They wouldn&#39;t be acting like this if they were winning think about that for minute.
2021-01-10T22:40:34Z,Jose Hernandez Trust me your not winning🤣
2021-01-11T02:47:31Z,Jose Hernandez The MAGA base has never been stronger!!💪
2021-01-11T15:07:08Z,Jose Hernandez We want your side to believe that so yes to whatever you just said 😆
2021-01-11T18:03:31Z,Jose Hernandez We see everything and now it&#39;s time to clean house.
2021-01-10T21:54:56Z,"While Trump has been actively downplaying the Pandemic since January and doing everything possible to ensure they we were unable to detect and treat it, we have lost nearly as many Americans as have been lost in combat in all American wars since 1776.  We will obviously surpass all combat deaths some time this year.  Trump has been pushing that he won the election and he can&#39;t believe that Biden one.  You intentionally let the pandemic spread unchecked, admit that you intentionally lied about the danger, and you actually believe that the majority of Americans want more of you?  What I can&#39;t believe that we have 74 million knuckle dragging Neanderthals that voted for you again  (sorry, didn&#39;t mean to insult the Neanderthals, I am certain they were smarter that Trump voters, after all, they cooked with fire and used stone tools)."
2021-01-10T21:52:12Z,"Republicans declared civil war on the rest of us on the 6th in their treasonous, terrorist, white supremacist, Nazi attack on the Capital in effort to become America&#39;s first (fascist, bigoted) dictatorship.  They are trying to plan a 2nd coup attempt on the 17th in DC as well as all 50 capitals.  They&#39;ll go full Nazi if we let them.<br><br>If they had reached Pence and congress people before they made it to safety, they&#39;d have taken hostages and likely killed some more people and they&#39;d likely still have control over the Capital now in effort to make Drumpf a dictator. Treasonous terrorists!"
2021-01-10T21:50:08Z,This is serious business!!!
2021-01-10T21:49:20Z,"The terrorist can be spraying these viruses in solution on public places, how will we know?"
2021-01-10T23:54:53Z,"Well true, but that could happen anywhere, anytime. You wouldn&#39;t need this virus for that."
2021-01-11T00:01:25Z,"@@tomterrific9459 how about the good old USA!!  There is NO love in the world for Americans,  NONE!!!  We need to start fighting back!!!"
2021-01-11T00:08:43Z,"@@tomterrific9459 the muslims say, &quot;if you crack my jaw, I will crack yours,&quot;"
2021-01-11T00:13:14Z,"@@tomterrific9459 I guarantee you, there will be no islands in the south china seas!!!  00000.00000"
2021-01-11T19:16:03Z,"@@goodnews4076 You&#39;d know by listening to them speak at trump rallies. US terrorists aren&#39;t smart enough to do that, they still think they need to get themselves infected to spread it, a spray bottle is beyond their IQ level"
2021-01-10T21:46:39Z,😥😥😥
2021-01-10T21:44:19Z,"We will hit 500,000 deaths by the first of March."
2021-01-10T21:42:12Z,What a legacy Trump has left our nation.
2021-01-10T21:41:50Z,"Time for a total lockdown now, like all other country&#39;s did, otherwise its to late!!!"
2021-01-10T21:40:54Z,Nope
2021-01-10T21:38:41Z,Hi Boys 😍💋 💝💖♥️❤️
2021-01-10T21:35:48Z,The major thing to do is social distance. The world have know that since the outbreak. Then he started his rallies. The outbreakes had to come and the crazy people who listned to him and joined this crowds.
2021-01-11T18:55:13Z,"agreed. Remember that Biden&#39;s win celebrations did exactly the same thing too though, so it&#39;s not just one side, it&#39;s both!"
2021-01-12T02:35:25Z,"@@MeYetAgain winning an election is more important than saving lives, no matter what party it is"
2021-01-12T03:28:54Z,"@@marias5088 and not just winning, but going out to party after the win it seems too"
2021-01-10T21:32:34Z,it will actually reach 1.5 million
2021-01-10T23:01:24Z,"Nope. Covid-19 will gain the ability to pierce through masks, enter your ears, follow people, be more lethal, and &quot;live&quot; in the indoor/outdoor air for 20 weeks. Estimated death count? 20mil. Covid has leveled UP. <a href=""http://www.youtube.com/results?search_query=%23wearedead"">#WeAreDead</a><br>Also....<br><br><br><br><br>It&#39;s a joke, don&#39;t die to covid-19!"
2021-01-10T21:29:09Z,"Donald Trump...<br><br>- Inherited a plan to contain a pandemic, but chose not to use it because it was commissioned by the Obama Administration. <br><br>- Recently accused a doctor of faking a makeshift COVID ward set up in a parking garage. <br><br>- Neglected to refill medical stockpiles for 3 years.<br><br> - Mistakenly predicted that, &quot;like a miracle,&quot; COVID would go away.<br><br>- Repeatedly falsely claimed we were &quot;rounding the corner&quot; on COVID.<br><br> - Pushed snake oil cures and touted an endorsement by a &quot;doctor&quot; who said COVID was a result of &quot;demon sperm&quot;. <br><br>- Left states to fend for themselves, forcing them into a bidding war against each other. <br><br>- Pushed hydroxychloroquin as a cure despite virtually all experts saying it had not been proven, even as a treatment. When one of his claims was rebuked by a scientist, Trump responded, &quot;I don&#39;t think science knows.&quot;<br><br>- Echoed the demands of domestic terrorists who planned to kidnap and hold a mock trial for the Governor of Michigan because of her COVID restrictions.<br><br>- Re-routed CDC data through the White House, where it was censored and re-worded.<br><br>- Removed the WHO&#39;s pandemic team from China months before it hit the US.<br><br>- Shamelessly politicized the disease, calling it a Democrat hoax. <br><br>- Repeatedly flouted local safety restrictions, the advice of the CDC, and his own COVID task force.<br><br>- Consistently blamed China for failing to contain COVID, but failed to contain it in the US, and failed to keep his family and White House staff from contracting it.<br><br>- Filled the COVID task force with people with more expertise in PR than medicine.<br><br>- Tried to take millions of Americans&#39; health care away during the worst pandemic in over a hundred years. <br><br>- Made multiple false claims about how it would just go away by certain dates, and was wrong every time. <br><br>- Held many large rallies and celebrations with little to no social distancing instead of setting a good example. He removed social distance stickers from seats at at least one rally.<br><br> - Repeatedly suggested that we should slow down testing so the numbers would decrease and make him look better. <br><br>- Spread false propaganda about COVID being no worse than the flu after telling Bob Woodward that it was a vicious disease, and that &quot;If you&#39;re the wrong person, you don&#39;t stand a chance.&quot; <br><br>- Claimed that 99% of cases were &quot;totally harmless&quot;. <br><br>- Discouraged his supporters from listening to the medical experts.<br><br>- Repeatedly discouraged mask-wearing and ridiculed those who wore them.<br><br>- Constantly lied about the US fatality rate.<br><br>- Repeatedly lied about testing rates and how the US compared to other countries.<br><br>- Baselessly blamed Mexico for COVID spikes in the US.<br><br>- Threatened to defund public education to try and force children to go back to school before the full impact of the disease was known. <br><br>- Baselessly accused hospital staff in New York of selling Personal Protective Equipment &quot;out the back door&quot;.<br><br>- Handled the pandemic so poorly that it crippled the economy and put 9 million people out of work, into a housing crisis, creating massive food insecurity. <br><br>- Claimed that COVID-19 was being overblown because of the US general election despite it being a world pandemic. <br><br>- Lied about Google engineers building a website to help Americans determine whether they need testing for COVID-19 and to direct them to their nearest testing site. <br><br>- Claimed to have saved 2.2 million lives by restricting travel from China, but allowed nearly 40,000 people to enter the US from China. 2.2 million was the projected death toll if we did nothing at all.<br><br>- Claimed this was something nobody thought could happen, when experts both inside and outside of the federal government sounded the alarm many times in the past decade about the potential for a severe global pandemic.<br><br>- Wondered aloud if injecting bleach or somehow shining UV light inside of the body could cure COVID."
2021-01-10T21:28:55Z,It will be gone next week like magic until then drick clorine or get some sunburne on the inside of your lungs. Send him and his folks to Guantanamo.
2021-01-10T21:28:47Z,Hit the 1 million goal? Score for America!<br>Then burst into tears
2021-01-10T21:27:27Z,So Nice 💘💘💘💘💘💘
2021-01-10T21:26:29Z,And I thought it was going away miraculously...
2021-01-11T19:01:21Z,"It is, just got a few more potential hosts to get rid of first, then when they&#39;re all dead, the virus won&#39;t be able to continue spreading, will be a miracle!"
2021-01-10T21:26:26Z,He and his coup troups almost turned USAinto Zimbabwe or Venetzuela.
2021-01-11T12:25:08Z,Coup Klutz Plan
2021-01-11T17:49:43Z,Don&#39;t keep insulting Zimbabwe or venezuela. They have a much lover death rate by the virus than the USA
