PublishedAt,Comment
2021-10-05T00:49:37Z,74% of cases in Massachusetts were people that had been fully vaccinated.<br>Currently we are at 300% the number of cases last year when we did not have a vaccine.<br>Israel&#39;s cases have skyrocketed after they got 60% vaccinated.
2021-10-05T01:15:02Z,Total coincidence
2021-10-05T01:24:04Z,correlation doesn&#39;t equal causation
2021-10-05T01:26:06Z,@@matteframe increased viral loads
2021-10-05T06:26:43Z,"Link to your source of your first claim regarding Massachusetts, please."
2021-10-05T12:23:44Z,@@vaels5682 they have no source. They&#39;re a liar.
2021-10-04T20:11:48Z,ask yourself why are so many not getting? why are they the front line workers risking there jobs and not taking the vaccine?? Do your research and watch what these people have said over the years and current...
2021-10-03T21:50:46Z,"WAKE UP AMERICA!! The US has already surpassed 700,000 deaths from COVID-19!! Since, we are not all doing what it takes to keep everyone safe from this deadly and debilitating virus...social distancing, sheltering in place, wearing masks correctly, self-quarantines...then the best alternative is to get COVID-19 vaccinations. Lest we forget, Trump and his cohorts chose not to protect us from the spread of COVID."
2021-10-03T21:41:10Z,"If someone Does Not Want Vaccine &amp; Refuses to wear Mask -- Better let them Suffer the Consequences of COVID - As they have no right to occupy a hospital ICU Bed That Should Be Kept Reserved for Cardiac , stroke &amp; Other Trauma Patients..<br>These people are knowingly taking the Risk claiming their freedom &amp; Right ...so they all need to Man up &amp; Stay home ,&amp; go throught it ...No right to take occupy the Precious ICU Beds"
2021-10-03T20:47:19Z,Is this kind of backwards like won&#39;t control but the healthy gun tolin Americans are going to be the only ones left alive soon..... Not very good for a civil war when you&#39;re the government...
2021-10-03T01:19:06Z,"Why are borders , schools  open"
2021-10-02T05:11:29Z,"I wish hospitals could refuse the unvaccinated, because the unvac deserve no help. Period…"
2021-10-05T02:45:13Z,Rosie Cheeeks what would make them ineligible? And haven’t you heard of people getting covid twice?? Naturally immune is not a thing really
2021-10-05T03:35:51Z,"Rosie Cheeeks thanks for the information, I should have said “except those who are not eligible”"
2021-10-05T03:41:17Z,Rosie Cheeeks I hope you recover well! So then you can get vaccinated!
2021-10-01T23:11:28Z,"Americans have to be educated about nutrition and fitness. I see whole families who are obese dying from Covid, and it’s unnecessary!"
2021-10-03T01:20:20Z,Lot skinny people sick too
2021-10-01T23:03:55Z,Florida has 3x the Covid daily death rate of California. Recall DeSantis!
2021-10-01T22:04:03Z,"The unvaccinated died for the cause. I’m not sure what the cause is, but they gave their life for it . Patriot in arms ❤️🇺🇸"
2021-10-01T19:32:50Z,The protected need to be protected from the unprotected by forcing the unprotected to use the protection that does not protect the protected?<br>Got it!
2021-10-05T01:30:01Z,"Lmfao,but the &quot;science&quot; shows the vaccine is worthless....the sheep who allowed a government to inject them with God knows what are spreading covid and getting sick more than the unvaxed....proof everywhere"
2021-10-05T01:51:15Z,"There is, of course, the possibility of being overly protective of the under protected."
2021-10-05T01:56:07Z,Dang!
2021-10-05T04:40:59Z,Your not very bright are you.
2021-10-05T04:42:41Z,@@magapatriot3740 🤣wtf kinda conspiracy Qanon garbage is this.  I bet your not even a DR.
2021-10-01T18:53:25Z,"All of ^ this ^ around the clock fear mongering for going on two solid years now, and how many do you honestly know of that passed due to covid without the presence of completely unrelated terminal illness? Shouldn&#39;t we ALL know of even just one, by now?"
2021-10-01T16:23:10Z,Altering my genes is a matter of a salary rate decision because <br>I am morally and intellectually defunct.
2021-10-05T06:35:43Z,No content says a lot about what you have to say.
2021-10-01T16:21:03Z,Anti vaxers. Parents caring for vaccine severely injured children are the villains of the day. Like aging war veterans that vote Republican. Loathsome.
2021-10-01T11:39:03Z,MSN~ Showcasing the Mentally Blind.<br>Sponsored by YouTube
2021-10-01T11:25:04Z,Censorship is NEVER a step to the right direction.
2021-10-05T01:33:19Z,Agree😢👍<br>This country is in terrible trouble.
2021-10-01T10:45:24Z,"From Europe: Didn&#39;t Biden won 3 red states with margins around 40.000 votes? And haven&#39;t the GOP recently voluntairy doubled those margins already, by letting tens of thousands of their voters die of Covid?"
2021-10-01T07:14:13Z,"Come on, stop this virtue  signaling… those people who want it, should get the 2nd shot or 3rd booster shot, we need to be careful and let delta or gamma or the soon to be Florida or Texas variant cleanse the country out of those wackos, cannot believe we are begging them not to be killed! If anything this pandemic provides a unique opportunity in history. Get wiped out  by their own stupidity, not because we don’t have the means or the science, but because they choose so. Let them be adults and live with the consequences of actions! Their body their choice, and hopefully for those ones that do not die they will realize the circular argument, women should also have the same ability to chose what’s better for them! Not only white, mainly men wackos! But pregnant women as well! Hunker down people, use your masks, avoid crowds, a little push more and we will have a better country after this! This cannot only but be positive for the country, we don’t see it now, but it will be!"
2021-10-01T07:11:56Z,Adult without medical excuse or documentation you&#39;ve antibodies  == No vaccination no service at a hospital. We are coddling the anti-vaxxers. Give them the respect of their decision. They show up at the hospital show them the door. They&#39;ll breathe easier a lot more outside in the cold. Everybody knows 30-degree air contains twice as much oxygen as 90° .
2021-10-05T10:04:23Z,Rosie Cheeeks Note edit
2021-10-01T06:57:03Z,"PRAYING FOR HEALING FOR PATIENTS &amp; STAFF!!! IJN!!! AMEN. A great time to enter the health profession. Starting as a housekeeper, aide, etc..can intro you to other med fields where you can service now &amp; in the future!!! Praying retired medical will mentor where needed !!!"
2021-10-05T01:23:11Z,Be very afraid.
2021-10-05T06:34:32Z,Go to heal...
2021-10-01T06:46:25Z,Sensationalism
2021-10-05T01:25:28Z,99% survival rate.
2021-10-01T05:36:39Z,Some people are too afraid of a tiny little needle poke to get over their own selfishness.
2021-10-05T01:28:08Z,"Our bodies, our choice. If the vaccine works for you, why do you care so much?"
2021-10-05T02:13:18Z,Dude you ignorance is epic!
2021-10-05T21:48:59Z,So we face the fear mongering that we are going to absolutely die without it and that makes us afraid?  The only people I see on here that are afraid are those of you wringing your hands and clutching your pearls because you&#39;re afraid of the unvaxed even though you&#39;re supposedly protected with the vax?  You make absolutely no sense.
2021-10-01T05:35:21Z,Yawn. Then quit.
2021-10-01T02:57:04Z,So now dr death wants to change tbe definition of vaccine again. This is the fourth time.
2021-10-01T01:13:54Z,😳 😳The Biden Administration is Mandating the Death 💀 Jab!!!   Start the  Nuremberg Trials Now!!!
2021-10-01T00:43:36Z,If you do allittle research youll find that 80% of cases in hospitals are fully poisoned.
2021-09-30T23:46:56Z,"decuk oppe you deleted all your comments and ran away, those little FACTS scare you??"
2022-03-01T09:43:28Z,You tried to comment to someone on a video. 🤣
2021-09-30T23:37:02Z,OVERWHELMED!!!!<br>AND THE DEMOCRAT SOLUTION IS ------- fire unvaccinated healthcare workers....who were heroes a few months ago when they treated patients when there were no Trump vaccines.
2021-09-30T23:18:55Z,99% survivability. No foundation scam. How many fails? Enough to call the armed forces?
2021-09-30T23:16:47Z,It&#39;s not a vaccine. Thin ice scam foundation.
2021-09-30T23:08:00Z,"The vaccine is a billion dollar money maker thus the mandates. An early treatment hydroxychloroquine is banned as it is not a money maker at just 50 cents a pill. Why are not migrants not tested, nor quarantined, or mandated to get the vaccine before being bussed across the country?"
2021-09-30T22:47:55Z,Covid is an IQ Test. The GOP failed.
2021-09-30T20:43:25Z,Censorship is like an xray of the enemy. The technocracy is made up of very weak people. Words are a mighty weapon to their fragile psyches.
2021-09-30T20:37:41Z,Anti vaxxers. The people caring for children severely injured by vaccines. They&#39;re the poster child for bad citizenry like the aging vets that vote Republican. Loathsome.
2021-09-30T20:36:06Z,I have never voted Republican. And have never been anti vaccines until 2020. It&#39;s a special-ed propaga ploy that targets people with abnormal responses to peer pressure.
2021-09-30T20:20:06Z,Can&#39;t you still get it and pass it even with shots???? What about Natural immunity ??.... I know people that still ended up in the hospital anyway
2021-10-01T05:47:44Z,Natural emunity is not enough for this just like it wasn&#39;t enough for polio.  You can still get and spread a smaller amount if your vaxxed. And if you have underling stuff you can wind up in hospital.. but there&#39;s cases are rare. When you vaxxed it doesn&#39;t hit you as hard.
2021-10-01T06:57:47Z,@@pennydavis9494 Well if that&#39;s what you believe  .... I know people personally that ended up in the hospital anyway with Zero &quot;underling stuff&quot;... I already had it about a year later I had a mild case.... I have issues to deal with ..... Not taking a risk at a vax injury to add to my problems ... we all know that black people don&#39;t get taken serious by the Medical Healthcare Insurance Big Pharma Industry
2021-10-05T01:40:28Z,@@pennydavis9494 Don&#39;t worry selection pressure will cause  another variant to emerge that will be resistant to the current vaccine over and over again just like the flu shots.  All the while the vaccines are tanking your immune system leaving you vulnerable to almost anything.  Good Luck!
2021-10-05T02:31:03Z,Natural immunity is a lot better than the death shot.
2021-10-05T02:31:46Z,@@anti-equity1027 yep but they won&#39;t listen to anything
2021-09-30T19:22:06Z,Somewhat arrogant of YouTube to censor supposed misinformation. Since when have they been experts in the field of medicine?
2021-10-05T04:41:11Z,"Google makes money by spying on people, so of course, the moral high ground is theirs."
2021-10-06T09:47:44Z,Marty Baldwin <br>What does your comment mean?  Explain.
2021-09-30T18:36:35Z,"Meanwhile Pfizer, Merck etc are working on a covid-19 pill that works eerily similar to ...wait for it...Horse dewormer."
2021-09-30T18:08:09Z,Is it really from Covid or because so many health care workers have quit because of mandates that there’s not enough staff?  A manufactured crisis?
2021-09-30T17:07:07Z,"@/Covid_19 is cumulative and permanently stay at human body&#39;s T-Cell then cause it malfunction to replicate, destroy and spread even you have fully recovered from covid infection or fully vaccinated. <br><br>Covid vaccine has the structure of AIDS same as C19 virus to deceive your immunity system to create T-Cell perish together with the virus(just like overclocking immunity system temporarily) but unable to deceive the new C19 variant. (2"
2021-09-30T16:27:30Z,The failure of a product blamed on people who refuse to use it. America has become clown world.
2021-09-30T16:09:56Z,What about the migrants.  Btw I am not dying for trump.  I am living through Jesus.
2021-09-30T15:37:08Z,No more Fox news Woop Woop!! 👏👏👏
2021-09-30T19:28:51Z,"All those lies and misinformation about Russia collusion. Tell me, who broadcasted that wacky theory?"
2021-09-30T15:30:58Z,I say DONT treat the unvaccinated Adults! They made a choice let them deal with their situation on their own!!
2021-10-01T05:51:23Z,I say treat the vaccinated first. Then the unvaxxed.
2021-10-01T16:06:20Z,Lol dems going from help everyone to help the ones only I care about lolololololol how easy things have changed
2021-10-05T01:34:17Z,Vaccinated are in there too. Just not being reported.
2021-10-05T06:28:54Z,"@@sufyb6432 Of course they are being reported, are you dull?"
2021-09-30T14:42:59Z,If YouTube is purging anti-vaxers why are there still anti-vaxer trolls in the comment section?
2021-10-05T01:27:44Z,We just can&#39;t post that&#39;s the thing.
2021-10-05T01:32:31Z,Nobodies an antivaxxer everyone has a pro choice opinion on the matter. 300% more Covid cases this time this year than last year with no vaccine? 75% of hospitalized cases in Massachusetts are vaccinated. Israel’s at 60% vaccinated with higher numbers than last year. So you tell me why I should get it?
2021-10-05T14:18:13Z,"@@TehXygen Nobody&#39;s an anti-vaxer except everything you quote is disinformation. You tell us why shouldn&#39;t you get it?? Young healthy, I believe in turd logic anti-vaxer."
2021-09-30T14:41:39Z,This just in: The unvaccinated are reported 95% more likely to shoot at helicopters with RPGs
2021-09-30T14:39:38Z,"I say stop saving them, they made their choice. I know that&#39;s ice cold but goes with the saying &quot;Cant save stupid&quot;"
2021-10-01T03:19:44Z,Anti-vaxxer: “I will never take your Vaccine. I am not a sheep.”<br><b>1 Week Later...</b><br>Anti-vaxxer: <b>Cough Cough</b> “Please... H-help me-“ <b>Cough</b><br>Me: <b>Looks at clogged Hospital beds</b><br><b>Looks at begging Anti-Vaxxer on the floor</b><br><b>Turns around and walks away</b>
2021-10-05T21:56:47Z,"Hmmm.... Let&#39;s use that same logic on people who fed their bodies nothing but crap their whole life, or drank, or became obese couch potatoes.... All bad choices and yet we still take care of them.  I hope you are the epitome of glowing health and you never end up with chronic illness because of your choices lest we stop treating all gluttons as well."
2021-09-30T14:13:09Z,why is this guy on TV. he is tainted
2021-10-03T14:55:07Z,You right like I&#39;m gonna trust him lol
2021-09-30T13:39:18Z,<b>DON&#39;T GET VACCINATED</b><br><br>                    <i>WILMORE FUNERAL HOME</i>
2021-09-30T13:26:14Z,"Your Health Insurance companies should invalidate the Health Insurance of all unvaccinated people and hospitals should only admit people ,who can produce a vaccination certificate. People who  cannot produce vaccination certificate should be turned away. Children and teenagers who get Covid ,would of course still be treated<br>     I broke my arm whilst staying in St. Louis ,MO ,in 2008. At the Barnes Jewish Hospital I had to produce a Certificate of Insurance before I could be treated . Do the same with vaccination certificates,by Law. Checking them before admission to Emergency will only take about 1 minute !"
2021-09-30T13:11:25Z,Only way to get rid of covid..is to vote it out of office.   Covid served its purpose. Biden is in office
2021-09-30T13:04:27Z,the real question is why are unvaccinated ppl overwhelming hospitals in the US when the rest of the world is experiencing a breakthrough pandemic?
2021-09-30T20:52:15Z,The government is lying that the unvax R overwhelming the hospital. They trying 2 get more unvax people 2 get the shot. Why R people not seeing thru the lies
2021-10-05T01:29:11Z,Just their daily dose of fear mongering.
2021-09-30T12:55:33Z,maybe don&#39;t fire all the nurses?
2021-10-05T01:34:50Z,👍
2021-09-30T12:37:48Z,I wouldn&#39;t go to any hospital where they choose your treatment with no second opinion.
2021-10-05T01:59:37Z,"When you can&#39;t breathe, how you can give second opinion?"
2021-10-05T04:50:24Z,"@@kocc7966 Think about what you&#39;re saying, or is English not a first language for you?"
2021-10-05T06:00:14Z,"Ya know, in these 18+ months of all this, I have BARELY heard of anyone suggesting a second opinion. Thought that was common practice/ sense"
2021-10-05T06:00:28Z,@@David..832 The way you write exposes your level of English! 😆
2021-10-05T09:12:15Z,Marty Baldwin That&#39;s their own fault if they don&#39;t. Remdisiver is some bad stuff and it&#39;s killing people.
2021-09-30T12:34:37Z,Calling the flu covid ensures it will never go away.
2021-09-30T12:29:30Z,Send them home!!!! Why should really ill people have to suffer because of these idiots.
2021-09-30T12:22:15Z,"Actually, any ban on those types of videos IS good even if it&#39;s so late."
2021-10-05T01:40:26Z,"&quot;When you tear out a man&#39;s tongue, you are not proving him a liar, you&#39;re only telling the world that you fear what he might say.&quot; George R R Martin"
2021-10-05T01:44:42Z,@@kam.26 logic escapes this kind. They need their tv to tell them how to live.
2021-09-30T12:21:19Z,I love how the doctor is just fed up with people not getting vaccinated but using hospital resources when they get sick. There&#39;s a better less painful way to do this and they&#39;re just being cowards.
2021-10-05T01:20:08Z,Time will tell who is right.
2021-10-05T05:59:40Z,He should lose his lisence
2021-09-30T12:08:49Z,2 years later. .the media is still scaring covidiots with their lies.  Most people have gotten tired of the political virus and have moved on
2021-09-30T12:03:07Z,Just remember that everyone who comes in to work at Fox News must show proof of vaccination or be tested DAILY.
2021-10-02T15:56:11Z,Truly a miscarriage of justice that they even let FOX have access to vaccines.  FOX should have been forced to follow their own misinformation and propaganda and use the nonsense remedies they promote on their shows. A waste fo good vaccines to allow them to be given to FOX employees.
2021-10-05T00:51:59Z,74% of cases in Massachusetts were people that had been fully vaccinated.<br>Currently we are at 300% the number of cases last year when we did not have a vaccine.<br>Israel&#39;s cases have skyrocketed after they got 60% vaccinated.
2021-10-05T01:26:43Z,@@Kraang <br>I hope there&#39;s fries included with them Whoppers.
2021-10-05T01:31:03Z,@@coreyham3753 CDC director came out and said that those vaccinated are now at higher risk for other diseases due to the weakening of the immune system. Also stated that those vaccinated can still pass the virus to others as well as get sick and even die. Its pretty easy to access this information put out by the CDC director. You can find it right here on youtube.
2021-10-05T06:50:44Z,@@Kraang LMAOOOOOOOOO ... all lies and BS. Must be a stop the steal believer and capitol hill traitor.
2021-09-30T12:01:23Z,"Unfortunately, there is no vaccine against stupidity and ignorance."
2021-10-01T06:38:03Z,"Don&#39;t worry, COVID-19 can fix that..."
2021-10-05T01:30:21Z,"I mean if they want to have their lives in the hands of eugenicists in a lab.<br>Nothing stopping them from taking the vaccine, and to save the planet. ⚰️⚰️⚰️🌲☑️"
2021-10-05T06:18:03Z,"@@kaylahills3760 You realize effectively zero people have died from the vaccines, right?"
2021-10-06T04:37:32Z,@@vaels5682 shut up.
2021-10-06T04:37:32Z,@@vaels5682 shut up.
2021-09-30T11:58:22Z,2000 deaths per day…😞  <br><br>Please take the vaccine 🙏🏻❤️. Please!
2021-10-05T00:52:19Z,74% of cases in Massachusetts were people that had been fully vaccinated.<br>Currently we are at 300% the number of cases last year when we did not have a vaccine.<br>Israel&#39;s cases have skyrocketed after they got 60% vaccinated.
2021-10-05T01:24:01Z,"My body, my choice, remember?"
2021-10-05T01:32:04Z,There&#39;s an agenda behind the unverified testing and mass vaccination the world population.<br>And that is the GREAT RESET 🌐🇨🇭🇪🇺🇨🇳 aka Agenda 2030 Sustainable Development:
2021-09-30T11:47:20Z,Meanwhile in New York people don’t wanna get vaccinated
2021-09-30T11:40:17Z,No vaccination? No service. Stop bailing out stupid people. Show up at the ER sick with covid but unvaccinated? Go home and choke. That will get idiots attention.
2021-09-30T11:30:41Z,"Easy fix, if it’s not a break through infection…send them home.  They chose not to get vaccinated, so own that misinformed decision and die at home."
2021-09-30T11:29:49Z,I f unvaccinated people anywhere who seek treatment should be told to go home and tough it out.(OR NOT).
2021-09-30T11:26:41Z,"Death touches us all… eventually. Why rush? I was unwell. Doc said do this, take that. Literally, in a short time I was better. I trust doc. He’s actually pretty smart. Thanx doc!"
2021-10-05T01:42:50Z,Nice advertisement. 🐑
2021-10-05T06:15:25Z,@@yuckfootoob9499 You like getting Polio? How about Measles?  Maybe doctors have done a good thing or two hmmmmmm makes you think.  Or maybe you aren&#39;t capable of that
2021-10-05T06:34:02Z,"@@vaels5682 I am capable of original thought. That is precisely the Avenue I took in my research. Of course, knowing measles and polio are not corona viruses did not take much mental effort. Rather it was a simple observation that required nothing more than sentience. Get lost."
2021-10-05T06:40:08Z,"@@yuckfootoob9499 Wow you figured out that measles and polio are not the same as coronavirus, impressive!"
2021-10-05T07:03:43Z,@@vaels5682 nice ad hominem.
2021-09-30T11:25:05Z,One of the greatest psychological experiments of all time how the Democrats killed off all the Republicans by trying to save their lives.
2021-10-05T01:15:59Z,"Big pharma shill i see. Young man, in the 90’s yall were called republicans"
2021-10-05T01:20:43Z,It’s mostly democrats who don’t trust the Trump vaccine.
2021-10-05T01:26:23Z,You’re talking about when democrats gave syphillis to black republicans in the south saying they were shots right?
2021-09-30T11:06:25Z,"I just got discharged from the hospital, none of this is actually happening."
2021-09-30T11:07:44Z,So you’re calling us hospital workers LIARS?
2021-09-30T11:10:22Z,@@stefaniekokal58 <br>Yes
2021-09-30T11:54:32Z,@don s <br>I will have to take your word on that.
2021-09-30T13:01:22Z,you are correct.  my wife works in the ICU and her department along with the ER is pretty much empty and it&#39;s the main hospital in the metro.
2021-09-30T13:14:57Z,same here i just picked my dad up from the hospital the on tuesday<br>hardly anyone on both ICU floors
2021-09-30T10:59:22Z,People are stupid. I’m over it. It’s time to make these people get vaccinated!!!!!
2021-09-30T10:53:38Z,At this point un-vaxed people should be not allowed to be admitted into hospitals.
2021-09-30T15:28:05Z,And fat people.
2021-09-30T19:27:10Z,And smokers and alcoholics and drug addicts and obese people! After all they also know the risks of what they&#39;re doing.
2021-09-30T22:13:03Z,@@superscaryrussianbot846   <br> @Claire Wright   screw you. Those people aren&#39;t knowingly putting others at risk with what they&#39;re doing and they can&#39;t infect someone with their bad habits
2021-10-01T00:17:51Z,"@@Axel_Kasai, you “knowingly put others at risk” every time you get behind the wheel of a car.  Would you expect treatment if you were to get into a car accident?"
2021-10-01T00:36:04Z,@@Axel_Kasai yeah if they tumble they can crush someone to death.
2021-09-30T10:52:30Z,No unvaccinated people without valid reasons should make it past the ER for covid symptoms. They should erect tents in parking lots to keep them away from normal patients.
2021-09-30T10:51:14Z,"The only reason there are three yellow states is their populations are miniscule: Maine 1,362359, Vermont 623,989, and Wyoming a mere 578,759, 10,000 people smaller than Boston. Just think the have equal representation in the Senate as California with a population of 39, 538,223."
2021-10-05T01:10:15Z,"as they should, we dont want california controlling everything, look how bad that entire state is!"
2021-10-05T05:48:41Z,Yes but the House of Representatives is based on the population of the state which is why Vermont Vermont has one in California has 53 now what you got to complain about
2021-09-30T10:46:28Z,"A curious voice of protests against YouTube was heard from that Cretin  Russia President Putin. Why? Because, he has invested so much time and money in his troll farms passing misinformation and lies to the American people to destroy and divide us. 🇺🇸  I don&#39;t care for Putins&#39; threats and his desires to control our Big Tech companies. I hope government agencies look into this, this is a national security issue. Putin is another one whose gotten away with crimes and now is emboldened and comes right out with complaints when his huge accounts are taken down. This is no longer Trump&#39;s America Putin!"
2021-09-30T10:36:17Z,Sue the unvaccinated for the countless deaths they’ve helped cause. Stop treating them in our hospitals. Let them die at home with their bigot friends and family.
2021-09-30T10:26:22Z,"North Carolina Funeral Parlor has the best Ads!! It painted in their vehicles, &quot;Don&#39;t be vaccinated!! Wait for us!&quot;. The best for these Morons!!"
2021-09-30T10:20:20Z,"Just not clear why they&#39;re not just tying on feed bags full of horse paste, since they can&#39;t trust the science.🤔"
2021-10-05T00:50:52Z,74% of cases in Massachusetts were people that had been fully vaccinated.<br>Currently we are at 300% the number of cases last year when we did not have a vaccine.<br>Israel&#39;s cases have skyrocketed after they got 60% vaccinated.
