PublishedAt,Comment
2021-07-12T01:48:44Z,"Your statement is illogical. We have been getting vaccinated for ages. We’ve had vaccine booklets for decades that you receive as baby to record your shots. <br><br>This is a novel coronavirus. A new coronavirus that we have no natural immunity against is where we are. The vaccine is what creates an immunological response. It’s like armor/weapons to protect YOU . If the virus keeps spreading more mutations develop and this will undermine the vaccine effectiveness if allowed to happen.<br><br>Who would benefit from a sick and disabled nation? <br><br>Who has something to gain if  United States is in such a state? The United States itself? No. Think national security. <br><br>Active measures. Disinformation. Look these terms up. Many of the comments on social media are foreign bots or trolls who post as real Americans and spread  these falsehoods. If you are rusty in the critical thinking skills department you might not catch it and like, upvote, share this disinformation which means Americans are doing the dirty work of nations hostile to the United States for them!!!!<br><br>Have you thought about any of these things?"
2021-07-12T01:56:26Z,@@atomicstyle7344 legacy media is disinformation. Don’t come around here with that nonsense.  You think MSDNC has your best interest at heart ??  Sure they do. They are a political mouthpiece for the radical left. Have a good night.
2021-07-12T02:03:33Z,"Yes, humans have natural immunity to polio and smallpox, don’t they?"
2021-07-12T02:08:25Z,"@@atomicstyle7344 the biggest money makers are the corrupt  pharma companies. Retaliation for the opiod lawsuits. They are evil people and you fell for it, hook line and sinker. Weak minded non-thinker."
2021-07-12T01:25:23Z,WHO and CDC and NHS stories always changes. Not buying it anymore.
2021-07-12T02:03:45Z,"Brand New Tube, BitChute, Lbry, Odysee and Rumble have un cen sored Ne ws.....Video; Catherine Austin Fits Planet Lockdown......mamm. org that stands for Millions Against Medical Mandates"
2021-07-12T02:17:15Z,"Dr Falsey changes too. One mask, 2 masks, 3 masks more. 😈"
2021-07-12T02:18:03Z,Because nothing was known about it at first.....geez🤪
2021-07-12T03:40:07Z,@@michelletaylor5691 the stories are still changing daily after a year and a half.  geez
2021-07-12T03:44:09Z,@@cathycasuccio3227 because we finanally have a man who respects science instead of a twice impeached con man and a former crack addict pillow salesman
2021-07-12T01:25:16Z,That &quot;death&quot; is only a 0.07% chance.
2021-07-12T01:33:11Z,2 people in my family died from Covid. Did they get it from you? Are you the super spreader?
2021-07-12T01:35:19Z,I think you missed the point of the video.
2021-07-12T01:41:06Z,"Where did you get the 0.07% of the death rate, currently we have 622,845 died, and 34,732,373 cases, so you take 622,845/34,732,373 and you get 1.7%, not 0.07%"
2021-07-12T01:47:02Z,One death is too many.
2021-07-12T01:48:26Z,If it’s broken down by age groups that number changes
2021-07-12T01:25:07Z,Soon people will understand that zombies are real pay attention people
2021-07-12T01:41:09Z,Grow up. Just last month 150 died from covid in Maryland and the saddest thing is all were unvaccinated.
2021-07-12T01:45:51Z,? should zombies get vaccinated ?<br>— Sambeau in Haiti
2021-07-12T01:48:37Z,@@iden63 34million 600k dead yes very sad but the virus is evolving very fast they have already lost control sure say what you will just wait and see the only way man will stop the hate if something effects us all equally and it&#39;s here but it will get worse wait and see
2021-07-12T01:51:00Z,160 million zombies waiting to be born. What&#39;s funny is none of the media are vaxxed let&#39;s see them rolling up those sleeves on live
2021-07-12T02:02:53Z,@@marcusstringfield1097 <br>You got a crystal ball. Can I get tomorrow&#39;s winning numbers.
2021-07-12T01:25:06Z,A bunch of sock-puppets saying what sock-puppets say. . .
2021-07-12T01:24:34Z,Media is in on the lie. MSNBC is not our friend.  I had Covid and I have antibodies so no need for a vaccine that isn&#39;t for the Covid 19 as it messes a lot that take it have adverse reactions and has killed many. This lying main stream media will never be truthful
2021-07-12T01:24:31Z,What the f**k? MORE consequences than death?
2021-07-12T01:26:08Z,yea they will also take your money
2021-07-12T01:28:14Z,@@ThornsOfOurTime LOL!
2021-07-12T01:24:08Z,"Here&#39;s your hourly dose of fear, compliments of the MSM."
2021-07-12T01:32:07Z,funny when she says.... &quot;We don&#39;t know the longer consequences for Covid&quot;  hahaha instead of &quot;we don&#39;t know the longer consequences of the vaccine&quot; LOL
2021-07-12T01:35:04Z,"Unlike the fearmongering that the right wing has been doing? Taking yer guns away, bibles too, CRT and teaching people that America ISN&#39;T the greatest and perfect nation to ever exist, Mexico border crossings sending MILLIONS of killers and gang members over, Florida demanding to know university students&#39; political alignment, etc. Take your pick."
2021-07-12T02:24:28Z,@@Rakerong - parrot says what?
2021-07-12T01:24:02Z,Funny.  The same could be said of the vaccines.  You can stop selling fear of the seasonal flu now.  We&#39;re done buying it.
2021-07-12T01:32:44Z,"This SEASON the flu was 2%. ...down by 98%,"
2021-07-12T02:00:37Z,"polio, diphtheria, measles, tetanus, rabies.........."
2021-07-12T04:11:29Z,"Right, you could follow those Indian people, just don&#39;t buy it and treat it like a flu. Let&#39;s see what happens"
2021-07-12T04:32:44Z,"Ah..no, it is still here. About the same rate (a little less because COVID restrictions stopped its spread too).  This is what is called a “heuristic.”  39-50 thousand Americans  die in car accidents per year, and it is much more dangerous per mile than flying, yet but there are way more news articles on the 30 to 40 Americans who die in commercial plane crashes annually.  Why?  Because people like news that is new or unusual, and some people interpret more news as meaning there is more of thing covered.  Some times that is true.  Often it isn’t (for example, no matter how many pics of the same broken window Fox News shows, the crime rate in Portland. Oregon is still significantly lower than most Republican cities."
2021-07-12T05:33:27Z,"shocking......finally, some intelligence. thank you"
2021-07-12T01:23:39Z,Loss of taste and smell for two weeks.  Woah.  That&#39;s real heavy.  I am scared.
2021-07-12T02:36:44Z,that was a vaccinated individual
2021-07-12T05:29:26Z,Imagine not having that at all....your entire life. LOL.
2021-07-12T01:22:09Z,I live in Arkansas. I haven&#39;t heard a single thing about an up rise in Covid-19 cases. 400 new cases? Wow! I better put my hazmat suit on because the population in Arkansas is over 3 Million. Better be safe than sorry I guess.
2021-07-12T01:56:41Z,spoken like someone from arkansas
2021-07-12T01:57:57Z,"Lmbo so true ,she speaks such lies"
2021-07-12T02:06:33Z,No offense but you&#39;re from one of the most boring state in America ...I&#39;ve never heard anyone say they&#39;re taking a vacation to Arkansas .
2021-07-12T02:10:16Z,Cause they are making this up
2021-07-12T02:30:46Z,@@blast4me754 <br><br>Ok and? Your point?
2021-07-12T01:21:58Z,"Oh, they believe in “long covid” but they absolutely will not consider that almost all Lyme disease is “long,” “chronic” or “late” Lyme."
2021-07-12T01:26:19Z,Some doctors still deny Lyme disease is even a thing.
2021-07-12T01:28:46Z,You are right on the money.  Could not have said it better.  Even the Flu can produce long s/s.
2021-07-12T02:23:32Z,"Why are they making such a big deal over this covid stuff and not cancer and diabetes,  or alzheimers? It all leads back to money or control or both."
2021-07-12T01:21:25Z,and you think its funny
2021-07-12T01:20:34Z,Hahahahah no
2021-07-12T01:20:10Z,Propaganda!
2021-07-12T01:19:44Z,"So, when will this ever end?  Every time we hear &quot;we&#39;re almost there!&quot; and then the rug is pulled out from under us.  I don&#39;t see this ever ending. Too much power in it for some."
2021-07-12T01:27:18Z,it will end when the un-vaccinated die off or receive immunity from multiple Covid infections.
2021-07-12T01:28:25Z,It will end when the technological prison is complete ... or it will end when everybody sees what&#39;s going on and just says &quot;No&quot;.
2021-07-12T01:31:48Z,"We hear that a lot because the solution is never attained to its fullest. We could have locked down stronger and taken the safety guidelines more serious from the onset but they politicized the mask wearing and social distancing. Several states decided to flat out open fully because they think the virus is gone. We have the vaccine now but disinformation campaigns and conspiracy theory is preventing enough % to get herd immunity. Even with deadlier variants hitting harder now people still think they are invincible. <br><br>At this point, when I hear &quot;We&#39;re almost there&quot; it will be because the virus claimed enough of the anti-vaxxers and anti-maskers that we achieve herd immunity that way for the rest. * shrugs *"
2021-07-12T01:36:27Z,"@@chansetwo  &quot;Pfizer has been a habitual offender, persistently engaging in illegal and corrupt marketing practices, bribing physicians and suppressing adverse trial results.&quot; - PubMed ...REPEAT &quot;... suppressing adverse trial results.&quot;<br>But hey, I&#39;m sure they&#39;re being super-honest now. Ha ha! Roll up that sleeve! Who needs long-term safety data anyway?"
2021-07-12T01:38:07Z,Well if you guys actually got vaccinated it wouldn’t be doing the Harlem shake and mutating inside you. Look up antigen drift.
2021-07-12T01:19:35Z,Vaccination supremacy wrapped in a FUD blanket.
2021-07-12T01:18:41Z,Someone forgot to turn off the comments  - funny.
2021-07-12T01:22:31Z,That might be remedied soon.  In the meantime I will remember to be scared of the delta variant and any upcoming boogieman variants.
2021-07-12T02:27:29Z,"And likes to dislikes don’t reflect comments! Seems more peoples see through the MoDe RnA propaganda, but some aren’t bright enough to realize they’re being played!"
2021-07-12T01:18:38Z,Pay me 10k and I’ll consider taking the vaccine
2021-07-12T02:54:40Z,Nowhere near enough!
2021-07-12T01:18:19Z,Are all the illegals being vaccinated???
2021-07-12T01:24:27Z,Less than the general population.
2021-07-12T01:28:06Z,Why don’t the rt go get vaccinated. I mean they are the ones causing the spread and delays of normalcy with they’re trump conspiracies. By the way if the vaccine was good for him…
2021-07-12T01:18:11Z,So are from flu. One can lose sense of smell permanently after a flu.
2021-07-12T01:31:00Z,"&quot;The flu can damage your sense of smell. Fortunately, this is usually not permanent, though it may take it a while to return. Often, whether or not you regain your sense of smell depends upon the underlying cause. If extensive damage is done to your nasal nerves, it is more likely that the condition will be permanent.&quot; - From Raleigh ENT 2018. This page will probably be scrubbed from the internet soon."
2021-07-12T01:34:18Z,"@@robotron17 10 years only about 20% smell recognition. Sometimes a blessing, mostly not😏"
2021-07-12T01:17:56Z,Be afraid. Be very afraid.
2021-07-12T01:23:11Z,And only 90 years ago we had a president that stated that &quot;The only thing we have to fear is fear itself&quot;
2021-07-12T02:44:48Z,"I was just thinking this. I wish the media would do some soul-searching, and stop being the voice of paranoid schizophrenia."
2021-07-12T07:23:06Z,"Watch more Hannity.<br>He graduated high school,<br>Nothing else, though."
2021-07-12T01:17:52Z,They dont care about our children dying from street violence but they care about your health? Something fishy / how is your vacation Lori ?
2021-07-12T01:17:21Z,Ive only had 1 vaccine in my life. I never get sick.
2021-07-12T01:24:39Z,Same! I still have like 10 vaccinations i need since i was a kid now I&#39;m 22 and not once have i gotten sick...
2021-07-12T01:16:37Z,I heard their ratings were down by 79%. Is MSNBC even still on the air?
2021-07-12T02:04:28Z,"Mainly just on YouTube, they eat this sheet up……"
2021-07-12T02:05:55Z,Yeah. There just a entertainment Channel now
2021-07-12T02:24:55Z,Sadly they still are on the air.
2021-07-12T02:40:55Z,@@chriscorbin1055 Greater  similarity to a propaganda outlet for the low educated and underread.
2021-07-12T04:12:08Z,"If you consider that Newsmax has almost no viewers, than yeah MSNBC is probably safe for awhile 🙄"
2021-07-12T01:16:34Z,Haven&#39;t had a single diagnosis in my county on a 7 day average for almost 10 days.  Still see kids lined up in 105 degree weather doing summer school masked up with all vaccinated teachers.  When do we overstep the child abuse level of this?  I think it&#39;s possible already been met.
2021-07-12T01:16:17Z,Dark Horse Dr Malone inventor of mRNA shot read new medical stating it is found in bone marrow and ovaries concentrated  This he and 2 PHD Biologists state on (Dark Horse) that the shots can be dangerous in long term for autoimmune problems
2021-07-12T01:15:19Z,More fear propaganda
2021-07-12T01:14:24Z,And there are more consequences to the vaccine than the virus for most people. So.......
2021-07-12T01:13:48Z,Fake news and the cdc is a joke. Shame on you and your fake news media.
2021-07-12T01:13:41Z,No ones even talking about this anymore...time to move on the dr.traitor fauci is a lier and so are you
2021-07-12T01:13:17Z,People are dying from the covid shots too...no one talking about this
2021-07-12T01:27:27Z,"Tons of people are talking about it just not on controlled media like the television &quot;news&quot; and statists sites like this one.  Look up the VAERS numbers and multiply by 50.  That sounds like 450,000 to me.  Try rumble, gab, lbry, BitChute, BrandNewTube, banned dot video, David Icke etc etc etc.  I&#39;ll let you in a secret, what they call viruses aren&#39;t causally linked to sickness or disease.  Bam - move."
2021-07-12T01:13:06Z,"MSNBC Executives: Death is no longer enough. We need Death+ to drive traffic! Quick, find new ways to scare people!!!"
2021-07-12T01:12:22Z,Yeah a ruined economy.
2021-07-12T01:24:02Z,"That&#39;s not a side affect, that is the desired affect."
2021-07-12T01:12:05Z,🤔🤔🤔🤥🤥🤥🤥🤥🤥🤥🤥🤥theses ppl are a  joke u can tell they all got paid to push these vaccines only the idiots believe this propaganda 😂😂😂😂😂😂this sister is lying she didnt get the shot
2021-07-12T01:11:41Z,There are more consequences to the Bioweapon Covid Lab Virus than just death. <br>Even more reason to listen to Frontline Doctors who keep telling us to use super safe super effective treatments we have had since day one.
2021-07-12T01:11:33Z,"I am the way the truth and the life no one comes to the father except through me. Jesus Christ John 14:6 Please believe Jesus died, rose again and confess your sins to God today! Dont be left behind."
2021-07-12T01:14:39Z,🙏
2021-07-12T02:45:21Z,Amen. maranatha
2021-07-12T01:11:13Z,"so even if you are vaccinated you need to worry, why get vaccinated? does the vaccine make you more susceptible to new variant is that why they should worry?"
2021-07-12T01:26:29Z,"OK, i do not want to call you dense.   But, dude, you need to talk to a doctor about your confusion about viruses and vaccines (and perhaps a therapist, I wish to gently suggest)"
2021-07-12T01:40:06Z,"@@mjl9002 I wouldn’t call him dense,when that’s your answer to the question. Nobody’s answering that question,that’s the problem. If the vaccines don’t help you not get the virus,what good are they?"
2021-07-12T02:07:23Z,"@@mjl9002 haha your buffoonery is entertaining but for the love of God take a reading comprehension class and stay with-in the context of the post, not sure if you need therapy or if you&#39;re in the Biden stage of life where you can&#39;t stay on task mentally but you calling me dense is rich try looking in the mirror. My point is the propaganda on the vaccine is causing more people to not want it, because again if you&#39;ve taken it and you still need to be worried, why take it at all? My guess you took it, if you did the CDC is part of the government and they don&#39;t care about us if they did they wouldn&#39;t send our children to foreign countries to be killed and maimed while keeping their children home!"
2021-07-12T02:29:50Z,"@@mikemhoon Sorry -  I did not intend to be confusing - let me clarify -  helping the immune system fight off viruses is pretty much the basic description of a vaccine.  A 95% effective vaccine (remarkably high) still means 1 in 20 can become infected.  But the supercharged antibodies your immune system produces in response to the vaccine appears to reduce the mortality of those breakthrough infections to almost zero (again, remarkably effective).   Viruses mutate to spread themselves quicker and more efficiently.  Most all mutations die off or fade from the data because they do not offer the vaccine an advantage.  But Delta has the big advantage that it is so much more transmissible (and, BTW, perhaps more lethal).  It&#39;s breakthrough rate is also worse, ~30% of vaccinated patients will contract it if exposed to Delta Covid.  But luckily, the incidence of hospitalization and/or death for such vaccinated people who do contract Delta is only about 7%.  There is no zero risk scenario in all this.  But the known risks of the vaccine are minuscule compared to the well known risks from Covid and especially its Delta variant.  Please consider getting vaccinated for your own sake as well as for your loved ones and society at large.<br>Scientists are not lying  to you sir - they are trying to preserve life.  God bless and keep you well."
2021-07-12T02:45:44Z,"@@OneTouchShort i provided a serious response to Mike Mhoon because he seemed sincere - but i see you are not - sorry to bother with you - you are not for real, dude."
2021-07-12T01:10:46Z,MSNBC  Communists!!!!!!!
2021-07-12T01:10:18Z,Main stream media and the push from our government is evil.
2021-07-12T01:09:52Z,I’m more scared of the government than Covid…
2021-07-12T01:18:11Z,Xi Jinping must be laughing his head off
2021-07-12T01:09:18Z,There are more consequences to the vaccine then being reported
2021-07-12T01:14:16Z,Your user name says it all...
2021-07-12T01:17:52Z,@@dougdelane3642 name calling is people with no intelligent response
2021-07-12T02:18:08Z,"@@nothinking8545 Please feel free to elaborate, on the peer reviewed articles of the consequences of the vaccine....I&#39;ll wait there genius lol"
2021-07-12T01:09:02Z,Lol no
2021-07-12T01:07:33Z,Where s the proof of the vaccine
2021-07-12T01:07:06Z,Jesus wins<br>We will all pay for the evil that is trying to take over the planet <br>But Jesus wins
2021-07-12T01:06:30Z,Mary Copa panic is real.
2021-07-12T01:05:49Z,Worst consequence is government trying to invade my personal information.
2021-07-12T01:18:31Z,(Walgreens too) Dark Horse ( censored recently but this is still there ) Dr Malone inventor of the mRNA shots reading new medial that the covid shot concentrates in ovaries and bone marrow  He and 2 PHD biologists all stated this is potentially dangerous in long term for autoimmune problems  We cannot sue the vaccine companies but we can sue everyone else ok?
2021-07-12T01:25:24Z,they been doing that since bush’s patriot act. You act like it’s new. Lol
2021-07-12T01:02:02Z,So her friend got fully vacinaed and still got covid?
2021-07-12T01:07:31Z,"It still amazes me that people don&#39;t understand that the vaccines only save you from death, they don&#39;t save you from contracting Covid, nor transmitting it to others... how is this not common knowledge?"
2021-07-12T01:13:57Z,@@sample.text. it’s amazing how stupid that sounds… covid saves you from death??? No wrong. Nothing saves you from death. Every one gotta go sometime.
2021-07-12T01:18:02Z,@@sample.text. also it is not common knowledge because it is false propaganda that have been implanted in your brain by the government via MSM
2021-07-12T01:18:05Z,@@sample.text. it amazes me how people dont see that the vaccines causedeth thanks to chews that invented them and want a world of their own
2021-07-12T01:18:42Z,@@co2hashoil the only thing that is stupid is that you really couldn’t comprehend what he or she said.  An ant  brain knew what they were. Heck even dumbdick Donald would’ve known
2021-07-12T01:01:15Z,People think COVID is a death sentence. It aint.
2021-07-12T01:06:43Z,It can be and downplaying it is exactly how we got so many people dying and of course it is getting more and more deadly with more variants popping up
2021-07-12T01:10:24Z,@@isaacdayton4962 puppet
2021-07-12T01:14:14Z,@@isaacdayton4962 Nope it&#39;s typically a harsh cold at best average.  Try again to push that nonsense elsewhere.... Please don&#39;t BTW.  That&#39;s toxic
2021-07-12T00:51:48Z,I got 2 shots and I still wear a 3M asbestos mask when I go out. Not taking any chances with whatever may come next.
2021-07-12T00:45:44Z,There are also consequences from the vaccine have you mentioned that?
2021-07-12T00:44:59Z,"COVID , COVID. BLAH blah blah blah blah....."
2021-07-12T00:39:06Z,COVID-19?? BWAHAHAHAHAHAAAHAHAHAAHAHAHA 😂😂😅😆😛😄😁😂😆🤪🤪😛🤪🤪
2021-07-12T00:28:30Z,"We need to stop cutting the non-vaxer so much slack. As a polio victim in the mid-50&#39;s, I have come to learn from other polio victims that we were afflicted because our parents were afraid. <br>And today, it&#39;s still about FEAR. Like my parents, and many like them then, today&#39;s naysayers are simply scared. They will look far and wide for any excuse to not take the vax. <br>Yesterday&#39;s tough &quot;Pull up your boot straps&#39;&#39; guys, are today biggest SNOWFLAKES! <br>And America&#39;s biggest bullcrappers!!!"
2021-07-12T00:28:29Z,Has anybody else tried to stick a magnet on their arm where they got their shot. Try it it&#39;s awesome
2021-07-12T00:34:13Z,I took my two doses once in each arm and now my chakras are in flux
2021-07-12T01:14:51Z,Seen it stick on people as if they are fridges this comment need be up voted
2021-07-12T01:14:56Z,"@@erikfinkel2717 I did too, maybe they did that so it wouldn’t do the magnet thingy :("
2021-07-12T04:18:45Z,@@davebuilds7261 I know the videos are all over the internet it&#39;s very strange if you ask me
2021-07-12T04:52:16Z,@@erikfinkel2717 sorry to hear that lol
2021-07-12T00:24:52Z,Look at the Democrats trying to get one more rigged election out of covid-19 guess what it&#39;s not going to happen you can take dr. Anthony fauci Wuhan coronavirus and stick it up your yin yang
2021-07-12T00:01:45Z,"Sadly, many of the unvaccinated populations in America are the communities that are refusing vaccine and masks, and would never dream of closing schools."
2021-07-12T01:51:28Z,"Probably true, but how many  of those unvaccinated people are seriously ill, hospitalized or dying from  covid. What are their ages? Give some statistics."
2021-07-12T03:11:01Z,And they’re not sick/ill either!
2021-07-11T23:44:04Z,"10,000 vaccine deaths reported on VAERS, and counting ..."
2021-07-11T23:42:20Z,With tyrannical government mandates we can be sure there will be more consequences than just death.
2021-07-11T23:36:33Z,F*&quot;k the CDC Fauci and the Demacraps
2021-07-11T23:35:50Z,"Guys guys, death is only &lt;5%. Stop being scared<br>Screw your vaccine"
2021-07-11T23:45:05Z,Survival rate is 99.95% for people under 50.
2021-07-11T23:33:17Z,"I can only speak for myself,  for me this has nothing to do with party lines or any ideological group. All it has to with is I think the system and the people who run it are corrupt and can&#39;t be trusted. Why should I trust them now?"
2021-07-11T23:37:50Z,You can’t and shouldn’t. These people who pull the strings for society do not have our best interests in mind.
2021-07-11T23:46:07Z,"Fauci loves you. Just take the experimental shot with zero long-term safety data, made by known liars ... for him."
2021-07-11T23:46:12Z,@@JJ-wk5wh I agree with that. I think they only seek to enrich themselves and the people they associate with.
2021-07-11T23:54:10Z,"But, which side of the issue do you distrust most.  I guess that&#39;s what one has to figure out.<br>I caught the news reports of the initial outbreaks in December &#39;19.<br> ( Recalling that our cultural messaging has foreshadowed &quot;the upcoming outbreak&quot; for decades.)<br> As things developed, I made decisions on how much caution was warranted.  <br>Then I referred to platitudes I grew up with.  An ounce of prevention is worth a pound of cure, better safe than sorry and cleanliness is next to godliness.<br>I&#39;m doing alright."
2021-07-12T00:57:19Z,@@irishhi8333 hahaha I found out about Wuhan zombies in china in September 2019.... I warned all my friends coworkers.. they laughed I bought food water ammo..
2021-07-11T23:32:54Z,"11 months after New Zealand&#39;s last Covid death, looking at American media is like stepping back in time..<br>WE LIVE IN A GENERATION WHERE TEASING AND LAUGHING AT AMERICANS IS THE NORM."
2021-07-12T00:40:32Z,"Less than an hour in and so far, already two doofi are proving your point - God help us!  <br>(I think that must be the Latin plural of doofus)"
2021-07-12T01:19:46Z,"@Citizen Cyx  So should we take that to be some kind of QuackAnon threat, dude?"
2021-07-12T01:22:47Z,Only 10% of New Zealand is fully vaccinated... while 48% of the US is fully vaccinated...
