PublishedAt,Comment
2021-10-05T01:36:34Z,Why is the Japanese🇯🇵 using ivermectin on its own people after Madonna got in trouble I&#39;m too much adverse side effects.<br><br>Edit: Why is the Japanese using ivermectin on its own people after Moderna got in trouble with so much adverse side effects?
2021-10-07T01:47:16Z,"No No 😂😂😂🤣🤣🤣🤣 oh my God that made me laugh.<br>I did not notice until now, my stupid speaker keeps up misunderstanding my words.<br>But thanks for the laugh."
2021-09-30T10:18:24Z,"Some of them genuinely couldn&#39;t get the vaccine. But why are the &quot;it&#39;s just a flu&quot;, &quot;plan-demic&quot; &quot;99.99% survival rate&quot; &quot;I want em natural antibodies! Yum yum&quot; crowd going to hospitals?"
2021-09-30T10:16:03Z,Can&#39;t you still get it and pass it even with shots???? What about Natural immunity ??.... I know people that still ended up in the hospital anyway
2021-09-30T11:09:02Z,"Thing is, a number of states have had to resort to crisis standards of care, which is like how MASH units in war would do triage, assessing who is more likely to benefit. Plus, most hospitalisations are unvaccinated people, between 92 and 98 percent. Yes, vaccines aren&#39;t 100% effective. Birth control isn&#39;t 100% effective. Everything has some exceptions. But that small percentage of people catching Covid when vaccinated is about 4 to 23 people in every hospital that has to refuse heart and cancer patients, who delay any surgery if at all possible despite the pain of patients,  all because a group of people are still catching up with Joe Rogan and their Facebook groups or looking for fake vaccination cards."
2021-09-30T12:24:11Z,"@@nancyjay790 I&#39;ve been in desperate need of surgery for the last 8 years , but since the Government and MSM don&#39;t care about Black People health the insurance will be able to get out of paying for it ...for years to come.... So, nothing has changed for people like me.... Not taking any chances of adding a vaccine injury to my problems that I won&#39;t any help for either"
2021-10-05T01:42:25Z,"They won&#39;t report those numbers though, just fear."
2021-09-30T10:12:22Z,"After three months of unvaxxed pandemic where unvaxxed are dying, they are still sick????? If you are vaxxed and your worried about an unvaxxed person, your a special kind of stupid or just a commie. Fat people are more at risk than unvaxxed."
2021-09-30T21:42:05Z,"I&#39;m not worried about them. I&#39;m worried about the hospital beds the unvaccinated parasites are filling.<br><br>Sprained ankles don&#39;t solve themselves. Get those antivaxxers into a tent, let the open air heal them instead of a ventilator"
2021-09-30T22:51:57Z,@@jkorimatsu227 I hope you don&#39;t regret your words commie
2021-09-30T10:02:58Z,I know covid 19 kills and it kills faster than you pronounce covid but in my case i have nothing to worry about life because I&#39;m always and constantly in hunger. So i realized that it&#39;s better to die of covid 19 than to be killed by poverty whichever way look at it I&#39;m not safe injection or not. In fact if it were to be my decision I&#39;d choose death but can&#39;t take my own life because I&#39;m not a coward.  I&#39;ve never had income in the last 19 years due to corruption and greed of the ruling class which i really detest.
2021-09-30T10:01:46Z,why not put the unvaccinated on federal reservations?
2021-09-30T10:20:41Z,You mean FEMA Camps ?....
2021-10-03T09:56:02Z,"Yeah, or like in a special camp with guards"
2021-10-05T01:32:36Z,You have no data to back up any of these claims.
2021-09-30T10:00:41Z,"The USA is clearly in decline, corrupt politicians (Manchin and Sinema and most Republicans) only filling their own pockets and an uneducated population denying all science. The US Banana Republic! LOL LOL LOL"
2021-09-30T09:56:44Z,Welcome to universal healthcare. Where your treatment is decided by your political views
2021-09-30T11:59:16Z,@don s you don’t believe that but the democrat leaders do believe you should be denied healthcare jobs or the right to anything if your not vaccinated.
2021-10-05T01:38:22Z,"@Don S Stupid decisions like obesity, smoking, drinking, recreational drug use, gang fighting shouldn&#39;t be treated either then, by your rule."
2021-09-30T09:53:11Z,"A vaccine so effective you need 3 shots in less then a year and are suggested not to be around unvaccinated people, sounds like you were sold on a lemon of a vaccine..sounds really effective..🐑🐑"
2021-09-30T10:34:44Z,They &#39;re about to come out with a daily pill preemptive treatment they want people to take ..... Equilibrium type stuff .... It  already seems like the people  that&#39;s marked are different some how .... There personality is no longer quite the same...but before it&#39;s all said and it&#39;ll probably be 10 15 shots a year just to test obedience levels Gullible Levels
2021-09-30T09:44:57Z,Does this mean that most of Tucker Carlson&#39;s material will be absent from YouTube?
2021-10-01T15:57:45Z,No it just means they will ban anything that they don&#39;t support
2021-10-05T01:12:32Z,"If msm didn&#39;t lie every day, maybe so."
2021-10-08T10:13:38Z,"The only thing more disgusting than Lying Cheating Joe are the 40 million uneducated, racist people that voted for him."
2021-09-30T09:44:17Z,"Funny seems to me that it&#39;s the EXACT OPPOSITE, THE FALSE NARRATIVE,  ITS MORE VACCINATED PEOPLE IN HOSPITALS,  GO FIGURE, THESE LIES HAVE GOT TO STOP, REPORT THE REAL PROBLEM."
2021-09-30T10:29:04Z,True. I died after taking the vaccine
2021-09-30T10:31:03Z,Got a source for that numbnuts?
2021-09-30T10:33:39Z,Ok horse paste
2021-09-30T10:37:10Z,@@jerryblazier1125 lmfao ok how long did it take to come up with that ?
2021-09-30T10:38:02Z,@@jerryblazier1125 get a clue or stay in your field
2021-09-30T09:41:24Z,Weird how all the hospitals are overwhelmed articles emerge the same day the hospitals are laying off hundreds of front line heros for not being vaccinated.weird like how the leaders of dozens of counties are all using build back better world economic forum united nations 2030 talking points.face it without covid their world government was 10 years behind schedule with covid you will own nothing and be happy.
2021-09-30T09:23:15Z,"Some of the same people who believe the vaccine doesn&#39;t work, use homeopathic pills against anything from headache to athletes foot.🥴"
2021-09-30T10:27:47Z,"So not underestimate the power of sugar balls, heathen!"
2021-09-30T10:47:39Z,@@gazpachopolice7211 😎 I call them homeo-pathetic.
2021-09-30T13:02:56Z,@Teenah Weenah Are you vaccinated?
2021-09-30T13:56:01Z,@Teenah Weenah I am sorry to hear that.
2021-10-05T01:22:30Z,"Some of them also believe in living a healthy lifestyle, but you&#39;re right, a shot is SO much better..."
2021-09-30T09:15:00Z,Time to hold China responsible
2021-09-30T09:13:41Z,Hypocrite fools
2021-09-30T09:13:09Z,"Americans are the LAUGHING STOCK OF THE PANDEMIC.<br>Americans love freedom but in reality New Zealanders are 26,442 times more FREE.<br>US Covid deaths 713,953 and Aotearoa New Zealand 27.    Who are the real world leaders?<br>3 New Zealanders can count the 27 NZ Covid deaths on their fingers and all have 1 finger left."
2021-09-30T08:47:28Z,Trump is loosing around 2000 supporters a day. Is that such a bad thing?
2021-09-30T12:08:47Z,That means about three quarters of a million people before the 2022 elections.  Will that be enough?  Let&#39;s hope the GOP disaffection rate continues to grow as the vaccine refusers continue to diminish.
2021-09-30T13:11:53Z,actually i hear trump is gaining 4000 supporters per day<br>but then again u also watch msnbc and think its news haha
2021-09-30T15:27:30Z,Loosing?  WTF...
2021-10-01T00:51:11Z,That&#39;s evil ..
2021-10-01T02:43:18Z,"Remember it&#39;s not a vaccine from the 1,980s this is MNRA with spike proteins they killed every test animal they tried it on As well as millions world widel right now..."
2021-09-30T08:33:27Z,Americans should give the unwanted vaccines to other countries who are desperate for them.
2021-09-30T09:25:00Z,America already does.
2021-09-30T16:06:22Z,"Tell me this liberals. If hospitals are overwhelm how can you fire 70,000 healthcare workers in a day"
2021-09-30T16:28:40Z,Places without the vaccine are doing better without it
2021-09-30T16:36:22Z,@@garyoakham9723 would you want the grim reaper working in a hospital? The nurses who put their politics over ppls health are more of a liability than they are an asset.
2021-10-01T05:14:29Z,@@howard7689 unvaccined are the ones filling up the Hospital/ apparently you&#39;re not paying attention or listening/ just trolling.
2021-09-30T08:30:01Z,This people who refuse the vaccine need to also refuse medical help from a doctor or hospital as part of thier right to refuse
2021-09-30T09:55:51Z,Welcome to universal health care
2021-09-30T10:21:44Z,@@davidhale378 nope.  welcome to Personal Responsibility.
2021-09-30T12:56:43Z,@@gazpachopolice7211 same could be said about the abortion argument.  personal responsibility goes a long way
2021-09-30T13:03:04Z,@@democracylives8448 you truly think it’s only republicans not getting vaccinated ? Are you truly that shallow ? <br>So all those Illegals coming unvaccinated are republicans ? <br>The 15% of blacks not getting vaccinated are republicans ? <br>You see your whole argument isn’t about science it’s political.
2021-09-30T13:05:29Z,@@gazpachopolice7211 so why were these doctors and nurses hero’s before the vaccine mandates. And now they are the enemy ? <br>Them not being vaccinated during the height of the pandemic wasnt a issue. Not tell the authoritarian mandates.
2021-09-30T08:29:45Z,"Let them die, says this ret nurse/psychiatrist"
2021-09-30T08:21:34Z,No it’s wrong because first of all you’re a YouTube channel center anyone regardless of their believes it’s wrong and I don’t care what What side you’re on and you know it’s HRA sorry I say miss information and conspiracy theories but it’s kind of hilarious how are theories actually came through but this is only to keep the narrative going about Covid and of course they’re going to do this because you know they have no life they want to keep on with her a little Covid narrative and they don’t want no one having another opinion seems like a communist mentality
2021-09-30T09:26:09Z,Congratulations to anyone who finished reading this.
2021-09-30T08:06:15Z,"Why we blaming on vaccinated people when you just released more than 180,000 afghanis and Mexicans and Haitians into the country who are not vaccinated or vetted for any disease?"
2021-09-30T08:12:02Z,"Where are the Nordic broadswordsmen and Norwegian lumberjacks when you need &#39;em, eh?"
2021-09-30T08:16:57Z,@@3souris I wasn&#39;t in Norway my family belongs to the shinnecock Nation now what&#39;s your problem? You got a problem with indigenous people I wish you would try to be a racist and say something about indigenous and black people because that&#39;s exactly what I am. Now what&#39;s your point in making a racist insult?
2021-09-30T08:28:59Z,"@@myndgodandpsyche hardly believe you are indigenous, and the people that do come in are vetted, vaccinated, tested and/or quarantined."
2021-09-30T09:23:00Z,"@@psycobleach46 We&#39;ve already fully established, YOU ARE NOT AMERICAN. Which translates into, you have no idea what&#39;s going on in this country other that what you hear on the news. Keep your opinions in your own country!!!!"
2021-09-30T09:24:07Z,"@@psycobleach46 The President&#39;s speaker, Jen Tsaki, has admitted that they are neither vetted nor vaccinated."
2021-09-30T07:59:05Z,The doctor has a good sense of humor.
2021-10-01T18:53:41Z,Doc $hill
2021-09-30T07:55:30Z,So YouTube is banning Fox News?
2021-09-30T09:53:29Z,About time they were scuttled
2021-09-30T19:24:42Z,"If they did that, then they&#39;d have to do the same to MSNBC and CNN."
2021-09-30T07:42:50Z,Now we have to praise corporations for doing what should have been done when the vaccines became available and the spread of anti-vaccination propaganda started.
2021-09-30T13:06:55Z,&quot;Now we have to praise corporations&quot;<br>now? lol ur literally advocating for the corporate establishment party<br>when did u stop praising corporations?
2021-09-30T07:19:31Z,"Japan, with half the US population, had a death rate of 17 yesterday."
2021-09-30T09:29:47Z,@Rurouni Kenshin Actually &quot;Daily death rate&quot; does very much make sense.
2021-09-30T09:30:01Z,@Rurouni Kenshin It seems you have not learned to read properly.
2021-09-30T10:14:36Z,"Total deaths in Japan = 17,622<br>Japan 7 day average = 39<br>Total deaths in US = 695,000<br>US 7 day average = 2,034<br>Helluva difference!"
2021-09-30T10:20:32Z,&quot;They are sheep. We are not. We&#39;re lemmings”
2021-09-30T10:48:34Z,there leaders value lives
2021-09-30T07:17:35Z,Anyone who chooses not to get vaccinated should automatically forfeit their choice to get hospital health care if they contract Covid.  Cluttering up our hospitals with their ignorance.  Ignoring Medical science and then turn to beg for their help when Covid hits them.
2021-09-30T07:14:58Z,Dying for Trump. What a waist
2021-09-30T08:21:57Z,"Waste, not waist. But I agree with your sentiment. A total waste."
2021-09-30T10:28:39Z,Tell these Morons that the Funeral Parlot is always ready for them!!
2021-09-30T13:16:04Z,So the White House says they vaccinated 200 million people. You truly think that’s only democrats ? <br>There’s not 200 million democrats in the United States. <br>So all those blacks that aren’t getting vaccinated are Trump supporters ? All the hundreds of thousands of illegals coming in unvaccinated are Trump supporters ?
2021-09-30T14:26:46Z,@@philgroves7694 Maybe Zan&#39;s despair was directed at Trump&#39;s waist.
2021-09-30T14:47:10Z,"@@davidhale378It is (quite rightly) difficult to determine the political leaning of individuals vaccinated. However, the only available figures reflecting any political support show that the least vaccinated states are overwhelmingly Republican."
2021-09-30T07:11:00Z,"1. Researchers in China, with American grant money, created a super-infectious virus in a laboratory.<br>2. Said virus escaped the laboratory.<br>3. Virus went worldwide.<br>4. We all now need to trust &quot;science&quot; and &quot;government&quot;<br>5. If we don&#39;t trust, we are bad people in need of punishment."
2021-09-30T07:10:38Z,"It&#39;s like at the end of Rudy, when the coach puts him on the field when Notre Dame was clearly going to win the game anyway."
2021-10-05T05:45:53Z,😂😂😂🔥🔥🔥
2021-09-30T07:06:27Z,People need regular emergency care. The unvaccinated are causing the death of patients who need emergency care but cant get it.
2021-09-30T07:53:36Z,"If the hospital would just turn away the Anitvax, there would be no more problem."
2021-09-30T09:36:39Z,Denise Higgins as they should.
2021-09-30T09:39:20Z,"@@talkingbutt3150 public hospitals have the moral responsibility to help the sick, no matter how stupid they are. But, it doesn’t mean they have to take up premium resources.  They don’t believe they can be protected, but demand help when sick. Stupidity at its worse."
2021-09-30T10:13:02Z,Turn off msm. You are being hoodwinked
2021-09-30T10:13:31Z,"@@talkingbutt3150 hope your never turned away when you need it, you commie"
2021-09-30T06:56:55Z,"Oh please, please get the vaccine anti-vaxxers...you add so much to the world. How could we get along if you die? : )<br><br><br><br><br><br>Just kidding...you guys should quit trusting all medical advice...it would go a long way towards making the world a much better place. : )"
2021-09-30T06:56:04Z,Democrats are mandated to wear turbans as a show of solidarity with their Taliban allies.
2021-09-30T07:10:21Z,The religious extremism in your country is not coming from the left. Radical right-wing evangelicals are dragging America backwards.
2021-09-30T07:33:41Z,"ALL unvaccinated people who end up in the hospital should be held responsible for the cost of their care, the vaccination works and its free. if you choose to be stupid or the best excuse of &quot;personal freedumb&quot; than you can foot the bill for your ignorence"
2021-10-01T02:59:04Z,You mean talibans like the 5000 terrorists trump freed and their leader he now calls by his first name? Ok karen.
2021-09-30T06:54:29Z,STOP ADMITTING THEM...!!<br><br>Spock : &quot;but Jim they&#39;re dying&quot;....<br>Kirk : &quot;LET THEM DIE!&quot;
2021-09-30T07:19:03Z,Cling-ons lol
2021-09-30T06:50:10Z,WELL THE NICE PART IS COVID TREATMENT IS NO LONGER FREE!!! THESE PPL ARE GOING TO GET NICE FAT HOSPITAL BILLS when they LEAVE!!.. have fun paying 100k for being treated for covid. when the shot was free.
2021-09-30T06:45:47Z,Guess you can&#39;t cure stupidity
2021-10-05T01:47:25Z,We&#39;ll see who the truly stupid were five years from now. The control group are waiting.
2021-10-05T06:36:13Z,@@sufyb6432 Ok genius what&#39;s gonna happen in 5 years huh?  Is everyone who took the vaccine gonna transform into a Chinese fruit bat?
2021-09-30T06:45:19Z,It’s about time the ICU at all  hospital units start setting aside at least 3 beds for other diseases or accident victims and tell the unvaccinated there are no beds for their care so home you go and hire a nurse ( of course if you can find a nurse to help you)
2021-09-30T06:56:30Z,3 beds? If they unvaxxed send them home. Let the people who care about living have use of the ICU.
2021-09-30T13:06:15Z,every ICU in my area is pretty much empty.   this is all being blown up to make &#39;news&#39;
2021-09-30T06:43:42Z,Send them to one of those faith healing churches that are spreading the antivax lies.
2021-09-30T06:43:02Z,America is fighting two pandemics CoVid and Infodemic of lies.
2021-09-30T06:49:01Z,And on top of that we have an outbreak of public stupidity. It looks like it has hit MAGA crowd especially hard
2021-09-30T07:01:50Z,"Sadly it&#39;s not just America,. Covid might have started in China but arguably the misinformation pandemic started America. Truth is the USA has been and is a shining example of how not to behave in a health crisis, among other things."
2021-09-30T06:40:17Z,They don&#39;t believe in Science but they are<br>First in Line to hog the Hospital Beds.  😏
2021-09-30T06:38:15Z,If your an AntiVac … go to the carpark &amp; wait out
2021-09-30T06:33:57Z,If only we had a vaccine against stupidity.<br>Not that it would do any good since the anti-vax maga death cult wouldn&#39;t take it. 😅😂
2021-09-30T06:45:15Z,It won’t work because they’re too stupid to figure out that the vaccine will cure their stupidity 🤣🤣🤣
2021-09-30T06:47:01Z,We have it is called public education
2021-10-05T01:35:31Z,Five years will show who has the real stupidity.
2021-09-30T06:29:56Z,I&#39;m in Florida and its horrible.  Completely shocked how IGNORANT and SELFISH the PPL are. Totally disrespectful to MEDICAL professionals and the PPL sick n dying.
2021-09-30T06:40:22Z,DeathSantis is killing his constituents and his own voters.
2021-09-30T06:40:52Z,JOYA MAHAN 🙄There&#39;s no fixing stupid but the cheap Red Hats make it easier to identify.
2021-09-30T06:45:25Z,JOYA MAHAN <br>You and your new account hiding your past commentary because of extreme embarrassment? 🤐😂😂
2021-09-30T06:58:37Z,JOYA MAHAN In my state of Texas it is less then 5%. That is what the state is reporting.
2021-09-30T06:28:58Z,A pandemic of the unvaccinated. Please get vaccinated 💉 to protect yourself and others. No one wants you to suffer illness or die!
2021-09-30T06:28:24Z,"Asa Hutchinson and Greg Abbott and Kristi Noem and Tate Reeves are four of the worst Governors and love to be on the news!<br>Alabama Governor Kay Ivey is going to take the lead from Florida Gov. Ron DeSantis and Fox who are the leaders in  this:   According to the latest infection data, Red States have become a hotbed of new Coronavirus outbreaks, with roughly 70% of new cases happening in Republican-controlled areas. 19 MORON Governors plan to sue to stop any safety programs! 99% of those hospitalized and 99.5% of those that died were not vaccinated! This is not a coincidence, it is a reflection of Fox and right wing policies that are no longer driven by logic or reason. Is this the Republican Party Leaders thinning the Republican herd?<br>Un-vaccinated Rates by States: Florida=44%; Alabama=53.9%; Louisiana=53.9%; Wyoming=52.2; Mississippi=50.0%"
2021-09-30T06:24:57Z,"I can&#39;t wait until the private health insurance companies get their hands untied by the Biden Administration &amp; businesses will go back to normal.<br><br>So get ready anti-vaxxers to open your wallets real wide open, because they already know who you are and have ways to know if you have been vaccinated or not &amp; much more.<br><br>If you want to play politics, don&#39;t bother they don&#39;t play, especially with all their lobbyists in DC &amp; in every state capital throughout the US."
2021-09-30T06:22:31Z,"what happens when your hospital workers burn out, anti vacs no treatment,"
2021-09-30T06:29:59Z,Go watch project veritas. Not all health care workers are not politically extreme.
2021-09-30T06:30:28Z,@@howard1262 lol. veritas the liars.
2021-09-30T06:57:35Z,@@howard1262 What part of being burned out is being politically extreme?
2021-10-05T01:42:11Z,"No.... The doctors should just give them the drugs that the anti-vaxxers want!!!!!<br>Ivermectin, hydroxychloroquine and regeneron."
2021-10-05T01:42:27Z,@@psycobleach46 why are they liars?
2021-09-30T06:21:43Z,There’s no profit in vaccinating ppl. Hospitalisation is more profitable especially if you are a politician who covets donations from the health industry.
2021-09-30T06:32:17Z,Parslow Pongbert there is NO profit in hospitalizations.
2021-09-30T06:35:31Z,"Not sure about that, what about the vast number of Americans who can’t afford medical insurance let alone out of pocket hospital treatment?"
2021-10-05T01:46:19Z,"Oh contraire, vaccinations are extremely profitable for big pharma. These paid shills wouldn&#39;t spout lies daily if they weren&#39;t."
2021-09-30T06:20:53Z,Darwin  poor decision were made
2021-09-30T06:20:10Z,Darwin will help you in the future for now get a shovel you faild to isolate the covid-19 because of leadership so get better leader&#39;s
2021-09-30T06:20:03Z,US Fatalities are shocking.
2021-10-05T01:39:39Z,The CDC has said that only 6% of the &quot;number&quot; are actual c19 deaths.
2021-09-30T06:15:47Z,Whats your OPINION!!!! will US reach 1 Mil?
2021-09-30T06:18:11Z,Under this failing administration.. Easily!
2021-09-30T06:32:48Z,"@@googleuser332 the admin is NOT failing, but the idiots out there sure are"
2021-09-30T06:35:34Z,@@googleuser332 <br>You still under the Trump influence gramps?<br>You sheep are easily programmable.
2021-09-30T06:41:56Z,Yes
2021-09-30T06:45:22Z,We should hit 1 million easy. Republicans are dumb.
2021-09-30T06:14:17Z,"Stop giving the unvaccinated any help at all , let them die , we can&#39;t take the strain of their self choice of being terminally stupid, LET THEM DIE. they want to , let them."
2021-09-30T06:13:03Z,I only saw 1 patient.. MSDNC opinion with no evidence.
2021-09-30T06:15:25Z,Go away troll.
2021-09-30T06:19:38Z,@@Iwannaps5 Did I offend you during your DNC media worship session?
2021-09-30T06:23:12Z,@@howard1262 You want to tell us what being a Repuplican or a Democrat has to do with getting a vaccination?
2021-09-30T06:28:05Z,"@@ChasKahler Hmm.. Democrats, republicans, independents and libertarian&#39;s like me all have the option for natural immunity."
2021-09-30T06:32:52Z,What&#39;s wrong Howard? Is the horse de-wormer impairing your vision or something? 😂🤣
2021-09-30T06:10:34Z,"<a href=""https://www.youtube.com/watch?v=EtEoMjf9pC0&amp;t=3m05s"">3:05</a> Over selling it"
2021-09-30T06:15:26Z,"not selling it enough , sad you think that but then you might not have the education to understand simple concepts like truth and honesty."
2021-09-30T06:16:53Z,@@embarrassedtobeanamerican.1667 🌝😀😃😄😆😅🤣😅😂🤣
2021-09-30T07:53:50Z,"​Qi QI Mask n Distance sure why not never quit wear mine , but Vaccine Absolutely Not .. I already had it ... I didn&#39;t vote because nether party offered anything tangible specifically for FBA that&#39;s  FOUNDATIONAL BLACK AMERICANS .... MSM nor politicians never care about black health ....... and bad we get treated by the Medical Healthcare Insurance Industry ... no what kind of insurance got ...... bye bye"
2021-09-30T06:09:43Z,You people  have  got to turn to jesus christ  to repent  before you die . All this non vaccinated  and unvaccinated  and vaccinated  you people  got to let this garbage  go. This world is  temporary  every one will die some.ask this question  are you living a righteous life. Vaccinated or not  you will die and stand before God in the spirit. Pray  to god forget about this world  let em have it .GOD WILL SUPPLY ALL OF YOUR NEEDS. NOT PEOPLE  BUT THE SPIRIT  OF GOD. WHAT PEOPLE SAY  MEANS  NOTHING  JUST SOMETHING  TO THEIR OWN SELF.
