PublishedAt,Comment
2021-10-01T20:25:28Z,I&#39;m old enough as well to remember the polio vaccines when they started. I also know people who had a mild case of polio as a child but recovered. As they grew older their &quot;mild&quot; case turned into COPD and they are not smokers however they are impacted as if they have emphysema. Trouble breathing sometimes and body muscle loss. People are worried about the impact of the vaccine in ten years? I&#39;m more concerned about my friends who have had covid and its impact on their bodies in ten years.
2021-10-01T20:04:13Z,Except for Gavin’s kids.
2021-10-01T20:14:58Z,Great to see you republicans so DESPERATE. republican party is DEAD (literally)
2021-10-01T20:20:13Z,Uhh he literally gave an interview this morning and told us his daughter just turned 12 and was excited to get the vaccine.
2021-10-01T20:26:58Z,@@bethany2820 If he said it must true..... Because No Politicians ever lie
2021-10-01T20:27:58Z,@@bethany2820 <br>And so?
2021-10-01T20:29:49Z,@@alltogethernow121 just like the dems spending bill.
2021-10-01T20:03:51Z,"Yay, the covid hysteria and authoritarianism never ends. Never moving to CA."
2021-10-01T20:17:14Z,Please don&#39;t move here.
2021-10-01T20:03:03Z,More adults should take the vaccines too.
2021-10-01T20:10:39Z,"They can if they choose, right?"
2021-10-01T20:15:08Z,"Correct, but you can&#39;t fix stupid. We all just have to live in a country where idiots listen to other idiots and conmen."
2021-10-01T20:22:47Z,We also live in a country where we shouldn’t be able to force someone into benefiting from the needless and intentional termination from an unborn child.  Respect should be a two way street.
2021-10-01T20:25:18Z,@@ianalan4367 cause that has anything to do with a vaccine in the midst of a pandemic.
2021-10-01T20:25:42Z,"@@billhicks6449 Yes, like how you listen to mainstream media news."
